,date,headline,link,summary
28,2014/05/18,Children Don’t Belong in Tobacco Fields,https://www.nytimes.com/2014/05/18/opinion/sunday/children-dont-belong-in-tobacco-fields.html,"With children suffering from nicotine poisoning, Washington can’t just rely on the tobacco industry to police its suppliers."
2,2014/05/18,AT&T to Buy DirecTV for $48.5 Billion in Move to Expand Clout,https://www.nytimes.com/2014/05/18/att-to-buy-directv-for-48-5-billion/,"Under the terms of the deal, AT&T will pay about $95 a share in stock and cash to acquire the country’s biggest satellite television operator."
130,2014/05/18,Medicine’s Top Earners Are Not the M.D.s,https://www.nytimes.com/2014/05/18/sunday-review/doctors-salaries-are-not-the-big-cost.html,Overseeing the business of medicine is big business.
35,2014/05/18,Putting Drama to Work to Soothe,https://www.nytimes.com/2014/05/18/theater/daniel-beaty-promotes-both-artistry-and-social-good.html,"The actor and writer Daniel Beaty tips his hat to Paul Robeson in a biographical play he created, but also follows his lead in working toward social change."
1,2014/05/19,AT&T Shareholders on Hold in DirecTV Deal,https://www.nytimes.com/2014/05/19/att-shareholders-on-hold-in-directv-deal/,"The unexpectedly robust $1.6 billion of cost savings from the acquisition do not quite cover the 30 percent premium AT&T is paying, Jeffrey Goldfarb of Reuters Breakingviews writes."
68,2014/05/19,Verizon Wireless Names Faster Part of Its Network: XLTE,https://bits.blogs.nytimes.com/2014/05/19/verizon-wireless-names-faster-part-of-its-network-xlte/,"The X refers to an extra-fast, higher-capacity version of LTE available on about half of Verizon’s network, including in New York and Los Angeles."
4,2014/05/19,How AT&T’s Deal for DirecTV Could Affect the Industry,https://www.nytimes.com/2014/05/19/how-atts-deal-for-directv-could-affect-the-industry/,"Several analysts thought the AT&T’s deal to buy DirecTV would pass regulatory muster, but some consumers and consumer advocates expressed concerns about the effects of reduced competition."
100,2014/05/19,The Curious Incident of Pfizer’s ‘Final’ Offer for AstraZeneca,https://www.nytimes.com/2014/05/19/the-curious-incident-of-pfizers-final-offer-for-astrazeneca/,"Britain does not have as many takeover defenses as the United States, so it is puzzling why Pfizer did not make a full-fledged hostile bid for AstraZeneca, Steven M. Davidoff writes in the Deal Professor column."
16,2014/05/19,"Betty Sherrill, Decorator to the White-Shoed and Wealthy, Dies at 91",https://www.nytimes.com/2014/05/19/nyregion/betty-sherrill-decorator-to-the-white-shoed-and-wealthy-dies-at-91.html,"Mrs. Sherrill, a socialite from the South, was an arbiter of taste for New York’s bygone elite, known for her artful but conservative decorating."
15,2014/05/19,The Advisers Behind the Deal for DirecTV,https://www.nytimes.com/2014/05/19/the-advisers-behind-the-deal-for-directv/,"Even for the telecommunications industry, AT&T’s $48.5 billion bid for DirecTV is a blockbuster deal. And should it be completed, the deal could bestow a wealth of fees upon the advisers who worked on it."
113,2014/05/19,"In Cannes, Who Needs the Movies?",https://runway.blogs.nytimes.com/2014/05/19/in-cannes-who-needs-the-movies/,"Parties, including the Vanity Fair gala, fashion shows and other events occupied celebrities near Cannes, leaving little time for the actual films."
121,2014/05/19,Drugs Found to Aid Breathing in a Fatal Lung Disease,https://www.nytimes.com/2014/05/19/health/drugs-found-to-aid-breathing-in-a-fatal-lung-disease.html,"Patients with idiopathic pulmonary fibrosis who were given pirfenidone or nintedanib declined more slowly, researchers in two studies reported."
26,2014/05/19,Camera Maker GoPro Files to Go Public,https://bits.blogs.nytimes.com/2014/05/19/camera-maker-gopro-files-to-go-public/,"GoPro is an unusual specimen for a Silicon Valley I.P.O., a hardware company without the flash of a social network or e-commerce start-up. The company said in the filing that it planned to raise up to $100 million in an initial public offering, a figure that could change later."
115,2014/05/19,Cashless Customers Hold Riches for Retailers,https://www.nytimes.com/2014/05/19/business/retailers-vie-to-cater-to-the-cash-free-customer.html,A hacking of customer data at Target has intensified the pace of changing the way Americans pay for goods.
8,2014/05/19,Options for Rivals in Wake of AT&T’s Bid for DirecTV,https://www.nytimes.com/2014/05/19/the-options-for-dish-sprint-and-others-in-the-wake-of-atts-bid-for-directv/,"Few industries have been as embroiled in merger mania as the telecommunications industry. Now, with another mega-deal in the works, how will others respond? Perhaps with even more consolidation."
5,2014/05/20,AT&T-DirecTV Deal Churns Regulatory Waters,https://www.nytimes.com/2014/05/20/business/media/att-directv-bid-poses-regulatory-questions.html,"While AT&T’s bid for DirecTV bears similarity to Comcast’s deal for Time Warner Cable, experts say the differences could lead regulators to separate conclusions for each one."
105,2014/05/20,Taxi Commission Official Plans to Join Uber,https://www.nytimes.com/2014/05/20/nyregion/taxi-commission-official-plans-to-join-uber.html,"A top official at the Taxi and Limousine Commission, Ashwini Chhabra, is leaving for Uber, he said on Monday, becoming the company’s first head of policy development and community engagement."
40,2014/05/20,Young Iranians Arrested for Being Too ‘Happy in Tehran’,https://thelede.blogs.nytimes.com/2014/05/20/young-iranians-arrested-for-being-happy-in-tehran/,"Six young Iranians were arrested and forced to repent on state television Tuesday for the grievous offense of proclaiming themselves to be “Happy in Tehran,” in a homemade music video they posted on YouTube."
6,2014/05/20,Daily Report: AT&T-DirecTV Deal Complicates Regulatory Task,https://bits.blogs.nytimes.com/2014/05/20/daily-report-att-directtv-deal-complicates-regulatory-task/,"While AT&T’s bid for DirecTV bears similarity to Comcast’s deal for Time Warner Cable, experts say the differences could lead regulators to separate conclusions for each one."
34,2014/05/20,Mixed Signals in a Corporate Felon’s Punishment,https://www.nytimes.com/2014/05/20/mixed-signals-in-a-corporate-felons-punishment/,"The government’s concern with minimizing the collateral consequences for Credit Suisse almost gives the impression that this was a guilty plea without all the guilt, Peter J. Henning writes in White Collar Watch."
30,2014/05/20,"Charges of Chinese Cyberspying, Wanted Posters Included",https://sinosphere.blogs.nytimes.com/2014/05/20/charges-of-chinese-cyberspying-wanted-posters-included/,"The five members of China’s military accused of hacking against American companies are at the top of the F.B.I. “Cyber’s Most Wanted” list, but little has been revealed about them beyond their names and aliases."
3,2014/05/20,What AT&T’s Satellite Deal Might Mean,https://www.nytimes.com/2014/05/20/opinion/what-atts-offer-might-mean.html,The company has not yet made a convincing case that buying DirecTV will be good for consumers.
128,2014/05/21,AstraZeneca’s Shareholders Remain Sharply Divided Over Talks With Pfizer,https://www.nytimes.com/2014/05/21/astrazenecas-shareholders-remain-sharply-divided-over-talks-with-pfizer/,"The fragmented response offers a glimmer of hope to Pfizer, but AstraZeneca also contends that under British takeover law, its hands are tied unless a third part steps in with a competing bid."
110,2014/05/21,"Looking Overseas, Google Weighs a Shift in Deal Focus",https://www.nytimes.com/2014/05/21/looking-overseas-google-weighs-a-shift-in-deal-focus/,Google’s plan to reserve up to $30 billion of its cash for foreign acquisitions represents both a shift in its focus for mergers and the reality that the company keeps amassing money overseas.
98,2014/05/21,Google S.E.C. Filing Says It Wants Ads In Your Thermostat and Car,https://bits.blogs.nytimes.com/2014/05/21/google-plans-to-deliver-ads-through-your-thermostat-and-car/,"According to a filing with the Securities and Exchange Commission, Google wants to put advertisements on your thermostat, in your car and on your refrigerator."
111,2014/05/21,Remember to Forget,https://www.nytimes.com/2014/05/21/opinion/dowd-remember-to-forget.html,Do you have to live with that goofy Instagram forever?
109,2014/05/21,Pfizer-AstraZeneca Talks Need a Rest and Then a Fresh Start,https://www.nytimes.com/2014/05/21/a-giant-drug-deal-first-needs-a-rest-and-then-a-fresh-start/,"If a merger with Pfizer really makes sense, AstraZeneca’s decision is not now or never, Christopher Hughes of Reuters Breakingviews writes."
97,2014/05/21,Home Depot Leads Weak Retail Sector Ahead of Spring Spending Thaw,https://www.nytimes.com/2014/05/21/business/home-depot-earnings-fall-short-of-expectations.html,"The home improvement chain’s first-quarter sales increased 2.9 percent from a year earlier, but it joined a variety of other retailers in missing earnings expectations."
59,2014/05/21,California Urges Websites to Disclose Online Tracking,https://bits.blogs.nytimes.com/2014/05/21/california-urges-websites-to-disclose-online-tracking/,The state’s attorney general is publishing guidelines meant to help companies comply with a new privacy law that went into effect Jan. 1.
139,2014/05/21,A Close Call for 2 Planes at Newark,https://www.nytimes.com/2014/05/21/nyregion/a-close-call-for-2-planes-at-newark.html,The National Transportation Safety Board reported that the pilots had to take evasive action to prevent a crash at Newark Liberty International Airport on April 24.
45,2014/05/21,Iranians Detained for ‘Happy’ Video Are Released on Bail,https://thelede.blogs.nytimes.com/2014/05/21/iranians-detained-for-happy-video-released-on-bail/,"One of the stars of “Happy in Tehran,” an exuberant music video that offended the sensibilities of Iran’s conservative judiciary, reported on Instagram Wednesday that she was free."
43,2014/05/22,Facebook’s New Privacy Mascot: The Zuckasaurus,https://bits.blogs.nytimes.com/2014/05/22/a-blue-dinosaur-becomes-a-facebook-ambassador-for-1-28-billion-people/,"On Thursday, Facebook showed off a blue dinosaur character that will become the privacy ambassador on the social network. But the dinosaur could follow in the path of Microsoft’s Clippy, and Twitter’s Fail Whale, both of which were meant to help users and ended up being hated by people."
58,2014/05/22,Chromebooks Win Buyers Ready to Live in the Cloud,https://www.nytimes.com/2014/05/22/technology/personaltech/chromebooks-win-users-and-some-respect.html,"Lightweight, inexpensive computers based on Google’s Chrome operating system are gaining acceptance as users learn to live in the cloud."
50,2014/05/22,BlackRock Encourages AstraZeneca to Renew Pfizer Talks at Later Date,https://www.nytimes.com/2014/05/22/blackrock-encourages-astrazeneca-to-renew-pfizer-talks-at-later-date/,"BlackRock, AstraZeneca’s largest shareholder, is said to prefer that the drug firm engage in talks with Pfizer later on rather than accept Pfizer’s most recent offer."
123,2014/05/22,Media Companies Join to Extend the Brands of YouTube Stars,https://www.nytimes.com/2014/05/22/business/media/media-companies-join-to-extend-the-brands-of-youtube-stars.html,"Keywords Press will release six to 10 titles annually, both in print and digital formats."
122,2014/05/22,One Woman’s Lonely Boycott of Amazon,https://bits.blogs.nytimes.com/2014/05/22/one-womans-lonely-boycott-of-amazon/,Amazon likes to say it is obsessed with its customers. It ranks high on the Reputation Institute’s annual survey of the most reputable companies. It’s also one of the hardest companies for customers to give up.
91,2014/05/22,A Survival Course for the Leaders of Companies in Pain,https://www.nytimes.com/2014/05/22/business/smallbusiness/aileron-helps-business-owners-put-companies-on-track.html,"Aileron, a nonprofit in Ohio, teaches business owners how to speed up their management learning curve and address issues that hurt their companies."
41,2014/05/22,Painless Shipping In a Few Easy Steps,https://www.nytimes.com/2014/05/22/technology/personaltech/use-an-app-pay-a-fee-and-ship-almost-anything.html,"To ship through Shyp, you first download the firm’s iPhone app and enter in your payment data."
36,2014/05/22,"As the Delay Continues on Crowdfunding Rules, Concerns About Investor Risks Grow",https://boss.blogs.nytimes.com/2014/05/22/as-the-crowdfunding-delay-continues-concerns-about-the-risks-grow/,Even one of the authors of the crowdfunding legislation wants the regulations tightened.
90,2014/05/23,Federal Regulators Seek to Stop Sale of Students’ Data,https://bits.blogs.nytimes.com/2014/05/23/federal-regulators-seek-to-stop-sale-of-students-data/,"ConnectEDU, a college and career planning site that collected student data, has proposed selling information as part of bankruptcy proceedings."
32,2014/05/23,Sears Posts Worst Report of a Bad Lot in Retailing,https://www.nytimes.com/2014/05/23/business/sears-announces-loss-in-quarterly-earnings.html,Sears Holdings’s dismal earnings report not only lacked signs of improvement but also laid bare how few options the company had left.
116,2014/05/23,Amazon’s Tactics Confirm Its Critics’ Worst Suspicions,https://bits.blogs.nytimes.com/2014/05/23/amazons-tactics-confirm-its-critics-worst-suspicions/,"For years, Amazon’s critics have warned that the bookseller may flex its power once it controls the market for books. Now the company is proving its critics right."
22,2014/05/23,"Fantasy Football: Analyzing N.F.L. Draft Picks, Part 4",https://www.nytimes.com/2014/05/23/sports/football/fantasy-football-analyzing-nfl-draft-picks-part-4.html,"We wrap up our look at fantasy-relevant rookies with players from the A.F.C. South and West, including Bishop Sankey and Marquise Lee."
134,2014/05/23,Elliott Management Backs Skyscraper Revival,https://www.nytimes.com/2014/05/23/elliott-management-backs-skyscraper-revival/,The $24 billion hedge fund run by Paul E. Singer is helping to finance the development of the site of one of Manhattan’s first skyscrapers.
7,2014/05/23,2 Major Time Inc. Magazines Will Run Cover Advertising,https://www.nytimes.com/2014/05/23/business/media/two-time-inc-magazines-will-run-cover-advertising.html,"The ads, tiny strips running along the mailing label area, are to appear on the covers of Time and Sports Illustrated."
86,2014/05/23,Televising Sizzling Meat to Bump Up Sales of a Brisket Sandwich,https://www.nytimes.com/2014/05/23/business/media/televising-sizzling-meat-to-bump-up-sales-of-a-brisket-sandwich.html,"Arby’s filmed a brisket being smoked for 13 hours at the smokehouse in Texas that cures its brisket, and that footage will be one long commercial."
81,2014/05/23,Go Shop? Go Fish.,https://www.nytimes.com/2014/05/23/go-shop-go-fish/,"The tactic of seeking bids after signing up a buyer is intended to ensure top dollar. More often, writes Reynolds Holding of Reuters Breakingviews, it leads to low offers and sale prices, new research shows."
56,2014/05/23,"Tom Leighton of Akamai, on the Professorial Side of Leadership",https://www.nytimes.com/2014/05/23/business/tom-leighton-of-akamai-on-the-professorial-side-of-leadership.html,"Mr. Leighton, chief executive of Akamai Technologies, considers the skills he learned as an academic essential to his position."
62,2014/05/23,"Some Privacy, Please? Facebook, Under Pressure, Gets the Message",https://www.nytimes.com/2014/05/23/technology/facebook-offers-privacy-checkup-to-all-1-28-billion-users.html,The move responds to complaints that the service’s privacy settings are too complicated and that people often don’t know who can see what they’re posting.
138,2014/05/23,"As Publishers Fight Amazon, Books Vanish",https://bits.blogs.nytimes.com/2014/05/23/amazon-escalates-its-battle-against-hachette/,"Seeking ever-higher payments from publishers to bolster its anemic bottom line, Amazon is holding books and authors hostage on two continents by delaying shipments and raising prices."
76,2014/05/24,European Regulators to Start Inquiry Into eBay Data Breach,https://www.nytimes.com/2014/05/24/technology/european-regulators-to-start-inquiry-into-ebay-data-breach.html,Regulators will begin an investigation into the online market after hackers gained access to the personal data of 145 million customers.
23,2014/05/24,Cuban Talks His Way Onto a Limb Occupied by Sterling,https://www.nytimes.com/2014/05/24/sports/basketball/few-owners-could-withstand-a-public-airing-of-private-remarks.html,"Mark Cuban, the owner of the Mavericks, sounded somewhat tone deaf while admitting that he harbors prejudice."
27,2014/05/24,"Where Winners Play, and Losers Pay",https://www.nytimes.com/2014/05/24/arts/video-games/rustys-real-deal-baseball-video-game-tests-haggling-skills.html,"It’s not whether you win or lose, but how well you haggle with a virtual dog in Rusty’s Real Deal Baseball, new from Nintendo."
133,2014/05/25,Global Digital News Brands See Growth Opportunity in India,https://india.blogs.nytimes.com/2014/05/25/global-digital-news-brands-see-growth-opportunity-in-india/,"BuzzFeed, Huffington Post and Atlantic Media are among the companies with plans to build major online news operations in India, both on their own and with local partners."
57,2014/05/25,Faking Cultural Literacy,https://www.nytimes.com/2014/05/25/opinion/sunday/faking-cultural-literacy.html,Our cultural canon is determined by whatever gets the most clicks.
9,2014/05/25,"The Chatter for Sunday, May 25",https://www.nytimes.com/2014/05/25/business/the-chatter-for-sunday-may-25.html,Notable quotes from business articles that appeared in The New York Times last week.
47,2014/05/25,"For Brett Wilson of TubeMogul, It’s All in the Follow-Through",https://www.nytimes.com/2014/05/25/business/corner-office-for-brett-wilson-of-tubemogul-its-all-in-the-follow-through.html,The chief executive of a video advertising software company says it values people “who do what they say — they have a high ‘do-to-say ratio.’”
64,2014/05/25,"Q. and A.: Chan Koonchung on Tibet, Sex and Censorship",https://sinosphere.blogs.nytimes.com/2014/05/25/q-a-chan-koonchung-on-tibet-sex-and-censorship/,"The author’s latest novel, “The Unbearable Dreamworld of Champa the Driver,” about a young Tibetan trying to find his way in Beijing, was published in English this month."
18,2014/05/25,My T-Shirt Told Me to Take a Chill Pill,https://bits.blogs.nytimes.com/2014/05/25/my-t-shirt-told-me-to-take-a-chill-pill/,Smart textiles are starting to hit the market. Their fans say they could represent the future of wearable computing.
102,2014/05/26,No Time to Text? Say It With Stickers,https://www.nytimes.com/2014/05/26/technology/no-time-to-text-apps-turn-to-stickers.html,"Sticker-based apps like Line and WeChat have transformed mobile messaging in Asia, but they have been slow to catch on in North America."
108,2014/05/26,Music Data Analyst Turns Sights to Books,https://www.nytimes.com/2014/05/26/business/media/music-data-analyst-turns-sights-to-books.html,"Next Big Sound is bringing its data analytics to book sales, with Next Big Book. It has also struck a partnership with Macmillan."
48,2014/05/26,"The Economy, Explored on Film",https://www.nytimes.com/2014/05/26/business/media/the-economy-explored-on-film.html,"The three- to five-minute shorts — a team effort of Paul G. Allen and Morgan Spurlock, the director of “Super Size Me” — will explain concepts like markets, money, and debt and credit."
33,2014/05/26,"Frank M. Woods, Vintner and Ambassador for Sonoma, Dies at 81",https://www.nytimes.com/2014/05/26/business/frank-m-woods-ambassador-for-sonoma-wines-dies-at-81.html,"Mr. Woods, a marketer and lifelong entrepreneur, put Sonoma County grapes on the map with his Clos du Bois winery."
25,2014/05/26,Rebutting Mark Cuban on Bigotry,https://www.nytimes.com/2014/05/26/opinion/blow-rebutting-mark-cuban-on-bigotry.html,"He gets points for candor, but the conversation can’t end there."
99,2014/05/27,Dairy Queen Finds a Summer Love: The S’more,https://www.nytimes.com/2014/05/27/business/media/dairy-queen-finds-a-summer-love-the-smore.html,"The company’s new ad campaign focuses on limited-time offers, including the S’mores Blizzard, returning from last summer, and a second item, the Chips Ahoy Blizzard, new for this summer."
96,2014/05/27,A Site That Matches Hotels With Prospective Guests,https://intransit.blogs.nytimes.com/2014/05/27/a-site-that-matches-hotels-with-prospective-guests/,The new booking site Hotelied matches users with hotels that might find them desirable (discounts are often involved).
65,2014/05/27,From Humble Sneaker to Luxury Icon,https://www.nytimes.com/2014/05/27/fashion/trends/from-humble-sneaker-to-luxury-icon.html,"Status-symbol men's shoes are having their moment, with some high-end brands selling for more than $1,000."
114,2014/05/27,"In Expanded Program, Officers Across New York City Will Carry Antidote for Heroin Overdoses",https://www.nytimes.com/2014/05/27/nyregion/in-expanded-program-officers-across-new-york-city-will-carry-antidote-for-heroin-overdoses.html,"An expansion of a program on Staten Island, paid for by the state attorney general’s office, would give kits to those most likely to come into street-level contact with overdose victims."
69,2014/05/27,The Google Car Takes a Step Away From Boring,https://bits.blogs.nytimes.com/2014/05/27/the-google-car-takes-a-step-away-from-boring/,Google is making the leap from semi-autonomous to completely autonomous cars. But what exactly does the search company plan to do with them?
126,2014/05/27,A Cable Merger Too Far,https://www.nytimes.com/2014/05/27/opinion/a-cable-merger-too-far.html,"Regulators should block Comcast’s acquisition of Time Warner Cable because it would control too much of what consumers watch, read and listen to."
78,2014/05/27,It’s Not as Simple as Asking to ‘Be Forgotten’ by Google,https://www.nytimes.com/2014/05/27/upshot/its-not-as-simple-as-asking-to-be-forgotten-by-google.html,A European court’s ruling on the ability to erase links to negative information may not solve the issue of harm to a person’s reputation.
75,2014/05/27,Applying the Lessons of Politics to Green Power,https://www.nytimes.com/2014/05/27/business/energy-environment/applying-the-lessons-of-politics-to-green-power.html,"Ethical Electric, a start-up founded by a former Washington political operative, allows customers to sign up for electricity from renewable sources."
92,2014/05/27,Amazon Strategy Raises Hackles in Germany,https://www.nytimes.com/2014/05/27/business/international/amazon-strategy-raises-hackles-in-germany.html,The U.S. company's tough tactics with one of the country's publishers have been taken as an indication of its moves in the future.
88,2014/05/27,Twitter’s Growth Shifts to Developing Countries,https://bits.blogs.nytimes.com/2014/05/27/twitters-growth-shifts-to-developing-countries/,"Twitter’s growth is sizzling in developing countries like Indonesia and India. But it is slowing down in the United States and Europe, where the social network makes most of its revenue."
63,2014/05/28,"Threatening a Proxy Battle, Valeant Raises Its Offer on the Botox Maker Allergan",https://www.nytimes.com/2014/05/28/valeant-raises-bid-for-allergan/,"Raising the possibility of a hostile takeover, the drug maker said it would increase the amount of cash it would pay Allergan to $58.30 a share."
52,2014/05/28,Valeant’s Latest Move Disappoints,https://www.nytimes.com/2014/05/28/valeants-latest-move-disappoints/,"In its pursuit of the maker of Botox, Valeant Pharmaceuticals has more work to do to reclaim the role of aggressor, writes Jeffrey Goldfarb of Reuters Breakingviews."
17,2014/05/28,Even Sun Microsystems Had Its Roots at Xerox PARC,https://bits.blogs.nytimes.com/2014/05/28/even-sun-microsystems-had-its-roots-at-xerox-parc/,"Most in the tech industry know how Apple and Microsoft owe (at least) inspiration to the famed research laboratory. Not many know that Sun, once one of the most influential companies in tech, also learned a few things from PARC."
13,2014/05/28,"By Design | Warm, Versatile Minimalism from Calvin Klein's Latest Furniture Collection",http://tmagazine.blogs.nytimes.com/2014/05/28/warm-versatile-minimalism-from-calvin-klein-latest-furniture-collection/,"Made with natural oak and brass, the house’s newest offerings will find a place in almost any home."
74,2014/05/28,"With July 4th Fireworks Leaving the Hudson, Jersey City’s Show Will Return",https://www.nytimes.com/2014/05/28/nyregion/with-july-4th-fireworks-leaving-the-hudson-jersey-city-will-revive-its-own-show.html,"Mayor Steven Fulop of Jersey City has seized the chance to stage a fireworks show in Liberty State Park, with the Statue of Liberty itself as a backdrop."
87,2014/05/28,Intel Shows Off ‘Smart’ Wearable Shirt,https://bits.blogs.nytimes.com/2014/05/28/intel-shows-off-smart-wearable-shirt/,"Intel announced that it was making a smart T-shirt in partnership with AIQ, a company that makes electronic-based textiles. The company hopes that the shirt will be used by people who exercise regularly."
83,2014/05/28,Goldman Predicts Brazil Will Win the 2014 World Cup,https://www.nytimes.com/2014/05/28/goldman-brazil-will-win-the-2014-world-cup/,The report from the Wall Street firm says that the winning nation typically sees an upturn in its local stock market the following month.
