,date,headline,link,summary
42,2016/10/26,AT&T Cheerleading Squad for Merger: Nearly 100 Lobbyists,https://www.nytimes.com/2016/10/26/technology/att-set-to-lobby-for-merger-with-deep-pockets-and-a-big-network.html,"As a multimillion-dollar donor to lawmakers, with a huge roster of lobbyists, the communications giant is ready to pursue its $85 billion bid for Time Warner."
876,2016/10/26,"Donald Trump, Alien to All That’s Great",https://www.nytimes.com/2016/10/26/opinion/donald-trump-alien-to-all-thats-great.html,"We know who he is. The big question now is, who are the rest of us?"
27,2016/10/26,AT&T’s Bid for Time Warner Faces Fierce Political Opposition,https://www.nytimes.com/2016/10/26/business/dealbook/atts-bid-for-time-warner-faces-fierce-political-opposition.html,The industry is already controlled by a small group of companies in an environment that gave rise to opponents like Donald J. Trump and Bernie Sanders.
35,2016/10/27,Individualized Ads on TV Could Be One Result of AT&T-Time Warner Merger,https://www.nytimes.com/2016/10/27/business/media/targeted-advertising-time-warner-merger.html,"In a call with investors, the chiefs of the companies noted that the combined trove of their consumer data would be useful to marketers and consumers."
1525,2016/10/27,Can a Spoonful From Pepsi Help the Medicine Go Down?,https://www.nytimes.com/2016/10/27/well/live/can-a-spoonful-of-pepsi-help-the-medicine-go-down.html,PepsiCo is returning to its pharmaceutical origins by working to improve the taste of tuberculosis drugs for children.
23,2016/10/27,AT&T’s Vision of Ultrafast Wireless Technology May Be a Mirage,https://www.nytimes.com/2016/10/27/technology/atts-vision-of-ultrafast-wireless-technology-may-be-a-mirage.html,The rapid wireless technology the company has described as a pillar of its Time Warner deal probably is a decade away from meaningful deployment.
44,2016/10/27,AT&T Could Find a Lesson in Comcast’s Media Merger,https://www.nytimes.com/2016/10/27/business/dealbook/att-could-find-a-lesson-in-comcasts-media-merger.html,Comcast’s acquisition of NBCUniversal was prudent by today’s standards.
1421,2016/10/27,Twitter Has an Old Media Problem. Here’s a Solution.,https://www.nytimes.com/2016/10/27/opinion/twitter-has-an-old-media-problem-heres-a-solution.html,"The company has become an indispensable news source for millions but as a business, it needs a white knight to swoop in."
1654,2016/10/27,Why Wait a Month for a Sofa That’s Not Even What You Wanted?,https://www.nytimes.com/2016/10/27/business/smallbusiness/why-wait-a-month-for-a-sofa-thats-not-even-what-you-wanted.html,"Start-ups are trying to break off pieces of the furniture market by offering custom sizes and colors, or more affordable prices, and quicker turnaround."
1729,2016/10/27,An Annuity for the Teacher — and the Broker,https://www.nytimes.com/2016/10/27/your-money/403-b-retirement-plans-teachers-brokers-fees.html,A look inside the high-pressure job of selling workplace annuities to public schoolteachers.
78,2016/10/27,"Morning Agenda: New Antitrust Era, Relief for VW Owners, Apple’s Optimism",https://www.nytimes.com/2016/10/27/business/dealbook/att-time-warner-volkswagen-apple.html,"The AT&T deal with Time Warner comes during what could be a new era for competition law, as a new generation of legal scholars concentrate on different facets of mergers."
918,2016/10/27,How Donald Trump Used Hollywood to Create ‘Donald Trump’,https://www.nytimes.com/2016/10/27/business/media/donald-trump-movies-tv-cameos.html,"Donald J. Trump has been a near-constant presence in TV shows, movies, documentaries, pageants and even professional wrestling events, since the 1980s."
1052,2016/10/28,‘Kimmy Schmidt’s’ Tituss Burgess: ‘My Presence Is Political’,https://www.nytimes.com/2016/10/28/opinion/kimmy-schmidts-tituss-burgess-my-presence-is-political.html,"The “Unbreakable Kimmy Schmidt” star talks about LGBT characters on TV, his future plans and Donald Trump."
379,2016/10/28,"Vine Is Closing Down, and the Internet Can’t Stand It",https://www.nytimes.com/2016/10/28/technology/vine-is-closing-down-and-the-internet-cant-stand-it.html,"One theory about the six-second video app’s demise says it was dead weight for its owner, Twitter, which is struggling to become profitable."
55,2016/10/28,Daily Report: Every Big Deal Must Have a Great Tech Angle,https://www.nytimes.com/2016/10/28/technology/daily-report-every-big-deal-must-have-a-great-tech-angle.html,AT&T’s chief executive says a pillar of his company’s acquisition of Time Warner is networking technology called 5G. But it could be years away.
759,2016/10/28,"Pushing That Crosswalk Button May Make You Feel Better, but …",https://www.nytimes.com/2016/10/28/us/placebo-buttons-elevators-crosswalks.html,"Some buttons, such as the door-close button on an elevator, are mere artifices — placebos that promote an illusion of control but in reality do not work."
86,2016/10/28,"Morning Agenda: Finance Gets Chatty, 2016’s Biggest American I.P.O., EpiPen Rival Returns, Commercials Just for You",https://www.nytimes.com/2016/10/28/business/morning-agenda-finance-gets-chatty-2016s-biggest-american-ipo-epipen-rival-returns-commercials-just-for-you.html,"Bank of America, MasterCard and some financial start-ups have been trying out chatbots that can initiate transactions and give financial advice."
1647,2016/10/28,Apple’s New MacBook Pro Gets More Touchy,https://www.nytimes.com/2016/10/28/technology/apple-new-laptop-touch-bar-macbook-pro.html,The new laptops feature a Touch Bar where function keys used to be. It works differently depending on the app in use.
1045,2016/10/28,Chelsea Clinton’s Frustrations and Devotion Shown in Hacked Emails,https://www.nytimes.com/2016/10/28/us/politics/bill-chelsea-clinton-foundation.html,The emails paint a detailed portrait of Ms. Clinton as she set about her goal of “protecting my father and the nonprofit status” of the Clinton Foundation.
29,2016/10/28,AT&T’s Bid for Time Warner Could Bolster Boutique Advisers,https://www.nytimes.com/2016/10/28/business/dealbook/atts-bid-for-time-warner-could-bolster-boutique-advisers.html,An increase in new deals would help reverse a decline in revenue for independent advisory companies.
1367,2016/10/28,"Review: In ‘Good Girls Revolt,’ the ‘Nasty’ Women of the 1960s Fight Job Discrimination",https://www.nytimes.com/2016/10/28/arts/television/review-in-good-girls-revolt-the-nasty-women-of-the-1960s-fight-job-discrimination.html,"Amazon’s new show, about a group of young journalists, has serendipitous parallels to the contentious gender politics dominating the presidential election."
1219,2016/10/29,"Review: ‘The Fall’ Returns, but Will the Deadly Hunt Continue?",https://www.nytimes.com/2016/10/29/arts/television/review-the-fall-netflix-gillian-anderson.html,"This serial-killer drama, starring Gillian Anderson and Jamie Dornan, comes back for Season 3 on Netflix. It was created for Irish and British television."
88,2016/10/29,Telecoms’ Ambitions on Targeted Ads Seen Curbed by F.C.C.’s New Privacy Rules,https://www.nytimes.com/2016/10/29/business/media/telecoms-ambitions-on-targeted-ads-seen-curbed-by-fccs-new-privacy-rules.html,AT&T’s and Verizon’s hopes of collecting and analyzing customer data to sell advertising may be dashed if they have to ask customers’ permission.
1260,2016/10/29,"5 Vine Stars Share Why They Loved, and Outgrew, Platform",https://www.nytimes.com/2016/10/29/technology/5-vine-stars-share-why-they-loved-and-outgrew-platform.html,Vine was a place for people with talents across different disciplines — it allowed artists-slash-comedians-slash-musicians to flourish.
1247,2016/10/29,"Morning Agenda: Shunning Hedge Funds, Chip Makers Consolidate, Tech Lessons",https://www.nytimes.com/2016/10/29/business/dealbook/carlyle-hedge-funds-qualcomm-google-amazon.html,Carlyle Group has joined the growing list of investors who are taking their money out of hedge funds. The private equity firm is instead opting for direct lending.
1714,2016/10/29,Twitter’s 4-Year Odyssey With the 6-Second Video App Vine,https://www.nytimes.com/2016/10/29/technology/twitters-4-year-odyssey-with-the-6-second-video-app-vine.html,"Twitter built up Vine to leapfrog Instagram and cultivated star users. But as competition stiffened, and employees and users peeled off, Vine lost its hold."
1592,2016/10/30,Meeting ‘the Other’ Face to Face,https://www.nytimes.com/2016/10/30/arts/design/meeting-the-enemy-face-to-face-through-virtual-reality.html,"With “The Enemy” project at M.I.T., the photojournalist Karim Ben Khelifa hopes to engender a form of empathy beyond the reach of traditional documentary film."
1055,2016/10/30,"Kesha, Interrupted",https://www.nytimes.com/interactive/2016/10/30/magazine/kesha-lawsuit-dr-luke.html,"Four years ago, she was a global superstar. Then a contract dispute — and her rape claim against her producer — sent her career into the wilderness."
1585,2016/10/30,Fast Times on the Campaign Trail in ‘Embeds’,https://www.nytimes.com/2016/10/30/style/embeds-comedy-presidential-campaign-megyn-kelly.html,The show will take a comic look at young political reporters against the backdrop of covering a presidential campaign.
9,2016/10/30,The AT&T-Time Warner Merger: A Match Built on Hope,https://www.nytimes.com/2016/10/30/business/the-att-time-warner-merger-a-match-built-on-hope.html,AT&T has long rewarded shareholders with one of the most sumptuous dividends on Wall Street. But the debt it’s taking on for its Time Warner deal could put that at risk.
1301,2016/10/30,"Farhad and Mike’s Week in Tech: Microsoft, Apple and Halloween!",https://www.nytimes.com/2016/10/30/technology/farhad-and-mikes-week-in-tech-microsoft-apple-and-halloween.html,Farhad is going as sexy Donald Trump and Mike as Guy Fieri. Amazon gets them reminiscing about Matthew McConaughey in a 1990s stoner movie.
1271,2016/10/30,Austin McChord of Datto: It’s Not Awesome Till It’s Awesome,https://www.nytimes.com/2016/10/30/business/austin-mcchord-of-datto-its-not-awesome-till-its-awesome.html,"Austin McChord, C.E.O. of the data protection company Datto, says he resists the trend of automatically handing out praise and instead saves it for exceptional achievements."
32,2016/10/30,"For AT&T Chief, Time Warner Deal Is the Peak of an Ambitious Climb",https://www.nytimes.com/2016/10/30/business/dealbook/for-att-chief-time-warner-deal-is-the-peak-of-an-ambitious-climb.html,"Randall Stephenson has a history of staking out risky business propositions, including speaking up on divisive subjects and aggressively going after acquisitions."
1409,2016/10/30,Camille Becerra Finds a Home via Instagram,https://www.nytimes.com/2016/10/30/realestate/camille-becerra-finds-a-home-via-instagram.html,"The chef found her apartment with help from her 76,600 followers."
1176,2016/10/30,"In ‘The Crown,’ a Young Queen, but a Young Woman, Too",https://www.nytimes.com/2016/10/30/arts/television/in-the-crown-a-young-queen-but-a-young-woman-too.html,The conflict between private and public is the central subject of this ambitious Netflix show about the reign of Queen Elizabeth II.
1234,2016/10/30,Obama Brought Silicon Valley to Washington,https://www.nytimes.com/2016/10/30/magazine/barack-obama-brought-silicon-valley-to-washington-is-that-a-good-thing.html,His administration embraced some of the tech industry’s best ideas — but also some of its worst values.
1658,2016/10/31,Peter Thiel Defends His Most Contrarian Move Yet: Supporting Trump,https://www.nytimes.com/2016/10/31/technology/peter-thiel-defends-his-most-contrarian-move-yet-supporting-trump.html,"The tech billionaire is known for bucking convention, but his backing of Mr. Trump’s presidential bid has outraged much of Silicon Valley."
305,2016/10/31,Publishers Are Rethinking Those ‘Around the Web’ Ads,https://www.nytimes.com/2016/10/31/business/media/publishers-rethink-outbrain-taboola-ads.html,"The ads, which appear mostly via the services Outbrain and Taboola, can lead to questionable websites. Now some publishers wonder about the effect on their readers."
1750,2016/10/31,The Stakes Are Rising in Google’s Antitrust Fight With Europe,https://www.nytimes.com/2016/10/31/technology/google-europe-antitrust.html,"The search giant is fighting three antitrust charges, and the results will have a major impact on both the tech company and European policy makers."
53,2016/10/31,Seeking Ownership of Both the Information and the Superhighway,https://www.nytimes.com/2016/10/31/business/media/seeking-ownership-of-both-the-information-and-the-superhighway.html,The AT&T-Time Warner merger raises concerns about the combination of a huge wireless company with a major movie studio and popular cable channels.
56,2016/10/31,Media’s Odd Couple: Proudly Freewheeling HBO and Buttoned-Up AT&T,https://www.nytimes.com/2016/10/31/business/media/new-media-odd-couple-hbo-att.html,"The telecom giant says it will not interfere with the network, which embraces sex and violence and spends money at will. But the union might not be that simple."
1597,2016/10/31,Con Ed Says Plan to Install Rooftop Solar Panels Will Aid Poor New Yorkers,https://www.nytimes.com/2016/10/31/nyregion/con-ed-says-plan-to-install-rooftop-solar-panels-will-aid-poor-new-yorkers.html,The utility plans to ask state regulators this week for permission to install solar panels on some of its buildings in the city and to share the benefits with needy customers.
1501,2016/11/01,"Morning Agenda: Competition Heats Up, the Fight Over Global Trade",https://www.nytimes.com/2016/11/01/business/dealbook/google-europe-vestager-trade-canada-ceta.html,"The stakes are rising for antitrust cases, especially in Europe, where Margrethe Vestager, the European competition chief, has picked some prominent fights."
1818,2016/11/01,N.B.A. Schedule: Here’s What to Watch This Week,https://www.nytimes.com/2016/11/01/sports/basketball/nba-schedule-heres-what-to-watch-this-week.html,The Chicago Bulls square off against the Boston Celtics on Wednesday for the second time this season. Each team has hopes of breaking the Cleveland Cavaliers’ stranglehold on the Eastern Conference.
1239,2016/11/01,Vine Dries Up. Black Humor Loses a Home,https://www.nytimes.com/2016/11/01/arts/vine-jay-versace-black-culture.html,Vine has been the internet home of conversations about the dynamics of comedy and culture created by black people.
1695,2016/11/01,Study Finds Some Uber and Lyft Drivers Racially Discriminate,https://www.nytimes.com/2016/11/01/technology/uber-lyft-racial-discrimination.html,Researchers who studied trips in Seattle and Boston said African-American users might wait up to 35 percent longer for rides than white users.
1414,2016/11/01,"Promoting Clinton, Obama Is a Snapchat Rarity: He Hopes His Message Lasts",https://www.nytimes.com/2016/11/01/us/politics/obama-snapchat-clinton-election.html,"The president recently recorded an interview for the image and video service, part of a push to galvanize support for Hillary Clinton among young people."
1786,2016/11/01,"Facebook Could Be Associated With a Longer Life, Study Finds",https://www.nytimes.com/2016/11/01/science/facebook-longer-life.html,"While the social media company cooperated with the research, it tracks other findings that social ties are linked to longevity."
1261,2016/11/01,Why Your Facebook Friends Are Checking In to Standing Rock,https://www.nytimes.com/2016/11/01/us/why-your-facebook-friends-are-checking-into-standing-rock.html,"People are using social media in the fight against the Dakota Access pipeline project, but the authorities say they’re not fooling anyone."
1603,2016/11/01,"CenturyLink, a Network Provider, to Acquire Level 3, a Rival",https://www.nytimes.com/2016/11/01/business/dealbook/centurylink-a-network-provider-to-acquire-level-3-a-rival.html,"In a $25 billion deal, the two companies will combine to create one of the largest communications providers for businesses."
1297,2016/11/01,Daily Report: Google’s Day in Europe’s Court Highlights Nature of New Tech,https://www.nytimes.com/2016/11/01/technology/daily-report-googles-day-in-europes-court-highlights-nature-of-new-tech.html,The search giant is one of several American tech companies facing inspections overseas for the way they do business.
1682,2016/11/01,"In a Copyright Case, Justices Ponder the Meaning of Fashion",https://www.nytimes.com/2016/11/01/us/politics/in-a-copyright-case-justices-ponder-the-fashion-industry.html,"The case before the Supreme Court concerns cheerleaders’ uniforms, but the implications for the world of fashion are vast."
1719,2016/11/01,Studies Linked to Soda Industry Mask Health Risks,https://www.nytimes.com/2016/11/01/well/eat/studies-linked-to-soda-industry-mask-health-risks.html,Soft drink studies conducted by independent researchers tend to draw different conclusions than studies supported by the beverage industry.
111,2016/11/02,"Morning Agenda: Markets and Trump, Time to Team Up, New Currency Frenzy",https://www.nytimes.com/2016/11/02/business/dealbook/trump-markets-economy-merger-currency.html,It is extremely hard to predict what markets will do in the event of Donald J. Trump winning the presidential election. It can even be hard to tell the election’s impact on the economy.
1816,2016/11/02,FilmStruck Streaming Service Places a Big Bet on Cinephiles,https://www.nytimes.com/2016/11/02/arts/television/filmstruck-streaming-service-places-a-big-bet-on-cinephiles.html,Turner Classic Movies and the Criterion Collection hope FilmStruck appeals to viewers who want to supplement other streaming services or cable.
138,2016/11/02,How Waning Competition Deepens Labor’s Plight,https://www.nytimes.com/2016/11/02/business/economy/how-waning-competition-deepens-labors-plight.html,"As many markets become more concentrated, America’s competition policy can no longer be understood in the narrow terms of protecting consumers from higher prices."
1666,2016/11/02,Will.i.am Moves Wearables Off the Wrist With the Help of Kendall Jenner and Apple,https://www.nytimes.com/2016/11/02/fashion/wearable-technology-will-i-am.html,"“We don’t expect our technology to match our outfits,” the entertainer-entrepreneur said. But with a band of fashion power players, he’s out to change that."
1133,2016/11/02,Daily Report: A $25 Billion Fiber Merger,https://www.nytimes.com/2016/11/02/technology/daily-report-a-25-billion-fiber-merger.html,"CenturyLink’s purchase of Level 3 is the latest sign of action in the high-potential, high-cost and high-stakes business of networking."
54,2016/11/02,Blockbuster Deals in a Race to Stay Ahead of the Competition,https://www.nytimes.com/2016/11/02/business/dealbook/blockbuster-deals-in-a-race-to-stay-ahead-of-the-competition.html,"Cheap money and investor confidence are driving a surge in mergers, leaving industries dominated by a few big players."
1111,2016/11/02,"In Greece, Property Is Debt",https://www.nytimes.com/2016/11/02/opinion/in-greece-property-is-debt.html,People are turning their backs on what used to be a pillar of the country’s economy and society: real estate.
1772,2016/11/02,That Historic Cocktail? Turns Out It’s a Fake,https://www.nytimes.com/2016/11/02/dining/seelbach-cocktail-louisville-fake.html,The bartender behind Louisville’s celebrated Seelbach cocktail and its quirky back story admits that he made it all up.
1519,2016/11/03,Outrage in Bronx as Barnes & Noble Is Set to Close,https://www.nytimes.com/2016/11/03/nyregion/barnes-noble-bronx-closing.html,"A rent increase has prompted the store to shutter in January, leaving the underserved borough without a general-interest bookstore."
1706,2016/11/03,The Political Awakening of a Fashion Power Player,https://www.nytimes.com/2016/11/03/fashion/raul-martinez-conde-nast-latino-presidential-election.html,"Raúl Martinez, the most powerful Latino in glossy publishing, finds his voice."
1579,2016/11/03,"Stanford Lipsey, 89, Publisher Whose Nebraska Weeklies Won Pulitzer, Dies",https://www.nytimes.com/2016/11/03/business/media/stanford-lipsey-died-buffalo-news.html,"Mr. Lipsey’s Omaha chain, the Sun Newspapers, won in 1973 for exposing fund-raising excesses by Boys Town, the charity for orphaned children."
1739,2016/11/03,Microsoft Puts Slack in Cross Hairs With New Office Chat App,https://www.nytimes.com/2016/11/03/technology/microsoft-teams-slack-competitor.html,"The tech giant introduced Microsoft Teams, an addition to its Office 365 suite, which resembles Slack but adds features like threaded conversations and videoconferencing."
116,2016/11/03,"Collusion Caused Dodgers TV Blackout, Justice Department Says",https://www.nytimes.com/2016/11/03/sports/baseball/directv-sportsnet-la-dodgers-time-warner-cable.html,The government accuses DirecTV of making moves that corrupted negotiations.
1707,2016/11/04,Google Rebuts Antitrust Claims in Europe,https://www.nytimes.com/2016/11/04/technology/google-eu-antitrust-europe.html,"The search giant faces three cases accusing it of hampering consumer choice and crippling competitors, all of which it denies."
1065,2016/11/04,Google Home vs. Amazon Echo: A Face-Off of Smart Speakers,https://www.nytimes.com/2016/11/04/technology/personaltech/google-home-vs-amazon-echo-a-face-off-of-smart-speakers.html,"Which is a better helper, Google Home or Amazon Echo? A side-by-side test for six days revealed strengths and weaknesses."
1533,2016/11/04,‘Luke Cage’ Made Him a Fashion Hero,https://www.nytimes.com/2016/11/04/fashion/mens-style/mike-colter-luke-cage-superhero-mens-fashion.html,Mike Colter describes how the character he plays has changed his wardrobe.
1757,2016/11/05,Trump Tower in Toronto Is in Receivership After Poor Sales,https://www.nytimes.com/2016/11/05/world/americas/canada-trump-tower-toronto.html,The hotel and condominium tower is in receivership after the owners failed to make debt payments for a year and a court ruled that investors were deceived.
1104,2016/11/05,How to Satirize This Election? Even the Onion Is Having Trouble,https://www.nytimes.com/2016/11/05/business/media/how-to-satirize-this-election-even-the-onion-is-having-trouble.html,"The 2016 presidential campaign, with its unsavory issues and unpopular candidates, has proved challenging to the staff of the satirical website The Onion."
1698,2016/11/05,These Officials Help Write Ballot Questions. Companies Write Them Checks.,https://www.nytimes.com/2016/11/05/us/politics/secretaries-of-state-elections-ballot-initiatives.html,"Secretaries of state, who oversee ballot measures on issues like gun control and the minimum wage, are courted by interest groups and industries with billions of dollars at stake."
191,2016/11/05,"Kobe Bryant’s Next Step, New Shoes and Moves With Los Angeles Artists",https://www.nytimes.com/2016/11/05/arts/design/kobe-bryants-next-step-new-shoes-with-los-angeles-artists.html,"Mr. Bryant, who retired from basketball, has entered several other ventures."
1626,2016/11/06,A Gmail Rival Sent to Siberia by a Mysterious Google Glitch,https://www.nytimes.com/2016/11/06/your-money/a-gmail-rival-sent-to-siberia-by-a-mysterious-google-glitch.html,"For 10 months, until Google “fixed something,” ProtonMail was pushed deep into Google’s search results, a reminder of the conflict of interest at the company’s core."
1100,2016/11/06,Searching for Lady Kung Fu,https://www.nytimes.com/2016/11/06/nyregion/searching-for-lady-kung-fu.html,Angela Mao was as famous as Bruce Lee when she was a martial arts film star during the 1970s. Then she seemed to vanish. It turns out she’s been in Queens this whole time.
603,2016/11/06,What Ken Jeong Can’t Travel Without,https://www.nytimes.com/2016/11/06/travel/what-ken-jeong-cant-travel-without.html,"When the star of the ABC comedy series “Dr. Ken” takes a trip, he always brings multiple chargers and honey cough drops."
1604,2016/11/07,"Oracle on Track to Acquire NetSuite, a Cloud Storage Company",https://www.nytimes.com/2016/11/07/business/dealbook/oracle-on-track-to-acquire-netsuite-a-cloud-storage-company.html,"The company said that holders of 53 percent of unaffiliated NetSuite shares agreed to tender their shares, and the deal will be completed on Monday."
1796,2016/11/07,Oil Industry’s New Threat? The Global Growth of Electric Cars,https://www.nytimes.com/2016/11/07/business/energy-environment/the-global-growth-of-electric-cars.html,"Aided by tax breaks, Norwegians have embraced the vehicles, and experts say the rest of the world may not be far behind."
170,2016/11/07,"Beware, iPhone Users: Fake Retail Apps Are Surging Before Holidays",https://www.nytimes.com/2016/11/07/technology/more-iphone-fake-retail-apps-before-holidays.html,"Hundreds of rogue apps, most of which came from developers in China, have managed to slip through Apple’s review process."
896,2016/11/07,Overturning Election Day Tradition,https://www.nytimes.com/roomfordebate/2016/11/07/overturning-election-day-tradition,
73,2016/11/07,How Comcast and NBCUniversal Used Minions to Fuse an Empire,https://www.nytimes.com/2016/11/07/business/media/media-merger-success-comcast-and-nbcuniversal-say-yes.html,"Supporters of the AT&T-Time Warner deal have pointed to the success of a similar one between Comcast and NBCUniversal, where both sides are thriving."
68,2016/11/08,"Morning Agenda: VW Scandal, Banker Bonuses, Media Mergers and Minions",https://www.nytimes.com/2016/11/08/business/dealbook/volkswagen-potsch-bank-bonus-att-comcast.html,"Prosecutors are investigating whether Hans Dieter Pötsch, the former top finance official at Volkswagen, failed to warn shareholders about the scandal."
