,date,headline,link,summary
5,2014/04/30,Reinventing Rye Playland Ignites an Unexpected Battle,https://www.nytimes.com/2014/04/30/nyregion/reinventing-rye-playland-ignites-an-unexpected-battle.html,"Neighbors of the Art Deco amusement park, built in 1928 and run by Westchester County, object to planned additions like a large field house."
1,2014/05/01,Time Warner’s Profit Rises On Strength in Film Unit,https://www.nytimes.com/2014/05/01/business/media/time-warner-posts-7-increase-in-first-quarter-profits.html,"The growth from movie and cable businesses helped fuel a 9 percent increase in revenue to $7.5 billion, from $6.9 billion during the same period a year ago."
0,2014/05/02,"With Online Video Offerings, the Establishment Plays the Upstart",https://www.nytimes.com/2014/05/02/business/media/with-online-video-offerings-the-establishment-plays-the-upstart.html,"Ambitious efforts are being made by legacy media companies like Time Inc. to join the frenzy of online video content creation that was set off by so-called digital natives like AOL, BuzzFeed and others."
3,2014/05/03,"Steve Jobs Defied Convention, and Perhaps the Law",https://www.nytimes.com/2014/05/03/business/steve-jobs-a-genius-at-pushing-boundaries-too.html,Mr. Jobs’s conduct is a reminder that the difference between genius and potentially criminal behavior can be a fine line.
2,2014/05/04,"Sometimes, the Video Doesn’t Have to Go Viral",https://boss.blogs.nytimes.com/2014/05/04/sometimes-the-video-doesnt-have-to-go-viral/,The video was a flop — except that it doubled our revenue.
4,2014/05/05,Slate Raising Its Investment in Podcasts,https://www.nytimes.com/2014/05/05/business/media/slate-raising-its-investment-in-podcasts.html,Slate is introducing two new podcasts at a time when other news publications have shrunk their podcast offerings in favor of video programming.
