,date,headline,link,summary
24,,"Paid Notice: Deaths MAZZOLA, ANTHONY A.",https://www.nytimes.com/Link.asp?I=LS000171106801,"<!-- ANTHONY A MAZZOLA --><IMG SRC=""/Images/Cobrands/NYTimes/Photos/NYT-1000637569-MAZZOLAA.1_011629.jpg"" lgyOrigName=""NYT-1000637569-MAZZOLAA.1.jpg"" ALIGN=""LEFT"" vspace=""4"" hspace=""10"">MAZZOLA--Anthony T., Former editor in chief of Town&Country and Harper's BAZAAR, and the curator of Hearst Corporation's fine art collection, died May 21 in New York. He was 90. ""Anthony Mazzola was a dynamic member of the Hearst Magazines family for more than 65 years,"" said Steven R. Swartz, president and CEO, Hearst Corporation. ""Tony will be missed by everyone who had the pleasure of working with him."" Frank A. Bennack, Jr., former CEO and now executive vice chairman of Hearst Corporation, added, ""Tony Mazzola's contributions to Harper's BAZAAR and Town&Country have not only influenced those titles as they appear even today but our entire magazine business."" Mazzola, the editor who defined affluence and style for millions of readers at the two magazines for 44 years, started his career at Hearst as an art director. In 1948, at the age of 25, Mazzola joined Town&Country as the youngest art director in the magazine's history. He held that post for nearly two decades, ultimately becoming editor in chief in 1965. Town&Country is the longest continuously published general-interest magazine in America, having been founded in 1846. ""Tony Mazzola was one of the most creative editors I've known,"" said Hearst Corporation Director Gilbert C. Maurer. ""A man of great personal style, he intuitively knew what good looked like and his work at Town&Country and Harper's BAZAAR reflected that acute sensibility. Tony was a loyal friend as well as a valuable mentor to a generation of our younger talents."" Building on what he once described as his ""fascination with trends,"" Mazzola's Town&Country began to reflect the current events and social reorganization then affecting elite American society as the nation mourned the assassination of President John F. Kennedy and grappled with civil rights, the Vietnam War and the first stirrings of modern-day feminism. Mazzola said he was captivated ""not by what's happening, but why."" While still the magazine's art director in 1964, he published a tongue-in-cheek ""It's Fun to Be Rich"" issue. In 1966, his first year as Town&Country's editor in chief, he put the Rolling Stones on the cover of what was widely held to be the bible of conservative, blue-blooded America. The ensuing controversy prompted Hearst's executives to ask him, ""Young man, do you know what you're doing?"" ""I think so,"" he replied. In fact, Mazzola did: By maintaining a meticulous balance between creating an exciting magazine and conveying the dignity of the subjects he presented, he broadened Town&Country's appeal and honored its audience. ""People make fun of money,"" he once said, ""but everyone forgets the good that money has done."" In 1972, Mazzola was appointed editor in chief of Harper's BAZAAR and expanded his editorial style even further. He relished the opportunity to widen the magazine's scope, which he again did in 1983 by adapting its pages to reflect newly emerging trends such as the more mature, sophisticated fashions--and celebrities--of the time, and readers' increasing interest in lifestyle, as well as fashion, content. ""We love the handle of being the fashion magazine with a little salt and pepper added,"" he said of BAZAAR in a 1983 interview. ""We appeal to a woman with a very strong confidence level, who is sure of herself, not wishy-washy. She wants to know everything there is to know...and we have become the fashion and beauty book with personality, the one with heart."" At the end of the decade, Mazzola again redesigned the magazine, this time to appeal to readers as they matured from trendy to classic tastes. Striving for what he called a ""very unconventional, exciting visual product,"" Mazzola encouraged photographers such as Francesco Scavullo, Rico Puhlmann and Matthew Rolston to take dramatic, even abstract approaches to fashion. One result was a celebrated shot described by a writer as ""a woman and a cabbage leaf facing off"" to illustrate a story on vegetable dyes used in hair coloring. After he stepped down as editor in chief in 1992, Mazzola edited BAZAAR's 125th anniversary book in 1993. The project was both professionally and personally rewarding. ""Reliving the history of this great magazine and knowing that I had a role in it is a great privilege,"" he said. In 1995, he was editorial director of Town&Country's two-volume 150th anniversary book. Mazzola was also the fine arts curator for Hearst Corporation, whose fine art collection emphasizes works on paper and emerging talents, many of whom have become household names since the collection was started. In addition to curating and cataloguing the collection, he produced many art and photography shows for Hearst Tower. Mazzola graduated from The Cooper Union with honors in 1948 and received The Cooper Union's distinguished alumni citation in 1992. After beginning study at The Cooper Union, he was drafted into World War II. His art background prompted an assignment to army intelligence, where he analyzed camouflage. He was awarded a Bronze Star for ""meritorious achievement in connection with military operations against the enemy in Luzon, Philippine Islands."" A recipient of numerous awards in the art direction and design fields, Mazzola was inducted as a Knight Officer of the Order of Merit by the Republic of Italy in 1967. He also served as a consultant and designer for such organizations as the United Nations Children's Fund, the Association of Junior Leagues of America, Princess Marcella Borghese, Inc., General Foods, Columbia Pictures, Inc. and the New York World's Fair of 1965. Mazzola is survived by his wife, Michele Morgan Mazzola, who worked with him at Hearst for over 45 years, and three children, Alisa Mazzola Mitchell, Marc Mazzola and Tony Mazzola. He is also survived by five grandchildren. There will be a private funeral in Indiana, and a memorial in New York at a future date. In lieu of flowers, donations can be made to Memorial Sloan Kettering Cancer Center (Memorial Sloan Kettering Cancer Center, PO Box 27106, New York, NY 10087-7105 or <a href=""http://www.mskcc.org/giving"" target=""_new"" rel=""nofollow"">http://www.mskcc.org/giving</a>).<br><br>"
11,,"Paid Notice: Deaths MAZZOLA, ANTHONY T.",http://query.nytimes.com/gst/fullpage.html?res=9407E1D6113AF930A15756C0A9629D8B63,"MAZZOLA--Anthony T.,Former editor in chief of Town&Country and Harper's BAZAAR, and the curator of Hearst Corporation's fine art collection, died May 21 in New York. He was 90. ""Anthony Mazzola was a dynamic member of the Hearst Magazines family for more than 65 years,"" said Steven R. Swartz, president and CEO, Hearst Corporation. ""Tony will be missed by everyone who had the pleasure of working with him."" Frank A. Bennack, Jr., former CEO and now executive vice chairman of Hearst Corporation, added, ""Tony Mazzola's contributions to Harper's BAZAAR and Town&Country have not only influenced those titles as they appear even today but our entire magazine business."" Mazzola, the editor who defined affluence and style for millions of readers at the two magazines for 44 years, started his career at Hearst as an art director. In 1948, at the age of 25, Mazzola joined Town&Country as the youngest art director in the magazine's history. He held that post for nearly two decades, ultimately becoming editor in chief in 1965. Town&Country is the longest continuously published general-interest magazine in America, having been founded in 1846. ""Tony Mazzola was one of the most creative editors I've known,"" said Hearst Corporation Director Gilbert C. Maurer. ""A man of great personal style, he intuitively knew what good looked like and his work at Town&Country and Harper's BAZAAR reflected that acute sensibility. Tony was a loyal friend as well as a valuable mentor to a generation of our younger talents."" Building on what he once described as his ""fascination with trends,"" Mazzola's Town&Country began to reflect the current events and social reorganization then affecting elite American society as the nation mourned the assassination of President John F. Kennedy and grappled with civil rights, the Vietnam War and the first stirrings of modern-day feminism. Mazzola said he was captivated ""not by what's happening, but why."" While still the magazine's art director in 1964, he published a tongue-in-cheek ""It's Fun to Be Rich"" issue. In 1966, his first year as Town&Country's editor in chief, he put the Rolling Stones on the cover of what was widely held to be the bible of conservative, blue-blooded America. The ensuing controversy prompted Hearst's executives to ask him, ""Young man, do you know what you're doing?"" ""I think so,"" he replied. In fact, Mazzola did: By maintaining a meticulous balance between creating an exciting magazine and conveying the dignity of the subjects he presented, he broadened Town&Country's appeal and honored its audience. ""People make fun of money,"" he once said, ""but everyone forgets the good that money has done."" In 1972, Mazzola was appointed editor in chief of Harper's BAZAAR and expanded his editorial style even further. He relished the opportunity to widen the magazine's scope, which he again did in 1983 by adapting its pages to reflect newly emerging trends such as the more mature, sophisticated fashions--and celebrities--of the time, and readers' increasing interest in lifestyle, as well as fashion, content. ""We love the handle of being the fashion magazine with a little salt and pepper added,"" he said of BAZAAR in a 1983 interview. ""We appeal to a woman with a very strong confidence level, who is sure of herself, not wishy-washy. She wants to know everything there is to know...and we have become the fashion and beauty book with personality, the one with heart."" At the end of the decade, Mazzola again redesigned the magazine, this time to appeal to readers as they matured from trendy to classic tastes. Striving for what he called a ""very unconventional, exciting visual product,"" Mazzola encouraged photographers such as Francesco Scavullo, Rico Puhlmann and Matthew Rolston to take dramatic, even abstract approaches to fashion. One result was a celebrated shot described by a writer as ""a woman and a cabbage leaf facing off"" to illustrate a story on vegetable dyes used in hair coloring. After he stepped down as editor in chief in 1992, Mazzola edited BAZAAR's 125th anniversary book in 1993. The project was both professionally and personally rewarding. ""Reliving the history of this great magazine and knowing that I had a role in it is a great privilege,"" he said. In 1995, he was editorial director of Town&Country's two-volume 150th anniversary book. Mazzola was also the fine arts curator for Hearst Corporation, whose fine art collection emphasizes works on paper and emerging talents, many of whom have become household names since the collection was started. In addition to curating and cataloguing the collection, he produced many art and photography shows for Hearst Tower. Mazzola graduated from The Cooper Union with honors in 1948 and received The Cooper Union's distinguished alumni citation in 1992. After beginning study at The Cooper Union, he was drafted into World War II. His art background prompted an assignment to army intelligence, where he analyzed camouflage. He was awarded a Bronze Star for ""meritorious achievement in connection with military operations against the enemy in Luzon, Philippine Islands."" A recipient of numerous awards in the art direction and design fields, Mazzola was inducted as a Knight Officer of the Order of Merit by the Republic of Italy in 1967. He also served as a consultant and designer for such organizations as the United Nations Children's Fund, the Association of Junior Leagues of America, Princess Marcella Borghese, Inc., General Foods, Columbia Pictures, Inc. and the New York World's Fair of 1965. Mazzola is survived by his wife, Michele Morgan Mazzola, who worked with him at Hearst for over 45 years, and three children, Alisa Mazzola Mitchell, Marc Mazzola and Tony Mazzola. He is also survived by five grandchildren. There will be a private funeral in Indiana, and a memorial in New York at a future date. In lieu of flowers, donations can be made to Memorial Sloan Kettering Cancer Center (Memorial Sloan Kettering Cancer Center, PO Box 27106, New York, NY 10087-7105 or http://www.mskcc.org/giving)."
10,,"Paid Notice: Deaths MAZZOLA, ANTHONY T.",http://query.nytimes.com/gst/fullpage.html?res=9F00E1DF1E3AF936A15756C0A9629D8B63,"MAZZOLA--Anthony T.,Former editor in chief of Town&Country and Harper's BAZAAR, and the curator of Hearst Corporation's fine art collection, died May 21 in New York. He was 90. ""Anthony Mazzola was a dynamic member of the Hearst Magazines family for more than 65 years,"" said Steven R. Swartz, president and CEO, Hearst Corporation. ""Tony will be missed by everyone who had the pleasure of working with him."" Frank A. Bennack, Jr., former CEO and now executive vice chairman of Hearst Corporation, added, ""Tony Mazzola's contributions to Harper's BAZAAR and Town&Country have not only influenced those titles as they appear even today but our entire magazine business."" Mazzola, the editor who defined affluence and style for millions of readers at the two magazines for 44 years, started his career at Hearst as an art director. In 1948, at the age of 25, Mazzola joined Town&Country as the youngest art director in the magazine's history. He held that post for nearly two decades, ultimately becoming editor in chief in 1965. Town&Country is the longest continuously published general-interest magazine in America, having been founded in 1846. ""Tony Mazzola was one of the most creative editors I've known,"" said Hearst Corporation Director Gilbert C. Maurer. ""A man of great personal style, he intuitively knew what good looked like and his work at Town&Country and Harper's BAZAAR reflected that acute sensibility. Tony was a loyal friend as well as a valuable mentor to a generation of our younger talents."" Building on what he once described as his ""fascination with trends,"" Mazzola's Town&Country began to reflect the current events and social reorganization then affecting elite American society as the nation mourned the assassination of President John F. Kennedy and grappled with civil rights, the Vietnam War and the first stirrings of modern-day feminism. Mazzola said he was captivated ""not by what's happening, but why."" While still the magazine's art director in 1964, he published a tongue-in-cheek ""It's Fun to Be Rich"" issue. In 1966, his first year as Town&Country's editor in chief, he put the Rolling Stones on the cover of what was widely held to be the bible of conservative, blue-blooded America. The ensuing controversy prompted Hearst's executives to ask him, ""Young man, do you know what you're doing?"" ""I think so,"" he replied. In fact, Mazzola did: By maintaining a meticulous balance between creating an exciting magazine and conveying the dignity of the subjects he presented, he broadened Town&Country's appeal and honored its audience. ""People make fun of money,"" he once said, ""but everyone forgets the good that money has done."" In 1972, Mazzola was appointed editor in chief of Harper's BAZAAR and expanded his editorial style even further. He relished the opportunity to widen the magazine's scope, which he again did in 1983 by adapting its pages to reflect newly emerging trends such as the more mature, sophisticated fashions--and celebrities--of the time, and readers' increasing interest in lifestyle, as well as fashion, content. ""We love the handle of being the fashion magazine with a little salt and pepper added,"" he said of BAZAAR in a 1983 interview. ""We appeal to a woman with a very strong confidence level, who is sure of herself, not wishy-washy. She wants to know everything there is to know...and we have become the fashion and beauty book with personality, the one with heart."" At the end of the decade, Mazzola again redesigned the magazine, this time to appeal to readers as they matured from trendy to classic tastes. Striving for what he called a ""very unconventional, exciting visual product,"" Mazzola encouraged photographers such as Francesco Scavullo, Rico Puhlmann and Matthew Rolston to take dramatic, even abstract approaches to fashion. One result was a celebrated shot described by a writer as ""a woman and a cabbage leaf facing off"" to illustrate a story on vegetable dyes used in hair coloring. After he stepped down as editor in chief in 1992, Mazzola edited BAZAAR's 125th anniversary book in 1993. The project was both professionally and personally rewarding. ""Reliving the history of this great magazine and knowing that I had a role in it is a great privilege,"" he said. In 1995, he was editorial director of Town&Country's two-volume 150th anniversary book. Mazzola was also the fine arts curator for Hearst Corporation, whose fine art collection emphasizes works on paper and emerging talents, many of whom have become household names since the collection was started. In addition to curating and cataloguing the collection, he produced many art and photography shows for Hearst Tower. Mazzola graduated from The Cooper Union with honors in 1948 and received The Cooper Union's distinguished alumni citation in 1992. After beginning study at The Cooper Union, he was drafted into World War II. His art background prompted an assignment to army intelligence, where he analyzed camouflage. He was awarded a Bronze Star for ""meritorious achievement in connection with military operations against the enemy in Luzon, Philippine Islands."" A recipient of numerous awards in the art direction and design fields, Mazzola was inducted as a Knight Officer of the Order of Merit by the Republic of Italy in 1967. He also served as a consultant and designer for such organizations as the United Nations Children's Fund, the Association of Junior Leagues of America, Princess Marcella Borghese, Inc., General Foods, Columbia Pictures, Inc. and the New York World's Fair of 1965. Mazzola is survived by his wife, Michele Morgan Mazzola, who worked with him at Hearst for over 45 years, and three children, Alisa Mazzola Mitchell, Marc Mazzola and Tony Mazzola. He is also survived by five grandchildren. There will be a private funeral in Indiana, and a memorial in New York at a future date. In lieu of flowers, donations can be made to Memorial Sloan Kettering Cancer Center (Memorial Sloan Kettering Cancer Center, PO Box 27106, New York, NY 10087-7105 or http://www.mskcc.org/giving)."
42,,Google’s Video of Its Self-Driving Car,https://www.nytimes.com/video/technology/100000002905026/demo-of-google8217s-self-driving-car.html,The company has begun building a fleet of experimental electric-powered vehicles that can’t be driven by people and are summoned with a smartphone app.
136,2014/05/15,"One Court Ruling on Privacy in Europe, and 28 Regulators",https://www.nytimes.com/2014/05/15/technology/one-court-ruling-on-privacy-in-europe-and-28-regulators.html,Europe’s highest court defended its citizens’ right to privacy. But it left unstated what the channels and particulars are.
20,2014/05/15,Don’t Force Google to ‘Forget’,https://www.nytimes.com/2014/05/15/opinion/dont-force-google-to-forget.html,But it does need to change how it searches for personal names.
12,2014/05/15,"A Funny Name, a Serious Sport. Pickleball, Anyone?",https://www.nytimes.com/2014/05/15/business/retirementspecial/a-funny-name-a-serious-sport-pickleball-anyone.html,"Nearly half a century since its creation, the tennis, table tennis and badminton hybrid is growing in popularity among baby boomers."
60,2014/05/15,"Organizing Your Photos, Cloud-Free",https://www.nytimes.com/2014/05/15/technology/personaltech/a-cloud-free-way-to-organize-your-far-flung-photos.html,"LyveHome has created a nifty way to arrange your photographs without using the cloud, but the system still needs a little smoothing out."
129,2014/05/15,Saving Your Favorite Videos on YouTube,https://www.nytimes.com/2014/05/15/technology/personaltech/saving-your-favorite-videos-on-youtube.html,Plus how to back up an iPod Nano.
95,2014/05/15,Rackspace Hires Morgan Stanley to Explore Options,https://www.nytimes.com/2014/05/15/rackspace-hires-morgan-stanley-to-explore-options/,"Rackspace, a web-hosting company with a market value of more than $4 billion, has hired Morgan Stanley to evaluate a sale or other strategic options, after being approached by potential suitors."
19,2014/05/16,"The Row’s New Home, a Frieze Frenzy and Moschino’s Plans for Men",https://tmagazine.blogs.nytimes.com/2014/05/16/chic-in-review-the-row-la-perla-louis-vuitton-galliano-lady-gaga/,"Plus, the social media response to anorexic mannequins, John Galliano’s next steps and more from the week in style."
84,2014/05/16,Yearning for a Bigger (Apple) Smartphone,https://bits.blogs.nytimes.com/2014/05/16/yearning-for-a-bigger-apple-smartphone/,"While I’ve owned an Apple iPhone for the past seven years, seeing a lot of larger Android devices on the market has caused me to have big phone envy."
82,2014/05/16,Ejected From the Doughnut Shop,https://cityroom.blogs.nytimes.com/2014/05/16/ejected-from-the-doughnut-shop/,"Metropolitan Diary: A customer felt sorry for a tall, shabbily-dressed woman who had been waiting silently until a store manager yelled at her to get out."
132,2014/05/16,Pepsi Challenges Coke in the Race to Design a More Tappable Soda Fountain,https://www.nytimes.com/2014/05/16/business/pepsi-challenges-coke-in-the-race-to-design-a-more-tappable-soda-fountain.html,"With soda sales sliding in grocery and convenience stores and other retail outlets, new equipment offers the companies a means of introducing consumers to their products."
124,2014/05/16,Texas Chases New Business but Worries About Water,https://www.nytimes.com/2014/05/16/us/texas-chases-new-business-but-worries-about-water.html,A recent effort to lure a maker of the hot sauce sriracha from California came despite the challenges farmers face in a state where they have been given low priority for dwindling water supplies.
51,2014/05/16,"As Barbara Walters Retires, the Big TV Interview Signs Off, Too",https://www.nytimes.com/2014/05/16/business/media/as-barbara-walters-retires-the-big-tv-interview-signs-off-too.html,Ms. Walters has been the queen of the TV celebrity “get.” But stars and politicians no longer need the networks to reach their public.
107,2014/05/16,Reports of Gas Odors Surge After East Harlem Blast,https://www.nytimes.com/2014/05/16/nyregion/reports-of-gas-odors-surge-after-east-harlem-blast.html,The number of calls to Consolidated Edison has led to a backlog of pipe repairs nearly twice as big as state regulators consider acceptable.
117,2014/05/16,Amazon vs. Hachette: When Does Discouragement Become Misrepresentation?,https://bits.blogs.nytimes.com/2014/05/16/amazon-vs-hachette-when-does-discouragement-become-misrepresentation/,"Amazon promotes books from Hachette Books Group while discouraging people from buying them. After the retailer’s aggressive stance became public last week, criticism and complaints mounted. But Amazon seems confident it will get what it wants in the end."
89,2014/05/17,"Portland, Ore., Sheds Its Walmart Bonds",https://www.nytimes.com/2014/05/17/business/portland-ore-will-no-longer-invest-in-walmart.html,"The city of Portland, Ore., said it had started divesting itself of holdings in the retail store because of its labor practices."
0,2014/05/17,AT&T Is Said to Be Near a Deal to Buy DirecTV,https://www.nytimes.com/2014/05/17/att-said-near-a-deal-for-directv/,"AT&T is poised to announce a takeover, people briefed on the matter said on Saturday, ushering in another transformation of the telecommunications industry."
137,2014/05/18,Quixotic ’80 Campaign Gave Birth to Kochs’ Powerful Network,https://www.nytimes.com/2014/05/18/us/politics/quixotic-80-campaign-gave-birth-to-kochs-powerful-network.html,"David H. Koch, a 40-year-old bachelor living in a rent-stabilized apartment in New York City, and his older brother Charles helped mount a long-shot assault on the fracturing American political establishment."
21,2014/05/18,Planners Adapt as Gay Unions Become More Common,https://www.nytimes.com/2014/05/18/fashion/weddings/planners-adapt-as-gay-unions-become-more-common.html,"As same-sex marriages become more common, wedding planners are changing their game."
61,2014/05/18,Tackling the Limits of Touch Screens,https://www.nytimes.com/2014/05/18/business/tackling-the-limits-of-touch-screens.html,New products aim to remove the obstacles to reading and writing effectively on tablet computers.
135,2014/05/18,GreenTech Scatters New Seeds,https://www.nytimes.com/2014/05/18/automobiles/greentech-scatters-new-seeds.html,"After the merger with VL Automotive, GreenTech Automotive promises to deliver a mix of electric city cars, plug-ins converted into muscle machines and performance-tuned cars for the Chinese market."
77,2014/05/18,What Do Pregnant Women Want?,https://www.nytimes.com/2014/05/18/opinion/sunday/what-do-pregnant-women-want.html,"Their cravings and desires, unearthed in their online searches, are revealing."
79,2014/05/18,The Harmony They Want to Hear,https://www.nytimes.com/2014/05/18/business/the-harmony-they-want-to-hear.html,An Apple-Beats Electronics combination could jump-start two important industries: music and wearable technology.
