,date,headline,link,summary
131,2014/03/30,Michael Lewis Views Market as ‘Rigged’ in Favor of High-Speed Traders,https://www.nytimes.com/2014/03/30/michael-lewis-views-market-as-rigged-in-favor-of-high-speed-traders/,"Michael Lewis, whose new book, “Flash Boys,” goes on sale on Monday, is revisiting the ills of capitalism."
28,2014/03/30,In Our Pages: March 31,https://iht-retrospective.blogs.nytimes.com/2014/03/30/in-our-pages-march-31/,"Highlights from the International Herald Tribune archives: A steamer cut in two after a collision at sea in 1889, and an associate of the heavyweight boxer Sonny Liston denies fronting for criminals in 1964."
40,2014/03/30,A Lone Ranger of the 401(k)’s,https://www.nytimes.com/2014/03/30/business/a-lone-ranger-of-the-401-k-s.html,A lawyer’s string of cases highlights a corporate responsibility to monitor the costs and fees in employees’ retirement plans.
159,2014/03/30,"In Some Ways, It’s Looking Like 1999 in the Stock Market",https://www.nytimes.com/2014/03/30/business/in-some-ways-its-looking-like-1999-in-the-stock-market.html,A surge in Internet and biotech stock values recalls an earlier bubble. But prices of other stocks seem more tethered to reality.
171,2014/03/30,"Meet Lucy H. Koh, a Silicon Valley Judge",https://bits.blogs.nytimes.com/2014/03/30/meet-lucy-h-koh-a-silicon-valley-judge/,"Judge Lucy H. Koh, who gained fame during her handling of the high-profile patent infringement lawsuit between Apple and Samsung Electronics, has become the de facto judge for landmark Silicon Valley lawsuits."
176,2014/03/30,How to Harm Investors,https://www.nytimes.com/2014/03/30/opinion/sunday/how-to-harm-investors.html,Proposed crowdfunding rules by the Securities and Exchange Commission need to be thoroughly reworked.
185,2014/03/30,Warner’s C.E.O. Is Bullish on the Big Screen,https://www.nytimes.com/2014/03/30/business/media/warners-ceo-is-bullish-on-the-big-screen.html,"In Hollywood’s sea of bravado, Kevin Tsujihara, the quiet new chief executive of Warner Bros., may seem miscast. But he is already making bold bets to keep the studio on top."
108,2014/03/30,Is Facebook Too Big to Care?,https://bits.blogs.nytimes.com/2014/03/30/is-facebook-too-big-to-care/,"The social network has made some recent moves that suggest it is determined to follow its own path, regardless of what outsiders think."
152,2014/03/31,WWE Network Is Loud Introduction to the Video Streaming Ring,https://www.nytimes.com/2014/03/31/business/media/the-body-slam-is-buffering.html,World Wrestling Entertainment has positioned itself on the cutting edge of Internet television with its new subscription-only streaming video service.
162,2014/03/31,Educators Survey State of Higher Learning in Asia,https://www.nytimes.com/2014/03/31/world/asia/educators-survey-state-of-higher-learning-in-asia.html,"The Asia-Pacific Association for International Education holds a conference in Seoul, covering topics as varied as rankings and online learning."
91,2014/03/31,Hollywood’s Antipiracy Efforts Add New Voice,https://www.nytimes.com/2014/03/31/business/media/hollywoods-antipiracy-efforts-add-new-voice.html,"Ruth Vitale, an independent film executive, was recently named executive director of CreativeFuture, a new force in the copyright wars."
