,date,headline,link,summary
15,2014/03/09,"Jeff Lawson of Twilio: When Ideas Collide, Don’t Duck",https://www.nytimes.com/2014/03/09/business/jeff-lawson-of-twilio-when-ideas-collide-dont-duck.html,"“Conflict shouldn’t be taboo,” says the chief executive of a cloud communications company. “In fact, resolving conflict is one of the key things companies do.”"
146,2014/03/09,The Playground Set Gets Its Own Bras,https://www.nytimes.com/2014/03/09/fashion/Bras-for-Grade-School-Girls-Bralettes.html,Bralettes — half camisoles with narrow straps — are catching on with young girls.
130,2014/03/10,When Local Politics Have Global Consequences,https://boss.blogs.nytimes.com/2014/03/10/when-local-politics-have-global-consequences/,"An acquaintance in Beijing recently brought up the discrimination bill and asked me, “Why is Arizona was so un-American?”"
223,2014/03/10,Icahn’s War of Words With eBay,https://www.nytimes.com/2014/03/10/icahns-war-of-words-with-ebay/,"Carl C. Icahn, the activist investor, is in a battle with Marc Andreessen, the entrepreneur turned technology investor."
101,2014/03/10,Accounts and People of Note in the Advertising Industry,https://www.nytimes.com/2014/03/10/business/media/accounts-and-people-of-note-in-the-advertising-industry.html,"The footwear brand Sanuk selected Ignited and Johnson & Wales University in Providence, R.I., hired Fuseideas as agencies of record."
247,2014/03/10,"Microsoft Pins Xbox One Hopes on Titanfall, a Sci-Fi Shooting Game",https://www.nytimes.com/2014/03/10/technology/microsoft-pins-xbox-one-hopes-on-titanfall-a-sci-fi-shooting-game.html,"The company is betting that a new game, Titanfall, will be enough of a hit to improve sales of the Xbox One and secure its influence in the video-game market."
129,2014/03/10,A Ski Pass for the States — and Japan,https://intransit.blogs.nytimes.com/2014/03/10/a-ski-pass-for-the-states-and-japan/,"The Epic Pass offered by Vail Resorts includes destinations in Colorado, Utah, the Lake Tahoe region and, now, Japan."
58,2014/03/10,The Monitored Man,https://well.blogs.nytimes.com/2014/03/10/the-monitored-man/,After six months of heavy use of activity-monitoring gadgets — sometimes wearing four at a time — the author reports back.
123,2014/03/11,Struggling Pizza Chain Sbarro Seeks Bankruptcy Protection Again,https://www.nytimes.com/2014/03/11/business/struggling-pizza-chain-sbarro-seeks-bankruptcy-protection-again.html,"The restaurant hopes to emerge from bankruptcy in May, but one expert says its business model no longer works because people want food that has been made to order."
102,2014/03/11,"Boldly Upsetting the Field, and the Establishment",https://www.nytimes.com/2014/03/11/sports/golf/patrick-reeds-confidence-overflows-upsetting-the-golfing-gentry.html,"The mistake Patrick Reed, 23, made in saying he considers himself to be a top-five player on the PGA Tour seems to be not in believing he is one of the best but in merely blurting it out."
216,2014/03/11,First Look Media Adds Editor of Gawker,https://www.nytimes.com/2014/03/11/business/media/first-look-media-adds-editor-of-gawker.html,"The online news venture backed by the technology billionaire Pierre M. Omidyar is adding John Cook, the editor of Gawker, to its growing stable of established journalists."
201,2014/03/11,Patentholder on Breast Cancer Tests Denied Injunction in Lawsuit,https://www.nytimes.com/2014/03/11/business/patentholder-on-breast-cancer-tests-denied-injunction-in-lawsuit.html,A federal judge in Utah refused to prevent a rival of Myriad Genetics from offering offer a test similar to Myriad’s for two genes tied to breast cancer.
219,2014/03/11,Former Rivals Come Together in a Campaign to End Childhood Hunger,https://www.nytimes.com/2014/03/11/business/media/former-rivals-come-together-in-a-campaign-to-end-childhood-hunger.html,"Procter & Gamble and ConAgra, two consumer-product giants that once battled each other for market share, are combining their ad dollars to advance a good cause."
32,2014/03/12,Sprint Owner’s New Appeal for Merger With T-Mobile,https://www.nytimes.com/2014/03/12/technology/sprint-owners-new-appeal-for-merger-with-t-mobile.html,"Masayoshi Son, the founder of SoftBank, took an unusual tack in a rare address to an American audience on Tuesday, saying that he wants to rescue the United States from broadband oblivion."
36,2014/03/12,Daily Report: Sprint’s Owner Makes New Case for Merger with T-Mobile,https://bits.blogs.nytimes.com/2014/03/12/daily-report-sprints-owner-makes-new-case-for-merger-with-t-mobile/,"Masayoshi Son, the founder of SoftBank, took an unusual tack in a rare address to an American audience on Tuesday, saying that he wants to rescue the United States from broadband oblivion."
135,2014/03/12,Report Says Medication Use Is Rising for Adults With Attention Disorder,https://www.nytimes.com/2014/03/12/us/report-says-medication-use-is-rising-for-adults-with-attention-disorder.html,"Some experts said the report indicated that the disorder is being diagnosed and treated with medication in children far too often, and that steeply rising diagnoses among adults might portend similar problems."
188,2014/03/12,Extended-Stay Hotels Climb in Manhattan,https://www.nytimes.com/2014/03/12/realestate/commercial/not-quite-hotel-units-where-late-checkouts-are-encouraged.html,"Corporate or short-term housing units have proliferated across Manhattan, both in buildings dedicated solely to this function or scattered inside existing rentals and condos."
141,2014/03/12,Candy Crush Maker Picks Valuation From Thin Air,https://www.nytimes.com/2014/03/12/candy-crush-maker-picks-valuation-from-thin-air/,"As King Digital Entertainment, the maker of the popular game Candy Crush Saga, prepares to go public, it is difficult to calculate what it’s worth when its profit can skyrocket 70-fold one year and could collapse the next, writes Robert Cyran in Reuters Breakingviews."
60,2014/03/12,Universities Try a Cultural Bridge to Lure Foreign Students,https://www.nytimes.com/2014/03/12/education/universities-try-a-cultural-bridge-to-lure-foreign-students.html,Oregon State University is among a growing number of academic institutions that are teaming up with private companies to lure foreign students with yearlong transitional programs.
168,2014/03/12,Elliott Raises Stake in Juniper Networks,https://www.nytimes.com/2014/03/12/elliott-raises-stake-in-juniper-networks/,The hedge fund Elliott Management is raising its bet on Juniper Networks after the networking equipment company announced a series of new initiatives.
238,2014/03/12,"For S.E.C., a Much-Needed Win",https://www.nytimes.com/2014/03/12/judge-imposes-hefty-fine-on-ex-goldman-trader/,"Fabrice Tourre, the former Goldman Sachs trader who reaped millions of dollars on Wall Street before a federal investigation derailed his career and redefined him as both a symbol and a scapegoat of the financial crisis, was ordered to pay more than $800,000."
68,2014/03/12,SXSW 2014: No Lady Gaga Show for Me,https://artsbeat.blogs.nytimes.com/2014/03/12/sxsw-2014-no-lady-gaga-show-for-me/,Getting a ticket to see the show would have required the kind of social-media shillling that I don’t think anyone’s friends or followers should be subjected to.
228,2014/03/13,Mobile Security Specialist Lookout to Announce New Chief Executive,https://bits.blogs.nytimes.com/2014/03/13/as-lookout-app-and-mobile-security-problems-grow-start-up-announces-new-c-e-o/,"Lookout, the mobile security app creator, is bringing on Jim Dolce as its new chief executive, as it grows from consumer start-up to full-fledged security firm."
195,2014/03/13,Eater Hires Three Restaurant Critics,https://www.nytimes.com/2014/03/13/dining/eater-hires-three-restaurant-critics.html,"The food blog will start reviewing as part of an ambitious expansion under its new owner, Vox Media."
117,2014/03/13,The Unhealthy Meat Market,https://www.nytimes.com/2014/03/13/opinion/kristof-the-unhealthy-meat-market.html,"A handful of companies control what we put on the dinner table, raising concerns for the lives of humans and animals alike."
115,2014/03/13,Charter Still Hanging Around Time Warner Cable,https://www.nytimes.com/2014/03/13/charter-still-hanging-around-time-warner-cable/,Charter has yet to withdraw the full slate of directors that it nominated to Time Warner Cable’s board just one day before Comcast swooped in.
215,2014/03/13,A Theory Behind Surge in Xbox One Sales,https://bits.blogs.nytimes.com/2014/03/13/a-theory-behind-surge-in-xbox-one-sales/,"In sales figures for February released Thursday afternoon by NPD, the retail tracking firm, Microsoft’s Xbox One nearly matched the U.S. sales of the PlayStation 4. That was a sharp narrowing of the lead Sony had in monthly sales, leading to speculation that Sony fans are getting tired of hunting for the PlayStation 4, which is in short supply."
112,2014/03/13,"Dan Harris, Co-Anchor of ‘Nightline,’ Discusses Multitasking and Meditation",https://bits.blogs.nytimes.com/2014/03/13/dan-harris-co-anchor-for-nightline-discusses-multitasking-and-meditation/,"Dan Harris, a co-anchor of Nightline, has just published a new book that says meditation can make us 10 percent happier and that multitasking in a technology-obsessed world is detrimental to our brains."
143,2014/03/13,Transferring Old Palm Desktop Data,https://www.nytimes.com/2014/03/13/technology/personaltech/transferring-old-palm-desktop-data.html,"Plus, picking a drive for Apple’s Time Machine."
181,2014/03/13,The Best 401(k)s Set a Higher Bar for Others,https://www.nytimes.com/2014/03/13/business/retirementspecial/the-best-401-k-s-set-a-higher-bar-for-others.html,"Firms that track benefit plans are finding their terms are improving for many employees, in areas such as company matching, vesting and fees."
248,2014/03/13,Wheelies: The V8 Hotel Edition,https://www.nytimes.com/2014/03/13/automobiles/wheelies-the-v8-hotel-edition.html,A car-themed hotel in Germany offers beds made out of classic cars; N.T.S.B. head steps down to lead safety advocacy non-profit.
33,2014/03/13,"Standing for More Than a Century, Only to Vanish in an Instant",https://www.nytimes.com/2014/03/13/nyregion/standing-for-more-than-a-century-only-to-vanish-in-an-instant.html,The two buildings that were wiped out by an explosion had been fixtures on their block in East Harlem since 1910.
86,2014/03/13,A Wild Idea: Making Our Smartphones Last Longer,https://www.nytimes.com/2014/03/13/technology/personaltech/the-radical-concept-of-longevity-in-a-smartphone.html,Saving money and global resources are just two good reasons not to ditch your cellphone after the traditional two-year cycle.
93,2014/03/13,"Weakened by Mobile, Desktop Search Advertising Is Declining",https://bits.blogs.nytimes.com/2014/03/13/weakened-by-mobile-desktop-search-advertising-is-declining/,"The desktop search advertising business, long the most reliably profitable on the web, will decrease $1.4 billion this year, according to eMarketer, while mobile search revenue will nearly double."
43,2014/03/13,"Action Cameras, for When a Smartphone Won’t Be Able to Keep Up",https://www.nytimes.com/2014/03/13/technology/personaltech/review-five-action-cameras-from-gopro-sony-garmin-drift-and-ion.html,A review of five cameras that are in the same price range but offer different features.
98,2014/03/13,This Is the Real Reason Sbarro Is in Bankruptcy,https://economix.blogs.nytimes.com/2014/03/13/this-is-the-real-reason-sbarro-is-in-bankruptcy/,Sbarro’s strategy of being where the hungry people are fails when crowds thin and rents don’t fall.
145,2014/03/14,Berkshire Hathaway Board Recommends Shareholders Vote Against Dividend,https://www.nytimes.com/2014/03/14/berkshire-hathaway-board-recommends-shareholders-vote-against-dividend/,"Warren E. Buffett prefers to use Berkshire Hathaway’s huge cash pile to buy up companies, rather than return it to shareholders."
142,2014/03/14,Uber Expands Insurance Program for Community Drivers,https://bits.blogs.nytimes.com/2014/03/14/uber-expands-insurance-program-for-community-drivers/,"Uber, the company that offers a smartphone app for summoning cars for rides, has been under intense scrutiny since an Uber driver struck and killed a 6-year-old girl while he was between fares — raising questions about when Uber is responsible for an accident. Now the company says it is buying more insurance for its drivers."
79,2014/03/14,Spring Cleaning Who Has Access to Your Data,https://bits.blogs.nytimes.com/2014/03/14/spring-cleaning-who-has-access-to-your-data/,"As spring comes into view, it’s time to manage which apps and services have access to your social accounts and can see everything you’re doing."
71,2014/03/14,Mark Zuckerberg’s Call to Obama Was Not About Privacy,https://takingnote.blogs.nytimes.com/2014/03/14/mark-zuckerbergs-call-to-obama-was-not-about-privacy/,"What Facebook’s founder is really concerned about is Internet security, which also happens to protect the interests of his company."
61,2014/03/14,"Avinoam Nowogrodski of Clarizen, on the Rewards of Listening",https://www.nytimes.com/2014/03/14/business/avinoam-nowogrodski-of-clarizen-on-the-rewards-of-listening.html,"The chief executive of Clarizen, a work management software company, says leadership is about asking the right questions."
147,2014/03/14,Complaints as Amazon Raises Cost of Prime,https://www.nytimes.com/2014/03/14/technology/amazon-is-raising-prime-membership-fee.html,"The annual fee for Amazon Prime, the two-day shipping service, will jump 25 percent, to $99."
16,2014/03/14,"Pharrell’s Phragrance, Karl’s Custom Emojis and Obama’s Shopping Trip",https://tmagazine.blogs.nytimes.com/2014/03/14/chic-in-review-pharrells-phragrance-karls-custom-emojis-and-obamas-shopping-trip/,"Plus, Vogue Italia’s controversy-baiting editorial, Tehran goes mad for models and more from the week in style."
244,2014/03/14,Wendy’s Turns Up Volume on Adoption Drive,https://www.nytimes.com/2014/03/14/business/media/wendys-turns-up-volume-on-adoption-drive.html,"Wendy’s has long supported adoption, but now the company is putting it front and center with a national advertising campaign and an adoption hub on its website."
196,2014/03/14,"As Crews Search for Survivors, They Discover Only More Victims",https://www.nytimes.com/2014/03/14/nyregion/east-harlem-building-collapse.html,"Firefighters and emergency personnel on Thursday dug deeply into the wreckage, looking for survivors and possible evidence of what caused the blast."
78,2014/03/15,Kentucky: Facebook Posts Lead to Charges of Threatening Governor,https://www.nytimes.com/2014/03/15/us/kentucky-facebook-posts-lead-to-charges-of-threatening-governor.html,"A Lexington man has been charged with threatening to kill Gov. Steven L. Beshear, his wife and their family in a series of Facebook postings."
166,2014/03/15,Jet Skids Off Philadelphia Runway After Takeoff Is Aborted,https://www.nytimes.com/2014/03/15/us/jet-skids-off-philadelphia-runway-after-takeoff-is-aborted.html,"A US Airways plane’s nose gear collapsed Thursday as its pilot attempted an emergency landing, forcing an evacuation of the plane but no serious injuries, officials said."
193,2014/03/16,What Comes After Rich Baby Boomers? Kids With a Big Inheritance,https://www.nytimes.com/2014/03/16/magazine/baby-boomers-inheritance.html,"An enormous, intergenerational transfer of wealth is imminent. What sort of country will it leave in its wake?"
205,2014/03/16,Cruise Quest: Keeping the Entertainment Fresh,https://www.nytimes.com/2014/03/16/travel/cruise-quest-keeping-the-entertainment-fresh.html,What do today’s cruise passengers consider engaging in 0nboard entertainment? Inside the search for answers.
110,2014/03/16,"Preserving Family History, One Memory at a Time",https://www.nytimes.com/2014/03/16/business/preserving-family-history-one-memory-at-a-time.html,StoryWorth is among new services that are helping relatives build an online treasure chest of anecdotes.
66,2014/03/16,Silicon Valley’s Youth Problem,https://www.nytimes.com/2014/03/16/magazine/silicon-valleys-youth-problem.html,"In start-up land, the young barely talk to the old (and vice versa). That makes for a lot of cool apps. But great technology? Not so much."
209,2014/03/16,Mathematicians Are Hoping Their Calculations Add Up to the Perfect Bracket,https://www.nytimes.com/2014/03/16/sports/ncaabasketball/mathematicians-are-hoping-their-calculations-add-up-to-the-perfect-bracket.html,The reason behind their motivation? How about 1 billion of them? That is the number of dollars offered by Quicken Loans for an unblemished result in predicting N.C.A.A. tournament games
229,2014/03/16,"To Change Tunes, a Nod Will Be as Good as a Wink",https://www.nytimes.com/2014/03/16/automobiles/to-change-tunes-a-nod-will-be-as-good-as-awink.html,"Automakers, including Mercedes-Benz and Ford, are cautiously installing gesture sensing systems that read hand and head motions as computer commands."
14,2014/03/16,Was There a Gangster Called Oscar the Poet?,https://www.nytimes.com/2014/03/16/nyregion/was-there-a-gangster-called-oscar-the-poet.html,Readers ask questions about a gang leader caught carrying a book of poems as well as the reason for green lights outside police precinct stations.
59,2014/03/16,The Death of the Bargain Bin,https://www.nytimes.com/2014/03/16/magazine/the-death-of-the-bargain-bin.html,We’ve replaced contained chaos with something so vast that we need algorithms to show us our way.
51,2014/03/16,Shawn Jenkins of Benefitfocus: A C.E.O. Is Like a Flight Instructor,https://www.nytimes.com/2014/03/16/business/shawn-jenkins-of-benefitfocus-a-ceo-is-like-a-flight-instructor.html,"The chief executive of a benefits technology company says good leaders let employees learn by experience. “I’ve got to be willing to let you fail a pretty good amount, almost to the point of danger,” he says."
148,2014/03/16,"A Harvest of Company Details, All in One Basket",https://www.nytimes.com/2014/03/16/technology/a-harvest-of-company-details-all-in-one-basket.html,New websites can help investors and others gather wide-ranging government data about a particular business.
167,2014/03/17,Lithium Producer Chases Tesla’s Bold Battery Plan,https://www.nytimes.com/2014/03/17/business/energy-environment/lithium-producer-chases-teslas-bold-battery-plan.html,"The California company Simbol Materials is building a plant that will use a novel extraction process, in the hopes that it can provide the lithium needed for the batteries in Tesla’s cars."
55,2014/03/17,"Navigating Cultures, Accepting Criticism",https://www.nytimes.com/2014/03/17/business/international/navigating-cultures-accepting-criticism.html,"Ann Cairns, president of MasterCard’s global operations outside North America, on ways to give feedback."
222,2014/03/17,States Urge Retail Giants With Pharmacies to Stop Selling Tobacco Products,https://www.nytimes.com/2014/03/17/business/states-urge-retail-giants-with-pharmacies-to-stop-selling-tobacco-products.html,More than two dozen attorneys general encouraged five of the country’s largest retailers to follow the example of CVS and stop selling tobacco products in stores that also have pharmacies.
210,2014/03/17,"A Conversation With Steve Jurvetson, Space Investor and Rocket Maker",https://bits.blogs.nytimes.com/2014/03/17/qa-with-steve-jurvetson-space-investor-and-rocket-maker/,"Steve Jurvetson, a venture capitalist who has invested in space start-ups, discusses the future of space, amateur rockets and people living on Mars."
156,2014/03/18,Tesla Fights for a Place to Park,https://www.nytimes.com/2014/03/18/business/tesla-fights-for-a-place-to-park.html,New Jersey is the latest state to bar Tesla’s stores for its electric vehicles under laws that favor independent dealerships.
27,2014/03/18,350 Rose Petals Packed Into a Single Jar of Moisturizing Balm,https://tmagazine.blogs.nytimes.com/2014/03/18/feeling-for-350-rose-petals-packed-into-a-single-jar-of-moisturizing-balm/,"The new Aerin Essentials Collection includes Rose Balm, a super-hydrating product that also serves as the base for a new set of 10 lipsticks."
175,2014/03/18,Walmart to Offer Customers Credit for Used Video Games,https://www.nytimes.com/2014/03/18/technology/walmart-to-offer-customers-credit-for-used-video-games.html,"The retailing giant is expected to announce that on March 26 it will begin allowing customers to convert their old games into credits in over 3,100 Walmart stores nationwide."
113,2014/03/18,Google Unveils Software for Smartwatches-to-Be,https://bits.blogs.nytimes.com/2014/03/18/google-introduces-a-smart-watch/,"In a pre-emptive move against Apple, Google revealed Android Wear, a version of the Android operating system that is tailored for wearable computers."
203,2014/03/18,Plenty of Ways to Try for a Billion-Dollar Prize,https://www.nytimes.com/2014/03/18/sports/ncaabasketball/plenty-of-ways-to-try-for-a-billion-dollar-ncaa-bracket-prize.html,A lighthearted look at three distinct approaches to picking the 67 games in the N.C.A.A. men’s basketball tournament in hopes of winning a $1 billion reward from Warren Buffett.
63,2014/03/18,Apple to Offer Cheaper iPhone 5C in Several Markets,https://bits.blogs.nytimes.com/2014/03/18/apple-to-offer-cheaper-iphone-5c-in-several-markets/,"The colorful plastic iPhone hasn’t been as big a hit as the high-end iPhone 5S. So to lure more customers, Apple is introducing another model in a few markets, including China."
46,2014/03/18,"Reading, Writing and Renewal (the Urban Kind)",https://www.nytimes.com/2014/03/18/arts/design/reading-writing-and-renewal-the-urban-kind.html,A new public school that also includes a community center and other public amenities is part of a joint project designed to revitalize a blighted section of East Baltimore.
85,2014/03/18,"A Conversation With Yukari Kane, Author of ‘Haunted Empire: Apple After Steve Jobs’",https://bits.blogs.nytimes.com/2014/03/18/a-conversation-with-yukari-kane-author-of-haunted-empire-apple-after-steve-jobs/,"In an interview, Ms. Kane talked about the highlights of her new book, and a company struggling to cope with the loss of its visionary founder."
41,2014/03/18,How to Profit Modestly by Moving to a Nonprofit,https://www.nytimes.com/2014/03/18/education/how-to-profit-modestly-by-moving-to-a-nonprofit.html,"Colleges across the country offer programs intended to prepare unemployed corporate professionals, or those looking to make career transitions, for the expanding nonprofit sector."
48,2014/03/19,Can You Trust ‘Secure’ Messaging Apps?,https://bits.blogs.nytimes.com/2014/03/19/can-you-trust-secure-messaging-apps/,Messaging apps and security are two of the hottest topics in tech. But can you trust the wave of supposedly secure messaging services coming out now? The New York Times’s Molly Wood talks to an expert.
212,2014/03/19,Former Goldman Chief Walks Among Warriors and Dragons,https://www.nytimes.com/2014/03/19/goldmans-former-leader-appears-among-warriors-and-dragons/,"Stephen Friedman, the onetime head of Goldman Sachs, appears in humble garb during a cameo appearance in the upcoming season of the HBO series “Game of Thrones.”"
153,2014/03/19,"New Social App Has Juicy Posts, All Anonymous",https://www.nytimes.com/2014/03/19/technology/new-social-app-has-juicy-posts-but-no-names.html,"Posts on Secret, an app that allows users to upload anonymous messages, can range from benign to inappropriate and are testing the tech industry’s appetite for sharing."
0,2014/03/19,Free-for-All on the Final Friday of Tribeca Film Festival,https://www.nytimes.com/2014/03/19/business/media/free-for-all-on-the-final-friday-of-tribeca-film-festival.html,"As the presenting sponsor of the festival for the first time, the company is introducing an effort, “Film for All,” that aims to expose the festival to more New Yorkers."
149,2014/03/19,Icahn Calls on eBay to Sell 20% of PayPal Unit to the Public,https://www.nytimes.com/2014/03/19/icahn-calls-on-ebay-to-sell-20-of-paypal-unit-to-the-public/,"The activist investor’s proposal, a retreat from his previous demand that the payment processor be spun out completely from its parent, still calls for a separation of the two businesses."
29,2014/03/19,Judge Sides with F.T.C. in Payday Lending Case,https://www.nytimes.com/2014/03/19/judge-sides-with-f-t-c-in-payday-lending-case/,A federal judge has reinforced the Federal Trade Commission’s authority to go after payday lenders that claim their ties to Native American tribes make them immune to laws restricting high-cost loans.
76,2014/03/19,"Your Questions, My Answers (III)",https://douthat.blogs.nytimes.com/2014/03/19/your-questions-my-answers-iii/,"A columnist faces his readers, yet again."
4,2014/03/19,Odd Birds,https://www.nytimes.com/2014/03/19/books/the-abc-of-fabulous-princesses-and-aviary-wonders-inc.html,"Willy Puchner’s “ABC of Fabulous Princesses” imagines princesses as exotic birds, and Kate Samworth’s “Aviary Wonders Inc.” takes the form of a manual for building your own birds."
83,2014/03/19,Jane Fonda and Lily Tomlin to Star in a Netflix Comedy Series,https://artsbeat.blogs.nytimes.com/2014/03/19/jane-fonda-and-lily-tomlin-to-star-in-a-netflix-comedy-series/,"“Grace and Frankie,” coming to Netflix next year, will feature Jane Fonda and Lily Tomlin as rivals who find their husbands are in love with each other."
132,2014/03/19,Questions Over Goldman Deal as Investors Sit in the Dark,https://www.nytimes.com/2014/03/19/questions-over-goldman-deal-as-investors-sit-in-the-dark/,"In a fight over a hotel company that went “dark,” investors have accused Goldman Sachs of having conflicting interests, writes Jesse Eisinger in The Trade column."
