,date,headline,link,summary
1328,2017/05/17,Las Vegas Officer Uses Stun Gun and Choke Hold on Man Who Dies,https://www.nytimes.com/2017/05/17/us/las-vegas-officer-uses-stun-gun-and-choke-hold-on-man-who-dies.html,"The officer, Kenneth Lopera, 31, believed the man, Tashi Farmer, 40, was trying to carjack a vehicle, an undersheriff said at a news conference."
569,2017/05/17,"‘Australia? Yes, I Know; Off the Coast of New Zealand’",https://www.nytimes.com/2017/05/17/world/australia/nytaustralia10-off-the-coast-of-new-zealand-archives-climate-change-aziz-ansari-pamela-paul.html,"In this week’s newsletter, we take a trip through the New York Times archives and invite subscribers to an event with beer and literary discussion."
463,2017/05/17,Katy Perry to Judge ABC’s Revival of ‘American Idol’,https://www.nytimes.com/2017/05/17/arts/television/katy-perry-american-idol.html,The singer-songwriter will join a long list of musicians who have taken part in the show. How did her predecessors fare?
1304,2017/05/17,Puerto Rican Day Parade to Honor a Long-Jailed Militant,https://www.nytimes.com/2017/05/17/nyregion/puerto-rican-day-parade-plants-its-flag-in-disputed-territory.html,"Oscar López Rivera, who was associated with a group that carried out a deadly bombing in Manhattan in 1975, will be a the parade’s National Freedom Hero."
550,2017/05/17,"Google, Not the Government, Is Building the Future",https://www.nytimes.com/2017/05/17/technology/personaltech/google-not-the-government-is-building-the-future.html,"Without greater federal funding of cutting-edge technologies, corporations such as Google will be the ones that own the future."
1265,2017/05/18,How to Fight Back Against Revenge Porn,https://www.nytimes.com/2017/05/18/us/fighting-revenge-porn.html,"For victims, fighting against such attacks can take years and prove costly. But there is help."
588,2017/05/18,"Roger Ailes, Who Built Fox News Into an Empire, Dies at 77",https://www.nytimes.com/2017/05/18/business/media/roger-ailes-dead.html,"Mr. Ailes exerted wide influence on American politics with his conservative Fox News, only to be undone by sexual harassment allegations."
1249,2017/05/18,Mercedes-Benz Brings a New Model (of Battery) to U.S. Homes,https://www.nytimes.com/2017/05/18/business/energy-environment/vivint-solar-mercedes-benz-battery.html,"In a partnership with Vivint Solar, the automaker will market a storage device that can help power lights, appliances — and even electric cars."
1551,2017/05/18,"In Tumult of Trump, Jon Corzine Seeks a Wall Street Comeback",https://www.nytimes.com/2017/05/18/business/dealbook/jon-corzine-wall-street-comeback.html,"After a number of setbacks, the former New Jersey governor and Goldman Sachs executive is planning his next act: a hedge fund built for the Trump era."
625,2017/05/19,Lisa Su on the Art of Setting Ambitious Goals,https://www.nytimes.com/2017/05/19/business/lisa-su-on-the-art-of-setting-ambitious-goals.html,The chief executive of AMD says that teams are often capable of achieving more than they believe they can.
4,2017/05/19,AT&T Workers Start 3-Day Strike in Contract Impasse,https://www.nytimes.com/2017/05/19/business/att-wireless-strike-union.html,"A walkout affecting over 35,000 employees backed protests that call-center jobs were being sent overseas and retail work diverted to nonunion stores."
1254,2017/05/19,Water Utilities Worldwide Face a Growing Need for Investment,https://www.nytimes.com/2017/05/19/business/dealbook/water-utilities-worldwide-face-a-growing-need-for-investment.html,Shares of the Brazilian utility Sabesp plunged on news that it may raise equity for post-drought projects. Other water companies are likely to follow suit.
231,2017/05/19,‘This Doesn’t Sound Legal’: Inside Nike’s Oregon Project,https://www.nytimes.com/2017/05/19/sports/nike-oregon-project-alberto-salazar-dathan-ritzenhein.html,"A report by antidoping officials says the coach, Alberto Salazar, violated drug protocols with Dathan Ritzenhein, Mo Farah and other elite runners."
563,2017/05/19,‘Bloodline’ Returns With Murder and Madness in the Florida Keys,https://www.nytimes.com/2017/05/19/arts/television/bloodline-returns-with-murder-and-madness-in-the-florida-keys.html,This Netflix series starring Kyle Chandler is back for its final season.
561,2017/05/19,"In the Stock Market, International Is Actually First",https://www.nytimes.com/2017/05/19/your-money/america-first-stock-market-international.html,"The Trump administration’s slogan is “America First,” but in the stock market, companies with big international operations are outperforming."
1725,2017/05/19,Here Is Your Fall 2017 TV Schedule,https://www.nytimes.com/2017/05/19/arts/television/fall-2017-tv-schedule.html,"This week the broadcast networks released their fall prime-time schedules, as they do every May. Here’s a quick look at the shows, both returning and new. New series are indicated in bold."
506,2017/05/19,Netflix Defends Strategy at Cannes: ‘The Culture Is Changing’,https://www.nytimes.com/2017/05/19/movies/cannes-okja-netflix.html,"The company’s chief content officer, Ted Sarandos, says the festival knew full well that its competition titles might not get a theatrical release."
454,2017/05/19,"Norm Macdonald, Comic Nonpareil. (That’s a Word He Might Use.)",https://www.nytimes.com/2017/05/19/arts/television/norm-macdonald-netflix-tracy-morgan.html,"A new Netflix special shows what other comedians, like David Letterman, have known all along: Mr. Macdonald has an exceptional way with language."
711,2017/05/19,Dubious Corporate Practices Get a Rubber Stamp From Big Investors,https://www.nytimes.com/2017/05/19/business/gretchen-morgenson-arconic-activist-investors.html,"Arconic, the industrial materials company that spun off Alcoa, has been treated with kid gloves by big asset managers. Thursday’s annual meeting could change things."
443,2017/05/20,Farhad’s and Mike’s Week in Tech: Caring About Tech News,https://www.nytimes.com/2017/05/20/technology/farhads-and-mikes-week-in-tech-caring-about-tech-news.html,"In a tide of breaking news, why pay attention to the tech industry?"
501,2017/05/20,Technology as a Teaching Tool,https://www.nytimes.com/2017/05/20/opinion/sunday/technology-teaching-chromebooks-google.html,Chromebooks and Google apps are in classrooms everywhere. Are they an educational boon — or a marketing bonanza?
568,2017/05/21,"No, Google’s Not a Bird: Bringing the Internet to Rural India",https://www.nytimes.com/2017/05/21/world/asia/internet-in-india.html,A recent convert to the wonders of the web is trying to persuade his neighbors in a remote village that “the whole world rests inside the mobile.”
99,2017/05/21,"Margot Gianis, Brendan Mooney",https://www.nytimes.com/2017/05/21/fashion/weddings/margot-gianis-brendan-mooney.html,"The couple met at Northwestern, where each received a law degree."
1553,2017/05/21,Networks Offer Taste of TV’s Ad Future. Marketers Are Hungry for More.,https://www.nytimes.com/2017/05/21/business/media/networks-offer-taste-of-tvs-ad-future-marketers-are-hungry-for-more.html,"At this year’s presentations of coming fall lineups, there were signs that the networks were doing more to embrace viewers’ shift to digital platforms."
883,2017/05/21,Pittsburgh Welcomed Uber’s Driverless Car Experiment. Not Anymore.,https://www.nytimes.com/2017/05/21/technology/pittsburgh-ubers-driverless-car-experiment.html,"Nine months after Uber rolled out self-driving vehicles in Pittsburgh, the city’s relationship with the ride-hailing company has soured."
495,2017/05/22,"A New ‘Dirty Dancing,’ and Baby’s Love Story Is Just the Start",https://www.nytimes.com/2017/05/22/arts/television/dirty-dancing-remake-abc.html,"A TV musical remake of the 1987 film, now starring Abigail Breslin and Colt Prattes, includes an interracial flirtation and a sexless middle-age marriage."
432,2017/05/22,"Robert H. Boyle, a Watchdog of the Hudson River, Dies at 88",https://www.nytimes.com/2017/05/22/nyregion/robert-h-boyle-founder-of-hudson-riverkeeper.html,"Mr. Boyle, whose affection for the river and for fishing began in childhood, was a crusading conservationist and a founder of the widely replicated group Riverkeeper."
826,2017/05/22,"Donald Trump, Our A.I. President",https://www.nytimes.com/2017/05/22/opinion/donald-trump-our-ai-president.html,"When seen in the light of pure machine learning (think IBM’s Watson), his behavior actually makes sense."
481,2017/05/22,"At Cannes, the Glam and the Grim Mix Uneasily",https://www.nytimes.com/2017/05/22/movies/at-cannes-film-festival-politics-farhadi.html,"Organizers held a moment of silence and canceled fireworks after the bombing in Manchester, England. But in other respects, the festival is carrying on as before."
565,2017/05/23,Google’s AlphaGo Defeats Chinese Go Master in Win for A.I.,https://www.nytimes.com/2017/05/23/business/google-deepmind-alphago-go-champion-defeat.html,The software’s victory over the world’s best player of the Chinese game demonstrates how artificial intelligence can increasingly outperform humans at complex tasks.
782,2017/05/23,Fraught Racial Dynamics in the ‘Bachelorette’ Premiere,https://www.nytimes.com/2017/05/23/arts/television/bachelorette-rachel-lindsay-premiere.html,"Our resident obsessives dissect Monday night’s episode, looking for clues to how the show will handle race, with its first black woman at the center."
1202,2017/05/23,"Uber to Repay Millions to Drivers, Who Could Be Owed Far More",https://www.nytimes.com/2017/05/23/business/economy/uber-drivers-tax.html,The company concedes taking tens of millions in excess commissions. But records point to improper tax deductions costing drivers even more.
382,2017/05/23,"China Can’t Sustain Its Debt-Fueled Binge, Moody’s Says",https://www.nytimes.com/2017/05/23/business/moodys-downgrades-china-economy-debt.html,A downgrade by the ratings agency underlines the difficulty Beijing faces in pushing economic growth while tackling problems in its financial system.
612,2017/05/23,Ex-C.I.A. Chief Reveals Mounting Concern Over Trump Campaign and Russia,https://www.nytimes.com/2017/05/23/us/politics/john-brennan-russia-trump-campaign-cia.html,"John O. Brennan, the former director of the C.I.A., offered the fullest public account yet of how the federal investigation into Russian election meddling began."
948,2017/05/23,Transit Hubs: A Growing Lure for Developers,https://www.nytimes.com/2017/05/23/business/transit-rail-property-development.html,Young workers who prefer to walk or take the train are pushing up property values and reshaping developers’ plans.
1815,2017/05/23,"Malaysian Money. Opulent Ideas. But Now, for Park Lane, a Forced Sale.",https://www.nytimes.com/2017/05/23/nyregion/park-lane-hotel-jho-low.html,"The Park Lane Hotel in Manhattan was to become an ultraluxury tower. Now, amid global intrigue and money laundering charges, it will go to the highest bidder."
533,2017/05/23,Review: ABC’s Perspiration-Free ‘Dirty Dancing’,https://www.nytimes.com/2017/05/23/arts/television/dirty-dancing-abc-tv-review.html,"Abigail Breslin and Colt Prattes star in a television remake of “Dirty Dancing,” the unexpected hit from 1987."
717,2017/05/24,"‘Transparent,’ the Musical: Coming Soon?",https://www.nytimes.com/2017/05/24/theater/transparent-the-musical-coming-soon-joes-pub-faith-soloway.html,"Faith Soloway, a writer for the Amazon series who is the sister of its creator, will present the show “Should ‘Transparent’ Become a Musical?” at Joe’s Pub."
984,2017/05/24,Why China’s Growing Debt Load Worries the World,https://www.nytimes.com/2017/05/24/business/china-downgrade-explained.html,"After Moody’s lowered its grade by a notch, the financial health of the world’s second-largest economy is again causing concern."
1158,2017/05/25,"Student Brought Loaded Gun to Brooklyn School, Police Say",https://www.nytimes.com/2017/05/25/nyregion/gun-brooklyn-school.html,"A teacher confronted the student, Daniel Barrow, on Thursday after seeing him in an online video with a gun, the police said. Mr. Barrow was arrested."
942,2017/05/25,"Eyeglass Vendor, Imprisoned for Terrorizing Consumers, Is Accused of Fraud",https://www.nytimes.com/2017/05/25/business/eyeglass-vendor-imprisoned-for-terrorizing-consumers-is-accused-of-fraud.html,"Federal prosecutors charged Vitaly Borker, who spent over three years in prison for threatening customers of his previous online business, with wire and mail fraud."
781,2017/05/25,"Rumors on WhatsApp Ignite 2 Mob Attacks in India, Killing 7",https://www.nytimes.com/2017/05/25/world/asia/india-vigilante-mob-violence.html,"Seven men were beaten to death last week by mobs stirred up by false reports of child kidnappers, underscoring the lawlessness that still plagues India."
926,2017/05/25,"Dani Mathers, Former Playboy Model, Gets Community Service for Snapchat of Woman in Gym",https://www.nytimes.com/2017/05/25/us/dani-mathers-body-shaming.html,"Ms. Mathers must remove graffiti in Los Angeles after taking a photograph of a naked 70-year-old in a shower area, in a case seen as body shaming."
1512,2017/05/25,What to See in New York Art Galleries This Week,https://www.nytimes.com/2017/05/25/arts/design/what-to-see-in-new-york-art-galleries-this-week.html,"More surprises from Flora Crockett, at Meredith Ward Fine Art, as well as new work from Juliana Huxtable, Laurent Grasso and four artists at Martos."
1190,2017/05/25,A Speedy Refresher Course for Your Summer TV Favorites,https://www.nytimes.com/2017/05/25/arts/television/refresher-house-of-cards-game-of-thrones-orange-is-the-new-black.html,"Catch up on “House of Cards,” “Game of Thrones,” “Orange Is the New Black,” “Younger” and “Queen Sugar.”"
605,2017/05/25,"In Rare Move, Netflix Cancels ‘The Get Down,’ a Hip-Hop Series",https://www.nytimes.com/2017/05/25/arts/television/get-down-netflix-canceled-baz-luhrmann.html,"The show, which was from the filmmaker Baz Luhrmann and ran one season, was set in the South Bronx in the late 1970s. It is unusual for Netflix to cancel an original series."
1491,2017/05/25,Summer in the Hamptons: Eleven Madison Park and Uber (Finally!) Are Coming to the East End,https://www.nytimes.com/2017/05/25/style/the-talk-of-the-hamptons-this-summer.html,"From the toughest reservation in town to the return of the ride-hailing app, here are six things that Hamptonites will be buzzing about."
112,2017/05/26,"For Many, ‘Bloom County’ Creator’s Trump Joke Doesn’t Land",https://www.nytimes.com/2017/05/26/us/bloom-county-trump.html,"Berkeley Breathed, the creator of the comic strip, shared a (fake) letter telling him to stop using Mr. Trump’s image."
1404,2017/05/26,"As C.E.O. Pay Packages Grow, Top Executives Have the President’s Ear",https://www.nytimes.com/2017/05/26/business/ceo-compensation-pay-president-donald-trump.html,"The top 200 chief executives, who make more than last year, are holding meetings with President Trump, who is considering rolling back Dodd-Frank regulations."
1486,2017/05/26,Coal Country’s Power Plants Are Turning Away From Coal,https://www.nytimes.com/2017/05/26/business/energy-environment/coal-power-renewable-energy.html,Corporate demand for electricity from renewable sources to meet clean-energy goals is leading utilities to cut the use of a politically prized fuel.
749,2017/05/27,The Instagram Obituaries of the Young Manchester Victims,https://www.nytimes.com/2017/05/27/opinion/sunday/the-instagram-obituaries-of-the-young-manchester-victims.html,The internet gives us a surprisingly intimate glimpse into the lives of those who were killed.
130,2017/05/27,‘How Can We Combat What We Don’t Understand?’,https://www.nytimes.com/2017/05/27/insider/how-can-we-combat-what-we-dont-understand.html,"Our Top 10 Comments of the Week: Readers debate the Manchester bombing, planning your own wake and the first female infantrymen in the United States."
150,2017/05/27,"The Rise and Fall of Yik Yak, the Anonymous Messaging App",https://www.nytimes.com/2017/05/27/style/yik-yak-bullying-mary-washington.html,"The app, which shut down in April, was plagued by bad press from the beginning, earning itself a reputation as a place for racism, sexism, bullying and bomb threats."
1129,2017/05/28,"Army Fraud Crackdown Uses Broad Net to Catch Small Fish, Some Unfairly",https://www.nytimes.com/2017/05/28/us/national-guard-army-fraud-crackdown.html,"An inquiry into an incentive effort for the National Guard has targeted hundreds of soldiers and charged more than 150, but found only a fraction of the estimated fraud."
441,2017/05/28,Review: ‘Still Star-Crossed’ Goes Beyond Romeo and Juliet,https://www.nytimes.com/2017/05/28/arts/television/still-star-crossed-review-romeo-and-juliet-shonda-rhimes-abc.html,"This new ABC drama from Shondaland imagines a Shakespearean sequel with feuding families, a beleaguered prince and, of course, romance."
638,2017/05/29,Immigrants Keep an Iowa Meatpacking Town Alive and Growing,https://www.nytimes.com/2017/05/29/business/economy/storm-lake-iowa-immigrant-workers.html,"Waves of Asian, African and Latino newcomers have filled jobs at pork, egg and turkey plants where wages have fallen and work has grown more grueling."
237,2017/05/30,Supreme Court Rules Patent Laws Can’t Be Used to Prevent Reselling,https://www.nytimes.com/2017/05/30/business/supreme-court-patent-rights-lexmark.html,"The justices said that Lexmark International, which makes toner cartridges for its printers, could not stop another company from refilling and selling them."
498,2017/05/30,What to Remember Before Watching ‘House of Cards’ Season 5,https://www.nytimes.com/2017/05/30/watching/house-of-cards-season-5-refresher.html,The critical characters and where they stand as the Underwoods sweep in for a new season.
573,2017/05/30,The End of the Road for Some Apps,https://www.nytimes.com/2017/05/30/technology/personaltech/the-end-of-the-road-for-some-apps.html,"As Apple moves to update its iOS software this year, apps that have not kept pace with the changes will be sidelined."
1468,2017/05/30,"Goldman Buys $2.8 Billion Worth of Venezuelan Bonds, and an Uproar Begins",https://www.nytimes.com/2017/05/30/business/dealbook/goldman-buys-2-8-billion-worth-of-venezuelan-bonds-and-an-uproar-begins.html,Goldman and other big investors have been willing to assume increasing levels of risk for high-yield investments when interest rates are near zero.
1098,2017/05/30,"In Venezuela, Goldman Sachs Found a Hot Deal and a Moral Mess",https://www.nytimes.com/2017/05/30/business/dealbook/venezuela-bonds-goldman-sachs.html,"By buying government bonds with a face value of some $3 billion, Goldman has helped prop up the embattled regime of President Nicolás Maduro."
526,2017/05/31,The Enduring Appeal of Seeing Trump as Chess Master in Chief,https://www.nytimes.com/2017/05/31/magazine/the-enduring-appeal-of-seeing-trump-as-chess-master-in-chief.html,"Both his supporters and his opposition talk about the president as if he’s a strategic genius, despite considerable evidence to the contrary."
633,2017/05/31,Planning a Trip With the Help of Google Home,https://www.nytimes.com/2017/05/31/travel/google-home-help-with-planning-trips.html,"The smart speaker has learned a few new tricks, including some enhancements for travelers."
298,2017/06/01,What to See in New York Art Galleries This Week,https://www.nytimes.com/2017/06/01/arts/design/what-to-see-in-new-york-art-galleries-this-week.html,New paintings by Patricia Treib and Eric Fischl; Mathias Poledna’s time-obsessed art; and an exhibition of works by imprisoned artists.
587,2017/06/01,‘Sense8’ Cancellation Is Netflix’s Second in a Week,https://www.nytimes.com/2017/06/01/arts/television/sense8-netflix-canceled.html,The globe-trotting sci-fi drama from the Wachowski siblings made it to two seasons.
1213,2017/06/01,PPG Drops Its Pursuit of Akzo Nobel,https://www.nytimes.com/2017/06/01/business/dealbook/ppg-akzo-nobel-paint.html,"The American paint and chemicals giant said it would not make a formal bid, after its Dutch rival repeatedly rejected its approaches."
1095,2017/06/01,How a Shift in U.S. Policy Could Affect Travel to Cuba,https://www.nytimes.com/2017/06/01/travel/how-a-shift-in-us-policy-could-affect-travel-to-cuba.html,"If President Trump revives limits relaxed by his predecessor, travel to Cuba for Americans could become more difficult."
966,2017/06/01,Walmart Is Accused of Punishing Workers for Sick Days,https://www.nytimes.com/2017/06/01/business/walmart-workers-sick-days.html,A report says that the retail giant routinely refuses to accept doctors’ notes and penalizes workers who need to take care of an ailing family member.
1371,2017/06/02,The Mysterious Case of the Glut in True-Crime TV,https://www.nytimes.com/2017/06/02/arts/television/true-crime-tv-shows.html,"There’s a broad, and growing, range of real-life shows about criminals, from high-end, award-worthy series to the mangy, boilerplate and forgettable."
95,2017/06/02,Some Things T Editors Are Really Into Right Now,https://www.nytimes.com/2017/06/02/t-magazine/nike-tom-sachs-ann-ringstrand-editors-picks.html,A by-no-means exhaustive list of great things we've stumbled upon.
492,2017/06/02,"Airbnb Is Popular, but Renting Out Your Car? That’s Another Story",https://www.nytimes.com/2017/06/02/your-money/airbnb-is-popular-but-renting-out-your-car-thats-another-story.html,"There are reasons — accidents, thefts, insurance questions — why lending services like Turo and Getaround for people’s private vehicles haven’t taken off."
1697,2017/06/03,How G.O.P. Leaders Came to View Climate Change as Fake Science,https://www.nytimes.com/2017/06/03/us/politics/republican-leaders-climate-change.html,The party’s fast journey from debating how to combat climate change to arguing against its existence is a story of big political money and Democratic hubris.
724,2017/06/03,Farhad’s and Mike’s Week in Tech: Techies Versus Trump Again,https://www.nytimes.com/2017/06/03/technology/farhads-and-mikes-week-in-tech-techies-versus-trump-again.html,"This time, they’re squared off over climate change. Also, there was more Uber news."
1281,2017/06/03,"The Doctor Is In. Co-Pay? $40,000.",https://www.nytimes.com/2017/06/03/business/economy/high-end-medical-care.html,"For five-figure annual fees, boutique medical services offer the wealthiest Americans the chance to cut the line and receive the best treatment."
753,2017/06/03,"Dissecting Marissa Mayer’s $900,000-a-Week Yahoo Paycheck",https://www.nytimes.com/2017/06/03/technology/yahoo-marissa-mayer-compensation.html,Yahoo’s chief executive presided over the decline and sale of the company. But she delivered big rewards to investors.
899,2017/06/04,G.M. Wants to Drive the Future of Cars That Drive Themselves,https://www.nytimes.com/2017/06/04/business/general-motors-self-driving-cars-mary-barra.html,"Under its chief executive, Mary T. Barra, General Motors is redirecting energy and capital toward a race with Silicon Valley to create self-driving cars."
769,2017/06/04,Oculus Founder Plots a Comeback With a Virtual Border Wall,https://www.nytimes.com/2017/06/04/business/oculus-palmer-luckey-new-start-up.html,"After facing political criticism and leaving Facebook, Palmer Luckey is working on another start-up. Its military interest will go nicely with his helicopters and abandoned missile silos."
950,2017/06/04,Jason Dufner Cools Off and Wins the Memorial,https://www.nytimes.com/2017/06/04/sports/jason-dufner-memorial.html,"After setting the 36-hole tournament record and then shooting a 77, Dufner vented steam at the practice range and made a strong finish."
91,2017/06/04,"Apple’s W.W.D.C., and Energy Ministers Meeting: The Week Ahead",https://www.nytimes.com/2017/06/04/business/apple-will-host-annual-developers-conference-and-global-energy-ministers-are-to-meet.html,"The technology company will show off new software and hardware on Monday, and delegations from over two dozen countries will discuss clean energy investments."
141,2017/06/05,"Five Killed in Orlando Workplace Shooting, Officials Say",https://www.nytimes.com/2017/06/05/us/orlando-shooting.html,"The gunman, John Robert Neumann Jr., 45, was an employee who had been fired in April, the authorities said. He also shot and killed himself."
467,2017/06/05,Fear of a Monopoly Will Help Amazon’s Cloud Rivals,https://www.nytimes.com/2017/06/05/business/dealbook/cloud-storage-amazon.html,Information technology managers have started to worry about the difficulty of switching cloud suppliers in the event of a breakdown or hacking attack.
818,2017/06/05,HomePod Speaker and New iMacs: What We Saw at Apple’s WWDC,https://www.nytimes.com/2017/06/05/technology/apple-wwdc.html,"Apple held its annual developer conference, where it announced the brand new HomePod speaker, other hardware and updates to its operating systems."
1010,2017/06/06,How Did the Subway Get So Bad? Look to the C Train,https://www.nytimes.com/2017/06/06/nyregion/how-did-the-subway-get-so-bad-look-to-the-c-train.html,The story of the old train cars — far past their prime at 53 — exemplifies the political and financial obstacles that have the system on the verge of collapse.
155,2017/06/06,What You Get (and What You Don’t) From a $50 Amazon Fire,https://www.nytimes.com/2017/06/06/technology/personaltech/amazon-kindle-fire-tablet-review.html,"The newest versions of Amazon’s tablets, starting at $50, are unabashedly slow and unflashy, but just capable enough to be worth the cheap price."
