,date,headline,link,summary
264,,Trump Wasn’t in Aetna’s Playbook,https://www.nytimes.com/video/business/dealbook/100000004761242/trump-wasnt-in-aetnas-playbook.html,"When Aetna ran through postelection expectations, the idea that Donald J. Trump would win was not even in play, said Mark T. Bertolini, the company’s chief executive."
36,,AT&T and Time Warner C.E.O.s,https://www.nytimes.com/video/business/dealbook/100000004726219/att-and-time-warner-ceos.html,"Randall Stephenson, chief executive of AT&T, and Jeffrey Bewkes, chief executive of Time Warner, defended their big merger on CNBC’s “Squawk Box.”"
39,,Opposition to an AT&T Giant,https://www.nytimes.com/video/business/dealbook/100000004726222/opposition-to-an-att-giant.html,"“From a regulatory standpoint – classic anti-trust analysis – this is kind of a no-brainer,” said James Stewart of The Times, “It’s classic vertical integration.”"
41,,AT&T in Talks With Time Warner,https://www.nytimes.com/video/business/dealbook/100000004723401/att-in-talks-with-time-warner.html,"“According to my sources, this thing is going to go for way north of $90 a share,” said Andrew Ross Sorkin, adding pressure on CBS and Viacom to merge."
1027,,Moving Abroad?,https://www.nytimes.com/paidpost/bank-of-the-west/moving-abroad.html,"For growing businesses expanding globally is often a necessity. But before you pack your bags, going global, like growing any business, includes new challenges. It requires foresight, adaptability and specialists to find success for your portfolio as well as your business."
1680,,A Classic Landmark for the Modern Age,https://www.nytimes.com/paidpost/cartier/a-classic-landmark-for-the-modern-age.html,"The doors of the mansion are open once again. After a two-and-a-half year renovation and 99 years on the corner of Fifth Avenue and 52nd Street, Cartier’s landmark flagship has reopened."
303,,"Stock Picking Isn’t Dead, Says Fink",https://www.nytimes.com/video/business/dealbook/100000004715160/stock-picking-isnt-dead-says-fink.html,"“You're seeing a migration from active to passive,” said Laurence Fink, chief executive of BlackRock. “I don’t believe active is dead.”"
180,,Go from Retirement Saving to Spending,https://www.nytimes.com/paidpost/brighthouse-financial/go-from-retirement-saving-to-spending.html,"As retirement draws near, change your strategy to prepare for the many years ahead. You need to think about how you’ll spend your nest egg and generate more predictable income in retirement."
940,,How Far We’ve Come,https://www.nytimes.com/paidpost/belvedere/a-decade-of-difference/how-far-weve-come.html,"With enough access to medicine and preventative services, experts predict that we can stop HIV transmission in Sub-Saharan Africa by 2030."
1336,,Goldman Sachs C.E.O. on Trump,https://www.nytimes.com/video/business/dealbook/100000004718532/goldman-sachs-ceo-on-trump.html,"“We weren’t meeting in secret and we certainly weren’t plotting the destruction” of America, said Lloyd Blankfein, reacting to comments from Donald Trump."
634,,The Light Fantastic,https://www.nytimes.com/paidpost/hennessy-paradis-imperial/the-sense-of-precision-series/the-light-fantastic.html,Part one of The Sense of Precision Series explores sight.
154,,Business School: Where Diverse Insights Meet Strong Drive,https://www.nytimes.com/paidpost/columbia-business-school/business-school-where-diverse-insights-meet-strong-drive.html,Columbia Business School fosters and nurtures connections to help students succeed in the business world.
888,2016/08/31,iRobot CEO Says Vacuum Cleaners Clear Path to Robot Future,https://www.nytimes.com/aponline/2016/08/31/us/ap-us-irobot-ceo.html,"The clash this year over the future of iRobot pitted visionary robotics against the retail success of the company's Roombas, the circular-shaped domestic helpers that have cleaned millions of living rooms around the world."
666,2016/08/31,A Few Reasons Your Phone Isn’t Getting the Update,https://www.nytimes.com/2016/08/31/technology/personaltech/a-few-reasons-your-phone-isnt-getting-the-update.html,"As Google and Apple improve their mobile operating systems each year, older phone hardware cannot keep up with the new software."
1206,2016/08/31,Africa's Elephants Rapidly Declining as Poaching Thrives,https://www.nytimes.com/aponline/2016/08/31/us/ap-us-great-elephant-census.html,"The number of savanna elephants in Africa is rapidly declining and the animals are in danger of being wiped out as international and domestic ivory trades drive poaching across the continent, according to a study released Wednesday."
1493,2016/08/31,Waiting for Cancer,https://www.nytimes.com/2016/08/31/well/live/waiting-for-cancer.html,"Taking a DNA test for fun, then finding yourself on permanent standby, just waiting for cancer."
425,2016/08/31,Chipmaker Intersil Set to Pick Renesas Over Maxim as Acquirer: Sources,https://www.nytimes.com/reuters/2016/08/31/technology/31reuters-intersil-m-a-renesas.html,"Intersil Corp may announce a sale to Renesas Electronics Corp &lt;6723.T.&gt; as early as next week, choosing the Japanese semiconductor company over U.S. suitor Maxim Integrated Products Inc, people familiar with the matter said."
1454,2016/08/31,"Apple, Congress and the Missing Taxes",https://www.nytimes.com/2016/08/31/opinion/apple-congress-and-the-missing-taxes.html,The corporation and the United States have only themselves to blame for a record tax penalty in Europe.
1494,2016/09/01,"Daily Report: Uber and Google, Ride-Sharing ‘Frenemies’",https://www.nytimes.com/2016/09/01/technology/daily-report-uber-and-google-ride-sharing-frenemies.html,A Google executive kept out of meetings stepped down from Uber’s board as the search giant expands its own nascent ride sharing service to San Francisco.
326,2016/09/01,"A Celebrity Z-List? Yes, It Exists",https://www.nytimes.com/2016/09/01/arts/instagram-celebrities-sofia-richie.html,"As the gossip machine continues to define celebrity downward, a striving celebrity underclass has risen to dominate it."
1567,2016/09/01,Video Games Allow Characters More Varied Sexual Identities,https://www.nytimes.com/2016/09/01/technology/personaltech/video-games-allow-characters-more-varied-sexual-orientations.html,"Video games have become more inclusive regarding gender and sexuality, adding features to accommodate L.G.B.T. players."
1577,2016/09/01,Have a Story to Tell? Your Personal Memoirist Is Here,https://www.nytimes.com/2016/09/01/business/smallbusiness/preserving-a-lifetime-of-memories-for-posterity-and-profit.html,Personal historians make a business of helping people chronicle the events of their lives in memoirs.
1834,2016/09/01,"Yesterday, Outraged by Apple’s Tax Dodge. Today, by Its Tax Bill.",https://www.nytimes.com/2016/09/01/business/yesterday-outraged-by-apples-tax-dodge-today-by-its-tax-bill.html,Lawmakers have criticized companies that avoid taxes by moving overseas. But they’re rallying to Apple’s defense after an E.U. demand for $14.5 billion in back taxes.
259,2016/09/01,"This Fashion Week, Google Gets a New Look",https://www.nytimes.com/2016/09/01/fashion/new-york-fashion-week-google.html,The latest tech giant to woo the fashion world isn’t a social network. It’s a search engine.
1687,2016/09/01,"His Movie, Her Job and Their Relationship",https://www.nytimes.com/2016/09/01/fashion/franca-sozzani-italian-vogue-documentary.html,"A new documentary about Franca Sozzani, the editor of Italian Vogue, by her son gives new meaning to the idea of the fashion family."
1681,2016/09/02,How Tech Giants Are Devising Real Ethics for Artificial Intelligence,https://www.nytimes.com/2016/09/02/technology/artificial-intelligence-ethics.html,"Four people involved in the creation of an industry partnership say its intent will be clear: to ensure that A.I. research is focused on things that will benefit people, not hurt them."
238,2016/09/02,Retiree Awarded $15.6 Million in Reported Ponzi Scheme Tied to MetLife,https://www.nytimes.com/2016/09/02/business/dealbook/retiree-awarded-15-6-million-in-reported-ponzi-scheme-tied-to-metlife.html,"After an eight-week trial, a Los Angeles jury awarded the retiree, Christine Ramirez, punitive and compensatory damages."
1652,2016/09/02,"Tim Cook, Apple Chief, Defends Tax Practices and Says Cash Will Return to U.S.",https://www.nytimes.com/2016/09/02/technology/apple-tax-ireland-tim-cook.html,The company’s chief executive said in an interview with an Irish broadcaster that the European Union’s tax decision was “maddening” and politically motivated.
1826,2016/09/02,"Morning Agenda: A Chinese Mystery, Mylan’s Capitalist Nirvana, J.P.Morgan Faces Suit",https://www.nytimes.com/2016/09/02/business/dealbook/anbang-china-mylan-jp-morgan.html,"Owners of Anbang, a Chinese insurer behind a wave of multibillion-dollar deals, include relatives and friends of its politically connected chairman."
1827,2016/09/02,"Big Carmakers Merge, Cautiously, Into the Self-Driving Lane",https://www.nytimes.com/2016/09/02/automobiles/big-carmakers-merge-cautiously-into-the-self-driving-lane.html,"As G.M., Audi and Mercedes match the capabilities of Tesla’s Autopilot, they are taking steps to make sure drivers use it responsibly."
1588,2016/09/02,Israel Courts Foreign Money in Effort to Become Gas Exporter,https://www.nytimes.com/2016/09/02/business/energy-environment/israel-courts-foreign-money-in-effort-to-become-gas-exporter.html,The campaign is a major shift for a country whose government wrestled with how to regulate the energy industry.
1517,2016/09/02,"Review: In ‘Narcos’ Season 2, Pablo Escobar’s Time Is Running Out",https://www.nytimes.com/2016/09/02/arts/television/review-narcos-delivers-a-grim-harvest-in-season-2.html,"This Netflix series picks up the story of the Colombian drug lord where Season 1 left off, with the kingpin trying to keep his empire intact."
1075,2016/09/02,Report Finds Ban Hasn’t Halted Use of Cluster Bombs in Syria or Yemen,https://www.nytimes.com/2016/09/02/world/middleeast/cluster-bombs-syria-yemen.html,"Most of the world’s countries have signed a treaty banning the munitions, but not the United States and Russia, where many such bombs were made."
1636,2016/09/03,Ireland to Appeal Tax Ruling in Apple Case,https://www.nytimes.com/2016/09/03/technology/apple-ireland-tax-ruling-appeal.html,"The country’s cabinet unanimously agreed to fight the $14.5 billion decision, and politicians are expected to debate it next week."
220,2016/09/03,Gatorade Shakes Up the Sport Drink by Going Organic,https://www.nytimes.com/2016/09/03/business/gatorade-shakes-up-the-sport-drink-by-going-organic.html,"The organic version will be made up of seven ingredients, will come in lemon, strawberry and mixed berry flavors and will be sold in select markets this fall."
1775,2016/09/03,Is EpiPen a Brand-Name or a Generic Drug? Mylan Casts It Both Ways,https://www.nytimes.com/2016/09/03/business/is-epipen-a-brand-name-or-a-generic-drug-mylan-casts-it-both-ways.html,"The drug company has listed the device as a generic to the government, possibly leading state Medicaid programs to overpay for it by millions of dollars."
1754,2016/09/03,China Opens Antitrust Investigation Into Uber’s Deal With Didi,https://www.nytimes.com/2016/09/03/business/china-uber-didi-chuxing.html,"The sale of the ride-hailing company’s Chinese operations to a rival, Didi Chuxing, would create a company worth about $35 billion."
1424,2016/09/03,An Outcry Over the Price of EpiPen,https://www.nytimes.com/2016/09/03/opinion/an-outcry-over-the-price-of-epipen.html,Readers express outrage that drug companies put lives at risk by setting very high prices for certain medications.
1798,2016/09/04,Political Correctness and Its Real Enemies,https://www.nytimes.com/2016/09/04/opinion/sunday/political-correctness-and-its-real-enemies.html,"Conservative donors have seized on campus debates to push their belief in free markets, not in free speech."
1431,2016/09/04,"A Warrior Against Junk Mail at Yahoo Looks Out for Mom, Too",https://www.nytimes.com/2016/09/04/jobs/a-warrior-against-junk-mail-at-yahoo-looks-out-for-mom-too.html,An anti-spam architect helps define the design and structure of Yahoo’s email system to root out spam without blocking any emails from your mother.
1387,2016/09/04,Steve Aoki Leaps Off Cliffs. But Biking in Chinatown? That Makes Him Nervous.,https://www.nytimes.com/2016/09/04/fashion/steve-aoki-pokemon-go.html,The electronic-music superstar indulges in a game of Pokémon Go on a stopover in New York.
1624,2016/09/04,"For the Rock Star, Love Has Finally Landed",https://www.nytimes.com/2016/09/04/fashion/weddings/for-the-rock-star-love-has-finally-landed.html,"Matthew Caws, of the band Nada Surf, and Emily Bidwell may have had an inkling of life ahead when they met 16 years ago at a Brooklyn record store."
1800,2016/09/04,TV Takes a Prime-Time Chance: Kooky Comedy,https://www.nytimes.com/2016/09/04/arts/television/network-sitcoms-prime-time-the-good-place.html,"NBC, Fox and ABC, dogged by cable, are gambling this season on outside-the-box comedies and quirky niche shows."
1534,2016/09/04,Sunbathed Portraits at Coney Island,https://www.nytimes.com/2016/09/04/nyregion/the-coney-island-boardwalk-as-a-runway.html,"The portrait series “Island” features images by Mark Hartman, who walks the same route along the beach nearly every day, snapping photos along the way."
1522,2016/09/04,"The Lesson of EpiPens: Why Drug Prices Spike, Again and Again",https://www.nytimes.com/2016/09/04/opinion/sunday/the-lesson-of-epipens-why-drug-prices-spike-again-and-again.html,Government has no real tools to curb extortionate prices.
1822,2016/09/05,"Hollywood’s Summer of Extremes: Megahits, Superflops and Little Else",https://www.nytimes.com/2016/09/05/business/media/hollywoods-summer-of-extremes-megahits-superflops-and-little-else.html,"As the industry searches for answers, some point to the loss of an underappreciated figure: the ticket buyer who treks to the theater more for the experience than for the movie itself."
676,2016/09/05,"Team Canada Offers Lessons for the Future, From 1972",https://www.nytimes.com/2016/09/05/sports/hockey/team-canada-summit-1972.html,Members of Team Canada refuse to let the legacy of their win over the Soviet Union — and the lessons it can provide — slip away.
556,2016/09/06,Will the New Apple iPhone Have a Headphone Jack? Rumormongers Say It Won’t,https://www.nytimes.com/2016/09/06/technology/will-the-new-iphone-have-a-headphone-jack-rumormongers-say-it-wont.html,"Apple is expected to unveil the latest model on Wednesday, but if it is indeed missing this basic feature, devotees may be left disenchanted."
1531,2016/09/06,BuzzFeed Regroups as Media Turns Video-Centric,https://www.nytimes.com/2016/09/06/business/media/buzzfeed-regroups-as-media-industry-turns-to-video.html,"A reorganization emphasizes video and entertainment to generate revenue, but executives say the company remains committed to its news operations."
1380,2016/09/06,Whom to Vote For? Employees Tend to Follow Their Leader,https://www.nytimes.com/2016/09/06/business/dealbook/whom-to-vote-for-employees-tend-to-follow-their-leader.html,"A chief executive’s political leanings may significantly influence whom workers donate to and choose at the polls, a study found."
1601,2016/09/07,Neon Makes a Point at the U.S. Open,https://www.nytimes.com/2016/09/07/fashion/neon-nike-us-open.html,A fashion cautionary tale courtesy of the yellow! and pink! and green! on Center Court.
1742,2016/09/07,ITT Educational Services Closes Campuses,https://www.nytimes.com/2016/09/07/business/itt-educational-services-closes-its-campuses.html,The move by the for-profit educational company — which cited strict new federal rules — leaves thousands of students and employees with few options.
1819,2016/09/08,"Everything You Need to Know About This Crazy, Mixed-Up, (Maybe) Very Good Season",https://www.nytimes.com/2016/09/08/fashion/everything-you-need-to-know-about-this-fashion-week.html,"From designer debuts to “seasonless” collections and see-now, shop-now disrupters, here is your crib sheet to the ready-to-wear circus."
1813,2016/09/08,Unforgettable Moments,https://www.nytimes.com/2016/09/08/fashion/new-york-fashion-week-history-moments.html,The wacky and weird events that turned fashion into theater.
1776,2016/09/08,Downfall of ITT Technical Institutes Was a Long Time in the Making,https://www.nytimes.com/2016/09/08/business/downfall-of-itt-technical-institutes-was-a-long-time-in-the-making.html,"More than a decade ago, students found themselves locked out as federal agents searched for evidence of fraud."
1779,2016/09/08,"A Cleaning Start-Up Wielding Mops, Buckets and 700 Data Points",https://www.nytimes.com/2016/09/08/business/smallbusiness/a-cleaning-start-up-wielding-mops-buckets-and-700-data-points.html,"Squiffy Clean in Silicon Valley takes a tech-minded approach to cleaning offices, using analytics to set prices and improve efficiency."
1646,2016/09/08,Shakiness of Giant Deals Poses No Threat to 2015 Record,https://www.nytimes.com/2016/09/08/business/dealbook/shakiness-of-giant-deals-poses-no-threat-to-2015-record.html,"More than $750 billion worth of acquisitions proposed last year have been abandoned, and more hang in the balance, but $4.4 trillion in deals were made."
1718,2016/09/08,Oregon Police Look for People Who Wrecked Popular ‘Duckbill’ Formation,https://www.nytimes.com/2016/09/08/us/oregon-duckbill-formation.html,Park officials first thought the sandstone had fallen naturally. But a video shows people toppling it.
1458,2016/09/08,No Clear Logic in Verizon’s Digital Media Venture,https://www.nytimes.com/2016/09/08/business/dealbook/no-clear-logic-in-verizons-digital-media-venture.html,Verizon’s acquisitions of Yahoo and AOL raise legitimate questions about the judgment of Verizon’s management.
1410,2016/09/08,What’s Really Missing From the New iPhone: Cutting-Edge Design,https://www.nytimes.com/2016/09/08/technology/whats-really-missing-from-the-new-iphone-dazzle.html,"The iPhone 7 doesn’t have a place to plug in headphones, but that is far from its worst shortcoming. The new device is an example of how Apple’s aesthetics have gone stale."
1436,2016/09/08,"Apple Moves Toward a Wireless Future, One Tweak at a Time",https://www.nytimes.com/2016/09/08/technology/iphone-7-apple-headphone-jack.html,"What was lacking in Apple’s product showcase was a new, can’t-miss hit. But if you like tweaks to products you may already have, the company had plenty to offer."
1575,2016/09/08,Ending Apple’s Offshore Tax Dodge,https://www.nytimes.com/2016/09/08/opinion/ending-apples-offshore-tax-dodge.html,Readers say a tax avoidance scheme used by many large corporations is unfair to small businesses and average taxpayers.
1825,2016/09/09,Your Car’s New Software Is Ready. Update Now?,https://www.nytimes.com/2016/09/09/automobiles/your-cars-new-software-is-ready-update-now.html,Automakers are taking advantage of connected cars by beaming improved features right into their vehicles via software upgrades.
1530,2016/09/09,Keeping Your Files Safe in the Sky,https://www.nytimes.com/2016/09/09/technology/personaltech/keeping-your-files-safe-in-the-sky.html,"Online storage services like Dropbox and iCloud use encryption to help keep your data secure, but you should be vigilant about password management."
1472,2016/09/09,"Daily Report: Tweaks on the Road to Wireless, but No Pyrotechnics From Apple",https://www.nytimes.com/2016/09/09/technology/daily-report-tweaks-on-the-road-to-wireless-but-no-pyrotechnics-from-apple.html,"The iPhone 7, iPhone 7 Plus and the Watch all acquired new features, though none of them a game changer. Three of our writers delve into the advances."
1557,2016/09/09,A Push to Lower Drug Prices That Hit Insurers and Employers the Hardest,https://www.nytimes.com/2016/09/09/business/express-scripts-urges-narrower-coverage-of-anti-inflammatory-drugs.html,"Seeking to force drug price competition in an expensive category, the company wants insurers to cover fewer anti-inflammatory drugs, at least as a first-line treatment."
1504,2016/09/09,Review: Have You Heard the One About the Grieving Daughter?,https://www.nytimes.com/2016/09/09/arts/television/tig-notaro-one-mississippi-review.html,"The comedian Tig Notaro stars in Amazon’s tender-funny “One Mississippi,” in which a loss brings a troubled family together."
1581,2016/09/10,Apple Is Said to Be Rethinking Strategy on Self-Driving Cars,https://www.nytimes.com/2016/09/10/technology/apple-is-said-to-be-rethinking-strategy-on-self-driving-cars.html,"The company has closed parts of its self-driving car project and laid off dozens of employees, according to three people briefed on the subject."
1609,2016/09/11,Aron Ain of Kronos: The Incalculable Value of a Good Boss,https://www.nytimes.com/2016/09/11/business/aron-ain-of-kronos-the-incalculable-value-of-a-good-boss.html,"Mr. Ain, chief executive of Kronos, a maker of work force management software, says leadership is the greatest factor that affects shareholder value."
1724,2016/09/11,"With Wearable Tech Deals, New Player Data Is Up for Grabs",https://www.nytimes.com/2016/09/11/sports/ncaafootball/wearable-technology-nike-privacy-college-football.html,"A new, $170 million deal could allow Nike to harvest personal data from Michigan athletes through wearable tech, raising concerns over privacy and who should control such information."
1665,2016/09/11,Farhad’s and Mike’s Week in Tech: The iPhone’s Super Mario Moment,https://www.nytimes.com/2016/09/11/technology/farhads-and-mikes-week-in-tech-the-iphones-super-mario-moment.html,"Apple is killing the headphone jack but helping revive Nintendo’s great franchise with Super Mario Run, coming exclusively to iOS."
1406,2016/09/11,What Could I Possibly Learn From a Mentor Half My Age? Plenty,https://www.nytimes.com/2016/09/11/business/what-could-i-possibly-learn-from-a-mentor-half-my-age.html,"How Snapchat lessons from a younger colleague, whose job didn’t exist five years ago, stretched a New York Times editor professionally and personally."
1590,2016/09/11,"In a Reverse Mentorship, Seeing Age Though a New Lens",https://www.nytimes.com/2016/09/11/business/in-a-reverse-mentorship-seeing-age-though-a-new-lens.html,A young Times editor gets an unexpected chance to take on a leadership role when a seasoned colleague asks for Snapchat lessons.
1679,2016/09/11,Where to Live? Ask an App,https://www.nytimes.com/2016/09/11/realestate/where-to-live-ask-an-app.html,New apps and online tools use a combination of big data and smart algorithms to help buyers and renters find their ideal neighborhoods.
354,2016/09/12,"Ireland Doesn’t Want Apple’s Back Taxes, but the Irish Aren’t So Sure",https://www.nytimes.com/2016/09/12/business/international/ireland-doesnt-want-apples-back-taxes-but-the-irish-arent-so-sure.html,"After six years of belt-tightening and tax increases, many Irish workers say their government’s reluctance to collect $14.5 billion from Apple is unfair."
1615,2016/09/12,Amazon and Pandora to Gauge Music’s Value in the Internet Age,https://www.nytimes.com/2016/09/12/business/media/amazon-and-pandora-to-gauge-musics-value-in-the-internet-age.html,"The companies are planning to charge as little as $5 a month for new streaming music services, half the cost of the current pricing model."
1507,2016/09/12,Elon Musk Says Pending Tesla Updates Could Have Prevented Fatal Crash,https://www.nytimes.com/2016/09/12/business/elon-musk-says-pending-tesla-updates-could-have-prevented-fatal-crash.html,The upgrades to Tesla’s Autopilot system will require drivers to refrain from taking their hands off the wheel for long periods and will use radar to better identify potential obstacles in the road.
1332,2016/09/12,In the Studio With the Creative Director of Coach,https://www.nytimes.com/2016/09/12/fashion/stuart-vevers-coach-new-york-fashion-week.html,Stuart Vevers reveals the secret sauce in his working environment that is transforming the brand into a fashion week talking point.
1346,2016/09/13,"Morning Agenda: A.I.G.’s Ex-Chief on Trial, Apple Taxes, Driverless Updates",https://www.nytimes.com/2016/09/13/business/dealbook/aig-greenberg-apple-ireland-tesla-uber.html,"Eleven years after charges were filed, Maurice R. Greenberg, the former chief executive of A.I.G., finally goes on trial."
1833,2016/09/13,"Polishing Financial Results Looks Good, but Can Lead to Fraud",https://www.nytimes.com/2016/09/13/business/dealbook/polishing-financial-results-looks-good-but-can-lead-to-fraud.html,Cases involving American Realty Capital Partners and Fiat Chrysler show how manipulating reported results can end up misleading investors.
1307,2016/09/13,"Her U.S. Open Loss Behind Her, Serena Williams Turns to Fashion",https://www.nytimes.com/2016/09/13/fashion/serena-williams-hsn-new-york-fashion-week.html,"She showed her newest collection for HSN, just days after losing her No. 1 ranking and the chance for a record-setting Grand Slam win."
1578,2016/09/13,"Agrium and Potash Corp. to Merge, Creating Fertilizer Giant",https://www.nytimes.com/2016/09/13/business/dealbook/agrium-and-potash-corp-to-merge-creating-fertilizer-giant.html,The companies agreed to an all-stock merger in a deal that follows others that touch the farming industry.
1792,2016/09/14,Songwriters Sue Justice Department Over Licensing Rules,https://www.nytimes.com/2016/09/14/business/media/songwriters-sue-justice-department-over-licensing-rules.html,The Songwriters of North America group said in its suit that a Justice Department ruling last month was unconstitutional.
