,date,headline,link,summary
208,2017/01/25,Dumping a Bad App? Tips for a Painless Breakup,https://www.nytimes.com/2017/01/25/technology/personaltech/dumping-a-bad-app-tips-for-a-painless-breakup.html,"If a once-beloved app no longer brings you joy, it may be time to move on. Here’s how to know when to look for something better and how to take your data with you."
972,2017/01/25,George Orwell’s ‘1984’ Is Suddenly a Best-Seller,https://www.nytimes.com/2017/01/25/books/1984-george-orwell-donald-trump.html,"The dystopian novel, published in 1949, about tyranny and the suppression of critical thought, has found a fresh audience in the United States."
998,2017/01/26,Shades of Gray in the Digital Darkroom,https://www.nytimes.com/2017/01/26/technology/personaltech/shades-of-gray-in-the-digital-darkroom.html,Adobe Photoshop comes with tools to convert your standard color pictures into rich-looking black-and-white photographs.
1248,2017/01/26,Facebook’s Virtual Reality Business Gets a New Leader,https://www.nytimes.com/2017/01/26/technology/facebook-virtual-reality-hugo-barra.html,"Hugo Barra, a former executive at Google and the Chinese phone maker Xiaomi, will lead the company’s virtual reality efforts, which have faced several hurdles."
38,2017/01/26,How to Save CNN From Itself,https://www.nytimes.com/2017/01/26/opinion/how-to-save-cnn-from-itself.html,There is more to the news than tweets and polls. The network should go back to its roots.
922,2017/01/26,Was BuzzFeed Right to Publish the Russia File on Trump?,https://www.nytimes.com/2017/01/26/opinion/was-buzzfeed-right-to-publish-the-russia-file-on-trump.html,"One reader applauds BuzzFeed’s decision, while two others criticize it. Fact-checking is not the reader’s job, one says."
1171,2017/01/26,Slashers’ Work Ruins Shoes Discarded at a Nike Store,https://www.nytimes.com/2017/01/26/nyregion/slashers-work-ruins-shoes-discarded-at-a-nike-store.html,A passer-by’s discovery of bags of ruined shoes outside a Nike store in SoHo seems to fly in the face of a stated policy of donating unworn clothing.
819,2017/01/26,"Elon Musk Has Trump’s Ear, and Wall Street Takes Note",https://www.nytimes.com/2017/01/26/business/elon-musk-donald-trump-wall-street.html,"The political tide might seem unfavorable for electric cars and solar panels, but the new president may see them as part of a job-producing future."
1193,2017/01/27,Daily Report: Elon Musk’s Unlikely Bond With Donald Trump,https://www.nytimes.com/2017/01/27/technology/daily-report-elon-musks-unlikely-bond-with-donald-trump.html,"Mr. Musk might seem to be anathema to the president, yet he’s part of Mr. Trump’s meetings with business leaders. The reasons: jobs, vision and power."
1003,2017/01/27,Does a Protest’s Size Matter?,https://www.nytimes.com/2017/01/27/opinion/does-a-protests-size-matter.html,"In the digital age, it’s no longer a reliable indicator of a movement’s strength."
1198,2017/01/27,"Google, in Post-Obama Era, Aggressively Woos Republicans",https://www.nytimes.com/2017/01/27/technology/google-in-post-obama-era-aggressively-woos-republicans.html,The tech company had many close links to the Obama administration. Now it’s scrambling to forge ties with President Trump and a Republican-dominated Congress.
1019,2017/01/27,Drew Barrymore’s Next Act: Suburban Zombie,https://www.nytimes.com/2017/01/27/arts/television/drew-barrymores-next-act-suburban-zombie.html,"Ms. Barrymore is Sheila Hammond, a California real estate agent who is transformed into a zombie, in “Santa Clarita Diet” on Netflix."
1006,2017/01/27,"Uneasy About the Future, Readers Turn to Dystopian Classics",https://www.nytimes.com/2017/01/27/business/media/dystopian-classics-1984-animal-farm-the-handmaids-tale.html,A boost in sales for books like George Orwell’s “Animal Farm” and “1984” seems to reflect an organic response from readers wary of President Trump’s rhetoric.
880,2017/01/27,"Instead of Leaving a Job, Why Not Take a Pause?",https://www.nytimes.com/2017/01/27/jobs/career-pause-sabbaticals-unpaid-leaves.html,"More companies should allow unpaid leaves so workers can take stock of their career path, a Google employee argues."
910,2017/01/27,Find the Right Power Cord for Your MacBook,https://www.nytimes.com/2017/01/27/technology/personaltech/find-the-right-power-cord-for-your-macbook.html,"Apple has many adapters for charging the laptop’s battery, so be sure to get the one designed for your model."
639,2017/01/28,These Booths Are Made For Talking: Soothers Hit the Streets,https://www.nytimes.com/2017/01/28/fashion/these-booths-are-made-for-talking-soothers-hit-the-streets.html,"Street preachers. Huggers without portfolio. If stores and restaurants can pop up, why can’t the helping professions?"
1279,2017/01/28,Golf Pro Aims to Revolutionize an Industry With One-Size-Fits-All Irons,https://www.nytimes.com/2017/01/28/sports/golf/single-length-irons-cobra.html,"Bryson DeChambeau sees single-length irons as a game changer, eliminating the need to make swing and stance adjustments for each club."
1242,2017/01/29,‘Becoming Warren Buffett’ Goes Beyond a $74 Billion Fortune,https://www.nytimes.com/2017/01/29/arts/television/becoming-warren-buffett-goes-beyond-a-74-billion-fortune.html,"This HBO documentary focuses on how Mr. Buffett became the Oracle of Omaha, but also details his most personal relationships."
1807,2017/01/29,$5 Million for a Super Bowl Ad. Another Million or More to Market the Ad.,https://www.nytimes.com/2017/01/29/business/5-million-for-a-super-bowl-ad-another-million-or-more-to-market-the-ad.html,"Companies, eager to get their money’s worth, now spend 25 percent or more of the cost of a Super Bowl ad to market the ad itself."
1351,2017/01/29,Silicon Valley’s Ambivalence Toward Trump Turns to Anger,https://www.nytimes.com/2017/01/29/technology/silicon-valleys-ambivalence-toward-trump-turns-to-anger.html,"Tech companies, which have embraced globalization, reacted more forcefully to the president’s immigration order than counterparts in other industries."
732,2017/01/30,Tech Companies Fight Trump Immigration Order in Court,https://www.nytimes.com/2017/01/30/technology/technology-companies-fight-trump-immigration-order-in-court.html,"Amazon and Expedia have joined a lawsuit in federal court in Seattle, asking for key parts of the executive order to be declared unconstitutional."
356,2017/01/30,How to Plan a Safe Trip for Gay and Transgender Travelers,https://www.nytimes.com/2017/01/30/business/how-to-plan-a-safe-trip-for-gay-and-transgender-travelers.html,"In many parts of the world, laws and social customs create an unwelcoming and unsafe environment for L.G.B.T. travelers, but planning ahead can reduce risks."
1240,2017/01/30,Frantic Phoning Among C.E.O.s: How to Address Trump Ban?,https://www.nytimes.com/2017/01/30/business/dealbook/ceo-response-trump-ban.html,Whispered questions among business leaders over the weekend produced no clear consensus on what to say about the President Trump’s immigration order in public.
1101,2017/01/31,"Amid Immigration Furor, Apple’s Chief Focuses on Apps and Music",https://www.nytimes.com/2017/01/31/technology/apple-tim-cook.html,"Timothy D. Cook said the iPhone maker hoped to double its services business in the next four years, but it will be harder to predict how to deal with the Trump administration."
1488,2017/01/31,What You Need to Know About #DeleteUber,https://www.nytimes.com/2017/01/31/business/delete-uber.html,The ride-hailing company has been forced to contend with an unexpected event: a surge in users seeking to delete their accounts.
939,2017/01/31,Making Under Armour Simple Takes Its Toll,https://www.nytimes.com/2017/01/31/business/dealbook/making-under-armour-simple-takes-its-toll.html,The athletic gear company’s shares plunge as it reports the slowest revenue growth in years and its finance chief departs.
1715,2017/01/31,Refugees Welcome. Volunteers Embrace Congolese Family in the Hudson Valley.,https://www.nytimes.com/2017/01/31/nyregion/refugees-congolese-family-hudson-valley.html,"Escaping violence in the Democratic Republic of Congo, a family arrived in the United States amid turmoil over President Trump’s executive order on immigration."
1753,2017/02/01,RushCard Ordered to Pay $13 Million for Disruption of Prepaid Card Service,https://www.nytimes.com/2017/02/01/business/rushcard-cfpb.html,"The Consumer Financial Protection Bureau, intending to send a warning to the industry, fined RushCard over a 2015 breakdown that denied thousands of customers access to their cash."
174,2017/02/01,White House Inc.,https://www.nytimes.com/2017/02/01/opinion/white-house-inc.html,Congress shouldn’t stand by as the most powerful office in the world is reduced to a marketing scheme.
1391,2017/02/01,Snap’s Chief Taps Into the ‘Right Now’,https://www.nytimes.com/2017/02/01/technology/snapchat-snap-ceo-evan-spiegel.html,"As Snap, the parent company of Snapchat, takes steps to go public, its leader still relies on unconventional notions to upend social media."
234,2017/02/01,Facebook’s Loss in Court Doesn’t Dim Excitement Over Huge Growth,https://www.nytimes.com/2017/02/01/technology/facebook-earnings-oculus-lawsuit.html,"Sales for the social media giant grew 51 percent in the most recent quarter, and a $500 million jury decision should do little to hurt its bottom line."
1710,2017/02/01,Trump’s Army Secretary Pick Could Trade One Potential Conflict for Another,https://www.nytimes.com/2017/02/01/us/politics/vincent-viola-army-secretary.html,Vincent Viola has been negotiating to swap his airline interest for a stake in a charter company with millions of dollars in government contracts.
1024,2017/02/01,Healthy Payout Possible for Carlyle From Nature’s Bounty,https://www.nytimes.com/2017/02/01/business/dealbook/healthy-payout-possible-for-carlyle-from-natures-bounty.html,The private equity firm bought the nutritional supplement maker using debt as leverage in 2010 and could potentially sell it now for $6 billion.
1338,2017/02/01,"SoFi to Acquire Zenbanx, Allowing It to Be More Like a Bank",https://www.nytimes.com/2017/02/01/business/dealbook/sofi-to-acquire-zenbanx-allowing-it-to-be-more-like-a-bank.html,"Acquiring Zenbanx would let Social Finance, a financial start-up, offer customers checking accounts, credit cards and money transfers."
1253,2017/02/01,Peloton Instructors Ride for Fitness and Fame,https://www.nytimes.com/2017/02/01/style/peloton-fitness-cycling-celebrity-instructors.html,"The indoor cycling company is closing the gap between fitness instructor and celebrity, one highly produced live-streamed class at a time."
943,2017/02/01,"Daily Report: At Apple, Triumphs Amid Tribulations",https://www.nytimes.com/2017/02/01/technology/daily-report-at-apple-triumphs-amid-tribulations.html,"The company faces slowing iPhone sales growth and uncertain relations with the new president. But revenue is up, and app sales and music are taking off."
1071,2017/02/02,What Snap’s I.P.O. Filing Reveals About the Company,https://www.nytimes.com/2017/02/02/business/dealbook/what-snaps-ipo-filing-reveals-about-the-company.html,Disclosures showed strong growth in revenue and the number of daily users of Snapchat.
1192,2017/02/02,Deal Advisers Face a Tricky Period for M.&A.,https://www.nytimes.com/2017/02/02/business/dealbook/deal-advisers-face-a-tricky-period-for-ma.html,"Evercore, Greenhill and Lazard beat earnings expectations but resilience will require confident clients this year."
332,2017/02/02,Amazon’s Holiday Quarter Doesn’t Match High Expectations,https://www.nytimes.com/2017/02/02/business/amazon-quarter-revenue.html,Investors have long been generous with Amazon. But lower-than-expected quarterly revenue growth dropped the company’s share price more than 4 percent.
843,2017/02/02,"Review: ‘Santa Clarita Diet,’ a Suburban Sitcom With Bite",https://www.nytimes.com/2017/02/02/arts/television/review-santa-clarita-diet-netflix-drew-barrymore.html,"In this Netflix series, Drew Barrymore plays a real estate agent whose midlife outlook improves when she becomes a zombie hungry for humans."
1746,2017/02/02,Nordstrom Drops Ivanka Trump Brand From Its Stores,https://www.nytimes.com/2017/02/02/business/nordstrom-ivanka-trump.html,The department store chain said it would put the brakes on its relationship with Ms. Trump and it removed her brand from a list on its site.
1543,2017/02/02,Trump Looks to Another Finance Veteran for Senior Role,https://www.nytimes.com/2017/02/02/business/dealbook/trump-stephen-feinberg-private-equity-cerberus.html,Private equity mogul Stephen Feinberg of Cerberus Capital Management has held talks about an unspecified job in the new administration.
229,2017/02/02,Snapchat Parent Showcases Its Strength in Preparation for I.P.O.,https://www.nytimes.com/2017/02/02/business/dealbook/snapchat-ipo-nyse.html,Making its filing public was one of the final steps the company would take before it begins trading on the New York Stock Exchange.
873,2017/02/02,"Jim Mattis, Romania, Rodrigo Duterte: Your Morning Briefing",https://www.nytimes.com/2017/02/02/briefing/your-morning-briefing.html,Here’s what you need to know to start your day.
981,2017/02/02,Solving the Case of the Mac’s Disappearing Scroll Bars,https://www.nytimes.com/2017/02/02/technology/personaltech/solving-the-case-of-the-disappearing-scroll-bars.html,"The Mac operating system often tucks an unused scroll bar out of sight, but that can be changed in the settings."
1059,2017/02/03,"For Nicholas K, Fashion Week Is the Finish Line",https://www.nytimes.com/2017/02/03/nyregion/nicholas-k-fashion-week.html,"A day at Nicholas K, as its designers, models and stylists are at work preparing for New York Fashion Week."
770,2017/02/03,Ricky Gervais Goes Back to ‘The Office’,https://www.nytimes.com/2017/02/03/movies/ricky-gervais-goes-back-to-the-office.html,"In the new movie “David Brent: Life on the Road,” he reprises his tactless and overbearing sitcom character."
105,2017/02/03,Snap as a Camera Company? I.P.O Raises Comparisons to GoPro,https://www.nytimes.com/2017/02/03/business/dealbook/snap-as-a-camera-company-ipo-raises-comparisons-to-gopro.html,The parent company of Snapchat called itself a “camera company” in its initial public offering filed on Thursday. Maybe investors should treat it that way.
168,2017/02/03,Snap’s Plan Is Most Unfriendly to Outsiders,https://www.nytimes.com/2017/02/03/business/dealbook/snap-ipo-plan-evan-spiegel.html,"The company behind the popular disappearing-message app Snapchat is offering three types of shares, and outsiders will get no voting rights."
786,2017/02/03,Cedric Bru of Taulia on Building Trust Through Vulnerability,https://www.nytimes.com/2017/02/03/business/cedric-bru-taulia-corner-office.html,The C.E.O. of the software firm says he works to create a safe environment for sharing constructive feedback.
1521,2017/02/05,"Stem Helps Split Royalties, and Takes Off as Music Distributor",https://www.nytimes.com/2017/02/05/business/media/stem-helps-split-royalties-and-takes-off-as-music-distributor.html,"The company has quickly become a player in the industry, as a new ad for Frank Ocean’s “Blonde” highlights, by attracting independent artists who like to collaborate."
1393,2017/02/05,A Resettlement Mission Upended by the Sweep of a President’s Pen,https://www.nytimes.com/2017/02/05/us/lancaster-refugees-trump-travel-ban.html,"The Church World Service has guided many immigrants to Lancaster, Pa. How can it function, though, after an executive order closing the nation to refugees?"
1460,2017/02/06,‘The Daily’: It All Comes Back to Goldman Sachs,https://www.nytimes.com/2017/02/06/podcasts/the-daily-goldman-sachs-gary-cohn.html,"And to a pivotal figure named Gary D. Cohn, and the role he played in the financial crisis of 2008 and 2009."
851,2017/02/06,"Tech Opposition to Trump Propelled by Employees, Not Executives",https://www.nytimes.com/2017/02/06/business/trump-travel-ban-apple-google-facebook.html,"In a court filing, nearly 100 technology companies cited the “tremendous impact” of immigrants on the United States in opposing the Trump immigration ban."
992,2017/02/07,How to Close a Gender Gap: Let Employees Control Their Schedules,https://www.nytimes.com/2017/02/07/upshot/how-to-close-a-gender-gap-let-employees-control-their-schedules.html,"A new company places women in jobs that give them schedule flexibility, which economists say can make a big difference."
1036,2017/02/07,Everything You Need to Know About This Fashion Season,https://www.nytimes.com/2017/02/07/fashion/fashion-week-new-york-paris-milan-london-what-you-need-to-know.html,"From all the change in New York to the Paris gossip grapevine, the ready-to-wear shows are going to be as topsy-turvy as everyday life."
1764,2017/02/08,German Automakers Step Up to Silicon Valley Challenge,https://www.nytimes.com/2017/02/08/business/germany-bmw-daimler-volkswagen-uber.html,"BMW, Daimler and Volkswagen are striving with increasing urgency to ride the digital wave sweeping the industry, before it rolls over them."
1004,2017/02/08,Newly Surfaced Andrew Wyeth Love Letters Are Headed to Auction,https://www.nytimes.com/2017/02/08/arts/design/andrew-wyeth-love-letters-auction.html,"In the letters, to his girlfriend, Alice Moore, he credits his success partly to her. About 40 of the letters will be offered via online bidding at Skinner."
1548,2017/02/08,"For Volunteers in New York, a Tumultuous Wait for a Refugee Family",https://www.nytimes.com/2017/02/08/nyregion/after-agonizing-delay-kurdish-syrian-refugees-reach-new-york.html,"A task force at Rutgers Presbyterian Church agreed months ago to sponsor a family of Syrian Kurds, only to find them caught up in a maelstrom of presidential politics and court delays."
1292,2017/02/08,Stephen Curry Takes Issue With Under Armour Leader on Trump,https://www.nytimes.com/2017/02/08/sports/basketball/stephen-curry-under-armour-donald-trump-warriors.html,"Curry, one of the company’s highest-paid endorsers, responded a day after Kevin Plank described the president as “a real asset” to the country."
1080,2017/02/08,Trump Assails Nordstrom for ‘Unfairly’ Dropping His Daughter Ivanka’s Line,https://www.nytimes.com/2017/02/08/business/ivanka-trump-nordstrom-tj-maxx.html,The action once again raised ethical questions about the relationship between Mr. Trump’s presidency and his family’s sprawling business interests.
1116,2017/02/09,10 Standout Moments of Raf Simons’s Career,https://www.nytimes.com/2017/02/09/t-magazine/fashion/raf-simons-calvin-klein-debut-expect.html,"The Belgian designer, who debuts at Calvin Klein on Friday, has had a long (and memorable) run in fashion."
1220,2017/02/09,The Women of ‘Girls’ and Protest Whack-a-Mole,https://www.nytimes.com/2017/02/09/podcasts/the-women-of-girls-and-protest-whack-a-mole.html,"Excerpts from a conversation with Lena Dunham, Allison Williams, Zosia Mamet and Jemima Kirke. Plus: the Uber/Lyft conundrum."
1364,2017/02/09,Crowdfunding Helps Rescue Refugees Upended by Travel Ban,https://www.nytimes.com/2017/02/09/us/travel-ban-crowdfunding.html,"Fund-raising sites have let friends, neighbors and total strangers cover the expenses hanging over immigrants left in limbo by President Trump’s travel ban."
1032,2017/02/09,The Lesson of Nordstrom: Do Business With the Trumps or Else,https://www.nytimes.com/2017/02/09/opinion/the-lesson-of-nordstrom-do-business-with-the-trumps-or-else.html,"If the president uses his position to intimidate businesses, the free market is no longer free."
936,2017/02/09,Next Fight for Anthem and Cigna: The Breakup Fee,https://www.nytimes.com/2017/02/09/business/dealbook/next-fight-for-anthem-and-cigna-the-breakup-fee.html,"Anthem is on the hook to pay $1.85 billion to Cigna after a judge blocked their merger, but the health insurers might have to battle it out on the payment."
1385,2017/02/09,Putting Clients Second,https://www.nytimes.com/2017/02/09/opinion/putting-clients-second.html,The Trump administration is moving to overturn a rule whose premise seems unarguable: that investment advisers should put their clients first.
266,2017/02/10,Job for Chocolate and Candy Taster Takes More Than a Sweet Tooth,https://www.nytimes.com/2017/02/10/business/mondolez-tasting-chocolate-oreo-cadbury.html,"The job looks perfect: Sample candy, chocolate and cookies for pay. But Mondelez, which wants to fill two positions, says the work is harder than it appears."
1141,2017/02/10,8 Things You Missed From the First 2 Days of Fashion Week,https://www.nytimes.com/2017/02/10/style/6-things-to-know-from-the-first-2-days-of-fashion-week.html,"Thom Yorke provided the beats at Rag & Bone's party, Raf Simons paid homage to Americana and everyone somehow made it through the snow."
1444,2017/02/10,"At Calvin Klein, Raf Simons Raises the Bar",https://www.nytimes.com/2017/02/10/fashion/calvin-klein-raf-simons-new-york-fashion-week.html,The New York ready-to-wear shows kick off with the most-anticipated debut of the week.
567,2017/02/10,Is Your Financial Adviser Acting in Your Best Interest?,https://www.nytimes.com/2017/02/10/your-money/is-your-financial-adviser-acting-in-your-best-interest.html,"A tale of two abysmally performing mutual funds, one of which investors fled on advice of their adviser, and the other less so."
1612,2017/02/10,Knicks Invent New Type of Loss as Owner Banishes Charles Oakley,https://www.nytimes.com/2017/02/10/sports/basketball/charles-oakley-james-dolan-knicks-madison-square-garden.html,James L. Dolan made the announcement on Friday on ESPN Radio after the former Knicks star was forcibly removed from the arena on Wednesday night.
1614,2017/02/10,Former A.I.G. Executives Reach Settlement in Accounting Fraud Case,https://www.nytimes.com/2017/02/10/business/dealbook/former-aig-executives-reach-settlement-in-accounting-fraud-case.html,"Maurice Greenberg fought New York’s attorney general for over a decade, but he and another A.I.G. executive have settled the case for almost $10 million."
1341,2017/02/10,Shopping Becomes a Political Act in the Trump Era,https://www.nytimes.com/2017/02/10/business/nordstrom-trump.html,"Handbags, dresses and other ordinary items — and where they are bought — have become politicized, turning shopping decisions into acts of protest for the millions."
1428,2017/02/10,A Long Way From Mexico: Company Bets China Has an Appetite for Taco Bell,https://www.nytimes.com/2017/02/10/business/china-kfc-taco-bell.html,"Once dominant, American fast-food chains in China are now looking for answers as they face tougher competition at the high and low ends of the market."
1322,2017/02/11,"Move Over, Wikipedia. Dictionaries Are Hot Again.",https://www.nytimes.com/2017/02/11/fashion/merriam-webster-dictionary-social-media-politics.html,"At a time when many are questioning the definition of common words they thought they understood, dictionaries have made a surprising comeback in the United States."
846,2017/02/11,"Farhad and Mike’s Week in Tech: All Trump, All the Time",https://www.nytimes.com/2017/02/11/technology/farhad-and-mikes-week-in-tech-all-trump-all-the-time.html,The policies of the Trump administration have made more rank-and-file tech employees are willing to talk about — and participate in — politics.
1607,2017/02/11,Retirement Advice in the Trump Era,https://www.nytimes.com/2017/02/11/opinion/retirement-advice-in-the-trump-era.html,"The “fiduciary rule” is solid, and those behind efforts to roll it back will have a difficult time asserting otherwise."
1035,2017/02/11,A Palm Beach Power Hostess Prepares for Trump’s Washington,https://www.nytimes.com/2017/02/11/style/hilary-geary-ross-wilbur-ross-donald-trump-washington-society.html,"With her multibillionaire husband Wilbur Ross likely to be confirmed as commerce secretary, Hilary Geary Ross is ready to play a role in the capital."
1770,2017/02/11,Trump’s Economic Cabinet Is Mostly Bare. This Man Fills the Void.,https://www.nytimes.com/2017/02/11/business/dealbook/trump-economic-cabinet-gary-cohn.html,"With crucial posts still vacant, Gary Cohn, a longtime Goldman Sachs executive, has become the president’s go-to figure on matters related to jobs, business and growth."
772,2017/02/12,Amazon’s Living Lab: Reimagining Retail on Seattle Streets,https://www.nytimes.com/2017/02/12/technology/amazon-seattle-retail.html,The company is putting its stamp on the city with an expanding array of unconventional experiments in bricks-and-mortar sales.
723,2017/02/12,When a Pillar of the Fourth Estate Rests on a Trump-Murdoch Axis,https://www.nytimes.com/2017/02/12/business/media/rupert-murdoch-donald-trump-news-corporation.html,"The ties between Rupert Murdoch and President Trump are undeniably close, writes our media columnist. But what does that mean for the press, and the rest of us?"
114,2017/02/12,"Trudeau and Trump Are to Meet, and Yellen Will Address Congress",https://www.nytimes.com/2017/02/12/business/trudeau-and-trump-are-to-meet-and-yellen-will-address-congress.html,"The Canadian Prime Minister and President Trump will have their first meeting on Monday, and the Fed chairwoman will discuss the bank’s monetary policy."
925,2017/02/13,How Texts From a ‘Hell Prison’ in the Pacific Led to a Powerful Video Diary,https://www.nytimes.com/2017/02/13/insider/manus-island-refugee-australia.html,"Behrouz Boochani would record a handful of videos, then travel from the refugee detention center to a nearby town to connect to the internet and send them."
