,date,headline,link,summary
39,2014/05/28,Daily Report: Google Testing a Completely Driverless Car,https://bits.blogs.nytimes.com/2014/05/28/daily-report-google-testing-a-completely-driverless-car/,Google has begun building a fleet of 100 experimental electric-powered vehicles that will dispense with all the standard controls found in modern automobiles and take the driver out of driving.
93,2014/05/28,Making Twitter Easier to Use,https://bits.blogs.nytimes.com/2014/05/28/making-twitter-easier-to-use/,"Dick Costolo, chief executive of the social network, said Twitter is trying to make its service easier to use, including using a mix of human curation and more sophisticated computer formulas to showcase the most relevant posts for each individual."
46,2014/05/28,Google’s Next Phase in Driverless Cars: No Steering Wheel or Brake Pedals,https://www.nytimes.com/2014/05/28/technology/googles-next-phase-in-driverless-cars-no-brakes-or-steering-wheel.html,Google has begun building a fleet of 100 experimental electric-powered vehicles that will dispense with all the standard controls found in modern automobiles and take the driver out of driving.
71,2014/05/28,New Curbs Sought on the Personal Data Industry,https://www.nytimes.com/2014/05/28/technology/ftc-urges-legislation-to-shed-more-light-on-data-collection.html,"The Federal Trade Commission said consumers should have access to information collected about them, along with the ability to suppress information."
106,2014/05/29,Apple to Pay $3 Billion to Buy Beats,https://www.nytimes.com/2014/05/29/technology/apple-confirms-its-3-billion-deal-for-beats-electronics.html,"In a move that will help Apple play catch-up with rivals that offer subscription-based music services, the company will offer both Beats’s streaming music service and its premium headphones."
125,2014/05/29,"Jimmy Iovine, a Master of Beats, Lends Apple a Skilled Ear",https://www.nytimes.com/2014/05/29/business/media/jimmy-iovine-a-master-of-beats-lends-apple-a-skilled-ear.html,"Apple is betting that Mr. Iovine’s four decades in the recording industry, his knack for trend-spotting and his credibility with artists will help rejuvenate its music business."
70,2014/05/29,Dish Network Says It Will Accept Bitcoin,https://www.nytimes.com/2014/05/29/dish-network-to-accept-bitcoin/,The satellite television provider announced on Thursday that it will begin allowing its 14 million subscribers to pay in Bitcoin later this year.
104,2014/05/29,Finally Breaking Up the Cable Bundles,https://www.nytimes.com/2014/05/29/technology/personaltech/finally-breaking-up-the-cable-bundles.html,"Trying to recalculate monthly bills by paying separate companies for high-speed Internet, cable television and landline telephone service."
85,2014/05/29,"Daily Report: In Buying Beats, Apple Bets on a Founder’s Skilled Ear",https://bits.blogs.nytimes.com/2014/05/29/daily-report-in-buying-beats-apple-bets-on-a-founders-skilled-ear/,"In acquiring Beats Electronics, Apple is hoping that its co-founder, Jimmy Iovine, will help Apple rejuvenate its music business nearly three years after the death of Steven P. Jobs."
131,2014/05/29,Cyberespionage Attacks Tied to Hackers in Iran,https://bits.blogs.nytimes.com/2014/05/29/cyberespionage-attacks-tied-to-hackers-in-iran/,"A series of attacks against American defense contractors, lobbyists, journalists and congressional personnel has been traced to hackers in Iran."
44,2014/05/29,Removing the Ads From a Kindle,https://www.nytimes.com/2014/05/29/technology/personaltech/removing-the-ads-from-a-kindle.html,"Plus, how to use use your 4G iPad as a mobile hot spot."
55,2014/05/29,"If You Work in Silicon Valley, Odds Are You’re a Man",https://www.nytimes.com/2014/05/29/upshot/if-you-work-in-silicon-valley-odds-are-youre-a-white-man.html,Google releases figures showing just 17 percent of its technical employees are women and just 1 percent are black.
112,2014/05/29,A New Irreverent Spirit at Apple,https://bits.blogs.nytimes.com/2014/05/29/apples-new-master-of-irreverence-jimmy-iovine/,"The music impresario Jimmy Iovine, who agreed to sell Beats Electronics to Apple for $3 billion on Wednesday, pulled no punches as he talked about his new employer, the competition and Silicon Valley."
66,2014/05/29,Samsung Stakes Claim on Wearable Tech That Monitors Health,https://bits.blogs.nytimes.com/2014/05/29/samsung-stakes-claim-on-wearable-tech-that-monitors-health/,"Samsung’s innovation and strategy team announced plans for an “open” platform so that developers, medical professionals and hardware makers can push forward the idea of “intelligent digital health.”"
54,2014/05/29,The Flaws of Apple’s iMessage,https://bits.blogs.nytimes.com/2014/05/29/the-flaws-of-apples-imessage/,"Because the service comes installed on iPhones, and in my experience is turned on by default, it is hugely popular. But there are many good alternative services."
29,2014/05/29,Clippers Draw Some High-Profile Offers,https://www.nytimes.com/2014/05/29/sports/basketball/letter-contradicts-donald-sterlings-vow-to-fight-sale-of-clippers.html,"Although there was no confirmation of the number of bidding groups, a person involved in the proposed sale said that Rochelle Sterling hopes to choose a buyer over the weekend."
127,2014/05/29,Hachette and Amazon Dig In for a Long Fight Over Contract Terms,https://www.nytimes.com/2014/05/29/technology/amazon-hachette-book-publisher-dispute.html,"The only thing the publisher and the retailer agree on is that there is no deal in sight, and 5,000 Hachette books are caught in the middle."
14,2014/05/30,"Underscoring Success of Live TV, Music Specials Will Make a Return",https://www.nytimes.com/2014/05/30/business/media/underscoring-success-of-live-tv-music-specials-will-make-a-return.html,"The revival dovetails with a growing programming trend: a desire among networks to give viewers more shows deemed worth watching — and discussing on social media — in real time, making it likelier that commercials will be seen."
53,2014/05/30,Daily Report: Hurdles to Privacy on Web in Europe,https://bits.blogs.nytimes.com/2014/05/30/daily-report-hurdles-to-privacy-on-web-in-europe/,"A recent court ruling in Europe has accelerated requests that Internet search companies expunge individuals’ data. Once a contested item is online, however, the genie will not easily go back in the bottle."
72,2014/05/30,Right to Be Forgotten? Not That Easy,https://www.nytimes.com/2014/05/30/business/international/on-the-internet-the-right-to-forget-vs-the-right-to-know.html,"A recent court ruling in Europe has accelerated requests that Internet search companies remove links to individuals’ data. Once a contested item is online, however, the genie will not easily go back in the bottle."
49,2014/05/30,More Emergency Centers Are Gearing Up to Receive 911 Texts,https://www.nytimes.com/2014/05/30/us/more-emergency-centers-are-gearing-up-to-receive-911-texts.html,Texas is at the forefront of a national initiative to modernize the call system to accommodate situations in which a voice call may be risky or impossible and to be more accessible to the deaf community.
38,2014/05/30,"Brad Jefferson of Animoto, on Knowing Your Company’s Heartbeat",https://www.nytimes.com/2014/05/30/business/brad-jefferson-of-animoto-on-knowing-your-companys-heartbeat.html,"The chief executive of Animoto, a video slide show service, answers all the questions that his employees submit anonymously each month — even the hard ones."
119,2014/05/30,Bias Claims for Insurers in Coverage of H.I.V.,https://www.nytimes.com/2014/05/30/business/four-insurers-accused-of-discriminating-against-people-with-hiv.html,"Two health care advocacy groups filed a complaint against CoventryOne, Cigna, Humana and Preferred Medical Plan for what they said was discrimination in Florida."
94,2014/05/30,What the Beats Deal Says About Apple: It Loves Tastemakers,https://bits.blogs.nytimes.com/2014/05/30/what-the-beats-deal-says-about-apple-it-loves-tastemakers/,"If Silicon Valley is bent on replacing human judgment with algorithmic efficiency, the Beats deal shows that Apple wants to hold itself up as the one tech company that stands proudly against that trend."
103,2014/05/30,Keeping Windows 8.1 Up to Date,https://www.nytimes.com/2014/05/30/technology/personaltech/keeping-windows-8-1-up-to-date.html,"Plus, how to move from Windows XP to a Mac."
37,2014/05/30,Fine Legal Point Poses Challenge to Appraisal Rights,https://www.nytimes.com/2014/05/30/fine-legal-point-poses-challenge-to-appraisal-rights/,"The question of whether a shareholder can prove it did not vote in favor of a takeover before asserting its appraisal rights could present a significant hurdle to hedge funds that have adopted such rights as a business strategy, Steven M. Davidoff writes in the Deal Professor column."
73,2014/05/30,Malcolm Gladwell ‘Surprised’ to Become an Amazon Bargaining Chip,https://bits.blogs.nytimes.com/2014/05/30/gladwell-on-amazon-its-sort-of-heartbreaking-when-your-partner-turns-on-you/,One of Hachette’s biggest authors says he wonders if writers need to act together to protest the retailer’s behavior in its dispute with his publisher.
120,2014/05/30,Why Is Amazon Squeezing Hachette? Maybe It Really Needs the Money,https://bits.blogs.nytimes.com/2014/05/30/why-is-amazon-squeezing-hachette-maybe-it-really-needs-the-money/,"Amazon used to take margin from its suppliers so it could sell things more cheaply. Now, it needs the margin for itself."
67,2014/05/30,Director of ‘Happy in Tehran’ Video Is Reportedly Freed,https://www.nytimes.com/2014/05/30/world/middleeast/director-of-happy-in-tehran-video-is-reportedly-freed.html,"The director of a YouTube remix that offended Iran’s judiciary was released on bail Thursday, a rights group said."
101,2014/05/31,Iran Hackers Dangle a Familiar Name to Fish for Data,https://www.nytimes.com/2014/05/31/world/middleeast/iran-hackers-dangle-a-familiar-name-to-fish-for-data.html,"Hackers seeking information about Washington’s elite posed as John R. Bolton, a former American ambassador to the United Nations, to friend online users through social media."
118,2014/06/01,"Urban Renewal, No Bulldozer",https://www.nytimes.com/2014/06/01/arts/design/san-francisco-repurposes-the-old-for-the-future.html,"Businesses are planting themselves in existing buildings in San Francisco, while residents are getting little relief from the high housing costs, and new construction faces obstructions."
31,2014/06/01,All Paths Lead to Illumination,https://www.nytimes.com/2014/06/01/nyregion/a-review-of-mastering-light-from-the-natural-to-the-artificial-in-poughkeepsie.html,"“Mastering Light: From the Natural to the Artificial” at Vassar’s Frances Lehman Loeb Art Center in Poughkeepsie is a quirky, thought-provoking show that divides its subject into three sometimes overlapping areas."
80,2014/06/01,Mapping Apps Follow the Crowd,https://www.nytimes.com/2014/06/01/automobiles/mapping-apps-follow-the-crowd.html,"Telenav, a navigation services company, is switching from maps that are professionally produced to ones that are crowdsourced, using data and updates provided by contributors."
