,date,headline,link,summary
217,2014/03/19,"Cheese Curds, a Riff on Cronuts, a Paris Ham and More",https://www.nytimes.com/2014/03/19/dining/cheese-curds-a-riff-on-cronuts-a-paris-ham-and-more.html,Recommendations for the week of March 18.
92,2014/03/19,The Billion Dollar Bracket Challenge Is Really a Hundred Thousand Dollar Lottery,https://takingnote.blogs.nytimes.com/2014/03/19/the-billion-dollar-bracket-challenge-is-really-a-hundred-thousand-dollar-lottery/,"The mathematical odds of winning the Grand Prize are 1:9,223,372,036,854,775,808."
126,2014/03/19,"After Derivatives, a Bet on Crispy Seaweed",https://www.nytimes.com/2014/03/19/after-derivatives-betting-on-crispy-seaweed-chips/,"Robert Mock, who once sold financial derivatives at Bank of America Merrill Lynch, has found new success making seaweed chips. The venture has attracted backers including Jerry Yang, a co-founder of Yahoo."
227,2014/03/19,In Defense of Anonymous Political Giving,https://www.nytimes.com/2014/03/19/opinion/edsall-in-defense-of-anonymous-political-giving.html,The Koch brothers’ historical case for secret donations.
52,2014/03/20,Apple After Jobs: Pretty Much the Same as Ever,https://bits.blogs.nytimes.com/2014/03/20/apple-after-jobs-pretty-much-the-same-as-ever/,A new book on Apple’s state after Steve Jobs paints a dire picture of a company losing its way. Farhad Manjoo disagrees.
194,2014/03/20,An Unrewarded Leap of Faith,https://www.nytimes.com/2014/03/20/fashion/Flight-23-shopping-new-york-city-jordans-shoes.html,"Shopping at Flight 23 in Midtown Manhattan, where the best Jordans are on the customers."
116,2014/03/20,"Facebook’s Hack, a Language of Tech Competition",https://bits.blogs.nytimes.com/2014/03/20/facebooks-hack-a-language-of-tech-competition/,"The world’s biggest social network introduced on Thursday a new open-source software language that is focused on helping to build interactive web pages. Besides winning geek credibility, it’s the latest version of a decades-old effort in tech to win over as many developers as possible."
240,2014/03/20,Shopping Openings and Events for the Week of March 19,https://www.nytimes.com/2014/03/20/fashion/new-york-city-shopping-openings-and-events-for-the-week-of-march-19.html,A Topshop x Adidas capsule collection in store now; the Nike + R.T. Air Force 1 collection lands at Dover Street Market on Friday and more.
122,2014/03/20,Turning a Tablet Into a Child’s Interactive TV,https://www.nytimes.com/2014/03/20/technology/personaltech/from-toytalk-a-tablet-that-lets-children-control-their-tv-viewing.html,"The Winston Show, which is an iPad-only program, is an example of the new content types that are possible when a TV is also a hand-held computer."
7,2014/03/20,Golden Gate Buys Stake in Parent of Ann Taylor,https://www.nytimes.com/2014/03/20/golden-gate-buys-stake-in-parent-of-ann-taylor/,"Golden Gate, the private equity firm, disclosed in a regulatory filing on Thursday that it had purchased a roughly 9.5 percent stake in Ann Inc., with the aim of bolstering the retailer’s stock price."
37,2014/03/20,Breaking From Donor Dependence,https://www.nytimes.com/2014/03/20/arts/artsspecial/breaking-from-donor-dependence.html,Institutions grapple with expanding their profit-making activities as government and private financing dwindles.
204,2014/03/20,$80 Million for 6 Weeks for Cable Chief,https://www.nytimes.com/2014/03/20/for-time-warner-cable-executives-billowing-golden-parachutes/,Robert D. Marcus will receive a severance payment that amounts to more than $1 million a day for the six weeks he ran Time Warner Cable before agreeing to sell.
133,2014/03/20,What Does $1.8 Billion Get You in Men’s Wear?,https://www.nytimes.com/2014/03/20/fashion/Mens-Wearhouse-Jos-A-bank-shopping.html,"The newly combined Men’s Wearhouse/Jos. A. Bank will trail only Macy’s, Kohl’s and J. C. Penney for volume in men’s wear, according to WWD."
190,2014/03/21,Premiums Rise for Long-Term Care Insurance. Keep It or Drop It?,https://www.nytimes.com/2014/03/21/your-money/premiums-rise-for-long-term-care-insurance-keep-it-or-drop-it.html,"Even if the premium goes up, it may be worthwhile to keep a current policy, some specialists say."
109,2014/03/21,Why Android Wear Is the Beginning of the Wearable Devices Era,https://bits.blogs.nytimes.com/2014/03/21/why-android-wear-is-the-beginning-of-the-wearable-devices-era/,"Every hardware platform needs software to be successful. By giving manufacturers a known operating system to work with, Google’s Android Wear will jump-start the wearables industry, says Molly Wood."
1,2014/03/21,Art Book Depicting Murder Inc. Is No Steal,https://www.nytimes.com/2014/03/21/nyregion/the-brownsville-boys-jewish-gangsters-of-murder-inc-book-to-cost-4200.html,"The collector’s edition of “The Brownsville Boys: Jewish Gangsters of Murder, Inc.” is lavishly illustrated, printed and boxed, and sells for $4,200 per copy."
2,2014/03/21,Time Inc. May Join Media Exodus to Lower Manhattan,https://www.nytimes.com/2014/03/21/nyregion/time-inc-nears-a-deal-to-move-joining-a-media-exodus-to-lower-manhattan.html,"After being a fixture in Midtown Manhattan for more than seven decades, the magazine publisher is considering relocating to an area that has become a lower-cost alternative for corporations."
18,2014/03/21,Douglas Merrill of ZestFinance: Steer Clear of What You Can’t Measure,https://www.nytimes.com/2014/03/21/business/douglas-merrill-of-zestfinance-steer-clear-of-what-you-cant-measure.html,The chief of a big-data company says using processes that can’t be quantified often means you aren’t asking the right questions.
197,2014/03/21,U.S. and California Officials Enter Battle Over Facebook Privacy Settlement,https://bits.blogs.nytimes.com/2014/03/21/u-s-and-california-officials-enter-battle-over-facebook-privacy-settlement/,Critics say a judge erred when he accepted Facebook’s argument that a federal privacy law for children under 13 preempted state protections for older children.
164,2014/03/21,Another Price Cut for the Xbox One,https://bits.blogs.nytimes.com/2014/03/21/another-price-cut-for-the-xbox-one/,"On Friday, Walmart and Best Buy began offering a bundle of Microsoft’s Xbox One and Titanfall, a high-profile science fiction shooter game, for $450, a $50 price cut on the bundle."
174,2014/03/21,"With a French Accent, a Soap Brand Tells a Tale of Well-Scrubbed Lovers",https://www.nytimes.com/2014/03/21/business/media/with-a-french-accent-a-soap-brand-tells-a-tale-of-well-scrubbed-lovers.html,"Method is introducing a series of quirky commercials that depict a young couple meeting at a party, falling in love, moving in together and having a baby."
200,2014/03/21,Joining the 11-Digit Valuation Club,https://www.nytimes.com/2014/03/21/morning-agenda-joining-the-11-digit-valuation-club/,The couch-surfing company Airbnb is close to raising a funding round that would give it a valuation of more than $10 billion. | The chief executive of Time Warner Cable is set to receive nearly $80 million in severance payment. | The Fed released the results of its latest stress test — and all but one of the 30 banks under review passed. | Dominique Strauss-Kahn is seeking to start a $2 billion hedge fund.
24,2014/03/22,Sit Back and Soak Awhile in Natural Springs,https://intransit.blogs.nytimes.com/2014/03/22/sit-back-and-soak-awhile-in-natural-springs/,An ancient practice is revived by travelers interested in natural treatments.
100,2014/03/22,Creativity vs. Quants,https://www.nytimes.com/2014/03/22/opinion/egan-creativity-vs-quants.html,"To be original, you need messiness and magic, serendipity and insanity."
186,2014/03/22,U.S. Pushes for Wider Recall of Graco Car Seats,https://www.nytimes.com/2014/03/22/automobiles/us-pushes-for-wider-recall-of-graco-car-seats.html,"When it issued a recall of 3.8 million child safety seats this year, the company resisted recalling an additional 1.8 million."
103,2014/03/22,"Following Great Score With Good One, Scott Extends Lead",https://www.nytimes.com/2014/03/22/sports/golf/adam-scott-follows-great-score-with-good-one-to-extend-lead.html,"Bucking a trend on the PGA Tour this season, Adam Scott didn’t experience a major drop-off after his low score of 62 on Thursday, posting a four-under 68 in the second round Friday."
224,2014/03/22,Lawmakers Attack Cost of New Hepatitis Drug,https://www.nytimes.com/2014/03/22/business/lawmakers-attack-cost-of-new-hepatitis-drug.html,"The congressmen’s inquiry about the $84,000 price for a 12-week course of treatment spurred a sell-off in biotechnology stocks on Friday."
34,2014/03/22,Health Care Shares Pull Down Indexes,https://www.nytimes.com/2014/03/22/business/daily-stock-market-activity.html,Questions about a hepatitis C drug affects biotech companies.
69,2014/03/22,Third-Party Hotel Booking Sites Can Mislead Consumers,https://www.nytimes.com/2014/03/22/your-money/third-party-hotel-booking-sites-can-mislead-consumers.html,"Instead of finding a good deal, many travelers wind up feeling duped when reserving a room on a website that only looks as if it is owned by a hotel."
243,2014/03/23,The Stone Unturned: Credit Ratings,https://www.nytimes.com/2014/03/23/business/the-stone-unturned-credit-ratings.html,"As its proposed rules languish, some investor advocates want the Securities and Exchange Commission to start over — and to get tougher."
50,2014/03/23,Real Estate Developers in Movieland,https://www.nytimes.com/2014/03/23/realestate/real-estate-developers-in-movieland.html,Some whose day job is putting up buildings have also found their way into show business. And it’s a labor of love.
57,2014/03/23,"Today’s Girls Love Pink Bows as Playthings, but These Shoot",https://www.nytimes.com/2014/03/23/business/todays-girls-love-pink-bows-as-playthings-but-these-shoot.html,"Inspired by a succession of female warrior heroes, toy makers are marketing a more aggressive line of playthings for girls — even as the industry clings to every shade of pink."
169,2014/03/23,Name-Calling in the Virtual Playground,https://bits.blogs.nytimes.com/2014/03/23/name-calling-in-the-virtual-playground/,Secret is the latest social media platform to confront the tendency of anonymous chat to provide cover for bad behavior.
140,2014/03/24,An App Where Nobody Knows Your Name,https://www.nytimes.com/2014/03/24/opinion/an-app-where-nobody-knows-your-name.html,"“The opportunity to post anonymously on Secret seems an invitation to negativity,” a reader writes."
239,2014/03/24,Banks Urge Young Analysts to Do the Unthinkable: Take Weekends Off,https://www.nytimes.com/2014/03/24/nyregion/banks-urge-young-analysts-to-do-the-unthinkable-take-the-weekends-off.html,"In an industry in which grueling schedules are embraced as a badge of honor, efforts to promote work-life balance reflect a significant change in corporate culture."
150,2014/03/24,Cisco Bets a Billion on the Cloud,https://bits.blogs.nytimes.com/2014/03/24/cisco-bets-a-billion-on-the-cloud/,"The biggest name in computer networking announces a plan to link public and private cloud computing systems in a secure and reliable system, the “Intercloud.”"
173,2014/03/24,Experts Offer Their Guidance for Dealing With Online Bullying,https://bits.blogs.nytimes.com/2014/03/24/experts-offer-their-guidance-to-cope-with-online-bullying/,A number of potentially harmful effects can result from anonymous content online. Specialists and social start-ups share unique insight into the pros and cons of anonymous online sharing.
44,2014/03/24,Risks Abound as Reporters Play in Traffic,https://www.nytimes.com/2014/03/24/business/media/risks-abound-as-reporters-play-in-traffic.html,"The availability of ready metrics on content is not only changing the way news organizations compensate their employees, but will have a significant effect on the news itself."
74,2014/03/25,Apple Invites Parents to Review In-App Purchases,https://parenting.blogs.nytimes.com/2014/03/25/apple-invites-parents-to-review-in-app-purchases/,"If your children have been making in-app purchases on iTunes without your permission, Apple is offering a refund."
21,2014/03/25,Today in Small Business: The Failure Fetish,https://boss.blogs.nytimes.com/2014/03/25/today-in-small-business-the-failure-fetish/,How to start a delivery business. How to find happiness after selling a business. Is a third of all Internet traffic bogus?
31,2014/03/25,The Women on the Sidelines of the Hobby Lobby Case,https://takingnote.blogs.nytimes.com/2014/03/25/the-women-on-the-sidelines-of-the-hobby-lobby-case/,Business owners aren’t the only people who will be affected by the Supreme Court’s take on the contraceptive mandate.
151,2014/03/25,"In Two Settlements, Money for Apple and Amazon Customers",https://bits.blogs.nytimes.com/2014/03/25/in-two-settlements-money-for-apple-and-amazon-customers/,Apple and Amazon customers on Tuesday were notified of opportunities to get some money back as a result of two separate legal settlements with the government. Both cases revolve around Apple.
207,2014/03/25,ABC News President to Be Top Disney TV Executive,https://www.nytimes.com/2014/03/25/business/media/ben-sherwood-of-abc-news-is-named-top-disney-tv-executive.html,"Ben Sherwood, who will head the ABC Television Group, has drawn attention for his work at the news operation, notably the rise of “Good Morning America.”"
154,2014/03/25,Easel Turns Tablet Into a Workstation,https://www.nytimes.com/2014/03/25/technology/personaltech/review-nimblstand-tablet-easel.html,"The creators of Nimblstand incorporated a design aspect they call gravity nesting, which allows almost any tablet to fit in the stand."
180,2014/03/25,"LiveSafe, a Safety App, Raises $6.5 Million From IAC and Others; Diller Joins Board",https://www.nytimes.com/2014/03/25/livesafe-a-mobile-safety-app-raises-6-5-million-from-iac-and-others/,"The company announced on Tuesday that it had raised $6.5 million in financing in a round led by the Internet conglomerate IAC. Barry Diller’s, IAC’s chairman, will join LiveSafe’s board."
127,2014/03/26,Facebook’s Alternate Financial Reality,https://www.nytimes.com/2014/03/26/facebooks-alternate-financial-reality/,"A $165 billion market value and dual-class share structure allow Mark Zuckerberg to spend the company’s stock on little more than a hunch, writes Richard Beales of Reuters Breakingviews."
119,2014/03/26,Early Supporters of Oculus VR Denounce Facebook Buyout,https://bits.blogs.nytimes.com/2014/03/26/early-supporters-of-oculus-vr-unnerved-upset-by-facebook-purchase/,"Some were upset over the social media giant’s plan to purchase Oculus VR, maker of virtual reality headsets, and took to Twitter and Reddit to vent their frustrations."
96,2014/03/26,What Would You Ask Michael Fertik About Your Online Reputation?,https://boss.blogs.nytimes.com/2014/03/26/what-would-you-ask-michael-fertik-about-your-online-reputation/,Here’s your chance to ask (almost) anything about dealing with Yelp and other review sites.
22,2014/03/26,Minecraft Maker Won’t Work With a Facebook-Owned Oculus VR,https://bits.blogs.nytimes.com/2014/03/26/gamers-and-makers-voice-frustration-with-facebook-acquisition/,"Like many game makers who were considering working with the Oculus virtual-reality tools, Markus Persson is uncomfortable with Facebook’s ad-driven business model."
192,2014/03/26,Citigroup Fails Federal Reserve’s Stress Test for 2nd Time in 3 Years,https://www.nytimes.com/2014/03/26/fed-rebuffs-citigroup-on-capital-plans/,The Fed’s decision is prompting calls for another round of changes at the top of the bank’s management and questions over whether the bank should break up its far-flung operations.
13,2014/03/26,Can’t Play by the Rules? It’s Fine by Mr. Monopoly,https://www.nytimes.com/2014/03/26/business/monopoly-fans-invited-to-rethink-rulebook.html,"Hasbro, the maker of the classic board game, will ask players to debate their favorite “house rules” for inclusion as options in a future edition."
121,2014/03/27,Why Movie Streaming Sites So Fail to Satisfy,https://www.nytimes.com/2014/03/27/technology/personaltech/why-movie-streaming-services-are-unsatisfying-and-will-stay-so.html,"At least until the end of this decade, viewers will have to navigate between multiple streaming services to watch the movie or TV show they want."
8,2014/03/27,Adviser on Dell Buyout Questions a Tumultuous Process,https://www.nytimes.com/2014/03/27/an-adviser-on-the-dell-buyout-questions-what-could-have-been-done-differently/,"At the Tulane Corporate Law Institute, an adviser on Dell’s leveraged buyout wondered whether the myriad steps the board took to ensure the integrity of the sales process could have been improved."
17,2014/03/27,Dealing With Online Reviews: ‘You Can’t Take This Personally’,https://www.nytimes.com/2014/03/27/business/smallbusiness/dealing-with-online-reviews-you-cant-take-this-personally.html,The founder of a company that helps people and businesses control their online reputations recommends acknowledging errors.
182,2014/03/27,A Wealth of Ideas,https://www.nytimes.com/2014/03/27/fashion/Michael-Walrath-Right-Media-Founder-Wealth-of-Ideas-.html,"Michael Walrath, the tech and night-life mogul, had made enough money by his early 30s to settle in. But he’s not the retiring type, and he has myriad projects to prove it."
231,2014/03/27,China’s Shadow Banking Malaise,https://economix.blogs.nytimes.com/2014/03/27/chinas-shadow-banking-malaise/,"A severe slowdown in China’s economy would have a modest ripple effect, particularly on global commodity prices, but would not provoke a global crisis, two economists write."
47,2014/03/27,"Smartphones, the Disappointing Miracle",https://bits.blogs.nytimes.com/2014/03/27/smartphones-the-disappointing-miracle/,"People from Earth’s most remote corners have something in common: They all download apps, interacting with the mobile Internet billions of times a day, and they all feel frustration at slow loads and app crashes. A new report shows how much work it is, getting us to this level of frustration."
90,2014/03/27,Failing Stress Test Is Another Stumble for Citigroup,https://www.nytimes.com/2014/03/27/failing-stress-test-is-another-stumble-for-citigroup/,The broader question hanging over Citigroup is one that has dogged it since it was created nearly two decades ago: that the bank may be simply too big to manage.
35,2014/03/27,Today in Small Business: Can Bookstores Survive?,https://boss.blogs.nytimes.com/2014/03/27/today-in-small-business-can-bookstores-survive/,Etsy collaborates with the enemy. Connecticut raises its minimum wage. How to find the right accountant for your business.
157,2014/03/27,Messaging Services Bypass the Old SMS Route,https://www.nytimes.com/2014/03/27/technology/personaltech/messaging-services-bypass-the-old-sms-route.html,"A number of alternatives to SMS allow longer messages, group chats and the ability to add photos or videos."
73,2014/03/27,Crowdfunders of the Maker of Oculus Rift Denounce a Facebook Buyout,https://www.nytimes.com/2014/03/27/technology/crowdfunders-of-the-maker-of-oculus-rift-denounce-a-facebook-buyout.html,"Oculus VR got its start on Kickstarter, raising $2.4 million. Some donors want their money back."
6,2014/03/27,Consortium Wants Standards for ‘Internet of Things’,https://bits.blogs.nytimes.com/2014/03/27/consortium-wants-standards-for-internet-of-things/,"Some of the largest multinational corporations have formed a global standards body intended to speed the connection of factories, oil rigs and hospitals to intricate systems of sensors and computers."
104,2014/03/27,Creator of a Virtual Reality Sensation,https://www.nytimes.com/2014/03/27/technology/creator-of-a-virtual-reality-sensation.html,Facebook’s acquisition of Oculus VR has brought attention to its co-founder Palmer Luckey and the Southern California tech scene where his company took root.
64,2014/03/27,"Etsy, the Makeup Counterculture",https://www.nytimes.com/2014/03/27/fashion/etsy-the-makeup-counterculture.html,Rejecting the big chain stores in favor of Etsy for natural products that are made at home and that sell for less.
94,2014/03/27,Isabel Toledo and Lane Bryant See a Plus in Collaboration,https://www.nytimes.com/2014/03/27/fashion/isabel-toledo-and-lane-bryant-see-a-plus-in-collaboration.html,The store and designer try to bring flair to larger sizes.
155,2014/03/28,A New Facebook Lab Is Intent on Delivering Internet Access by Drone,https://www.nytimes.com/2014/03/28/technology/a-new-facebook-lab-is-intent-on-delivering-internet-access-by-drone.html,Facebook is creating a laboratory to devise a way to provide web access from solar-powered drones or perhaps other “connectivity aircraft.”
128,2014/03/28,"At Big on Mars, Trying to Get a Handle on Tomorrow’s Tech",https://www.nytimes.com/2014/03/28/business/media/at-big-on-mars-trying-to-get-a-handle-on-tomorrows-tech.html,Digitaria is starting a unit devoted to mobile technology in another example of efforts on Madison Avenue to keep up with the fast-changing landscape.
82,2014/03/28,Dealing With Unwanted Windows Updates,https://www.nytimes.com/2014/03/28/technology/personaltech/dealing-with-unwanted-windows-updates.html,"Plus, adding shortcuts to Mac programs not on the dock."
136,2014/03/28,Memphis and Cardinals Partner in Deal to Revitalize Ballpark,https://www.nytimes.com/2014/03/28/memphis-and-cardinals-partner-in-deal-to-revitalize-ballpark/,"The City of Memphis tapped the municipal bond market to finance the $19 million purchase of AutoZone Park, the home of the Memphis Redbirds, a farm team that the St. Louis Cardinals will buy for $15 million."
233,2014/03/28,Google Flu Trends: The Limits of Big Data,https://bits.blogs.nytimes.com/2014/03/28/google-flu-trends-the-limits-of-big-data/,"Two recent research papers, examining Google Flu Trends, offer a critique of big-data analysis."
111,2014/03/28,"Microsoft to Offer Office for iPad, Maybe a Bit Late",https://www.nytimes.com/2014/03/28/technology/microsofts-office-suite-for-ipad.html,"Owners of Apple’s tablet will be able to use Word, Excel, PowerPoint and other popular productivity tools — but they still may not want to."
45,2014/03/28,The Tech Bubble’s Silver Lining: Cheap Services for Everyone,https://bits.blogs.nytimes.com/2014/03/28/the-tech-bubbles-silver-lining-cheap-services-for-everyone/,Box’s documents filed for its initial public offering show that the cloud-storage firm is losing a lot of money. There’s another way to say this: It’s giving customers lots of services for free. And it’s not alone.
187,2014/03/29,Seeking a Town on the Border of Fiction and Reality,https://www.nytimes.com/2014/03/29/nyregion/in-search-of-agloe-ny-a-town-on-the-border-of-fiction-and-reality.html,"Google recently removed Agloe, N.Y., in the western Catskills, from its map, but how it endured on area charts for so long remains a cartographic mystery."
134,2014/03/29,Women Charge Bias and Harassment in Suit Against Sterling Jewelers,https://www.nytimes.com/2014/03/29/business/women-charge-bias-and-harassment-in-suit-against-sterling-jewelers.html,"A group of 12 women said they were paid less than men and were sexually harassed while working for the company’s stores, Jared and Kay Jewelers."
118,2014/03/29,U.S. Judge Dismisses Lawsuit Against Chinese Search Engine,https://www.nytimes.com/2014/03/29/business/us-judge-dismisses-lawsuit-against-chinese-search-engine.html,Eight writers and video producers had accused Baidu of violating their right to free speech by blocking users in the United States from viewing their pro-democracy material.
54,2014/03/29,Did Facebook Buy Virtual Reality Too Soon?,https://bits.blogs.nytimes.com/2014/03/29/did-facebook-buy-virtual-reality-too-soon/,Facebook has an impeccable sense of introducing products that are right for right now. But did the company make a bet on the future that might not pan out with its acquisition of Oculus VR?
160,2014/03/29,A Vision Beyond Cable for Comcast After Merger,https://www.nytimes.com/2014/03/29/business/a-vision-for-comcast-in-a-post-merger-world.html,"If its acquisition of Time Warner Cable is approved, Comcast will become much more than a regional cable company, says its chief executive, Brian Roberts."
99,2014/03/29,Cloud Computing’s Watershed Week,https://bits.blogs.nytimes.com/2014/03/29/cloud-computings-watershed-week/,"Moves by older incumbents and young giants show that 2014 is the year computing everywhere comes into its own. Now it’s time for big development. Looking for the next frontier? There was plenty of that, too."
226,2014/03/29,Wheelies: The Euro-Buick Edition,https://www.nytimes.com/2014/03/29/automobiles/wheelies-the-euro-buick-edition.html,G.M. will build Buicks at its Opel plant in Germany; Ford will build its new V6 Ecoboost truck engines at its factory in Ohio.
236,2014/03/29,Head of Intelligence Panel in House Says He’ll Retire to Take Job as Radio Host,https://www.nytimes.com/2014/03/29/us/politics/representative-mike-rogers-will-not-run-again.html,Representative Mike Rogers of Michigan made the announcement just days after proposing an ambitious overhaul of electronic surveillance programs.
49,2014/03/30,"Tom Erickson of Acquia, on the Philosophy of ‘Ready, Fire, Aim’",https://www.nytimes.com/2014/03/30/business/tom-erickson-of-acquia-on-the-philosophy-of-ready-fire-aim.html,"The chief executive of an open-source software company says he wants to hire people “who are going to jump in and own their work, who are going to risk something, and risk failing.”"
