,link,headline,summary,date
474,http://maplewood.blogs.nytimes.com/2009/09/10/get-out-singing-open-mic-and-art/,"Get Out: Singing, Open Mic and Art","Forget what the poet said about April being the cruelest month. For a lot of us it's September that's the real drag. With the passing of Labor Day, the joy of summer will soon become a distant memory, and the drudgery of work and school and less sunshine will become the new reality. (Sorry for the melodrama, just thought it fit in with the poetry reference).",2009/09/10
428,http://fifthdown.blogs.nytimes.com/2009/09/14/giants-open-thread-the-return-of-umenyiora/,Giants Open Thread: The Return of Umenyiora,How would the Giants' 2008 season have ended if Plaxico Burress had been available? A lot of ink was spilled on that one.,2009/09/14
470,http://thecaucus.blogs.nytimes.com/2009/09/17/early-word-fine-print/,Early Word: Fine Print,"The Senate Finance Committee is poised to begin voting next week on the health care legislation unveiled by the committee's chairman, Senator Max Baucus, of Montana.",2009/09/17
349,http://dealbook.nytimes.com/2009/09/17/is-vivendi-planning-an-ipo-of-its-nbc-universal-stake/,Is Vivendi Planning an I.P.O. of Its NBC Universal Stake?,Is Vivendi mulling an initial public offering for its 20 percent stake in NBC Universal?,2009/09/17
258,https://www.nytimes.com/2009/09/19/technology/internet/19net.html,F.C.C. Seeks to Protect Free Flow of Internet Data,The proposal would expand and formalize rules meant to keep Internet providers from discriminating against certain content flowing over their networks.,2009/09/19
305,http://dealbook.nytimes.com/2009/09/21/would-vivendis-nbc-stake-be-a-perfect-target-for-malone/,Is Vivendi's NBC Stake a Perfect Target for Malone?,"As speculation continues whether and how Vivendi would divest itself of the 20 percent stake in holds in General Electric's NBC Universal, The New York Post has thrown John Malone's name into the ring of potential avenues.",2009/09/21
284,http://mediadecoder.blogs.nytimes.com/2009/09/23/sony-announces-huge-multi-network-preview-of-2012-footage/,"Sony Announces Huge, Multi-Network Preview of '2012'","It's hard to verify - there isn't a Guinness book of movie marketing gimmicks to consult - but the plan does sound impressive: To promote ""2012,"" the coming Roland Emmerich thriller about a global cataclysm, Sony has organized what it believes is the largest-ever preview of a movie.",2009/09/23
340,http://dealbook.nytimes.com/2009/09/25/bankruptcy-judge-gives-ok-to-sale-of-the-cubs/,Bankruptcy Judge Approves Sale of the Cubs,"A federal bankruptcy court judge in Delaware on Thursday approved the Tribune Company's $845 million sale of the Chicago Cubs to the family of Joe Ricketts, the founder of the TD Ameritrade discount brokerage. One of his sons, Tom, will be the controlling owner, The New York Times's Richard Sandomir reported.",2009/09/25
282,https://www.nytimes.com/2009/09/25/sports/baseball/25bats.html,Bankruptcy Judge Gives O.K. to Sale of the Cubs,"A federal bankruptcy court judge in Delaware approved the Tribune Companyâ€™s $845 million sale of the Chicago Cubs to the family of Joe Ricketts, the founder of the TD Ameritrade.",2009/09/25
296,https://www.nytimes.com/2009/09/28/technology/companies/28wimax.html,Sprint Banks on WiMax to Win Back Market Share,"The next generation of mobile technology promises to deliver faster Internet service, and Sprint is aiming to be first on the scene.",2009/09/28
246,http://bits.blogs.nytimes.com/2009/09/28/will-consumers-take-their-isps-to-go/,Will Consumers Take Their I.S.P.'s to Go?,Do you want your home Internet provider to let you use your laptop or netbook around town?,2009/09/28
248,http://bits.blogs.nytimes.com/2009/09/28/blogs/28bits-will-con19727.html,Will Consumers Take Their I.S.P.'s to Go?,Cable companies want to offer customers wireless Internet access for laptops and other portable gadgets. How many people will pay $30 a month for the Web-to-go?.,2009/09/28
66,http://dealbook.nytimes.com/2009/09/30/comcast-denies-talk-of-deal-for-nbc-universal/,Comcast Denies Report of a Deal for NBC Universal,Update | 10:03 p.m. Is a mega-media deal -- a merger of Comcast and NBC Universal -- imminent?,2009/09/30
388,https://www.nytimes.com/2009/10/01/technology/internet/01broad.html,Broadband Speeds Surge in Many Countries,"South Korea and France are also at the top of two lists, and the United States has advanced into one surveyâ€™s second-ranked group.",2009/10/01
67,http://dealbook.nytimes.com/2009/10/01/rumors-of-comcast-talks-for-nbc-universal-continue/,Rumors of Comcast Talks for NBC Universal Continue,"Despite denials from Comcast, rumors that the company might ink a deal to buy a stake in NBC Universal continued unabated Wednesday.",2009/10/01
63,http://mediadecoder.blogs.nytimes.com/2009/10/01/ge-and-comcast-exploring-a-spin-off-of-nbc-universal/,GE and Comcast Exploring a Spinoff of NBC Universal,"General Electric and its NBC Universal unit are in talks with Comcast to spin off a new company, which would consist of the creative assets of NBC Universal and Comast.",2009/10/01
70,https://www.nytimes.com/2009/10/01/business/media/01nbc.html,Comcast Denies Report on a Deal to Buy NBC Universal,A claim from a Web side prompted the cable provider to issue a statement about the television and film business owned by G.E.,2009/10/01
60,http://dealbook.nytimes.com/2009/10/02/in-nbc-universal-bid-comcast-seeks-an-empire/,"In NBC Universal Bid, Comcast Seeks an Empire","Five years after Comcast's failed bid for the Walt Disney Company, Brian L. Roberts is again looking to fulfill his long-sought dream of turning his cable company into a major media conglomerate.",2009/10/02
58,https://www.nytimes.com/2009/10/02/business/media/02nbc.html,"In NBC Universal Bid, Comcast Seeks an Empire","The cable company is said to be in negotiations with General Electric to create a separate company, merging Comcastâ€™s programming assets with NBC Universal.",2009/10/02
323,http://dealbook.nytimes.com/2009/10/02/mgm-studio-gains-concession-from-lenders/,MGM Studio Gains Concession From Lenders,"Less than two months after hiring restructuring guru Stephen Cooper as a top executive, debt-laden Metro-Goldwyn-Mayer Inc. said Thursday it received a brief respite from making interest payments on nearly $4 billion in debt.",2009/10/02
264,http://mediadecoder.blogs.nytimes.com/2009/10/06/speed-read-for-october-6-2009/,"Speed Read for Oct. 6, 2009",Highlights from media coverage in today's edition of The New York Times.,2009/10/06
313,https://www.nytimes.com/2009/10/06/business/media/06universal.html,Universalâ€™s Movie Unit Ousts Its Two Chairmen,"Adam Fogelson, previously president for marketing and distribution at Universal, was named one of two chairmen.",2009/10/06
384,http://gadgetwise.blogs.nytimes.com/2009/10/06/more-e-mail-account-details-leaked-online/,More E-Mail Account Details Leaked Online,Now is the time to take a few minutes to change the password and any security questions for your e-mail account.,2009/10/06
314,http://dealbook.nytimes.com/2009/10/06/universals-movie-unit-ousts-its-two-chairmen/,Universal's Movie Unit Ousts Its Two Chairmen,"A shake-up in General Electric's troubled entertainment business continued, with Marc Shmuger and David Linde ousted from their co-chairmen posts at Universal Pictures even as G.E. explores merging its film, TV and theme park operations with properties of the cable giant Comcast.",2009/10/06
502,https://www.nytimes.com/2009/10/08/technology/personaltech/08basics.html,Parental Guidance on Web Video for Children,"The Internet offers a vast amount of video, not all of it suitable for young eyes. But parents can let their children explore while still curating what they see.",2009/10/08
489,https://www.nytimes.com/2009/10/12/business/media/12nbc.html,Debate Over Effects of Lenoâ€™s Show,"Critics of NBCâ€™s move to bring Jay Leno to 10 p.m. cite a negative effect on other programs, but the network says it is too early to judge.",2009/10/12
162,http://dealbook.nytimes.com/2009/10/13/ge-may-unwind-nbc-stake-slowly-report-says/,"G.E. May Unwind NBC Stake Slowly, Report Says","A proposed deal to acquire media giant NBC Universal would give its current owner, General Electric, the ability to unwind its stake over several years, and could see Comcast commit billions more to the joint venture, The Associated Press reported, citing a person close to the situation.",2009/10/13
180,http://dealbook.nytimes.com/2009/10/13/time-warner-chief-invokes-past-in-assessing-nbc-talks/,Time Warner Chief Invokes Past in Criticizing NBC Talks,What's possibly the harshest way to deride a Comcast-NBC Universal joint venture? Compare it to the 2000 star-crossed merger of AOL and Time Warner.,2009/10/13
471,http://slapshot.blogs.nytimes.com/2009/10/13/more-morning-skate-helping-versus-victims-caps-and-bs-slump-and-chelly-returns/,"More Morning Skate: Helping Versus Victims, Caps and B's Slump and Chelly Returns","Last night's historic comeback by the Blackhawks over Calgary was another missed game for N.H.L. fans who have DirecTV. Versus/Comcast and DirecTV remain at odds about fees and such (which Richard Sandomir outlined in The Times earlier this month) and the N.H.L.'s response, at least publicly, has been no more than to encourage fans to write letters.",2009/10/13
277,http://dealbook.nytimes.com/2009/10/16/ges-profit-fell-44-in-quarter/,G.E.'s Profit Fell 44% in Quarter,"The conglomerate General Electric said Friday that the continued woes of its big financial unit fueled a big drop in third-quarter earnings, outweighing signs of improvement in its divisions that make heavy machinery and other industrial equipment.",2009/10/16
420,https://www.nytimes.com/2009/10/17/business/17electric.html,"At $2.5 Billion, G.E.â€™s Quarterly Profit Hints at Stability","Despite continued problems in General Electricâ€™s finance unit, industrial orders increased $500 million over the previous quarter.",2009/10/17
453,https://www.nytimes.com/2009/10/18/arts/television/18stel.html,Guy Magnet: Giant Pies and Viral Videos,"â€œAttack of the Show,â€ broadcast live each weekday on the G4 cable channel, is a variety show for Web-savvy young men.",2009/10/18
230,https://www.nytimes.com/2009/10/18/business/18shelf.html,The Hunger of the Media Empire,"Media executivesâ€™ desire for acquisitions has led to $200 billion in write-offs since 2000, write the authors of â€œThe Curse of the Mogul.â€",2009/10/18
464,http://dealbook.nytimes.com/2009/10/19/media-giant-wrestles-with-a-shifting-identity/,Media Giant Wrestles With a Shifting Identity,"Of the world's biggest media companies, the one that might seem in the best position to ride out the recession is Vivendi, whose headquarters in the shadow of the Arc de Triomphe oversees a sprawling empire of music, pay television, video game and mobile phone businesses, The New York Times's Eric Pfanner writes.",2009/10/19
243,http://dealbook.nytimes.com/2009/10/19/how-much-has-nbc-cost-ge/,How Much Has NBC Cost G.E.?,"General Electric at long last appears ready to part with NBC Universal, the media and entertainment business it assembled through 24 years of management effort - and at least $33 billion of shareholders' money. A reported deal in the works with the cable operator Comcast that could value NBC at around $24 billion wouldn't be a big disaster, Breakingviews.com says. But, the Web site says, it would hardly qualify as an advertisement for G.E.'s vaunted management and capital allocation skills.",2009/10/19
245,https://www.nytimes.com/2009/10/19/business/media/19views.html,The Worth of NBC as a Piece of G.E.,A deal in the works to sell NBC to the cable operator Comcast would hardly qualify as an advertisement for G.E.â€™s vaunted management and capital allocation skills.,2009/10/19
59,http://mediadecoder.blogs.nytimes.com/2009/10/19/a-surprise-advisor-for-comcast-bid-peter-chernin/,A Surprise Adviser for Comcast Bid: Peter Chernin,"Peter Chernin, the former president of News Corporation and one of the highest profile media executives not tethered to a major conglomerates, is advising Comcast in its bid to acquire a majority stake in NBC Universal, according to executives briefed on the matter who spoke anonymously because Mr. Chernin's role in the deal was meant to be private.",2009/10/19
465,https://www.nytimes.com/2009/10/19/business/media/19vivendi.html,Media Giant Wrestles With a Shifting Identity,"If Vivendi, the media conglomerate, sells its stake in NBC, does it make sense for the company to keep its empire intact?",2009/10/19
64,http://dealbook.nytimes.com/2009/10/19/surprise-adviser-for-comcast-bid-peter-chernin/,Surprise Adviser for Comcast Bid: Peter Chernin,From Tim Arango at Media Decoder:,2009/10/19
235,http://mediadecoder.blogs.nytimes.com/2009/10/20/speed-read-for-tuesday-october-20/,"Speed Read for Tuesday, Oct. 20",Highlights from media coverage in today's edition of The New York Times:,2009/10/20
76,https://www.nytimes.com/2009/10/20/business/media/20comcast.html,Ex-News Corp. Executive Said to Be a Deal Adviser,"As a paid consultant, Peter Chernin is helping Comcast understand the prospects for the businesses.",2009/10/20
293,http://fifthdown.blogs.nytimes.com/2009/10/24/reviews-of-redzone-channel/,Reviews of RedZone Channel,We're asking readers who have the NFL RedZone channel to give us their assessments. Would you recommend it to other readers?,2009/10/24
493,https://www.nytimes.com/2009/10/26/business/media/26stream.html,Studiosâ€™ Quest for Life After DVDs,"Hollywood used to keep quiet about digital video, for fear of angering DVD retailers like Wal-Mart. The silence is over, and the innovations are rolling out.",2009/10/26
53,http://dealbook.nytimes.com/2009/10/26/nbc-comcast-a-big-deal-but-not-a-good-one/,"NBC-Comcast: A Big Deal, but Not a Good One","Content never became king - search did - but the notion continues to lure otherwise careful companies to the deal altar with its abundant charms, The New York Times's David Carr writes in his latest Media Equation column.",2009/10/26
69,http://mediadecoder.blogs.nytimes.com/2009/10/26/the-media-equation-comcast-marching-a-familiar-path-in-bid-for-nbc-universal/,The Media Equation: Comcast Marching a Familiar Path in Bid for NBC Universal,"Sometime in the near future, Comcast, predominantly a cable company with about 24 million customers in 39 states, is likely to buy a majority state in NBC Universal, David Carr writes in Monday's Media Equation column.",2009/10/26
77,https://www.nytimes.com/2009/10/26/business/media/26carr.html,"A Big Deal, but Not a Good One","We havenâ€™t seen anything quite like these Comcast-NBC Universal talks since the merger of Time Warner and AOL. And that turned out well, right?",2009/10/26
195,http://dealbook.nytimes.com/2009/10/29/former-nbc-boss-doubts-ipo/,Former NBC Boss Doubts I.P.O. Will Happen,"Update | 9:32 a.m. Vivendi's chief, Jean-Bernard LÃ©vy, may think an initial public offering of NBC Universal is an option, but a former NBC Universal chairman, Bob Wright, begs to differ.",2009/10/29
347,https://www.nytimes.com/2009/10/29/sports/baseball/29tickets.html,Lines Blur Between Phillies and Yankees Territory,Data that tracks people searching for World Series tickets online suggests geographical overlap in the fan bases.,2009/10/29
413,https://www.nytimes.com/2009/10/31/sports/baseball/31cubs.html,"New Owner to Improve Wrigley, and Maybe the Cubs","The Ricketts family, which derives its wealth from the TD Ameritrade brokerage, vowed to spruce up, but not to overhaul, the organization.",2009/10/31
42,https://www.nytimes.com/2009/11/02/business/media/02nbc.html,Comcast Said to Be Close to Gaining NBC Universal,"G.E. would continue to hold 49 percent of NBC Universal at first, but would be expected to shed that over several years.",2009/11/02
47,http://dealbook.nytimes.com/2009/11/02/comcast-said-to-be-close-to-gaining-nbc-universal/,Comcast Said to Be Close On NBC Universal,"General Electric and the cable giant Comcast have moved closer to a deal giving control of NBC Universal to Comcast, and a formal announcement could be made sometime next week, The New York Times's Michael J. de la Merced and Andrew Ross Sorkin reported, citing people briefed on the talks.",2009/11/02
298,http://dealbook.nytimes.com/2009/11/04/scripps-is-said-to-win-control-of-travel-channel/,Scripps to Buy Control of Travel Channel,"Update | Nov. 5, 8:21 a.m. Scripps Networks said Thursday that it was buying a controlling stake in the Travel Channel, in a deal valuing the network at $975 million. It will own 65 percent of a new joint venture controlling Travel Channel, while current parent Cox Communications will own 35 percent.",2009/11/04
216,http://mediadecoder.blogs.nytimes.com/2009/11/08/speed-read-for-monday-november-9/,"Speed Read for Monday, Nov. 9",Highlights from today's media coverage:,2009/11/08
223,http://dealbook.nytimes.com/2009/11/09/sprint-to-invest-1-billion-more-in-clearwire-report-says/,Sprint Plans to Spend $1 Billion More on Clearwire,"Sprint Nextel is preparing to pump at least $1 billion more into Clearwire, The Wall Street Journal reported, citing two people familiar with the matter.",2009/11/09
144,http://dealbook.nytimes.com/2009/11/09/intense-review-is-expected-for-nbc-deal/,Intense Review Is Expected for Possible NBC Deal,"The Center for Digital Democracy, a public interest group, has already called the potential union of Comcast and NBC Universal ""the equivalent of Godzilla swallowing Rockefeller Center.""",2009/11/09
75,https://www.nytimes.com/2009/11/09/business/media/09comcast.html,Intense Review Is Expected for NBC Deal,"Comcastâ€™s plan to gain control of NBC Universal, which is expected to be announced soon, is likely to be the first major test of the Obama administrationâ€™s media regulators.",2009/11/09
285,http://dealbook.nytimes.com/2009/11/12/ge-sells-security-unit-for-18-billion/,G.E. Sells Security Unit for $1.8 Billion,"General Electric said on Thursday that it will sell its fire alarm and security systems unit to United Technologies for $1.82 billion, continuing a sale of what the industrial conglomerate considers noncore businesses.",2009/11/12
218,http://mediadecoder.blogs.nytimes.com/2009/11/13/speed-read-for-friday-november-13/,"Speed Read for Friday, Nov. 13",Highlights from today's media coverage:,2009/11/13
74,https://www.nytimes.com/2009/11/13/sports/olympics/13sandomir.html,A Possible Glimpse of Ebersolâ€™s Future,"Dick Ebersol, longtime head of NBC Sports, might soon have a new boss â€” Comcast â€” if discussions result in the nationâ€™s largest cable operator acquiring control of NBC Universal.",2009/11/13
226,https://www.nytimes.com/2009/11/13/business/13fire.html,G.E. to Sell Security Unit,"The deal, valued at $1.82 billion, will help General Electric to part with what it considers noncore businesses.",2009/11/13
227,http://mediadecoder.blogs.nytimes.com/2009/11/13/its-official-mgm-is-back-up-for-sale/,It's Official: MGM Is Back in Play,Metro-Goldwyn-Mayer is officially back on the block.,2009/11/13
45,https://www.nytimes.com/2009/11/13/business/media/13comcast.html,"For Comcastâ€™s Chief, Content Led the Way","At a dinner 12 years ago in Redmond, Wash., Brian L. Roberts challenged the richest man in the world to invest in his business Â— cable TV.",2009/11/13
46,http://dealbook.nytimes.com/2009/11/13/for-comcast-chief-content-led-the-way/,"For Comcast Chief, Content Led the Way","At a dinner 12 years ago in Redmond, Wash., Brian L. Roberts challenged the richest man in the world to invest in his business -- cable TV.",2009/11/13
286,https://www.nytimes.com/2009/11/14/business/media/14mgm.html,"Burdened by Billions in Debt, MGM Puts Itself Up for Sale","Estimates for the studio, which owns a 4,000-title film library, range from $1.5 billion to almost $3 billion.",2009/11/14
167,https://www.nytimes.com/2009/11/15/magazine/15FOB-Phenomenon-t.html,The Price of Free,What will happen to TV if we all stream shows from the Web.,2009/11/15
291,http://dealbook.nytimes.com/2009/11/15/burdened-by-billions-in-debt-mgm-puts-itself-up-for-sale/,"Burdened by Debt, MGM Puts Itself Up for Sale","Metro-Goldwyn-Mayer is back on the block, The New York Times's Brooks Barnes reported.",2009/11/15
461,https://www.nytimes.com/2009/11/16/business/media/16msnbc.html,MSNBC Presses Obama on Campaign Promises,MSNBC hosts are calling on the president to keep his campaign promises about health care and other issues.,2009/11/16
161,http://dealbook.nytimes.com/2009/11/16/is-vivendis-gtv-deal-a-signal-on-nbc-stake/,Is Vivendi's GVT Deal a Signal on NBC Stake?,Vivendi said Friday that it had gained control of GVT in a deal that valued the Brazilian telecommunications company at about 2.8 billion euros ($4.2 billion) and gave the French media conglomerate a foothold in Latin America's biggest market.,2009/11/16
263,http://dealbook.nytimes.com/2009/11/18/is-icahn-swooping-down-on-mgm/,Is Icahn Swooping Down on MGM?,"Is Carl C. Icahn buying Metro-Goldwyn-Mayer bonds ""like a bat out of hell""? That's the word, according to Hollywood blogger Nikki Finke.",2009/11/18
148,http://dealbook.nytimes.com/2009/11/18/vivendi-said-to-want-more-for-nbc-stake/,Vivendi Said to Want More for NBC Stake,It seems Vivendi may be holding out for more in its negotiations to sell its 20 percent stake in NBC Universal to majority owner General Electric.,2009/11/18
253,https://mediadecoder.blogs.nytimes.com/2009/11/19/at-ad-council-dinner-tart-humor-from-tina-fey/,"At Ad Council Dinner, Tart Humor From Tina Fey","The â€œ30 Rockâ€ actress poked fun of the heads of NBC Universal and General Electric, as well as her look-alike, Sarah Palin.",2009/11/19
147,http://dealbook.nytimes.com/2009/11/20/ge-and-vivendi-said-to-be-1-billion-apart-on-nbc/,G.E. and Vivendi Said to Be $1 Billion Apart on NBC,A report saying that Vivendi was holding for more money in its negotiations to sell its 20 percent stake in NBC Universal to majority owner General Electric left industry observers wondering just how far apart the two firms were on price.,2009/11/20
139,https://www.nytimes.com/2009/11/21/business/media/21nbc.html,G.E. and Vivendi Halt Talks Over Stake in NBC,"The sides appear to be at least $500 million apart on how to value NBC Universal, which G.E. is hoping to sell to Comcast, the big cable television company.",2009/11/21
325,https://www.nytimes.com/2009/11/21/business/media/21network.html,An Unsteady Future for Broadcast,"Analysts and executives are wondering if the economic model of broadcast television, which is more heavily reliant on advertising than cable, is irreparably broken.",2009/11/21
138,http://dealbook.nytimes.com/2009/11/23/ge-and-vivendi-halt-talks-over-stake-in-nbc/,G.E. and Vivendi Halt Talks Over Stake in NBC,"Talks between General Electric and Vivendi over the future of NBC Universal have stalled, The New York Times's Andrew Ross Sorkin and Tim Arango reported on Saturday, citing people involved in the discussions who spoke on condition of anonymity because they were part of confidential negotiations.",2009/11/23
473,https://www.nytimes.com/2009/11/23/business/media/23adnewsletter1.html,"Neither Red State Nor Blue State, but Toy State",A Chinese toy company is hoping that a brand character named Ripp will help it compete against rivals such as Hasbro and Mattel.,2009/11/23
190,http://dealbook.nytimes.com/2009/11/23/chieftain-capital-said-to-split-amid-conflicts/,Chieftain Capital Said to Split Amid Conflicts,"Chieftain Capital Management, an investment firm with about $3 billion in assets, is breaking up following a rift among its managers, The Wall Street Journal reported.",2009/11/23
412,https://www.nytimes.com/2009/11/24/business/media/24adcol.html,"Shows Online, Brought to You by ...","Web series, or webisodes, are being created specifically for advertisers.",2009/11/24
279,http://dealbook.nytimes.com/2009/11/24/joost-sells-its-name-and-most-of-its-assets/,Joost Sells Its Name and Most of Its Assets,"Joost, the struggling video Web site, said on Tuesday that it was selling most of the company to the Adconion Media Group, an online advertising and marketing company, for an undisclosed amount. The acquisition ends a long sales process that at one point was thought to involve possible interest from the cable television operators like Time Warner Cable and Comcast.",2009/11/24
302,http://thecaucus.blogs.nytimes.com/2009/11/29/business-titans-and-others-expected-at-jobs-summit/,"Business Titans, and Others, Expected at Jobs Summit","The invitations went out just before Thanksgiving, but by the end of the holiday weekend the White House has confirmed that President Obama's jobs summit on Thursday will include about 130 business leaders, union chiefs, academics, mayors and representatives of nonprofit groups.",2009/11/29
118,http://dealbook.nytimes.com/2009/11/30/ge-reaches-pact-with-vivendi-over-nbc-universal/,G.E. Pact With Vivendi Clears Way for Sale of NBC,"Update | 9:17 p.m. General Electric has reached a tentative agreement to buy Vivendi's 20 percent stake in NBC Universal for about $5.8 billion, helping clear the path to a sale of the television and movie company to Comcast, people briefed on the matter told DealBook.",2009/11/30
332,http://mediadecoder.blogs.nytimes.com/2009/12/01/shaw-abcs-top-salesman-steps-down/,ABC's Top Salesman Steps Down,"Mike Shaw, who has held the top sales post at the ABC Television Network division of ABC, is stepping down from his day-to-day duties.",2009/12/01
