,link,headline,summary,date
133,https://www.nytimes.com/2017/09/17/fashion/weddings/amber-brandes-elana-caplan.html,"Amber Brandes, Elana Caplan","The couple met on the dating app Hinge in September 2015, and will use the surname Brandes-Caplan.",2017/09/17
320,https://www.nytimes.com/2017/09/18/business/media/emmy-winners-took-a-topical-and-political-route-to-the-prize.html,"And This Year, the Emmy Goes to … Politics","From “Saturday Night Live” to “The Handmaid’s Tale,” shows with a political — and anti-Trump — viewpoint ruled the day at the Emmy Awards.",2017/09/18
341,https://www.nytimes.com/2017/09/20/technology/internet-giants-face-new-political-resistance-in-washington.html,Internet Giants Face New Political Resistance in Washington,"Facebook, Google and Amazon are coming under increasing pressure by regulators concerned about their growing power.",2017/09/20
228,https://www.nytimes.com/2017/09/22/business/apple-investment.html,The Best Investment Since 1926? Apple,"Apple has generated more wealth for shareholders than any other of the top 50 companies, which account for 40 percent of stock market wealth.",2017/09/22
261,https://www.nytimes.com/2017/09/29/movies/fandangonow-streaming.html,FandangoNow Bridges the Theatrical Experience and Streaming,Going to the movies with Fandango and getting the movies at home with FandangoNow.,2017/09/29
305,https://www.nytimes.com/2017/10/02/business/dealbook/katzenberg-television-mobile.html,Katzenberg’s Big Ask: $2 Billion for Short-Form Video Project,"After selling DreamWorks Animation last year, Jeffrey Katzenberg is seeking big investors for a new idea. Think “Game of Thrones” in short bites.",2017/10/02
363,https://www.nytimes.com/interactive/2017/10/12/business/media/toyota-camry-ads-different-ethnicities.html,"Different Ads, Different Ethnicities, Same Car","Toyota recently unveiled several ads for the same car — its flagship Camry. Each ad speaks to a different audience, offering a fascinating glimpse into how race and culture figure into American advertising today.",2017/10/12
203,https://www.nytimes.com/2017/10/16/business/media/netflix-earnings.html,Netflix Says It Will Spend Up to $8 Billion on Content Next Year,The company beat expectations by adding 5.3 million subscribers in the third quarter and said it would ramp up its spending on original content.,2017/10/16
80,https://www.nytimes.com/2017/10/19/business/dealbook/competition-and-debt-could-spell-trouble-for-verizon.html,"Competition, and Debt, Could Spell Trouble for Verizon",Verizon’s perch as the No. 1 carrier in the United States looks secure. But the gap is narrowing. And a heavy debt load could hobble Verizon’s ability to quickly change lanes.,2017/10/19
379,https://www.nytimes.com/2017/10/19/business/dealbook/ken-chenault-american-express.html,Ken Chenault’s Retirement Makes a Small Club Smaller: DealBook Briefing,"When the American Express C.E.O. steps down in February, there may be just three black men running Fortune 500 companies.",2017/10/19
140,https://www.nytimes.com/2017/10/24/technology/personaltech/what-to-do-when-the-cable-goes-out.html,What to Do When the Cable Goes Out,Many providers have online troubleshooting tools and apps that you can use to see if the service is down for everyone — or just you.,2017/10/24
25,https://www.nytimes.com/2017/10/26/business/dealbook/comcasts-careful-steps-to-grow-past-cable-yield-results.html,Comcast’s Careful Steps to Grow Past Cable Yield Results,"The $170 billion company has made some mistakes, but it was prudent in its purchase of NBC Universal and its launch of a wireless service using Verizon infrastructure.",2017/10/26
119,https://www.nytimes.com/2017/11/06/business/media/disney-fox-deal.html,Disney Said to Have Held Talks to Acquire 21st Century Fox Assets,"The two media companies are no longer talking, but a deal, which may still be in the works, would make sense for Disney, analysts said.",2017/11/06
94,https://www.nytimes.com/2017/11/08/business/dealbook/att-time-warner.html,Justice Department Says Not So Fast to AT&T’s Time Warner Bid,"CNN, a network criticized by Trump, figures in a dispute between the government and AT&T, setting up a battle over the pending $85.4 billion deal.",2017/11/08
211,https://www.nytimes.com/2017/11/08/business/media/21st-century-fox-disney.html,"21st Century Fox Discusses a Deal With Sky, but Not Disney",James and Lachlan Murdoch did not take questions about reports that Disney had discussed acquiring some of 21st Century Fox’s entertainment business.,2017/11/08
222,https://www.nytimes.com/2017/11/09/opinion/att-time-warner-merger-fcc.html,Why Blocking the AT&T-Time Warner Merger Might Be Right,"The Trump administration is correct in taking a hard look at the proposed takeover, which could discourage competition and hurt consumers.",2017/11/09
242,https://www.nytimes.com/2017/11/14/business/dealbook/taxing-companies-for-using-our-personal-data.html,It’s Time to Tax Companies for Using Our Personal Data,"Companies are making a fortune by using personal data gleaned from the internet. They would barely notice a 1 percent tax, but it could make a better world.",2017/11/14
88,https://www.nytimes.com/2017/11/14/pageoneplus/corrections-november-14-2017.html,"Corrections: November 14, 2017","Corrections appearing in print on Tuesday, November 14, 2017.",2017/11/14
221,https://www.nytimes.com/2017/11/15/opinion/att-time-warner-deal-trump.html,Mr. Trump Casts a Shadow Over the AT&T-Time Warner Deal,"He politicizes everything he touches, so unless his appointees act with utmost integrity they will be tainted as his henchmen.",2017/11/15
143,https://www.nytimes.com/2017/11/15/business/dealbook/att-time-warner.html,Peltz May Have Won After All: DealBook Briefing,"After a bitter dispute, Nelson Peltz’s firm announced that a vote count showed that Mr. Peltz had been elected to Procter & Gamble’s board of directors, despite previous preliminary counts.",2017/11/15
24,https://www.nytimes.com/2017/11/16/business/media/comcast-21st-century-fox.html,Comcast Said to Be in Talks to Buy 21st Century Fox Assets,"The cable giant is discussing acquiring the Fox movie studio, the FX network, regional sports channels and a vast overseas TV distribution business.",2017/11/16
98,https://www.nytimes.com/2017/11/16/business/att-time-warner.html,"With AT&T and Time Warner, Battle Lines Form for an Epic Antitrust Case","The Justice Department is favoring divestiture, meaning CNN might have to go. But experts say many concerns can be addressed with “conduct remedies.”",2017/11/16
393,https://www.nytimes.com/2017/11/16/business/dealbook/kochs-time-inc-meredith.html,"DealBook Briefing: ‘Antitrust Is Law Enforcement, Not Regulation’",The Justice Department’s new antitrust chief Makan Delrahim laid out the principles that could guide a suit to block AT&T’s acquisition of Time Warner.,2017/11/16
115,https://www.nytimes.com/2017/11/16/opinion/att-time-warner-merger.html,Why the AT&T-Time Warner Merger Makes Sense,The proposal will not hurt competition or consumers. The Justice Department has no solid antitrust reasons to block it.,2017/11/16
231,https://www.nytimes.com/2017/11/17/business/dealbook/fox-comcast-deal.html,"DealBook Briefing: Corporate Taxes, Musk vs. Buffett, and Will Fox Strike a Deal?","Will companies invest their cash windfall from the Republican tax plans? Also, the Murdochs are in talks with suitors interested in pieces of their empire. But will they sell?",2017/11/17
134,https://www.nytimes.com/2017/11/17/business/how-to-profit-from-time-warners-troubles.html,How to Profit From Time Warner’s Troubles,The Trump administration’s signals have hurt Time Warner shares. But there is money to be made if last month’s pricing was more accurate than today’s.,2017/11/17
300,https://www.nytimes.com/2017/11/17/briefing/al-franken-tesla-justice-league.html,"Al Franken, Tesla, ‘Justice League’: Your Friday Briefing",Here’s what you need to know to start your day.,2017/11/17
277,https://www.nytimes.com/2017/11/20/business/atts-run-ins-with-the-government.html,AT&T’s Run-Ins With the Government,AT&T's many tangles with antitrust law over the years are a reminder of the complicated balancing act the government must strike in regulating ever-changing companies.,2017/11/20
110,https://www.nytimes.com/2017/11/20/business/dealbook/att-time-warner-merger.html,Justice Department Sues to Block AT&T-Time Warner Merger,A lawsuit to block the merger sets up a showdown over the first blockbuster acquisition to come before the Trump administration.,2017/11/20
194,https://www.nytimes.com/2017/11/20/business/dealbook/susan-collins-tax-senate.html,DealBook Briefing: U.S. Sues to Block AT&T-Time Warner,The Justice Department plans to file a lawsuit aimed at blocking AT&T’s $85.4 billion bid for Time Warner.,2017/11/20
122,https://www.nytimes.com/2017/11/21/business/net-neutrality-antitrust-.html,Washington Has Delivered a Tangled Message on AT&T’s Power,Loosening rules on internet providers would let big companies charge more for their services. But a suit to block a merger signals a tougher stance against big business.,2017/11/21
164,https://www.nytimes.com/2017/11/21/business/dealbook/justice-department-deal-making.html,Will Justice Department’s Lawsuit Derail Deal-Making Boom?,Investment bankers are nervous that the effort to block AT&T’s takeover of Time Warner will cool a hot market for mergers and acquisitions.,2017/11/21
400,https://www.nytimes.com/2017/11/21/business/dealbook/att-time-warner-justice-department.html,DealBook Briefing: Trump Is Still Not a Fan of AT&T-Time Warner,The business community is buzzing about the F.C.C.’s plan to dismantle net neutrality regulations and the Justice Department’s lawsuit to block AT&T’s bid for Time Warner.,2017/11/21
217,https://www.nytimes.com/2017/11/21/technology/net-neutrality-repeal-questions.html,Net Neutrality Repeal: What Could Happen and How It Could Affect You,"For you and me, the repeal of net neutrality rules can be boiled down to two questions: What might happen? And who do you trust?",2017/11/21
125,https://www.nytimes.com/2017/11/21/technology/fcc-repeal-net-neutrality.html,F.C.C. Is Said to Plan Repeal of Net Neutrality Rules,"In a sweeping proposal to be revealed on Tuesday, Ajit Pai, the chairman of the F.C.C., is preparing to scrap the net neutrality rules, said people familiar with the plan.",2017/11/21
278,https://www.nytimes.com/2017/11/21/technology/fcc-net-neutrality.html,F.C.C. Plans Net Neutrality Repeal in a Victory for Telecoms,A rollback of net neutrality regulations would represent a significant victory for companies like AT&T and Comcast and would amount to a strike against consumers.,2017/11/21
237,https://www.nytimes.com/interactive/2017/11/21/learning/21Zimbabwe_Da-Vinci_TaxesLN.html,"Weekly News Quiz: Zimbabwe, Da Vinci, Taxes",Have you been paying attention to the headlines this week? Take our 10-question quiz and see.,2017/11/21
66,https://www.nytimes.com/2017/11/22/business/the-att-antitrust-case-questions-and-answers.html,How to Make Sense of the U.S. Case Against AT&T-Time Warner,The Justice Department’s suit to block the AT&T and Time Warner merger was a stark departure from decades of leniency toward similar tie-ups.,2017/11/22
247,https://www.nytimes.com/2017/11/22/business/net-neutrality-small-businesses.html,F.C.C. Plan to Roll Back Net Neutrality Worries Small Businesses,"Small companies, which have increasingly turned to the internet, worry that a pay-for-play system online could price them out of doing business.",2017/11/22
215,https://www.nytimes.com/2017/11/24/opinion/atts-trump-justice.html,AT&T’s C.E.O. Meets Trump’s Justice,Economic policy driven by presidential pique.,2017/11/24
233,https://www.nytimes.com/2017/11/28/opinion/trump-competition-net-neutrality.html,The Trump Administration’s Incoherent Stance on Competition,It’s planning to end net neutrality while opposing the Time Warner and AT&T merger. This doesn’t make sense.,2017/11/28
127,https://www.nytimes.com/2017/11/29/technology/internet-dying-repeal-net-neutrality.html,The Internet Is Dying. Repealing Net Neutrality Hastens That Death.,"Over the last decade, a few giant corporations became an inescapable part of online life. Gutting net neutrality would cement their power.",2017/11/29
76,https://www.nytimes.com/2017/11/29/opinion/net-neutrality-consumers.html,How Repealing Net Neutrality Will Hurt Consumers,Readers worry that eliminating rules that ensure a level playing field will allow internet gatekeepers to abuse their power and play favorites.,2017/11/29
236,https://www.nytimes.com/2017/11/29/business/dealbook/kind-bars-mars.html,DealBook Briefing: Pass-Throughs vs. Corporations — Who’s the Bigger Winner?,Two senators have argued that big corporations are being given preferential treatment compared with pass-throughs. The problem that is wrong.,2017/11/29
214,https://www.nytimes.com/2017/12/01/business/media/matt-lauer-firing-nbc-news.html,"After Firing Matt Lauer, NBC Executives Move to Control the Damage","As competitors raised questions, the NBC News chairman and the news division president worked to reassure staff members about the handling of the scandal.",2017/12/01
75,https://www.nytimes.com/2017/12/02/business/dealbook/disney-21st-century-fox.html,Disney Is Said to Have Resumed Talks to Buy Parts of Fox,"The move comes as the Murdoch family decides whether to sell big parts of its empire, as the media industry continues to consolidate.",2017/12/02
84,https://www.nytimes.com/2017/12/03/opinion/fcc-net-neutrality-internet.html,The F.C.C. Wants to Let Telecoms Cash In on the Internet,"Ending net neutrality and letting companies charge more, or block, certain services, will enrich them and strangle the web.",2017/12/03
163,https://www.nytimes.com/2017/12/04/business/dealbook/cvs-aetna-deal.html,The Deal Makers on CVS’s Bid for Aetna: DealBook Briefing,"An army of firms helped put together the year’s biggest announced merger, with at least $120 million in potential fees to go around for the banks alone.",2017/12/04
128,https://www.nytimes.com/2017/12/04/opinion/net-neutrality-overblown-concerns.html,Why Concerns About Net Neutrality Are Overblown,It’s simply not in service providers’ interests to throttle access to what their customers want to see.,2017/12/04
74,https://www.nytimes.com/2017/12/05/business/dealbook/disney-fox-murdoch.html,Disney Said to Be Nearing a Deal With 21st Century Fox,Disney is said to be seeking to acquire parts of Fox’s empire in a transaction that could offer a senior executive role for Rupert Murdoch’s son James at Disney.,2017/12/05
385,https://www.nytimes.com/2017/12/06/business/dealbook/disney-fox-murdoch.html,DealBook Briefing: A Fox Deal May Keep Iger at Disney Longer,The Walt Disney Company may extend chief executive Robert Iger’s tenure if it completes a purchase of the entertainment assets of 21st Century Fox.,2017/12/06
132,https://www.nytimes.com/2017/12/06/business/trump-and-warren-find-common-ground-on-antitrust.html,Trump and Warren Find Common Ground on Antitrust,Senator Elizabeth Warren’s criticism of megadeals like CVS-Aetna and AT&T-Time Warner puts her in the same camp as the president.,2017/12/06
254,https://www.nytimes.com/2017/12/07/business/dealbook/disney-iger-ceo.html,"DealBook Briefing: Bitcoin Surges Past $16,000","As his company closes in on a deal for much of the Fox media empire, the C.E.O. may have to postpone retirement yet again to oversee post-merger work.",2017/12/07
111,https://www.nytimes.com/2017/12/08/opinion/facebook-net-neutrality.html,What Facebook Taught Me About Net Neutrality,"In the early days of creating the social network, we were at the mercy of internet providers. They could easily have killed the company.",2017/12/08
284,https://www.nytimes.com/2017/12/10/business/net-neutrality-europe-fcc.html,Net Neutrality’s Holes in Europe May Offer Peek at Future in U.S.,"Telecom operators have been pushing boundaries in Europe, where loopholes have left net neutrality regulations weaker than intended.",2017/12/10
209,https://www.nytimes.com/2017/12/11/sports/football/nfl-verizon-digital-rights.html,The N.F.L. Goes Deep With Mobile and Verizon,"The N.F.L. and Verizon announced a $2 billion digital rights deal. Fans should love it. Longtime media partners, not so much.",2017/12/11
283,https://www.nytimes.com/2017/12/12/technology/net-neutrality-fcc-tech.html,"Net Neutrality Protests Move Online, Yet Big Tech Is Quiet","While some technology companies used their websites to proclaim support for equal internet access, some of the giants, including Google and Microsoft, were lying low.",2017/12/12
118,https://www.nytimes.com/2017/12/12/business/media/disney-21st-century-fox.html,Disney’s Deal for 21st Century Fox Is Said to Be Close,"The $60 billion-plus acquisition would give Disney control of most of Rupert Murdoch’s movie and TV empire, and give a serious boost to the company’s streaming ambitions.",2017/12/12
391,https://www.nytimes.com/2017/12/12/business/dealbook/alabama-senate-election.html,How Alabama’s Election Could Reshape Washington’s Policy Battles: DealBook Briefing,"Reducing Republicans’ majority in the Senate by just one seat may have big effects on debates about health care, infrastructure, taxes and more.",2017/12/12
252,https://www.nytimes.com/2017/12/13/us/california-today-a-mayor-for-a-city-in-transition.html,California Today: A Mayor for a City in Transition,"Wednesday: The death of San Francisco’s mayor, California’s failing dams, wildfires, the Go-Go’s and the state Hall of Fame",2017/12/13
314,https://www.nytimes.com/2017/12/14/business/dealbook/disney-fox-deal.html,Disney Makes $52.4 Billion Deal for 21st Century Fox in Big Bet on Streaming,The acquisition of most of Rupert Murdoch’s entertainment empire makes Disney a true competitor to services like Netflix and Amazon.,2017/12/14
227,https://www.nytimes.com/2017/12/14/business/dealbook/disney-fox-takeover.html,Trump Congratulated Murdoch on the Disney Deal: DealBook Briefing,"While the Trump administration has moved to block one media deal, the president offered support to another — and said that it would be a “great thing” for jobs.",2017/12/14
205,https://www.nytimes.com/2017/12/14/technology/net-neutrality-rules.html,Why Net Neutrality Was Repealed and How It Affects You,The Federal Communications Commission voted Thursday to repeal Obama-era net neutrality rules. Here’s what you need to know.,2017/12/14
251,https://www.nytimes.com/2017/12/14/opinion/net-neutrality-china-internet.html,What if You Couldn’t See This Page?,This nightmare internet scenario is at our digital doorstep.,2017/12/14
241,https://www.nytimes.com/2017/12/15/sports/disney-fox-sports.html,Why Did Disney Expand Its Sports Kingdom With Out-of-Favor Networks?,"In its megadeal with 21st Century Fox, Disney acquired 22 regional sports networks that it believes will complement ESPN. It’s unclear how that will happen.",2017/12/15
147,https://www.nytimes.com/2017/12/15/technology/net-neutrality-repeal.html,What’s Next After the Repeal of Net Neutrality,"Here is a guide to what will happen in the coming weeks (and maybe years), including potential changes from companies and numerous lawsuits.",2017/12/15
260,https://www.nytimes.com/2017/12/15/technology/farhad-mikes-week-tech-net-neutrality.html,Farhad and Mike’s Week in Tech: Net Neutrality Is Gone,"Our reporters look at the week in tech, including the F.C.C.’s decision to repeal net neutrality and Bitcoin’s continued boom.",2017/12/15
223,https://www.nytimes.com/2017/12/15/business/dealbook/rupert-murdoch-fox.html,DealBook Briefing: Peltz Gets His Seat on Procter & Gamble’s Board,Procter & Gamble has appointed activist investor Nelson Peltz to its board following a certified recount of shareholder votes cast at its annual meeting in October.,2017/12/15
137,https://www.nytimes.com/2017/12/20/technology/net-neutrality-repeal-teens.html,"In Protests of Net Neutrality Repeal, Teenage Voices Stood Out","Young people who have grown up knowing only an open internet organized rallies, streamed the F.C.C. vote in class — and say they plan to keep fighting.",2017/12/20
426,https://www.nytimes.com/2017/12/20/business/dealbook/uber-european-court.html,It’s a Merry ‘Taxmas’ for AT&T Employees: DealBook Briefing,"AT&T said it will pay a $1,000 bonus to more than 200,000 employees and would increase its capital expenditure budget for next year by $1 billion.",2017/12/20
126,https://www.nytimes.com/2017/12/21/business/dealbook/tax-cuts-crystallize-haves-wants-cants-wonts.html,"Tax Cuts Crystallize Haves, Wants, Can’ts, Won’ts","AT&T, Comcast, Boeing and Wells Fargo are sharing the wealth from lower taxes with workers. But there’s less to these claims than meets the eye.",2017/12/21
409,https://www.nytimes.com/2017/12/21/business/dealbook/taxes-workers-att.html,"Eric Schmidt, Alphabet’s ‘Ambassador,’ to Step Down: DealBook Briefing",Eric Schmidt is stepping down as executive chairman of Google-parent Alphabet.,2017/12/21
294,https://www.nytimes.com/2017/12/25/business/mba-business-school-ethics.html,"Business Schools Now Teaching #MeToo, N.F.L. Protests and Trump","With sexual harassment rocking the business world and C.E.O.s speaking out, business schools are ripping new case studies straight from the headlines.",2017/12/25
267,https://www.nytimes.com/2017/12/27/technology/personaltech/new-years-resolutions-technology.html,5 New Year’s Resolutions to Protect Your Technology,The cybersecurity nightmares of 2017 highlight the need to protect yourself. Here are some resolutions for living a safer digital life this new year.,2017/12/27
325,https://www.nytimes.com/2018/01/01/us/politics/trump-businesses-regulation-economic-growth.html,"The Trump Effect: Business, Anticipating Less Regulation, Loosens Purse Strings",The administration’s campaign to reduce regulation has improved the mood of business executives. They may be spending more money as a result.,2018/01/01
121,https://www.nytimes.com/2018/01/02/business/dealbook/tv-content-streaming.html,TV Content Wars: Too Many Characters Chasing Not Enough Action,Budgets for video-streaming content are rising faster than revenue. Something will have to give in 2018.,2018/01/02
263,https://www.nytimes.com/2018/01/03/us/politics/trump-tweets-nuclear-button.html,Trump’s First Big Twitter Day of 2018: Analyzing Nuclear Buttons and the ‘Corrupt Media’,The president’s 17 posts on Tuesday can be read as an outline of his agenda but also a glimpse at the challenges he faces this year.,2018/01/03
193,https://www.nytimes.com/2018/01/03/business/corporate-tax-cut-bonuses-employees.html,Companies Are Handing Out Bonuses Thanks to the Tax Law. Is It a Publicity Stunt?,"Following the big tax cut, companies have announced bonuses or wage hikes for employees. Will they make a difference? Or are they publicity stunts?",2018/01/03
196,https://www.nytimes.com/2018/01/26/business/the-remote-control-out-of-control-why-a-la-carte-tv-is-too-much-for-a-trekkie.html,"The Remote Control, Out of Control: Why à la Carte TV Is Too Much for a Trekkie",CBS airs the latest Star Trek spinoff on its paid subscription service. But how many are we supposed to buy? This fan says no. For now.,2018/01/26
144,https://www.nytimes.com/2018/01/28/business/media/rob-norman-advertising.html,An Ad Executive Often in the Vanguard Peers Into the Future,"Rob Norman, a leading industry voice who recently retired, talked with The Times’s advertising reporter about Facebook, Google and the possibility of an emboldened Hulu.",2018/01/28
367,https://www.nytimes.com/2018/02/04/business/media/super-bowl-commercials.html,Advertisers Eschew Politics for Humor in Super Bowl Commercials,This year’s Super Bowl ads were more humorous than political. But Ram was criticized for using a sermon by the Rev. Dr. Martin Luther King Jr. in a commercial for its truck.,2018/02/04
176,https://www.nytimes.com/2018/02/04/technology/early-facebook-google-employees-fight-tech.html,Early Facebook and Google Employees Form Coalition to Fight What They Built,"A group of Silicon Valley technologists plans to call attention to the dangers of tech, including working on an ad campaign aimed at 55,000 public schools.",2018/02/04
195,https://www.nytimes.com/2018/02/06/business/dealbook/stock-market-drops.html,DealBook Briefing: Tronc Nears Deal to Sell Los Angeles Times,"The owner of The Los Angeles Times is close to a deal to sell the newspaper to Patrick Soon-Shiong, a billionaire Los Angeles doctor.",2018/02/06
171,https://www.nytimes.com/2018/02/08/opinion/ceo-tax-cuts.html,How C.E.O.s Should Spend Their Tax Cuts,"Bonuses are nice, but the best investment is in training your employees.",2018/02/08
418,https://www.nytimes.com/2018/02/12/business/dealbook/wall-street-markets.html,Stocks Record Their Biggest Two-Day Rally Since 2016: DealBook Briefing,Stocks on Wall Street endured their worst week in two years last week. Monday they capped their biggest two-day advance since 2016.,2018/02/12
22,https://www.nytimes.com/2018/02/12/business/dealbook/comcast-fox-disney.html,Comcast’s Interest in Fox May Force Disney to Raise Its Offer,"Antitrust concerns and Murdoch family politics could keep Comcast from reprising its $60 billion bid, but Disney may yet have to step up its game.",2018/02/12
388,https://www.nytimes.com/2018/02/13/business/dealbook/steve-cohen-sexual-discrimination-lawsuit.html,Will Market Volatility Help Goldman Get Its Groove Back?: DealBook Briefing,"Lloyd Blankfein, Goldman’s chief executive, seemed to embrace the recent market volatility at a conference on Tuesday.",2018/02/13
