,link,headline,summary,date
579,http://bits.blogs.nytimes.com/2008/01/08/tv-guide-hopes-to-make-a-big-splash-thanks-to-the-web/,"TV Guide, Interconnected","Remember TV Guide? The company that owns the venerable TV listings magazine that once graced millions of living room coffee tables hopes that it's poised for a comeback -- not in print, but thanks to the Web.",2008/01/08
273,https://www.nytimes.com/2008/01/08/technology/08cable.html,Comcast Plans to Offer a Huge Menu of Films,A plan aims to offer Comcast subscribers a nearly limitless supply of movies and TV shows that can be viewed on demand and through the Internet.,2008/01/08
832,https://www.nytimes.com/2008/01/08/business/08sorkin.html,Questioning an Adviserâ€™s Advice,"If youâ€™re a chief executive under siege, Martin Lipton is the lawyer to call.",2008/01/08
643,http://bits.blogs.nytimes.com/2008/01/08/att-and-other-isps-may-be-getting-ready-to-filter/,AT&T and Other I.S.P.'s May Be Getting Ready to Filter,"UPDATEDFor the last 15 years, Internet service providers have acted - to use an old cliche - as wide-open information super-highways, letting data flow uninterrupted and unimpeded between users and the Internet.",2008/01/08
851,http://dealbook.nytimes.com/2008/01/08/questioning-an-adviser-to-the-imperial-ceo/,Questioning an Adviser to the Imperial C.E.O.,"Editor's note: DealBook's bimonthly column that ran in The New York Times on Sundays is now moving to Tuesday, when it will appear each week on the front of the Business Day section. Below, the first column on the new schedule, which takes a look at Martin Lipton, the influential lawyer known for advising chief executives and boards under siege by shareholders:",2008/01/08
864,https://www.nytimes.com/2008/01/10/technology/10electronics.html,"Fixated on TVs, and Whatâ€™s on Them","TV makers at the Consumer Electronics Show boast their sets are thin, sharp and rich in content.",2008/01/10
666,https://www.nytimes.com/2008/01/10/technology/personaltech/10askk-002.html,VoIP Backups for Power Failures,Is it true that you lose VoIP phone service if thereâ€™s a power failure? What can you do if it happens and you donâ€™t have a mobile phone to fall back on?,2008/01/10
770,http://bits.blogs.nytimes.com/2008/01/10/hd-dvds-fall-like-dominoes/,HD DVDs Fall Like Dominoes,"Nothing has been announced, but Variety is reporting that the last two major studios backing HD DVD - NBC Universal and Paramount - are opening the door for a switch to Blu-ray. These studios have commitments to release some discs this year in HD DVD, but both have ended their exclusive commitment to that format, which is backed by a group led by Toshiba.",2008/01/10
668,http://pogue.blogs.nytimes.com/2008/01/15/the-27-hour-day/,The 27-Hour Day,This e-mail message blew my mind with its logic...,2008/01/15
701,https://www.nytimes.com/2008/01/15/technology/15cnd-apple.html,Apple Unveils Movie Rentals and Thin Notebook,"Apple introduced a new iTunes movie rental service and an ultralight, super-thin Mac notebook.",2008/01/15
688,https://www.nytimes.com/2008/01/16/sports/16philly.html,A New Power Broker Rises in Philadelphia,"Instead of focusing on naming rights or pitching the building for political conventions, Peter Luukkoâ€™s main job is hiring the right people so the Flyers and Sixers can win championships.",2008/01/16
759,https://www.nytimes.com/2008/01/16/technology/16rent.html,Second Leg of Appleâ€™s Plans Includes Jumping Back Into Movie Rentals,Steven P. Jobs is rebooting Appleâ€™s digital movie effort and putting the company squarely in the middle of an intensifying industry battle.,2008/01/16
551,https://www.nytimes.com/2008/01/17/fashion/17Cyber.html,The Day the Internet Stood Still,"Take away my access to e-mail and online databases, and Iâ€™m nothing but a lonely woman sitting in a cold basement.",2008/01/17
268,http://dealbook.nytimes.com/2008/01/18/investor-calls-for-ouster-of-comcast-chief/,Investor Calls for Ouster of Comcast Chief,"Is the performance of Comcast's chief executive, Brian Roberts, a ""Comcastrophe""?",2008/01/18
705,https://www.nytimes.com/2008/01/22/business/media/22adnewsletter3.html,People and Accounts of Note,Webdenda.,2008/01/22
792,https://www.nytimes.com/2008/01/23/business/media/23adco.html,Product Placement on Reality TV Seems Somehow More Realistic,It is typically easier to weave a product into an episode of a reality show like â€œAmerican Idolâ€ than into a scripted series like â€œGreyâ€™s Anatomyâ€ or â€œTwo and a Half Men.â€,2008/01/23
695,https://www.nytimes.com/2008/01/23/sports/hockey/23versus.html,Versus Extends Contract With N.H.L.,"Buoyed by higher ratings this season, Versus has agreed to carry N.H.L. games through the 2010-11 season.",2008/01/23
628,http://dealbook.nytimes.com/2008/01/24/opportunists-said-to-be-circling-yahoo/,Opportunists Said to Be Circling Yahoo,"While Yahoo's co-foundersm Jerry Yang and David Filo, may not want to sell the struggling Internet company, its stock price is so low that the duo may not be able to fend off a takeover offer without compromising their fiduciary duty to shareholders, according to The New York Post.",2008/01/24
536,http://mediadecoder.blogs.nytimes.com/2008/01/30/imus-closer-to-a-return-to-tv/,Imus Closer to a Return to TV,"Patrick Gottsch, the founder and president of RFD-TV, a cable channel that carries Don Imus's show ""but primarily chronicles life in rural America, said on Wednesday morning that he had signed an affiliation agreement with Comcast, the nation's largest cable operator,"" Jacques Steinberg reports.",2008/01/30
519,http://mediadecoder.blogs.nytimes.com/2008/01/30/growing-demand-for-video-on-demand/,Growing Demand for Video on Demand,"LAS VEGAS -- Video on demand, as popularized by HBO and the major cable operators, doesn't have the cachet of online video but is increasingly gaining viewers, said Matthew Strauss, the senior vice president for new media at Comcast Cable, at a panel discussion at the National Association of Television Program Executives conference on Tuesday.",2008/01/30
768,https://www.nytimes.com/2008/01/30/technology/30yahoo.html,"Yahoo to Cut 1,000 Jobs, and Warns on Growth","Despite the disappointing outlook, the company said it planned to invest aggressively in advertising technology as it tries to capture a larger share of online ad dollars.",2008/01/30
524,https://www.nytimes.com/2008/01/31/arts/31arts-IMUSMARCHESO_BRF.html,Imus Marches On,"Viewers in Washington, Boston, Chicago and San Francisco, among other big cities, moved a step closer on Wednesday to watching the simulcast of the Don Imus morning radio show on RFD-TV, a cable channel. Patrick Gottsch, the founder and president of RFD, which primarily chronicles life in rural America, said that he had signed an affiliation agreement with Comcast. With the agreement RFD-TV is authorized to begin negotiations with individual Comcast cable systems. Comcast is available in more than 24 million households. While RFD-TV is available in 30 million homes, many are in towns and small cities outside the Northeast; the exception are those that receive the channel via satellite. Jenni Moyer, a Comcast spokeswoman, confirmed the deal. In signing Mr. Imus last year after his firing by CBS Radio and MSNBC over a racial remark, Mr. Gottsch was hoping that Mr. Imus would become a lure for big-city cable operators. RFD is seeking a similar agreement with Time Warner Cable, which has systems in New York City and Los Angeles.",2008/01/31
828,https://www.nytimes.com/2008/02/02/technology/02yahoo.html,"Eyes on Google, Microsoft Bids $44 Billion for Yahoo","If consummated, the deal would instantly redraw the competitive landscape on the Internet and escalate the battle between Microsoft and Google.",2008/02/02
799,http://dealbook.nytimes.com/2008/02/04/google-works-to-foil-microsofts-yahoo-bid/,Google Works to Foil Microsoft's Yahoo Bid,Standing between a marriage of Microsoft and Yahoo may be the technology behemoth that has continually outsmarted them: Google.,2008/02/04
642,https://www.nytimes.com/2008/02/04/business/media/04espn.html,ESPN to Offer Sports Events on the Web Free to Some,The networkâ€™s charge for access to content over the Internet has been troubling.,2008/02/04
600,http://dealbook.nytimes.com/2008/02/04/who-would-want-aol-now/,Who Would Want AOL Now?,AOL is looking pretty lonely these days.,2008/02/04
619,http://bits.blogs.nytimes.com/2008/02/05/verizon-rejects-hollywoods-call-to-aid-piracy-fight/,Verizon Rejects Hollywood's Call to Aid Piracy Fight,"More often than not companies in similar positions have similar views. But when Hollywood asked the two big phone companies to help with its fight against piracy, they responded in opposite ways. AT&T, as we wrote, is talking about developing a system that would identify and block illicitly copied material being sent over its broadband network.",2008/02/05
700,http://dealbook.nytimes.com/2008/02/05/fading-prospects-for-a-white-knight-for-yahoo/,Fading Prospects for a White Knight for Yahoo,"If Yahoo's chief executive, Jerry Yang, is expecting a white knight to help him keep the company from being frog-marched down the aisle with Microsoft, he shouldn't put his hopes on the private equity quarter, according to industry observers.",2008/02/05
641,https://www.nytimes.com/2008/02/11/business/11ahead.html,This Weekâ€™s Major Business Events,A look at some of this weekâ€™s major business events coming this week.,2008/02/11
591,http://dealbook.nytimes.com/2008/02/12/hostility-by-the-numbers/,Hostility by the Numbers,"As analysts and investors try to handicap Microsoft&#8217;s chances of clinching Yahoo, we thought it was a good time to consider the track record for large, hostile bids.",2008/02/12
664,https://www.nytimes.com/2008/02/14/technology/14cnd-yahoo.html,Yahoo Chief Explains Rejection of Microsoft Bid,Jerry Yang explained his companyâ€™s rejection of Microsoftâ€™s buyout offer in a letter to shareholders late Wednesday outlining why he believed the bid was too low.,2008/02/14
711,http://dealbook.nytimes.com/2008/02/14/yahoo-makes-its-case-to-shareholders/,Yahoo Makes Its Case to Shareholders,"In what may be a sign that its investor base is growing restless, Yahoo sent a letter from its chief executive, Jerry Yang, to shareholders Wednesday explaining the Web company's decision to turn down a takeover offer from Microsoft and laying out its turnaround strategy.",2008/02/14
691,http://fifthdown.blogs.nytimes.com/2008/02/15/inspector-specter-the-honest-broker/,Inspector Specter,"After the embarrassing episode on Capitol Hill on Wednesday, when many members of Congress seemed to take sides on the Clemens-McNamee affair based on party affiliation instead of on the merits of the case, N.F.L. fans are fortunate that they have an impartial arbiter looking into the N.F.L. spying scandal.",2008/02/15
820,https://www.nytimes.com/2008/02/16/technology/16shortcuts.html,All-in-One Telecom Packages: The Savings Donâ€™t Come Simple,"â€œBundlingâ€ sounds sweet, doesnâ€™t it? Like swaddling a baby. But donâ€™t let it fool you â€” the communications version of it is not such a simple pleasure.",2008/02/16
865,https://www.nytimes.com/2008/02/19/technology/19shortcutscomm.html,Readersâ€™ Responses,"Excerpts of reader responses to Alina Tugendâ€™s Feb. 16 Shortcuts column on whether to buy cable television, high-speed Internet and telephone service in a package from one company.",2008/02/19
582,http://thelede.blogs.nytimes.com/2008/02/21/stopping-one-avalanche-but-missing-another/,Stopping One Avalanche but Missing Another,"NOTES ON THE NEWS Spam filters mistakenly hold back important e-mails all the time, but this particular instance reported by The Denver Post stopped an electronic avalanche while leaving Coloradans in the dark about a real one:",2008/02/21
849,https://www.nytimes.com/2008/02/21/technology/personaltech/21pogue.html,Web Movies Show Why DVDs Sell,The Internet movie download era may be more distant than you think.,2008/02/21
513,https://www.nytimes.com/2008/02/25/technology/25cnd-fcc.html,F.C.C. to Act on Delaying of Broadband Traffic,The agency is considering new rules that would force the cable and telephone companies to more clearly disclose to consumers the circumstances in which they might delay some traffic.,2008/02/25
508,http://bits.blogs.nytimes.com/2008/02/25/net-neutrality-hearing-when-is-an-internet-traffic-delay-ok/,Net Neutrality Hearing: When Is an Internet Traffic Delay O.K.?,UPDATED,2008/02/25
839,https://www.nytimes.com/2008/02/25/business/media/25dvd.html,Studios Are Trying to Stop DVDs From Fading to Black,"The victory of Sonyâ€™s new Blu-ray high-definition disc over a rival format, Toshibaâ€™s HD DVD, masks a problem facing the studios: the overall decline of the DVD market.",2008/02/25
634,http://dealbook.nytimes.com/2008/02/26/regulator-approves-libertys-directv-deal/,Regulator Approves Liberty's DirecTV Deal,The media mogul John C. Malone could soon be back in the business of delivering TV signals to consumers-this time via satellite.,2008/02/26
514,https://www.nytimes.com/2008/02/26/technology/26fcc.html,F.C.C. Weighing Limits on Slowing Web Traffic,The commission is considering taking steps to discourage cable and telephone companies from delaying the downloads and uploads of heavy Internet users.,2008/02/26
512,https://www.nytimes.com/2008/02/27/sports/basketball/27sandomir.html,Hoops Hybrid Being Molded Into a League,The hybrid basketball-gymnastics extreme sport that had a short life on Spike in 2002 and 2003 is being resurrected for a â€œshowcaseâ€ season to be taped in June.,2008/02/27
689,https://www.nytimes.com/2008/03/03/business/apee-cable.html,Cable Executives Lose Last Appeal in Fraud Case,"John Rigas, the Adelphia Communications founder, and his son, Timothy, lost their final appeal of their convictions for fraud that led to the collapse of the cable television company.",2008/03/03
694,http://dealbook.nytimes.com/2008/03/03/morgan-stanley-dives-into-hostile-offers/,Morgan Stanley's Hostile Tendencies,"In journalism, three examples usually makes a trend. By that rule, Morgan Stanley has hopped onto the hostile bid bandwagon.",2008/03/03
690,https://www.nytimes.com/2008/03/06/sports/football/06nfl.html,Raiders Continue to Add to Offense,The Oakland Raiders have agreed to terms with the former Pro Bowl receiver Javon Walker and the free-agent offensive tackle Kwame Harris.,2008/03/06
588,http://mediadecoder.blogs.nytimes.com/2008/03/06/weather-channel-bids-due-friday/,Weather Channel Bids Due Friday,Andrew Ross Sorkin reports:,2008/03/06
595,https://www.nytimes.com/2008/03/06/business/media/06deal.html,Deadline Nears for Weather Channel Bids,"A half-dozen media companies have signaled that they plan to bid for the Weather Channel, which is up for auction, people involved in the talks said Wednesday.",2008/03/06
580,http://dealbook.nytimes.com/2008/03/06/big-name-companies-line-up-for-weather-channel/,Big Names Line Up for Weather Channel,"A half-dozen media companies have signaled that they plan to bid for the Weather Channel, which is up for auction, according to The New York Times.",2008/03/06
629,http://mediadecoder.blogs.nytimes.com/2008/03/07/nbc-still-looking-for-an-open-receiver-for-friday-night-lights/,NBC Still Looking for an Open Receiver for 'Friday Night Lights',"NBC says a deal has not been reached yet. And DirecTV has no comment. But fans of ""Friday Night Lights"" are hopeful that the rumors of a third season deal for the football drama are true.",2008/03/07
924,https://www.nytimes.com/2008/03/09/theater/09gree.html,"Enter the Boosters, Bearing Theaters",In recent years many of the 75 companies that form the League of Resident Theaters have joined what amounts to a nonprofit theatrical building boom.,2008/03/09
566,http://dealbook.nytimes.com/2008/03/10/giant-realm-reels-in-35-million/,Giant Realm Reels In $3.5 Million,Giant Realm has raised $3.5 million to expand its entertainment Web site for young male adults.,2008/03/10
576,http://mediadecoder.blogs.nytimes.com/2008/03/10/the-purpose-of-project-canoe/,The Purpose of 'Project Canoe',Tim Arango reports:,2008/03/10
673,https://www.nytimes.com/2008/03/10/business/media/10cable.html,Cable Firms Join Forces to Attract Focused Ads,The nationâ€™s six largest cable companies are planning a jointly owned company that would allow national advertisers to buy customized ads across their systems.,2008/03/10
763,http://bits.blogs.nytimes.com/2008/03/10/where-every-ad-knows-your-name/,Where Every Ad Knows Your Name,"Just how personal can advertising from the Web giants get? That's a question you may be wondering after reading my article in Monday's Times and the related blog post. With big Internet companies, which already have a lot of data about users, moving into the ad network business, is every ad you see on the Internet going to reflect what you have been doing and reading about lately.",2008/03/10
696,https://www.nytimes.com/2008/03/11/business/media/11hulu.html,"Testing Over, Hulu.com to Open Its TV and Film Offerings This Week","The streaming-video site displays free, ad-supported shows and feature films from NBC, Fox and more than 50 media companies.",2008/03/11
835,https://www.nytimes.com/2008/03/12/technology/12inertia.html,Techâ€™s Late Adopters Prefer the Tried and True,Millions of people are reluctant to change their technology habits just for the sake of progress.,2008/03/12
217,http://dealbook.nytimes.com/2008/03/14/the-choice-facing-comcasts-roberts/,The Choice Facing Comcast's Roberts,"It has been four years since Comcast, the cable company, abandoned its hostile bid for Walt Disney. So when is Brian L. Roberts, Comcast's chief executive, going to start striking deals again?",2008/03/14
611,http://dealbook.nytimes.com/2008/03/20/mgm-backers-said-to-question-studios-strategy/,MGM Backers Said to Question Studio's Strategy,"Metro-Goldwyn-Mayer Chairman and Chief Executive Harry Sloan's plan to rebuild a full-fledged movie studio is not sitting well with the private equity firms backing the studio, according to The New York Post.",2008/03/20
573,https://www.nytimes.com/2008/03/22/business/22online.html,The Thin Skin of Apple Fans,Introducing even a hint of negativity into a review or article will bring down the wrath of Appleâ€™s most fanatical fans.,2008/03/22
220,http://bits.blogs.nytimes.com/2008/03/31/comcasts-blurry-high-definition-picture/,Comcast's Blurry High Definition Picture,"Not only has Comcast been slowing down Internet users exchanging files with the BitTorrent protocol, it has been quietly reducing the quality of some high definition television networks it carries as well.",2008/03/31
623,https://www.nytimes.com/2008/03/31/business/media/31carr.html,"We Want It, and Waiting Is No Option","The Web empowers both groups and individuals as a place where choice is not only an option, but an imperative.",2008/03/31
648,http://slapshot.blogs.nytimes.com/2008/04/01/blackhawks-to-televise-all-games-join-20th-century/,"Blackhawks to Televise All Games, Join 20th Century","For decades, the Chicago Blackhawks were ridiculed both in the Windy City and around the sports world for refusing to televise their home games. Former owner Bill Wirtz reasoned that TV would keep fans away from Chicago Stadium and then the United Center, which would not only erode ticket sales, but also the parking and concession businesses, which Wirtz controlled. Critics pointed out that Wirtz's obstinance cost him a chance to get potential fans to sample the games, which would lead to better home attendance, but he never budged.",2008/04/01
234,http://bits.blogs.nytimes.com/2008/04/02/comcast-to-bring-speedier-internet-to-st-paul/,Comcast to Bring Speedier Internet to St. Paul,"Minnesota sports teams are not known for coming in first. But the Twin Cities are now out in front in at least one respect: Comcast plans to announce Thursday that it is beginning the introduction of a new broadband Internet technology in the Minneapolis-St. Paul region, starting this week.",2008/04/02
568,http://mediadecoder.blogs.nytimes.com/2008/04/07/how-nbc-and-directv-kept-friday-night-lights-alive/,How NBC and DirecTV Kept 'Friday Night Lights' Alive,"Last week's deal between NBC and DirecTV, a subscription satellite television service, to keep ""Friday Night Lights"" on the air could become a model for other television shows, today's New York Times reports.",2008/04/07
722,https://www.nytimes.com/2008/04/07/business/media/07direct.html,DirecTV Deal Will Subsidize â€˜Friday Night Lightsâ€™,"Television executives say this model, whereby a subscription television service gets rights to broadcast a show first, could help keep other sentimental favorites on the air.",2008/04/07
665,https://www.nytimes.com/2008/04/12/sports/football/12sandomir.html,Gumbel Resigns From NFL Network,Bryant Gumbel resigned from the NFL Network on Friday after two seasons in which his skills as a play-by-play announcer did not match his talent as a studio host.,2008/04/12
555,http://mediadecoder.blogs.nytimes.com/2008/04/15/are-you-among-the-21-million/,Are You Among the 21 Million?,"LAS VEGAS -- When broadcasting executives say they will ""leave no TV set behind"" - which they do often here at the National Association of Broadcasters' annual show -- the slogan elicits some quiet chuckles from the audience.",2008/04/15
202,http://bits.blogs.nytimes.com/2008/04/17/comcasts-concession-to-net-neutrality/,Comcast's Concession to Net Neutrality,"On Tuesday afternoon, Comcast put out a vague, jargon-filled news release about working to create a ""Bill of Rights and Responsibilities"" for users of peer-to-peer file-sharing software. The release has prompted no shortage of criticism on blogs.",2008/04/17
254,http://mediadecoder.blogs.nytimes.com/2008/04/17/comcast-hires-consultant-to-improve-sports-channels/,Comcast Hires Consultant to Improve Sports Channels,"Richard Sandomir reports: Comcast is turning to Mike Weisman, a 35-year veteran of sports producing, to ""improve the quality of its national sports networks -- the Golf Channel and Versus -- and its eight regional sports networks and two channels devoted to the Mountain West Conference and southeastern regional sports.""",2008/04/17
483,http://bits.blogs.nytimes.com/2008/04/17/the-raggie-grannies-greet-the-fcc/,The Raging Grannies Greet the F.C.C.,Robert Topolski simply wanted to share digital recordings of barber shop quartets with his buddies.,2008/04/17
658,https://www.nytimes.com/2008/04/18/pageoneplus/corrections.html,Corrections: For the Record,FRONT PAGE.,2008/04/18
530,https://www.nytimes.com/2008/04/18/sports/18Correction-04.html,Corrections: For the Record,"A summary in some editions on Thursday of an online article about Comcastâ€™s decision to hire the veteran producer Mike Weisman to improve its national sports networks described the personnel move incorrectly. He was hired as a consultant; he was not hired â€œaway from NBC,â€ where he remains under contract.",2008/04/18
797,http://slapshot.blogs.nytimes.com/2008/04/22/the-morning-skate-oodles-of-euros-and-montreal-is-burning/,"The Morning Skate: Oodles of Euros, and Montreal is Burning","When it's down to one game, anything can happen. This fantastically entertaining first round of the Stanley Cup playoffs concludes tonight with a pair of Game 7's, and the Orange Army fan base worldwide is being placed on suicide-watch after the revival of Ovechkin and the Flyers' failure last night to take out the Caps for the second time in three days -- this time blowing a two-goal lead on home ice.",2008/04/22
640,https://www.nytimes.com/2008/04/22/sports/baseball/22marzano.html,"John Marzano, Catcher and Analyst, Dies at 45","The former catcher became known to avid baseball fans as the co-host of â€œLeading Off,â€ the weekday morning analysis of the prior dayâ€™s games on MLB.com.",2008/04/22
677,https://www.nytimes.com/2008/04/28/technology/28cnd-warner.html,WB Network Returns as a Web Site,"Warner Brothers hopes to find an online audience for its programs, particularly with young women.",2008/04/28
678,https://www.nytimes.com/2008/04/29/business/media/29warner.html,WB Network to Return as a Web Site,The launch of TheWB.com and KidsWB.com is part of TimeWarnerâ€™s â€œdigital destinationâ€ strategy to tailor Web sites to specific audiences.,2008/04/29
747,http://cityroom.blogs.nytimes.com/2008/04/29/verizon-moves-closer-to-joining-citys-tv-market/,Verizon Takes a Step Into City's TV Market,"For years, New Yorkers frustrated with their cable television have dreamed of unplugging Cablevision and Time Warner Cable. The problem has always been where else to go. The two companies have been the main options in most of Manhattan and other densely populated parts of the city where satellite television - the most logical alternative - is hard to hook up.",2008/04/29
674,http://bits.blogs.nytimes.com/2008/04/30/warner-brothers-to-rent-movies-online-sooner/,Warner Brothers To Rent Movies Online Sooner,"There was good news for Apple and Comcast, but bad news for Blockbuster woven into Time Warner's conference call with investors today.",2008/04/30
730,https://www.nytimes.com/2008/04/30/nyregion/30verizon.html,"Verizon May Soon Join Local TV Market, Adding a Cable Option","The telecommunications company is one step closer to adding cable service, which could spur more competition and yield better service for local customers.",2008/04/30
