,link,headline,summary,date
183,http://query.nytimes.com/gst/fullpage.html?res=9A07E3D6163CF934A35754C0A9649D8B63,Comcast Said to Be Near Sale of A&E Stake,"Comcast is close to selling its stake in the A&E cable networks, which would bring in nearly $3 billion for just 15 percent of the company, an executive briefed on the negotiations said Friday. The deal, first reported in The New York Post, has been in the works for many months, and now awaits approval from banks involved in lending the money.",
857,http://query.nytimes.com/gst/fullpage.html?res=9D0DE5DE103EF931A15751C0A9649D8B63,Inside the Times,International CHáVEZ SAYS HIS CANCER,
644,http://query.nytimes.com/gst/fullpage.html?res=9C01EFD9133AF93AA35756C0A9649D8B63,Profit Grows 21% at Disney on Cable TV Gains and a Surge in Resorts Business,"LOS ANGELES - Climbing ad sales and subscription fees at ESPN and cable channels like ABC Family helped the Walt Disney Company increase its quarterly profit by 21 percent from a year earlier, to $1.14 billion. Disney's financial results, reported on Tuesday afternoon, also carried an optimistic message about consumer confidence from its sprawling theme park operation - a sharp contrast to last week's downbeat job growth and retail sales reports. Operating income at Walt Disney Parks and Resorts, watched as a barometer of the broader economy, surged 53 percent, to $222 million.",
1378,http://query.nytimes.com/gst/fullpage.html?res=9F04E4D6123AF932A15750C0A9679D8B63,AT&T Makes Deal To Buy T-Mobile For $39 Billion,"12:16 a.m. | Updated AT&T announced on Sunday that it had agreed to buy T-Mobile USA from Deutsche Telekom for $39 billion, in a deal that would create the largest carrier in the nation and promised to reshape the industry. The transaction - one of the largest since the onset of the financial crisis - is expected to start a fierce battle in Washington as regulators scrutinize the impact of the deal on competition and consumers. The deal would leave just three major cellular companies in the country: AT&T, Verizon and the much smaller Sprint Nextel.",
1379,http://query.nytimes.com/gst/fullpage.html?res=9504E4D61630F934A15752C1A9679D8B63,Dreary Browns Test Patience,"Browns (4-6) at Bengals (6-4) Sunday, 1 p.m. Line: Bengals by 8.5 . The Talking Heads once sang that heaven is a place where nothing ever happens. Heaven, then, is a Browns game, a nonevent between moribund teams with few recognizable stars that ends in a 6-3, 13-12, or 14-10 final score. When not losing convincingly to good teams, the Browns challenge the devotion and attention span of fans everywhere by wasting whole afternoons in slow-motion tugs of war against fellow thrill ascetics. It takes real work to comb through the game tape and play-by-play of an entire Browns-Jaguars game, only to discover that the only quasi-interesting story lines are questions about whether a 38-yard field goal sailed just inside the right upright (it didn't) or if Jack Del Rio could explain the final Jaguars play call that gave the Browns a victory (he couldn't). Bengals games, by contrast, are full of action. The Bengals catch bombs and allow bombs. Andy Dalton completes incredible passes and attempts ill-conceived option pitches on the same drive. Defenders tackle receivers by pulling their hair. Pacman Jones has been on the roster for weeks and has done nothing loopy yet, which means that he is due. The Bengals are just good enough to lose to the Ravens and the Steelers, but they are a cut above the teams that get trapped in the Browns' tar pits. The Bengals' 27-17 victory at Cleveland in Week 1 will repeat itself, if only because the Browns are too boring to try something new. Pick: Bengals.",
1272,http://query.nytimes.com/gst/fullpage.html?res=9806E3DC113CF937A35757C0A9679D8B63,"A Return, of Sorts, to NBC","As always in the entertainment industry, business is business - and so, Ben Silverman is back in business with NBC. Mr. Silverman is best remembered for his brief reign as NBC's top programmer, one that did not result in hits or happiness for either party. In the aftermath of the departure, Jeff Zucker, then the network's chief executive, said hiring Mr. Silverman had been the biggest mistake he made.",
714,http://query.nytimes.com/gst/fullpage.html?res=9806E2D91131F934A2575AC0A9649D8B63,Series of Select Guests To Highlight iVillage,"It might take a village to turn NBC around. Or, at least, an iVillage. NBCUniversal's female-oriented Web site, iVillage.com, has lined up a string of prominent ""guest editors"" who will handpick content on the site and appear in recorded vignettes. The media company plans to use that content not just on iVillage, but in sponsored video clips to appear on its cable channels and potentially on the struggling broadcast channel.",
1271,http://query.nytimes.com/gst/fullpage.html?res=9500E4D7103EF937A25753C1A9669D8B63,An Abrupt Halt to a Highflying Career in Finance,"By MICHAEL J. de la MERCED On Tuesday night, Steven L. Rattner was surrounded by an assemblage of stars from the financial and media worlds at the Four Seasons restaurant in Manhattan. Chief executives and powerful politicians had gathered to celebrate his new book on the restructuring of the American auto industry.",
569,https://www.nytimes.com/interactive/technology/20130204-billion-interactive.html,Billion-Dollar Ideas,A look at a few markets in the technology industry that are creating numerous billion-dollar companies.,
215,http://query.nytimes.com/gst/fullpage.html?res=9803E2DD153BF930A35756C0A9649D8B63,Earnings at Comcast Exceed Analysts' Expectations,"One year after taking control of NBCUniversal, Comcast posted a quarterly profit on Wednesday that exceeded analyst expectations and signaled progress at the struggling NBC broadcast network. Comcast, which is the largest cable provider in the United States, also showed strong growth in its broadband business as Americans sought faster Internet connections. But some investors said they were disappointed by continued declines in the company's core cable television business.",
567,http://query.nytimes.com/gst/fullpage.html?res=9F0DE7DA103CF931A35757C0A9649D8B63,Removing a Limit On Streaming,"12:35 p.m., March 31 | Updated Adding statement from Comcast at end. Comcast said recently that a video-streaming service it will provide to Xbox consoles would not count toward its customers' monthly data limits. The cable company's move is raising concerns about net neutrality, the idea that Internet providers should treat all services equally to keep competition fair.",
565,http://query.nytimes.com/gst/fullpage.html?res=9E07E6DB173FF93AA25752C0A9679D8B63,Comcast Receives Approval For NBC Universal Merger,"6:00 p.m. | Updated The proposed combination of Comcast and NBC Universal was approved by the Federal Communications Commission and the Justice Department on Tuesday, smoothing the way for the deal to close by the end of January. As expected, the approvals came with significant conditions attached. The combination of Comcast's cable systems and NBC Universal's channels will create a media powerhouse, and it will represent the first time that a cable company will control a major broadcast network.",
867,http://query.nytimes.com/gst/fullpage.html?res=9B07E4DF163DF93BA3575AC0A9679D8B63,DealBook Online,"WHERE ARE THE WOMEN? Women -- always a rare breed in the upper echelons of Wall Street -- are looking like an endangered species in the executive suite of big banks. With the departure of Sallie Krawcheck, left, from Bank of America, only a handful of women still report directly to the bank's chief executive, Brian T. Moynihan. It is a long-running theme across Wall Street, with the plum spots in investment banking and brokerage firms typically held by men. All told, women account for just 2.7 percent of the chief executives in the financial industry and 16.8 percent of the executive officers, according to a study by Catalyst.",
888,http://query.nytimes.com/gst/fullpage.html?res=9E05EFD8123FF931A35757C0A9649D8B63,Dispute Blocks Channels For DirecTV Customers,"Some DirecTV customers woke up on Sunday without Fox or the CW networks on their television sets, the result of a failed negotiation with Tribune Broadcasting, which owns or operates 23 television stations across the United States. The blackout effects stations in 19 markets, including New York, where Tribune owns the CW network affiliate WPIX; Philadelphia, where it owns MyNetworkTV affiliate WPHL; Chicago, where it owns CW affiliate WGN-TV; Los Angeles, where it owns CW affiliate KTLA; and Seattle, where it owns Fox affiliate KCPQ. It also effects WGN America, a version of WGN-TV that is available on cable and satellite systems in many parts of the country.",
99,https://www.nytimes.com/video/multimedia/100000002877612/att-in-talks-to-buy-directv.html,AT&T in talks to buy DirecTV,The potential combination of AT&T and DirecTV would produce a behemoth that would rival the proposed Comcast-Time Warner Cable merger in total subscribers. Fred Katayama reports.,
1251,http://query.nytimes.com/gst/fullpage.html?res=9B04E6D71E31F932A35754C0A9679D8B63,Journalist Suspended From MSNBC for Profane Disparagement of President,"3:41 p.m. | Updated MSNBC suspended one of its best-known political analysts, Mark Halperin, on Thursday morning after he directed a derogatory comment at President Obama on the channel's morning show, ''Morning Joe.'' Sitting on the set of ''Morning Joe,'' Mr. Halperin smiled mischievously as he disparaged Mr. Obama's behavior at a news conference a day earlier. ''I thought he was kind of a dick yesterday,'' Mr. Halperin said.",
230,https://www.nytimes.com/Link.asp?I=LS000167109687,"Paid Notice: Deaths MOSS, JOSEPH H.","<!-- JOSEPH H. MOSS -->MOSS--Joseph H., age 94, peacefully passed away in Hobe Sound, FL on June 29, 2013. Son of late restaurateur/host Joe Moss and the late Octavine Ware. For info: joemoss@comcast.net<br><br>",
231,http://query.nytimes.com/gst/fullpage.html?res=9B04E5D9123AF931A1575AC0A9659D8B63,"Paid Notice: Deaths MOSS, JOSEPH H.","MOSS--Joseph H.,age 94, peacefully passed away in Hobe Sound, FL on June 29, 2013. Son of late restaurateur/host Joe Moss and the late Octavine Ware. For info: joemoss@comcast.net",
904,http://query.nytimes.com/gst/fullpage.html?res=9F05E0DD1F39F936A15752C0A9649D8B63,The Weather Channel Replaces Its Chief,"The Weather Channel Companies, which owns the Weather Channel, replaced its leadership on Tuesday, and named the digital advertising veteran David Kenny its chairman and chief executive. Mr. Kenny will start immediately. Michael J. Kelly, who had been the chief executive since 2009, will become a special adviser to the company and an adviser to Bain Capital, the private equity firm that co-owns the company with the Blackstone Group and Comcast's NBCUniversal. The surprise change signaled a desire on the part of the co-owners to expand the Weather Channel's digital and mobile businesses more quickly. Through mobile apps and Web sites like Weather.com, the company sees an opportunity to have a much bigger international footprint. ''Six and a half billion people need information about weather,'' Mr. Kenny said in an interview Tuesday after addressing the company's staff in Atlanta. Mr. Kenny also said that the company would make more investments in long-form programming - part of a gradual move away from live weather news and toward taped weather-related reality shows. ''Now that people can get the information they need for their forecast off the Web, and certainly on their mobile phone, that gives us more license to do more long-form on the cable channel,'' he said. The channel remained committed to live news during severe weather, he added. Mr. Kenny, a member of the board of directors of Yahoo, was the president of Akamai until he stepped down last October. He was previously the co-founder of VivaKi, a digital agency that is part of the Publicis Groupe. In a statement, the three co-owners of the Weather Channel said that Mr. Kenny's experience ''gives him a deep understanding of the TV and digital business, and he has the leadership experience and vision to drive global initiatives across all platforms.'' Mr. Kelly, similarly, had a digital media background when he was hired two and a half years ago. Mr. Kenny said he was initially recruited to join the board of the company, and was later asked by the board to consider the chief executive position. ''What I've long stood for is convergence,'' he said. ''I think you'll see us find better ways to run the Weather Channel as one company, really organized around our hundreds of millions of users.'' NBCUniversal and the private equity firms have owned the Weather Channel since 2008. This is a more complete version of the story than the one that appeared in print.",
915,http://query.nytimes.com/gst/fullpage.html?res=9505EEDD153AF93AA25751C1A9679D8B63,The Queen of Cable TV,"Early in Bonnie Hammer's first stint running a cable network, she knew something was wrong. The SciFi channel was emerging as a destination for fans of the genre, largely on her strategy of reviving the mini-series. But looking at the first day of shooting ''Taken,'' an alien abduction series with what then was the outrageous budget of $40 million, she knew the lead child actress was not strong enough. She pushed the show's studio, Dreamworks, and its renowned producer, Steven Spielberg, for a different actress.",
1234,http://query.nytimes.com/gst/fullpage.html?res=9C0CE5DB1730F937A25751C1A9669D8B63,Yale Dean Is Awarded Architecture Prize,"At a time when contemporary architecture tends to get most of the attention, at least one award recognizes classicism. Robert A. M. Stern, the dean of the Yale School of Architecture, has been named the 2011 recipient of the Richard H. Driehaus Prize for Classical Architecture. Established in 2003 through the University of Notre Dame School of Architecture, the prize honors the practitioners of traditional, classical, sustainable architecture and urbanism. Mr. Stern will receive $200,000 and a model of the Choregic Monument of Lysikrates at a March 26 ceremony in Chicago.",
926,http://query.nytimes.com/gst/fullpage.html?res=9904E4D8123DF937A25754C0A9679D8B63,Knicks Drop Two Scouts,"Two Knicks scouts, including one who was disciplined for illegal workouts, are being dismissed this month after their contracts expire. Rodney Heard, the Knicks' director of East Coast scouting, was fined $20,000 in February after an investigation by Yahoo Sports revealed the illegal workouts. The Knicks were fined $200,000. Although Heard was not fired at the time, his dismissal was considered an inevitability.",
1400,http://query.nytimes.com/gst/fullpage.html?res=9801E6D91739F931A15751C1A9669D8B63,F.C.C. Faces Challenges To Net Rules,"8:52 p.m. | Updated Want to watch hours of YouTube videos or sort through Facebook photos on the computer? Your Internet providers would be forbidden from blocking you under rules approved by the Federal Communications Commission on Tuesday. But if you want to do the same on your cellphone, you may not have the same protections. The debate over the rules, intended to preserve open access to the Internet, seems to have resulted in a classic Washington solution - the kind that pleases no one on either side of the issue. Verizon and other service providers would prefer no government involvement. Public interest advocates think the rules stop far short of ensuring free speech. Some Republicans believe the rules are another instance of government overreach.",
252,http://query.nytimes.com/gst/fullpage.html?res=9800E3DA1338F93AA35750C0A9649D8B63,Comcast Decides Not to Offer Netflix Access to Its Subscribers,"Netflix may have hit a snag as it negotiates with cable operators. Comcast, the country's largest cable company, says it has no interest in offering Netflix to its Xfinity subscribers regardless of whether it's in the form of an on-demand service or a billing partnership.",
72,https://www.nytimes.com/video/business/100000002709372/no-break-up-fee-in-cable-deal.html,No Break-Up Fee in Cable Deal,"Responding to a question about a break-up fee, Rob Marcus, the chief of Time Warner Cable, told Andrew Ross Sorkin that the deal should clear regulatory hurdles.",
254,http://query.nytimes.com/gst/fullpage.html?res=9901E1D7163FF935A25751C0A9649D8B63,Net Income At Comcast Gains 26%,"A decline in the number of customers canceling their cable service coupled with additional high-speed Internet subscriptions contributed to a 26.4 percent increase in quarterly net income at Comcast, the nation's largest cable provider. In the three months that ended Dec. 31, the company said Wednesday, Comcast generated $1.29 billion in net income, up from $1.02 billion in the same period in 2010.",
931,http://query.nytimes.com/gst/fullpage.html?res=9F01E2DD1E3FF932A25757C0A9679D8B63,"Holocaust Memories, via Cable","Comcast, the nation's top cable company, is distributing 10 films about the Holocaust in a public service project it is calling ''Days of Remembrance.'' And it started with an unrelated telephone call to the director Steven Spielberg. The person calling Mr. Spielberg last year was Brian L. Roberts, the chief executive of Comcast, which was acquiring NBCUniversal. Mr. Roberts had visited the Universal Studio lot, the location of Mr. Spielberg's office, but had not had a chance to see him.",
1406,http://query.nytimes.com/gst/fullpage.html?res=9907E1DC153BF93BA15757C0A9679D8B63,"As Buds Open, So Do Doors","THE season of spring is also the season of house tours, when long-closed doors and garden gates unfurl like flowers for a quick peek. Throughout the Northeast and beyond, there are mansions, studio apartments, bungalows and row houses to suit every taste, filled with antique china and contemporary paintings, stainless steel stoves and iron-grilled fireplaces, and parquet floors and historic wallpaper. Show houses remain open for a few weeks, but some house and garden tours slip by in an afternoon -- unless otherwise noted, all events are self-guided. SHELLY FREIERMAN NEW YORK CITY",
742,http://query.nytimes.com/gst/fullpage.html?res=9A07EEDB163DF931A35754C0A9649D8B63,New Movie Marketing Cachet: An Amusement Park Ride,"LOS ANGELES - Success in Hollywood can be measured in any number of ways: box-office grosses, the number of assistants you employ ... the size of your theme park ride. John Lasseter, Pixar's chief creative officer, now has an entire ''land'' devoted to his ''Cars'' movies - 12 acres in all at a Disney park called California Adventure. James Cameron and Disney are working on a similar size ''Avatar'' land in Orlando. You can almost hear the grumbling from George Lucas, who has a Disney ride based on his ''Star Wars'' films: James Cameron gets an entire land?",
895,http://query.nytimes.com/gst/fullpage.html?res=9402E6DD113EF93BA35757C0A9649D8B63,Extra Bases: Balancing Act Helps Giants Spread Wealth,"One reason the San Francisco Giants sell out every game, said their chief executive, Larry Baer, is that fans relate to the different personalities on the roster. The eccentric ones stand out most: Brian Wilson is the raging, bearded closer; Pablo Sandoval is the jovial panda of a third baseman; Tim Lincecum is the little, long-haired ace. Matt Cain, meanwhile, is the ''nose-to-the-grindstone guy,'' Baer said. Cain is the unassuming right-hander from Tennessee - bright enough to be the team's union representative at 24, loyal enough to sign a contract extension before free agency.",
1277,http://query.nytimes.com/gst/fullpage.html?res=9E02E3DE1130F934A35754C0A9679D8B63,Justice Department's Top Antitrust Prosecutor Is to Join a New York Law Firm,"Christine A. Varney, the government's top antitrust lawyer, is leaving the Justice Department to join Cravath, Swaine & Moore as a partner, representatives of the law firm confirmed on Wednesday. Ms. Varney, 55, who was appointed by President Obama in January 2009, was expected to bring a more aggressive antitrust approach to Washington after what many legal experts saw as a period of lax enforcement during the Bush administration.",
855,http://query.nytimes.com/gst/fullpage.html?res=9A00E0DA1430F935A35753C1A9679D8B63,Hulu to Start Carrying Spanish-Language Shows,"The popular streaming video Web site Hulu is adding Spanish-language television shows for the first time. In a deal announced on Wednesday and to be carried out later this year, Hulu will have a selection of the Spanish-language soap opera dramas known as telenovelas and other shows from Univision, the leading Spanish language network in the United States.",
1373,http://query.nytimes.com/gst/fullpage.html?res=9907EFD61138F936A15753C1A9669D8B63,A Fund to Invest in Social Start-Ups,"Hoping to capitalize on the popularity of social networking, the well-known venture capital firm Kleiner Perkins Caufield & Byers is teaming up with heavyweights of the social Web to create a $250 million fund to invest in social start-ups. The ''sFund'' was announced by John Doerr, a Kleiner veteran, on Thursday at a star-studded press conference at Facebook headquarters in Palo Alto, Calif. The fund includes investments from Amazon, Facebook, the Zynga Gaming Network, Comcast, Liberty Media and Allen & Company, as well as Kleiner and some unnamed individuals. The chief executives of Amazon, Facebook and Zynga -- Jeff Bezos, Mark Zuckerberg and Mark Pincus -- all spoke at the event. They declined to say how much each party put into the fund.",
1343,http://query.nytimes.com/gst/fullpage.html?res=9A00EEDD1730F934A15752C0A9679D8B63,Inside the Times,International NEXT PREMIER OF LEBANON,
140,https://www.nytimes.com/video/multimedia/100000002731804/times-minute-looking-for-yanukovych.html,Times Minute | Looking for Yanukovych,"An arrest warrant has been issued for former President Victor F. Yanukovych of Ukraine. Also on the Minute, Egypt's government unexpectedly resigns and Comcast strikes a deal with Netflix.",
749,http://query.nytimes.com/gst/fullpage.html?res=9504EEDD1F3CF930A25754C0A9649D8B63,Thousands Of Passwords At Yahoo Are Exposed,"SAN FRANCISCO -- Another month, another major security breach. Yahoo confirmed Thursday that about 400,000 user names and passwords to Yahoo and other companies were stolen on Wednesday.",
1346,http://query.nytimes.com/gst/fullpage.html?res=9C04E4DE153FF932A25753C1A9669D8B63,New Host for 'E! Investigates',"Laura Ling, who was detained in North Korea with a colleague from Current TV last year, is restarting her television career at a channel much closer to home - E!, the entertainment channel. Ms. Ling has been hired to host ''E! Investigates,'' a series of hourlong programs that will take on a harder edge. Her first two programs will explore the causes of teenage suicide and the lives of military wives.",
144,http://query.nytimes.com/gst/fullpage.html?res=9D0DEED8153AF936A35750C0A9629D8B63,"Paid Notice: Deaths BOWMAN, KEN","BOWMAN--Ken. Denver artist. Born in 1937, died on February 16, 2014. He was a member of the original ""Rhino Horn"" new humanism group. His work was shown at Tibor de Nagy Gallery and is in many private and corporate collections. His widow, Connie Bowman, is handling his estate. You may reach her at kcbow@comcast.net.",
734,http://query.nytimes.com/gst/fullpage.html?res=9C0CE4D91539F930A35751C1A9679D8B63,"With Verizon's $3.6 Billion Deal, Cable and Wireless Inch Closer","In a deal that could remake the boundaries of the cable and wireless industries, Verizon Wireless said on Friday that it had agreed to acquire wireless spectrum from three cable companies at a cost of $3.6 billion. The spectrum transfer, if approved by the government, will allow Verizon to further expand its wireless data networks. But perhaps just as important, a separate agreement announced Friday will enable the cable companies - Comcast, Time Warner Cable and Bright House Networks - to market Verizon services and vice versa, foreshadowing the possibility of cable television, broadband, home phone and cellphone service someday appearing on a single monthly bill.",
147,https://www.nytimes.com/Link.asp?I=LS000169995194,"Paid Notice: Deaths BOWMAN, KEN","<!-- KEN BOWMAN -->BOWMAN--Ken. Denver artist. Born in 1937, died on February 16, 2014. He was a member of the original ""Rhino Horn"" new humanism group. His work was shown at Tibor de Nagy Gallery and is in many private and corporate collections. His widow, Connie Bowman, is handling his estate. You may reach her at kcbow@comcast.net.<br><br>",
1350,http://query.nytimes.com/gst/fullpage.html?res=9A03E3D81531F934A3575BC0A9679D8B63,Connecticut,A guide to cultural and recreational events in Connecticut. Items for the calendar should be sent at least three weeks in advance to ctcal@nytimes.com. For Children,
153,https://www.nytimes.com/video/multimedia/100000002710978/wall-st-bets-on-warmer-days.html,Wall St. bets on warmer days,Summary: U.S. stocks turned higher despite chilly retail and jobless data as investors bet the economy will warm up in the spring; Comcast bulks up with $45 billion purchase of Time Warner Cable. Airlines rise despite more snow cancellations. Conway G. Gittens reports.,
639,http://query.nytimes.com/gst/fullpage.html?res=9501E0DD1239F937A15751C1A9669D8B63,F.C.C. Is Said to Give Nod To Comcast-NBC Takeover,"7:26 p.m. | Updated The Federal Communications Commission chairman, Julius Genachowski, signaled his approval of Comcast's acquisition of NBC Universal on Thursday, but that approval will come with conditions. Among the anticipated stipulations is that Comcast not withhold NBC programming from its competitors in the online video market and that it allow rival distributors to have reasonable access to NBC Universal programming.",
