,link,headline,summary,date
1111,https://www.nytimes.com/2012/03/18/sports/ncaabasketball/when-colleges-dedicate-courts-squabbles-often-follow.html,"When Colleges Dedicate Courts, Squabbles Often Follow",The naming of basketball courts by colleges and universities after a former coach or donor can often leave hurt feelings and spark controversy.,2012/03/18
1150,https://www.nytimes.com/2012/03/19/business/media/accounts-and-people-of-note-in-the-advertising-industry.html,Accounts and People of Note in the Advertising Industry,"Walt Barron joined Peter Mayer Advertising, New Orleans, in a new post, vice president and director for planning and strategic development.",2012/03/19
1046,https://www.nytimes.com/2012/03/19/business/media/c-span-founder-brian-lamb-to-step-down-as-ceo.html,C-Span Founder to Step Down as Chief Executive,"Brian Lamb will hand over management of C-Span, the public affairs cable network, to Rob Kennedy and Susan Swain, while remaining as executive chairman.",2012/03/19
985,https://www.nytimes.com/2012/03/22/sports/baseball/mets-start-getting-their-financial-house-in-order.html,Mets Start Getting Their Financial House in Order,The owners completed the sale of shares in the team for $240 million and repaid millions in loans shortly before they settled the lawsuit against them.,2012/03/22
273,https://bits.blogs.nytimes.com/2012/03/27/comcast-xbox-net-neutrality/,Comcast Streaming Service Raises Net-Neutrality Concerns,"Comcast recently said that a video-streaming service that it will provide to Xbox consoles would not count toward its customers’ monthly data limits. The cable company’s move is raising concerns about net neutrality, the idea that Internet providers should treat all services equally to keep competition fair.",2012/03/27
870,https://www.nytimes.com/2012/03/29/business/media/news-corp-said-to-be-considering-rival-to-espn.html,News Corp. Said to Weigh a Channel to Rival ESPN,"Although executives said no decision has been made, News Corporation may be looking to position itself as a bidder for sports rights in order to compete with ESPN — for both viewers and fees.",2012/03/29
932,https://mediadecoder.blogs.nytimes.com/2012/03/29/philadelphia-newspapers-set-to-be-sold-to-local-leaders/,Philadelphia Newspapers Set to Be Sold to Local Leaders,"The group expected to buy the Philadelphia Media Network includes the parking lot magnate Lewis Katz and George E. Norcross III, a Democratic power broker.",2012/03/29
761,https://www.nytimes.com/2012/03/30/sports/basketball/nba-basketball-roundup.html,Heat Sweep Mavericks in Finals Rematch,LeBron James and Chris Bosh each finished with 19 points and 9 rebounds and the Miami Heat extended their home winning streak to 15 with a 106-85 victory over the Dallas Mavericks.,2012/03/30
267,https://mediadecoder.blogs.nytimes.com/2012/04/01/ryan-seacrest-is-said-to-be-close-to-new-deal-with-comcast/,Ryan Seacrest Is Said to Be Close to New Deal With Comcast,"Ryan Seacrest is on the verge of completing a new contract with NBCUniversal that will include occasional appearances on the “Today” show, among other elements.",2012/04/01
886,https://mediadecoder.blogs.nytimes.com/2012/04/01/directv-and-tribune-fail-to-reach-deal/,DirecTV and Tribune Fail to Reach Deal,"DirecTV customers in 19 markets woke up on Sunday without Fox or the CW networks on their television sets, the result of a failed negotiation with Tribune Broadcasting.",2012/04/01
835,https://www.nytimes.com/2012/04/02/business/media/olbermann-set-the-tone-at-current-and-msnbc.html,"2 Channels, and Anchor Who Set Liberal Tone","As he did at MSNBC, Keith Olbermann established himself as Current TV’s star anchor and opened the door to a more overt political ideology in its news programs.",2012/04/02
811,https://www.nytimes.com/2012/04/03/business/media/espn-spanish-commercial-breaks-a-barrier.html,A Network Popular With Hispanics Reaches Out to Them,ESPN’s “This is SportsCenter” campaign will introduce a commercial in Spanish on Wednesday that will be included on its English-language networks.,2012/04/03
284,https://mediadecoder.blogs.nytimes.com/2012/04/04/hbo-go-is-coming-to-an-xbox-near-you-via-comcast/,Reed Hastings Will Get His HBO Go as Comcast Nears Deal on Xbox,Comcast and Time Warner are said to be close to a deal that would make the HBO Go app available on the Xbox.,2012/04/04
608,https://mediadecoder.blogs.nytimes.com/2012/04/04/for-seacrest-nbc-deal-includes-the-olympics/,"For Seacrest, NBC Deal Includes the Olympics",Ryan Seacrest appeared on NBC’s “Today” show on Wednesday and revealed his coming role on NBC’s prime-time coverage of the Summer Olympics this July and August.,2012/04/04
880,https://bats.blogs.nytimes.com/2012/04/07/balancing-act-helps-giants-spread-wealth/,Balancing Act Helps Giants Spread Wealth,"The ability of the San Francisco Giants to retain stars like Matt Cain depends largely on having prospects turn into low-cost, high-impact players.",2012/04/07
1075,https://www.nytimes.com/2012/04/09/business/media/today-feeling-the-heat-of-good-morning-america.html,Supremacy in Jeopardy for ‘Today’,“Good Morning America” is coming up fast in the ratings behind the consistently top-rated “Today” show.,2012/04/09
228,https://mediadecoder.blogs.nytimes.com/2012/04/10/bloomberg-accuses-comcast-of-favoring-its-own-channels/,Bloomberg Accuses Comcast of Favoring Its Own Channels,"Bloomberg says Comcast should include its business news channel in a cable news “neighborhood” on the dial, alongside CNBC and MSNBC.",2012/04/10
807,https://slapshot.blogs.nytimes.com/2012/04/11/covering-n-h-l-playoffs-will-be-a-team-effort/,Covering N.H.L. Playoffs Will Be a Team Effort,"Four networks — NBC, NBC Sports Network, CNBC and the NHL Network — will carry all the postseason games nationally.",2012/04/11
914,https://www.nytimes.com/2012/04/16/business/media/news-from-the-advertising-industry.html,News From the Advertising Industry,"Account assignments, executive appointments and miscellaneous news from advertising agencies.",2012/04/16
1099,https://www.nytimes.com/2012/04/16/business/media/accounts-and-people-of-note-in-the-advertising-industry.html,Accounts and People of Note in the Advertising Industry,"Steven Amato, chief content officer at Omelet, Los Angeles, was named president, a new post, and chief content officer of a new division, Omelet Studio.",2012/04/16
830,https://mediadecoder.blogs.nytimes.com/2012/04/17/at-london-olympics-nbc-says-if-cameras-are-on-it-well-stream-it/,"At London Olympics, NBC Says, ‘If Cameras Are on It, We’ll Stream It’","In a change in thinking, events will be available online as they happen. To protect the prime-time broadcast, big events, like gold-medal races, will not be archived until they have appeared on TV.",2012/04/17
1125,https://www.nytimes.com/2012/04/17/business/media/hulu-the-online-tv-site-adds-original-programming.html,An Online TV Site Grows Up,Hulu will promote its original programming to advertisers this week in an annual ritual known as upfronts that is typically reserved for cable channels and network broadcasters.,2012/04/17
718,https://www.nytimes.com/2012/04/18/ubss-stenzler-departs-as-co-head-of-u-s-mergers/,UBS’s Stenzler Departs as Co-Head of U.S. Mergers,"UBS’s co-head of United States mergers and acquisitions, Ehren Stenzler, has left the firm, in the second prominent departure from the investment bank in two days.",2012/04/18
1071,https://www.nytimes.com/2012/04/18/technology/mobile-carriers-warn-of-spectrum-crisis-others-see-hyperbole.html,Carriers Warn of Crisis in Mobile Spectrum,"As data usage multiplies on mobile devices, carriers say they need more spectrum, but scientists and engineers say newer technologies can improve efficiency.",2012/04/18
800,https://bits.blogs.nytimes.com/2012/04/19/verizon-spectrum-sale/,Verizon to Sell Spectrum if It Can Buy More From Cable Companies,"Verizon Wireless, the nation’s No. 1 carrier, is prepared to sell some parts of its radio spectrum if it is allowed to buy wireless spectrum licenses from cable companies. But carriers constantly warn of a looming spectrum shortage that could affect the speed and reliability of smartphones and tablets. How can there be a shortage if Verizon has some it can sell?",2012/04/19
905,https://www.nytimes.com/2012/04/20/technology/verizon-reports-a-profit-of-1-7-billion.html,Mobile Data Service Fees Help Bolster Profit at Verizon,"Although the nation’s largest cellphone service added fewer customers in the first quarter, its customers paid to watch videos, use the Web or play music on their smartphones and tablets.",2012/04/20
954,https://www.nytimes.com/2012/04/21/business/ge-earnings-beat-expectations.html,G.E. Profit Beats Expectations,"Excluding the impact from the sale of NBCUniversal, General Electric’s quarterly revenue also rose 4 percent, as the company increasingly returned to its industrial roots.",2012/04/21
721,https://www.nytimes.com/2012/04/22/fashion/weddings/melissa-mcguirk-harold-maude-iii-weddings.html,"Melissa McGuirk, Harold Maude III",The bride has a clothing line; the bridegroom works in marketing for Comcast.,2012/04/22
1011,https://www.nytimes.com/2012/04/23/business/media/nimbletv-aims-to-stream-tv-on-devices.html,Start-Up Aims to Stream Pay TV Onto Web Devices,NimbleTV is the latest example of technology companies trying to break into the closed system of television distribution in the United States.,2012/04/23
1087,https://www.nytimes.com/2012/04/23/business/a-hit-maker-bets-future-earnings-on-an-expansion-plan.html,A Hit Maker Bets Future Earnings on an Expansion Plan,"The entertainment entrepreneur Peter Chernin has made an arrangement with investors, who are taking a stake in the future earnings of his films and television shows and channeling him the money now.",2012/04/23
1158,https://www.nytimes.com/2012/04/23/business/media/accounts-and-people-of-note-in-the-advertising-industry.html,Accounts and People of Note in the Advertising Industry,"Carla Ballecer and Karen Gereffi joined Johannes Leonardo, New York, part of WPP, in new posts. Ms. Ballecer becomes a senior copywriter and Ms. Gereffi becomes a senior art director.",2012/04/23
947,https://www.nytimes.com/2012/04/23/business/media/q-and-a-with-stuart-elliott.html,Q. and A. With Stuart Elliott,Are AT&T and BBDO recycling a campaign from the late 1990s?,2012/04/23
713,https://www.nytimes.com/2012/04/25/business/media/aspire-cable-channel-lands-3-big-advertisers.html,A Cable Start-Up Lands 3 Big Brands,"Among the initial advertisers on Aspire, which will make its debut on June 27, are the Chrysler Group, L’Oréal USA and Nationwide Insurance.",2012/04/25
762,https://mediadecoder.blogs.nytimes.com/2012/04/26/investors-sale-of-its-stake-in-hulu-could-value-the-business-at-2-billion/,Investor’s Sale of Its Stake in Hulu Could Value the Business at $2 Billion,"Providence Equity Partners, one of the original owners of the online video service, would get about $200 million for its 10 percent share, sources said.",2012/04/26
663,https://mediadecoder.blogs.nytimes.com/2012/04/27/seacrests-role-at-nbcuniversal-will-span-news-sports-and-entertainment/,"Seacrest’s Role at NBCUniversal Will Span News, Sports and Entertainment","On the “Today” show, Ryan Seacrest will be a special correspondent, under his new two-year “multi-platform” agreement. He also will report from the Olympics and be part of election coverage.",2012/04/27
948,https://www.nytimes.com/2012/04/27/business/media/newfronts-make-bids-for-big-marketing-dollars.html,"Small Screens, Big Dollars",Media companies that specialize in online content are banding to together to appeal to Madison Avenue.,2012/04/27
847,https://www.nytimes.com/2012/04/28/business/media/developers-are-working-on-television-apps-but-tv-industry-is-wary.html,In Search of Apps for Television,"The technology industry is working on viewing options that could include apps, a move that has the potential to transform cable television’s interface and business model.",2012/04/28
1081,https://www.nytimes.com/2012/04/30/business/media/accounts-and-people-of-note-in-the-advertising-industry.html,Accounts and People of Note in the Advertising Industry,"The 2012 B2B Ace Awards, sponsored by the Business Marketing Association of New York, were presented earlier this month.",2012/04/30
745,https://www.nytimes.com/2012/04/30/business/economic-reports-for-the-week-of-april-30.html,Economic Reports for the Week Ahead,"Governments reports will include personal income for March and unemployment figures for April, and companies reporting earnings will include MasterCard, General Motors, Kraft Foods and LinkedIn.",2012/04/30
707,https://mediadecoder.blogs.nytimes.com/2012/05/01/netflix-may-resurrect-jericho-canceled-cbs-drama/,"Netflix May Resurrect ‘Jericho,’ Canceled CBS Drama","The show, which imagined post-nuclear war life in a Kansas, was canceled in 2008. But, much the way Netflix is bringing back “Arrested Development,” it is in talks to make more episodes of “Jericho.”",2012/05/01
222,https://mediadecoder.blogs.nytimes.com/2012/05/02/commission-rules-for-bloomberg-tv-in-dial-dispute-with-comcast/,Commission Rules for Bloomberg TV in Dial Dispute With Comcast,The Federal Communications Commission said Comcast must program the less-watched cable channel in the same “neighborhood” on the cable dial as competitors like Fox Business and CNBC and more general news channels like CNN and MSNBC.,2012/05/02
860,https://mediadecoder.blogs.nytimes.com/2012/05/02/the-breakfast-meeting-unfit-to-be-tied-and-network-television-looks-up/,The Breakfast Meeting: ‘Unfit’ to Be Tied and Network Television Looks Up,The British parliamentary report surprises Rupert Murdoch and implicates the editor of a rival newspaper.,2012/05/02
887,https://www.nytimes.com/2012/05/02/business/media/cbs-reports-strong-first-quarter.html,"CBS, Ahead of Upfronts, Has Strong 1st Quarter",The corporation reported its best first quarter since being spun off from Viacom in 2006.,2012/05/02
206,https://mediadecoder.blogs.nytimes.com/2012/05/02/comcast-reports-progress-at-nbc-but-declines-in-cable-subscriptions/,"Comcast Reports Progress at NBC, but Declines in Cable Subscriptions","Comcast reported net income of $1.22 billion, or 45 cents a share, for the first quarter, up from $943 million, or 34 cents a share, and above analysts’ expectations. But it also reported that 37,000 cable TV customers cancelled the service.",2012/05/02
974,https://www.nytimes.com/2012/05/03/business/media/youtube-channels-court-advertisers-at-newfronts.html,"YouTube and Kin Woo Marketers, Seeking to Siphon Dollars From TV","THE people behind the Tribeca Film Festival are getting a channel, but unlike the channel from the people behind the Sundance Film Festival, don't look for it on television. Tribeca Enterprises, the parent of the Tribeca Film Festival, is teaming up with Maker Studios to create a channel on YouTube.com, named the Picture Show, that is to go live later this year. The channel on YouTube, which is part of Google, will be a home for online series and short films, rather than the feature-length movies that are released by Tribeca Film in theaters and on the video-on-demand channels on cable systems.",2012/05/03
1044,https://www.nytimes.com/2012/05/07/morning-take-out-478/,Morning Take-Out,Highlights from the DealBook newsletter.,2012/05/07
651,https://mediadecoder.blogs.nytimes.com/2012/05/08/espn-and-theme-parks-drive-disney-profits/,ESPN and Theme Parks Drive Disney Profits,"The giant entertainment company continued to see growth in ESPN and other cable channels, as well as its theme parks, but had to take a $200 million write down for its failed science fiction epic “John Carter.”",2012/05/08
599,https://www.nytimes.com/2012/05/09/business/economy/net-neutrality-and-economic-equality-are-intertwined.html,Keeping the Internet Neutral,"To reach the multitude of online services competing for your attention, you must first get through a bottleneck that is not competitive at all: high-speed broadband access.",2012/05/09
786,https://mediadecoder.blogs.nytimes.com/2012/05/10/hollywood-to-back-effort-to-aid-veterans-return-to-civilian-life/,Hollywood to Back Effort to Aid Veterans’ Return to Civilian Life,"The program, Got Your 6 — military slang for “I’ve got your back” — will involve all six major movie studios, the four big broadcast networks, Hollywood’s largest talent agencies and a slew of cable channels.",2012/05/10
675,https://www.nytimes.com/2012/05/13/fashion/weddings/elyse-lupin-phil-chang-weddings.html,"Elyse Lupin, Phil Chang",The bride works in marketing. The bridegroom is a physical education teacher and coach.,2012/05/13
810,https://www.nytimes.com/2012/05/14/business/media/few-tv-shows-survive-a-ruthless-proving-ground.html,Few TV Shows Survive a Ruthless Proving Ground,"In network television, hundreds of ideas are carefully nurtured into dozens of shows and thrown into the air before being pared to a handful of winners.",2012/05/14
879,https://www.nytimes.com/2012/05/14/business/media/news-from-the-advertising-industry.html,News From the Advertising Industry,"Account assignments, executive appointments and miscellaneous news from advertising agencies.",2012/05/14
963,https://www.nytimes.com/2012/05/15/business/media/networks-bank-on-comedies-for-2012-13-season.html,Comedies Lead the Way for the Next TV Season,NBC and Fox showcase the networks’ funny sides with comedies scheduled for the fall and for midseason.,2012/05/15
776,https://bits.blogs.nytimes.com/2012/05/16/in-tv-race-microsoft-has-lead-forrester-says/,"In TV Race, Microsoft Has Lead, Forrester Says","When it comes to the underlying technology providers that matter for mobile app developers, there’s Google and Apple, with Microsoft as an also-ran. But as television begins to resemble the mobile business, Microsoft is in the lead with the Xbox, according to a new report out Wednesday from Forrester Research.",2012/05/16
988,https://www.nytimes.com/2012/05/16/business/media/broadcasters-pitch-programming-for-hispanics-advertising.html,More Pitches Accent the Spanish,"Nine cable channels and broadcast networks are offering advertisers a way to reach the Hispanic population, up from five at the upfronts presentations last year.",2012/05/16
747,https://bits.blogs.nytimes.com/2012/05/16/fcc-questions-verizon/,F.C.C. Wants Clarity From Verizon on Proposed Spectrum Deals,The federal government is wondering why Verizon Wireless wants to sell some parts of its radio spectrum if it is allowed to acquire spectrum licenses from a group of cable companies.,2012/05/16
783,https://mediadecoder.blogs.nytimes.com/2012/05/16/viacom-and-time-warner-cable-reach-deal-on-app-for-streaming-programs/,Viacom and Time Warner Cable Reach Deal on App for Streaming Programs,The companies reached a settlement that will allow users to stream shows from Viacom’s channels through Time Warner Cable’s TWCable TV app.,2012/05/16
873,https://green.blogs.nytimes.com/2012/05/17/the-billboard-wars-chapter-2/,"Billboard Wars, Chapter 2 (or Is It 3?)",The media company that accepted the conservative Heartland Institute’s controversial ad about climate change rejected one rival billboard but accepted another.,2012/05/17
214,https://mediadecoder.blogs.nytimes.com/2012/05/17/comcast-to-test-broadband-pricing-tied-to-use/,Comcast to Test Broadband Pricing Tied to Use,"The company is moving away from a one-size-fits-all pricing plan that capped monthly Internet use at 250 gigabytes. Potentially, there will be higher costs for customers who use the most.",2012/05/17
953,https://www.nytimes.com/2012/05/17/business/media/two-and-a-half-men-aims-to-lift-thursday.html,‘Two and a Half Men’ Aims to Lift Thursday,The shift will be the second time that CBS has moved a successful Monday comedy to Thursday to try to establish a stronger foothold with viewers later in the week.,2012/05/17
957,https://slapshot.blogs.nytimes.com/2012/05/19/labor-showdown-looms-ominously-for-the-n-h-l/,Labor Showdown Looms Ominously for the N.H.L.,"The N.H.L.’s labor agreement with its players is set to expire on Sept. 15, and there are signs that another work stoppage could be ahead.",2012/05/19
809,https://mediadecoder.blogs.nytimes.com/2012/05/21/the-breakfast-meeting-competing-on-disneys-turf-and-to-catch-a-straying-eye/,"The Breakfast Meeting: Competing on Disney’s Turf, and to Catch a Straying Eye","Also, the European Commission offers Google a deal, and the founders of an online journalism start-up have an impressive track record.",2012/05/21
621,https://mediadecoder.blogs.nytimes.com/2012/05/21/cable-operators-to-expand-their-plan-to-share-wi-fi-hot-spots/,Cable Operators to Expand Their Plan to Share Wi-Fi Hot Spots,"Five of the nation’s biggest cable operators announced they would collaborate so that customers of one company can use the Wi-Fi of any of the others in public places like malls, arenas and parks.",2012/05/21
257,https://www.nytimes.com/2012/05/21/business/universal-armed-with-cash-from-comcast-takes-aim-at-disney.html,Clash of the Theme Parks,"Universal Studios, the theme park chain now controlled by Comcast, is rolling out new weapons in its battle against Walt Disney Parks and Resorts — and Disney is fortifying its defenses.",2012/05/21
1114,https://www.nytimes.com/2012/05/21/business/media/accounts-and-people-of-interest-in-the-advertising-industry.html,Accounts and People of Note in the Advertising Industry,"Victor Abramson joined the Portland, Ore., office of Advanced Broadcast Solutions in a new post, national sales manager for cable television solutions.",2012/05/21
1007,https://www.nytimes.com/2012/05/21/business/media/eugene-volokh-ucla-professor-makes-a-case-for-google-as-publisher.html,Professor Makes the Case That Google Is a Publisher,"IS Google search an intermediary like the phone company -- simply connecting people with the information they seek? Or is Google search a publisher, like a newspaper, which provides only the information that it sees fit and is protected by the First Amendment? There are good reasons for Google to want to be considered a mere connector; like other Internet companies, it can beg off responsibility for what is transmitted by its users. That is the useful stance when it comes to rebutting claims of copyright infringement or libel.",2012/05/21
687,https://www.nytimes.com/2012/05/23/business/media/fcc-weighs-treating-video-sites-like-cable-companies.html,If Video Sites Could Act Like Cable Companies,The Federal Communications Commission is considering giving online distributors like Hulu and YouTube the same rights and responsibilities enjoyed by cable companies.,2012/05/23
780,https://www.nytimes.com/2012/05/24/technology/personaltech/buddytv-peel-and-tv-guide-apps-find-shows-worth-watching.html,Seeing What's on TV Without Touching the Remote,"Smartphones and tablets have emerged as the best television companions since the Barcalounger. What better to do during two minutes of commercials than check e-mails, fire off a text or engage in some Words With Friends smack talk? But relatively few people know what mobile devices can do to enrich the other 28 minutes of a half-hour television slot. With apps like BuddyTV Guide (free on Apple and Android) and Peel (free on Apple and Android), you can find good shows much more efficiently than you would by channel surfing.",2012/05/24
922,https://www.nytimes.com/2012/05/26/arts/television/seeing-girls-and-other-hbo-shows-with-hbo-go.html,Seeing HBO’s ‘Girls’ Without Buying a Television,What do you do when you don’t have a TV set but want to watch an HBO show? Call your parents and ask for the password.,2012/05/26
1074,https://www.nytimes.com/2012/05/27/opinion/sunday/sunday-dialogue-online-profits-and-privacy.html,Sunday Dialogue: Online Profits and Privacy,Readers discuss questions raised by the Facebook offering.,2012/05/27
1166,https://boss.blogs.nytimes.com/2012/05/28/this-week-in-small-business-blame-the-s-b-a/,This Week in Small Business: Blame the S.B.A.,"Plus: Home sales up, gridlock eases, lessons from “Shark Tank” and Howard Stern. And do you think entrepreneurship can be taught in an academic setting?",2012/05/28
1076,https://www.nytimes.com/2012/05/29/business/media/webdenda.html,Accounts and People of Note in the Advertising Industry,"Jack Bamberger joined MEC North America, New York, in a new post, president for digital, and will also become a member of the MEC North American executive committee.",2012/05/29
1025,https://www.nytimes.com/2012/05/29/technology/microsoft-at-work-on-meshing-its-products-with-skype.html,Meshing Microsoft With Skype,"PALO ALTO, Calif. -- By some measures, Tony Bates has accomplished a lot at Skype since Microsoft paid $8.5 billion for the Internet calling service. The statistics tell the story. In seven months, the number of people using the service each month has jumped 26 percent to nearly a quarter of a billion, affirming Skype's status as one of the crown jewels of consumer Internet services.",2012/05/29
701,https://bits.blogs.nytimes.com/2012/05/29/daily-report-8-5-billion-skype-deal-presents-a-puzzle/,Daily Report: $8.5 Billion Skype Deal Presents a Puzzle,"Skype must be able to give Windows and other Microsoft products an edge for Microsoft to justify the $8.5 billion it paid. One important milestone will come this year, when Skype is expected to release a preliminary version of its calling software that runs on Windows 8, an overhaul of Microsoft’s flagship operating system intended to work well with touch-screen computers.",2012/05/29
