,link,headline,summary,date
919,http://query.nytimes.com/gst/fullpage.html?res=9907E3DB123EF931A15752C1A9609C8B63,TODAY IN BUSINESS,"GOOGLE, STILL FEELING LUCKY -- Google's shares closed up $14.60 at $509.65, rising past the $500 mark for the first time, not bad for a company that was forced to reduce its initial share price to $85 barely two years ago because of lackluster demand. And an analyst who once recommended selling at $137 is among those predicting that it will rise to $600 within a year. [Page C1.] A LINE IN THE SAND -- Rupert Murdoch has pushed the boundaries throughout his career, usually without contrition. But the media billionaire's decision to cancel a TV and book project featuring O. J. Simpson by subsidiaries of the News Corporation was a rare demonstration that even Mr. Murdoch has his limits. [C1.] RIGHTS TO SIMPSON BOOK SOUGHT -- Seeking to prevent a canceled book and television interview with O. J. Simpson from ever becoming public, the family of Ronald L. Goldman, who was murdered along with Nicole Brown Simpson in 1994, has asked the News Corporation to turn over the rights to the material. [C5.] INVESTORS SHOW FAITH IN DELL -- Dell reported another quarter of slow revenue growth and falling profits, compared to year-earlier results. But investors looked at the marked improvement from the previous quarter as a sign of a turnaround and pushed the company's stock up in after-hours trading. [C1.] SENATOR AT THE CROSSROADS -- As Senator Christopher Dodd prepares to take over the leadership of the Senate Banking Committee while also considering a run for the presidency, lobbyists and lawmakers are all asking the same question. Will he be a populist champion for the middle class or will he advance the causes of corporate patrons? [C1.] ASIAN GIANTS SEEK CLOSER TIES -- India and China established a 10-point strategy to strengthen economic relations as President Hu Jintao of China, left, started a four-day visit to India. As he and Prime Minister Manmohan Singh of India came face to face, there was evidence that they were trying to define the Asian version of globalization. [C2.] SHORT-LIVED SOFTWARE CEASE-FIRE -- Less than three weeks after they reached an accord hailed as proof that open source and proprietary software companies could work together, Novell and Microsoft executives are bickering in public. [C4.] POTATO TODAY, GONE TOMORROW -- The United States Potato Board is joining the ranks of marketers using a technique known as pop-up retailing, opening a temporary store that consumers can visit for a short time. Stuart Elliott: Advertising. [C4.] LENS CLEANER RECALLED -- Advanced Medical Optics has recalled 2.9 million bottles of Complete MoisturePlus contact lens solution after harmful bacteria were found in some units sold in Japan. The company's shares fell 8.9 percent, and the company issued lowered forecasts for sales and earnings through 2007. The voluntary recall is a precaution against eye infections caused by water-borne bacteria that infiltrated a plant in China; no problems have been reported in the United States. [C6.] COMCAST AND DISNEY IN DEAL -- The Comcast Corporation and the Walt Disney Company have signed a multibillion-dollar distribution deal that allows the cable operator to distribute Disney content through its video-on-demand service. [C10.] G.M. SCUTTLES SATURN MINIVAN -- General Motors confirmed that it had decided not to build a Saturn minivan that was tentatively planned for production at its Spring Hill, Tenn., plant, but the company said that it would find a new vehicle for workers there to build. Union leaders said they feared the plant, where the first Saturn was built, would close. [C4.] PENTAGON SEEKS SUPERCOMPUTER -- The Pentagon awarded almost $500 million in contracts to I.B.M. and Cray Inc. to design a supercomputer several times as fast as today's most powerful systems. [C8.] AVIATION COMPANY RISES IN DEBUT -- Shares of Spirit AeroSystems Holdings, a unit of Onex, the Canadian leveraged buyout company, rose 12 percent in their first day of trading in New York yesterday. Onex formed Spirit in June 2005 after acquiring Boeing's aircraft component factories in Wichita, Kan., and Tulsa and McAlester, Okla. Spirit stock opened at $26 and ended the day's trading at $29 a share. [C8] STOCKS RISE WITH OIL PRICES -- Stocks resumed their November advance yesterday after an increase in oil prices lifted the Exxon Mobil Corporation, the world's biggest energy company, and shares of Google surpassed $500 for the first time. [C8.] Business Briefing Articles on these developments are at nytimes.com/business. The accounting firm KPMG asked a federal appeals panel to rule that a district judge could not compel the firm to pay the legal fees of former executives facing criminal charges in a tax-shelter fraud investigation. (DOW JONES) The bookstore operator Borders Group said that its third-quarter loss widened as sales edged down. The company reported a loss of $39.1 million, or 64 cents a share, for the quarter that ended Oct. 28 compared with a loss of $14.1 million, or 20 cents in the period a year ago. (AP) Higher prices for farm and lawn-care equipment helped Deere & Company increase its fourth-quarter profit by 19 percent, the company said Tuesday. The share price rose sharply, even as the company warned of a sales slowdown. (AP) EarthLink, the Internet access provider, said that its chief executive, Garry Betty, would take a medical leave to fight cancer. (BLOOMBERG NEWS)",
890,http://query.nytimes.com/gst/fullpage.html?res=9C01E2D71E31F934A15751C1A9609C8B63,"For N.F.L. Fans, The Cable Picture Isn't Any Clearer","Roger Goodell, the National Football League commissioner, visited Green Bay for last week's Vikings-Packers game at Lambeau Field, where he discussed why many fans in Wisconsin would not be watching what was the sixth of eight Thursday and Saturday night games on the NFL Network. The truth was this: The state's dominant cable operators, Time Warner and Charter, don't carry the network, but in the Packers' home markets, Green Bay and Milwaukee, local stations showed the game.",
931,https://www.nytimes.com/2006/08/31/business/media/31adco.html,G.M. Drops â€˜Survivorâ€™ but Says Racial Format Isnâ€™t the Reason,"General Motors, which accounts for roughly one-fifth of the advertising on â€œSurvivor,â€ said its decision was unrelated to the showâ€™s race-based format.",2006/08/31
860,http://dealbook.nytimes.com/2006/09/01/bid-from-3-cable-companies-could-create-new-wireless-network/,Cable Companies Could Create New Wireless Network,"The three largest U.S. cable operators have offered more than $2.3 billion for airwaves in a U.S. auction, a slice big enough to create a new national wireless network.",2006/09/01
925,https://www.nytimes.com/2006/09/03/business/yourmoney/03frenzy.html,Time Warnerâ€™s Anxious Autumn,"Regardless of how much Time Warner tries to regroup, retool and reorganize its sprawling media empire, the stock market just yawns.",2006/09/03
959,https://www.nytimes.com/2006/09/08/sports/football/08sandomir.html,N.F.L. Learns Its Worth and Makes ESPN Pay,"ESPN is paying $1.1 billion a year for ""Monday Night Football,"" 83 percent more than it paid for Sunday nights.",2006/09/08
904,http://dealbook.nytimes.com/2006/09/13/rcn-may-go-on-the-block-report-says/,"RCN May Go on the Block, Report Says","Less than two years after emerging from bankruptcy protection, the RCN Corporation, a cable company, may put itself up for sale, Bloomberg News reported, citing two people with knowledge of the plans.",2006/09/13
914,https://www.nytimes.com/2006/09/14/business/14cable.html,Ex-S.E.C. Chairman Hired for Cable Case,Richard C. Breeden has been hired to oversee the payment of millions to investors defrauded by Adelphia Communications.,2006/09/14
527,https://www.nytimes.com/2006/09/15/business/media/15comcast.html,A Comcast-CBS Venture,Comcast said it will make eight CBS prime-time series available to customers through its on-demand service at no extra cost.,2006/09/15
962,https://www.nytimes.com/2006/09/18/business/media/18marketplace.html,Satellite TVâ€™s 3-Headed Rival: Cable Plus Internet Plus Phone,"If the satellite business is so great, why is Rupert Murdoch thinking of selling DirecTV and why is John Malone thinking of buying it?",2006/09/18
910,http://dealbook.nytimes.com/2006/09/19/us-closes-lucrative-airwaves-auction/,U.S. Closes Lucrative Airwaves Auction,"The Federal Communications Commission declared the latest and most lucrative auction of the public airwaves closed on Monday, with bids totaling nearly $13.9 billion.",2006/09/19
932,https://www.nytimes.com/2006/09/19/business/media/19adco.html,Trying to Figure Out How Much Tease Is Too Much,The outing of Lonelygirl15 has forced her audience to consider: Was Lonelygirl a simple hoax or high-concept art?,2006/09/19
953,https://www.nytimes.com/2006/09/19/technology/19spectrum.html,U.S. Closes Lucrative Airwaves Auction,Bids totaled nearly $13.9 billion in the latest and most lucrative auction of the public airwaves.,2006/09/19
906,https://www.nytimes.com/2006/09/19/sports/football/19sandomir.html,NFL Network Is Counting on Fans to Pay a Lot for a Little,The NFL Network is overreaching in its tough-minded campaign to prove its indispensability to fans in the cable TV universe.,2006/09/19
930,http://pogue.blogs.nytimes.com/2006/09/25/25pogues-posts-5/,Doing the DVR Math,"Last week in The Times, I reviewed the expensive but delicious new TiVo Series 3 video recorder. One key mission of the article was to explain why video fans might consider buying a box that costs $800 plus $13 a month, when they could rent a generic, bare-bones recorder from their cable companies for $5 a month.",2006/09/25
954,https://www.nytimes.com/2006/10/10/business/10place.html,Wall St. Likes Familyâ€™s Simplified Cablevision Bid,The Dolan familyâ€™s offer to buy out the Cablevision Systems Corporation sent the company's stock up 10.7 percent.,2006/10/10
898,https://www.nytimes.com/2006/10/15/fashion/weddings/15NELSON.html,"Emily Nelson, Zachary Cunha","Emily Georgia Nelson, a daughter of the late Patricia Neyens Nelson and the late Dr. George L. Nelson, was married yesterday to Zachary Anthony Cunha, a son of Marie Boyer Cunha and Dr. Burke A. Cunha of Garden City, N.Y. The Rev. Laurie Sue Brockway, a nondenominational minister, officiated at the New York Botanical Garden in the Bronx.",2006/10/15
934,http://dealbook.nytimes.com/2006/10/16/who-if-anyone-should-buy-yahoo/,Who (If Anyone) Should Buy Yahoo?,"When high-profile deals go down -- as when the Internet search giant Google announced its YouTube acquisition -- everybody starts looking for the next one. So speculation over who might buy Yahoo, one of the best-known brands on the Web, is in heavy rotation in the news and, much moreso, in blogland.",2006/10/16
889,https://www.nytimes.com/2006/10/17/sports/ncaafootball/17miami.html,Cokerâ€™s Job Safe for Now; Suspensions Continue,"The University of Miami president, Donna Shalala, ended speculation Monday that the Hurricanesâ€™ brawl with Florida International Saturday night might cost Coach Larry Coker his job before the seasonâ€™s end.",2006/10/17
836,https://www.nytimes.com/2006/10/19/business/media/19cable.html,Time Warner to Sell Shares in Cable Unit,The shares would be equal to 16 percent of the company and would be used to pay off shareholders in Adelphia.,2006/10/19
916,https://www.nytimes.com/2006/10/23/business/23ahead.html,Looking Ahead,"EYES ON THE HOUSING MARKET Several important gauges of housing activity will be released this week, including existing-home sales for September (Wednesday) and new-home sales for September (Thursday). Any movement in either direction for either gauge can be expected to lead to some movement in the markets as well as many predictions about the real estate outlook.",2006/10/23
842,https://www.nytimes.com/2006/10/27/business/27stox.html,October Bull Run Continues as Nasdaq Hits 5-Year High,Stocks extended their rally as lower oil prices improved the outlook for companies sensitive to consumer spending.,2006/10/27
913,https://www.nytimes.com/2006/10/29/sports/playmagazine/1029play_business.html,Power Game,"The N.F.L. already gets billions from CBS, NBC, Fox and ESPN, and it's not done yet. Diagramming the league's economic attack.",2006/10/29
550,http://dealbook.nytimes.com/2006/11/01/disney-nears-deals-with-comcast-and-time-warner-report-says/,"Disney Nears Deals With Comcast and Time Warner, Report Says","Comcast is reportedly nearing a deal to buy Walt Disney's 39.5 percent stake in E! Entertainment Television for about $1.2 billion. According to The Los Angeles Times, Disney is closing in on multiyear deals to continue to supply billions of dollars worth of content to the two largest U.S. cable operators, Comcast and Time Warner Cable.",2006/11/01
883,https://www.nytimes.com/2006/11/01/business/media/01place.html,"Cable and Phone Companies Compete, but Both Thrive","This year, every major phone and cable stock has risen and there is still room for the giants to grow.",2006/11/01
867,https://www.nytimes.com/2006/11/01/technology/circuits/01sett.html,Cable or Satellite? That Depends,"With DirecTV and Dish Network offering all-digital channel lineups and central customer service, satellite has traditionally been the service to beat. But cable is changing.",2006/11/01
871,http://dealbook.nytimes.com/2006/11/03/litigious-forgent-reaches-patent-settlement-with-tech-firms/,Litigious Forgent Reaches Patent Settlement With Tech Firms,"Forgent Networks, a company that generates most of its revenue from patent licensing and litigation, has reached an $8 million settlement with some of the technology industry's biggest players over the use of a patent covering the ubiquitous JPEG digital image format.",2006/11/03
935,https://www.nytimes.com/2006/11/06/business/media/06adco-webdenda.html,People and Accounts of Note,,2006/11/06
563,https://www.nytimes.com/2006/11/07/business/media/07fox.html,Comcast Is Said to Agree to Carry Foxâ€™s Planned Business News Channel,"A final decision on whether to start the channel has still not been made, two executives briefed on the arrangement said.",2006/11/07
510,http://dealbook.nytimes.com/2006/11/09/will-comcast-buy-sprint-analyst-thinks-not/,Will Comcast Buy Sprint? Analyst Thinks Not,"Despite the rumors around Wall Street, it is unlikely that Comcast will try to acquire Sprint Nextel, according to Douglas Shapiro, a Bank of America analyst. Such a deal would join Comcast's vast cable network with Sprint's wireless assets. But in a note Thursday, Mr. Shapiro offers a list of reasons why Comcast would not bite.",2006/11/09
531,http://dealbook.nytimes.com/2006/11/10/comcast-sprint-deal-could-happen-citi-says/,"Comcast-Sprint Deal Could Happen, Citi Says","Wall Street is obviously taking seriously the rumors that Comcast might buy Sprint Nextel. On Thursday, Bank of America analyst Douglas Shapiro issued a note saying that such a deal is unlikely, and wouldn't be a very good idea in any case. On Friday, Citigroup's Jason Bazinet issued his own note saying there's a ""40 percent probability"" that Comcast will acquire a wireless firm in the next year, and that Sprint Nextel would be the most likely target.",2006/11/10
915,https://www.nytimes.com/2006/11/11/business/11values.html,"As Rally Ages, Old Standbys Take the Lead",Nearly all of the 10 largest contributors to the return this year in Standard & Poorâ€™s 500-stock index are longstanding marquee names in corporate America.,2006/11/11
952,https://www.nytimes.com/2006/11/11/sports/basketball/11nba.html,Hawks Win and Continue a Strong Start,Joe Johnson scored a season-high 34 points Friday night and Josh Smith had a career-best 29 to lead the Atlanta Hawks to a 111-102 victory against the host Toronto Raptors.,2006/11/11
879,https://www.nytimes.com/2006/11/12/fashion/weddings/12blume.html,"Deborah Blume, Steven Stutman","Deborah Beth Blume, the daughter of Sylvia B. Blume and Fred Blume of Penn Valley, Pa., was married last evening to Steven Jay Stutman, the son of Franni Stutman and Dr. Paul Stutman, also of Penn Valley. Rabbi Neil Cooper officiated at the Rittenhouse Hotel in Philadelphia.",2006/11/12
804,http://dealbook.nytimes.com/2006/11/13/is-sprint-nextel-headed-for-a-buyout/,Is Sprint Nextel Headed for a Buyout?,"The valuation of Sprint Nextel has banks and private equity firms talking about the possibility of a leveraged buyout, though the sheer size of such a deal could be prohibitive, according to the Daily Deal.",2006/11/13
887,https://www.nytimes.com/2006/11/14/business/14legal.html,Two Law Firms Agree to Merge,The Philadelphia law firm of Drinker Biddle & Reath and Gardner Carton & Douglas of Chicago agreed to merge and form a firm with 650 lawyers.,2006/11/14
961,https://www.nytimes.com/2006/11/16/business/media/16adco.html,A Yardstick for Video-on-Demand,Nielsen Media Research is to announce that it will release video-on-demand ratings starting in December.,2006/11/16
958,https://www.nytimes.com/2006/11/18/arts/18arts.html,"Arts, Briefly","Campaigning to keep a Thomas Eakins painting in Philadelphia, a comic strip of New Yorker covers, PBS-affiliated channel is criticized again and more culture news.",2006/11/18
809,https://www.nytimes.com/2006/11/19/opinion/l19conn.html,Home-Care Services for the Elderly; Unhappy Customers of Cable Monopolies (2 Letters),Home-Care Services.,2006/11/19
538,https://www.nytimes.com/2006/11/22/business/media/22disney.html,Comcast Buys Some Rights to Disneyâ€™s Programs,"As part of the multiyear deal, Comcast also agreed to buy Disneyâ€™s 39.5 percent stake in the E Entertainment Television channel for $1.23 billion.",2006/11/22
535,http://dealbook.nytimes.com/2006/11/22/comcast-and-disney-ink-multi-billion-dollar-deal/,Comcast Agrees to Buy Disney's E Networks Stake,"Comcast has bought Walt Disney's 39.5 percent stake in E Networks for $1.23 billion, and the two companies have landed long-term distribution agreements for 10 ABC-owned television stations and other Disney networks. The deal extends a content distribution agreement for the 10 ABC-owned broadcast television stations and many of Disney's TV networks, including Disney Channel, ABC Family, Toon Disney, ESPN and ESPN2, the companies said.",2006/11/22
848,https://www.nytimes.com/2006/11/24/business/24damage.html,Phone vs. Cable: Turf Wars Escalate,"After decades of relative peace and separation, friction is growing as cable providers sell more phone lines and phone companies get into the video business.",2006/11/24
877,http://dealbook.nytimes.com/2006/11/27/merrill-analyst-more-media-consolidation-ahead/,Merrill Analyst: More Media Consolidation Ahead,"Despite the proliferation of new media channels and new technologies, both the creators and the distributors of media will further consolidate, with an even smaller handful of companies dominating, a Merrill Lynch analyst, Jessica Reif Cohen, said Monday at the Reuters Media Summit in New York.",2006/11/27
917,https://www.nytimes.com/2006/11/28/sports/football/28sandomir.html,"Cable Subscribers Arenâ€™t Saying, â€˜I Want My N.F.L.â€™","The NFL Network carried its first regular-season game on Thanksgiving night, but the cable operators who have refused to show the channel did not enlist.",2006/11/28
523,http://dealbook.nytimes.com/2006/11/29/equity-firm-officer-to-succeed-financial-executives-at-comcast/,Equity Firm Officer to Succeed Financial Executives at Comcast,"Comcast said Tuesday that its two longtime chief financial officers would retire next year and be succeeded by an executive from a private equity firm. The company named Michael J. Angelakis, a managing director of Providence Equity Partners, as chief financial officer. Mr. Angelakis, who worked on some of the biggest media buyouts is recent years, including the acquisition of Metro-Goldwyn-Mayer and the YES Network, was the chief executive of a small cable operator in Maine called State Cable TV in the 1990's.",2006/11/29
520,https://www.nytimes.com/2006/11/29/business/media/29cable.html,Equity Firm Officer to Succeed Financial Executives at Comcast,Comcastâ€™s two longtime chief financial officers will retire next year and will be succeeded by an executive from a private equity firm.,2006/11/29
908,https://www.nytimes.com/2006/11/30/fashion/30online.html,"Iâ€™m a Technology Werewolf, Striking Terror Into Gadgets","In my husbandâ€™s opinion, when it comes to technology, whatever the opposite of a green thumb is, I have it.",2006/11/30
943,https://www.nytimes.com/2006/12/03/magazine/03food.html,Shell Game,These competitive oyster crackers are going for the big shucks.,2006/12/03
923,http://thelede.blogs.nytimes.com/2006/12/04/live-from-paris-everything-youre-not-supposed-to-know/,Live from Paris: Everything You're Not Supposed to Know,"If you wake up in the morning and think, ""Gosh, I'm tired of the same old Anglo Saxon biases in my English-language international news broadcasts,"" you've had precious few options.",2006/12/04
907,https://www.nytimes.com/2006/12/09/business/09adelphia.html,Deloitte and Banks to Pay $455 Million to Adelphia Investors,"Deloitte & Touche, Bank of America and 38 other banks have agreed to pay $455 million to settle a lawsuit with Adelphia investors.",2006/12/09
900,https://www.nytimes.com/2006/12/10/nyregion/nyregionspecial2/10Rcable.html,A Wiring War Among Giants,"As Verizon enters the television market in the New York region, archrivals are moving to lure phone customers away with discounts.",2006/12/10
902,https://www.nytimes.com/2006/12/16/business/16interview.html,Turning Around Sprint-Nextel,"Gary Forsee, chief executive of Sprint-Nextel, spoke about efforts to right the companyâ€™s ship.",2006/12/16
945,https://www.nytimes.com/2006/12/16/sports/ncaafootball/16sandomir.html,"Sorry, Rutgers Fans, This Cable Squabble Isnâ€™t About You",The chances of Rutgers fans in the New York-New Jersey area watching the Scarlet Knights play Kansas State in the Texas Bowl on Dec. 28 are dimming.,2006/12/16
963,https://www.nytimes.com/2006/12/18/business/media/18adco-webdenda.html,People and Accounts of Note,,2006/12/18
784,https://www.nytimes.com/2006/12/18/technology/18cable.html,On Demand and on DVD at the Same Time,"Comcast, the nationâ€™s largest cable operator, has introduced an experimental program to release films on demand simultaneously with their release on DVDs.",2006/12/18
785,http://dealbook.nytimes.com/2006/12/20/vcs-feather-home-decors-nest-with-65-million/,V.C.'s Feather Home DÃ©cor's Nest With $65 Million,"A group of venture capital and strategic investors have acquired the stakes held by previous shareholders in online retailer Home DÃ©cor Products, providing the company with a $65 million injection of private capital and scuttling near-term plans for an initial public offering. The new financing was led by 3i Group and included Liberty Associated Partners and Comcast Interactive Capital, the venture investment vehicles associated with Liberty Media Holding and Comcast, respectively.",2006/12/20
955,https://www.nytimes.com/2006/12/24/sports/basketball/24hoops.html,"After Losing the Foundation, Whatâ€™s Often Left Is the Cellar",N.B.A. teams that jettison franchise players without receiving equal value often fall into disarray and are forced to start anew. The Philadelphia 76ers are hoping for better things after trading Allen Iverson.,2006/12/24
891,https://www.nytimes.com/2006/12/27/sports/football/27sandomir.html,"For N.F.L. Fans, the Cable Picture Isnâ€™t Any Clearer","When a network with appealing programming, such as the NFL Network, is not widely distributed, fan disenchantment is sure to follow.",2006/12/27
816,http://dealbook.nytimes.com/2007/01/03/revolving-door-weil-gotshal/,Revolving Door: Weil Gotshal,"Law firm Weil Gotshal & Manges said Wednesday that it hired Michael J. Aiello as a partner in the mergers and acquisitions group of its corporate department. Mr. Aiello was previously a partner at Dewey Ballantine, where he was part of the legal team that advised Walt Disney as it fought off Comcast's unsolicited bid in 2004.",2007/01/03
884,https://www.nytimes.com/2007/01/03/technology/03patent.html,Patent Lawsuit Names Leading Technology Firms,"The latest patent dispute pits Apple, Google and Napster against a company that closed five years ago.",2007/01/03
830,http://dealbook.nytimes.com/2007/01/03/apple-google-and-napster-named-in-patent-lawsuit/,"Apple, Google and Napster Named in Patent Lawsuit","Intertainer, a video-on-demand company, last week filed a broad lawsuit asserting that Apple, Google and Napster are infringing on a 2005 patent that covers the commercial distribution of audio and video over the Internet.",2007/01/03
896,https://www.nytimes.com/2007/01/04/business/media/04cable.html,Adelphia Bankruptcy Plan Is Approved,The plan to pay creditors and end one of the biggest bankruptcy cases in U.S. history was approved by a judge in New York.,2007/01/04
837,http://dealbook.nytimes.com/2007/01/08/time-warner-cable-may-come-to-market-without-an-ipo/,Time Warner Cable May Come to Market Without an I.P.O.,"Shares of Time Warner Cable, the second largest cable company in the nation, could hit the market within the next few weeks, analysts said. But Time Warner may bring its cable unit to market without having to go through the costly and time-consuming process of an initial public offering.",2007/01/08
946,https://www.nytimes.com/2007/01/10/washington/10net.html,Congress to Take Up Netâ€™s Future,Senior lawmakers have begun drafting legislation that would prevent high-speed Internet companies from charging content providers for priority access.,2007/01/10
