,link,headline,summary,date
514,https://www.nytimes.com/2013/05/10/business/media/youtubes-pay-channels-include-sesame-street-and-mixed-martial-arts.html,"YouTube Offers ‘Sesame Street’ and Martial Arts, for a Fee","The Web site identified 30 partners in its online video marketplace, which offers subscription rates ranging from 99 cents to $7.99 a month.",2013/05/10
642,https://www.nytimes.com/2013/05/10/business/media/now-the-tv-heavyweights-have-their-week-to-unveil-shows.html,Now the TV Heavyweights Have Their Week,"At the annual upfront week, the largest broadcast networks and cable channels will show off their programming for the 2013-14 season in expensive presentations.",2013/05/10
490,https://www.nytimes.com/2013/05/11/business/media/nbc-to-name-new-head-of-news-division.html,NBC News Is Said to Pick a Woman as Its Chief,"Deborah Turness, who worked at ITV News in Britain, would become the first woman to lead the news division at a major network.",2013/05/11
427,https://gadgetwise.blogs.nytimes.com/2013/05/13/qa-hanging-out-on-google/,Q.& A.: Hanging out on Google+,"Google+ Hangouts can support up to 10 people in a video chat or virtual meeting, but certain bandwidth speeds are required.",2013/05/13
636,https://www.nytimes.com/2013/05/13/business/media/abc-to-let-app-users-live-stream-local-programming.html,ABC to Live-Stream Its Shows via App,"The live stream, which will be available only to cable and satellite subscribers, is the first time that any major broadcaster has turned on such a technology.",2013/05/13
638,https://www.nytimes.com/2013/05/13/business/media/accounts-and-people-of-note-in-the-advertising-industry.html,Accounts and People of Note in the Advertising Industry,"Julie Atherton joined the New York office of SapientNitro as vice president for strategy. She succeeds Steve Zaroff, who is now the chief strategy officer at McCann Erickson New York.",2013/05/13
722,https://www.nytimes.com/2013/05/13/business/media/tv-networks-face-falling-ratings-and-new-rivals.html,"As TV Ratings and Profits Fall, Networks Face a Cliffhanger","The broadcast networks are preparing to unveil new fall lineups for an audience that is shrinking rapidly, lured away by new rivals on all sides.",2013/05/13
470,https://www.nytimes.com/2013/05/14/business/media/broadcast-networks-are-amply-filling-schedules.html,Broadcast Networks Are Amply Filling Schedules,NBC and Fox are the first of the big broadcast networks to present their coming schedules.,2013/05/14
392,https://www.nytimes.com/2013/05/15/business/media/univision-resets-sights-after-ratings-win-over-nbc.html,Univision Resets Sights After a Ratings Victory,Univision and many other television networks and channels aimed at Hispanics made their presentations to advertisers for the coming fall season.,2013/05/15
495,https://www.nytimes.com/2013/05/16/technology/personaltech/keeping-wi-fi-always-within-range.html,Keeping Wi-Fi Always Within Range,"A growing number of options are making a portable Wi-Fi connection affordable, including special hot spot devices and phone-tethering plans.",2013/05/16
512,https://www.nytimes.com/2013/05/17/business/media/usa-network-turns-to-vignettes-to-draw-viewers-and-advertisers-to-its-daytime-schedule.html,USA Network Turns to Vignettes to Draw Viewers and Advertisers to Its Daytime Schedule,The channel is adapting the show “Talk Stoop With Cat Greenleaf” for a series of vignettes that will appear during a daytime block of programming.,2013/05/17
373,https://www.nytimes.com/2013/05/19/business/whats-pro-business.html,What’s ‘Pro-Business’?,A reader responds to “Friend of the Corporation” (May 5).,2013/05/19
433,https://www.nytimes.com/2013/05/20/business/media/telecoms-big-players-hold-back-the-future.html,Telecom’s Big Players Hold Back the Future,A law school professor is on a permanent campaign to argue that the telecom and cable industry has been overtaken by monopolists who resist innovation and overcharge consumers.,2013/05/20
380,https://bits.blogs.nytimes.com/2013/05/20/aid-for-f-c-c-in-defending-its-net-neutrality-rules/,A Ruling Could Support F.C.C.’s Net Neutrality Defense,Supreme Court justices said that courts should defer to regulatory agencies in weighing how they carry out their mandates.,2013/05/20
306,https://www.nytimes.com/2013/05/21/business/media/video-on-demand-viewing-is-gaining-popularity.html,Viewers Start to Embrace Television on Demand,"Although it has been around for years, the technology is catching on among people who want to watch television on their own schedules.",2013/05/21
400,https://www.nytimes.com/2013/05/21/business/media/deborah-turness-named-president-of-nbc-news.html,NBC News Picks Leader to Steer Turnaround,"Ms. Turness, a British news executive, will face the same challenges as her counterparts at ABC and CBS as television viewers spend more time online.",2013/05/21
541,https://www.nytimes.com/2013/05/28/business/webdenda.html,Accounts and People of Note in the Advertising Industry,"Advertising Hall of Achievement, Washington, which honors industry professionals ages 40 and younger, selected its inductees for 2013.",2013/05/28
610,https://www.nytimes.com/2013/05/29/grubman-dishsprint-numbers-dont-add-up-to-shareholder-value/,Grubman: Dish/Sprint Numbers Don’t Add Up to Shareholder Value,"Jack Grubman, the former Citigroup telecommunications analyst and now an industry consultant, argues against a proposed Dish Network-Sprint deal.",2013/05/29
435,https://www.nytimes.com/2013/06/06/business/media/allen-gerritsen-to-merge-with-the-neiman-group.html,A Hint of ‘Mad Men’ in an Agency Merger,The two independent agencies want to expand to handle larger accounts and compete better.,2013/06/06
629,https://www.nytimes.com/2013/06/10/business/media/accounts-and-people-of-note-in-the-advertising-industry.html,Accounts and People of Note in the Advertising Industry,"ABC Regional Sports and Entertainment Sales, New York, signed a sales and marketing agreement to collaborate on a digital out-of-home LED network in major cities around the country.",2013/06/10
715,https://www.nytimes.com/2013/06/10/business/media/how-now-time-warner-cable-media.html,"‘How’ Now, Time Warner Cable Media?",Time Warner Cable is starting a campaign to raise awareness of its Media unit and will use the theme “That’s how.”,2013/06/10
293,https://www.nytimes.com/2013/06/13/business/media/gatekeepers-of-cable-tv-try-to-stop-intel.html,Gatekeepers of Cable TV Try to Stop Intel,Intel’s plan to create a virtual cable service is running up against a barricade being guarded by cable and satellite distributors.,2013/06/13
366,https://bits.blogs.nytimes.com/2013/06/13/daily-report-intel-aims-to-remake-the-tv-landscape/,Daily Report: Intel Aims to Remake the TV Landscape,"Intel’s ambition to sell a bundle of television channels to subscribers over the Internet is running up against stiff resistance from cable and satellite companies, Brian Stelter reports in The New York Times.",2013/06/13
245,https://www.nytimes.com/2013/06/13/sports/tennis/tennis-channel-executive-rants-after-losing-a-court-ruling.html,Tennis Channel Executive Rants After Losing a Court Ruling,Ken Solomon apologized after an angry e-mail to his staff about the decision was published on Deadspin.,2013/06/13
528,https://www.nytimes.com/2013/06/16/opinion/sunday/no-country-for-slow-broadband.html,No Country for Slow Broadband,The popular story going around about the state of America’s broadband networks is almost entirely false.,2013/06/16
364,https://www.nytimes.com/2013/06/19/bank-of-america-names-new-co-heads-of-technology-and-media-banking/,Bank of America Names New Co-Heads of Technology and Media Banking,"Bank of America Merrill Lynch named new co-heads of its technology, media and telecommunications investment banking group on Wednesday. It poached one from JPMorgan Chase.",2013/06/19
582,https://www.nytimes.com/2013/06/21/opinion/how-the-us-got-broadband-right.html,How the U.S. Got Broadband Right,Maintaining a restrained regulatory approach is the only way to continue momentum in broadband innovation.,2013/06/21
450,https://www.nytimes.com/2013/06/22/business/media/demise-of-rock-center-shows-difficulty-of-creating-a-newsmagazine.html,"Disappointing Fall for ‘Rock Center,’ a News Program With Big Ambitions","The NBC show was an ambitious effort to mimic the breadth of “60 Minutes,” but it never generated much of an audience. Friday was its last night.",2013/06/22
664,https://www.nytimes.com/2013/06/23/fashion/an-advice-book-by-a-28-year-old-not-quite.html,An Advice Book by a 28-Year-Old? Not Quite,Kelly Williams Brown tries to bring an amusing touch to her recommendations on how to be an adult.,2013/06/23
594,https://www.nytimes.com/2013/06/24/business/media/accounts-and-people-of-note-in-the-advertising-industry.html,Accounts and People of Note in the Advertising Industry,"The Ad Club, Boston, is observing its 100th anniversary with, among other things, a dinner-dance that will include a fireworks display.",2013/06/24
650,https://www.nytimes.com/2013/06/24/business/media/hulu-seeking-a-buyer-may-shift-course.html,Hulu Faces a Nebulous Future as It Seeks a New Owner,"Hulu’s sale could signal the end of one of the pioneers of online streaming, which has become an increasingly popular way to watch television.",2013/06/24
516,https://bits.blogs.nytimes.com/2013/06/29/after-fighting-mobile-trend-intel-now-embraces-it/,"After Fighting Mobile Trend, Intel Now Embraces It","Intel’s new chief executive, Brian Krzanich, explains how the company initially fought the mobile revolution and is now trying to catch up.",2013/06/29
370,https://www.nytimes.com/2013/06/30/fashion/weddings/kristan-jiggetts-benjamin-kenney.html,"Kristan Jiggetts, Benjamin Kenney","The bride teaches high-school English in Deerfield, Ill.; the groom is an assistant director of strategic research and analysis for the University of Chicago Medicine.",2013/06/30
296,https://www.nytimes.com/2013/06/30/talk-of-mergers-stirs-the-big-players-in-cable-tv/,Talk of Mergers Stirs Cable TV’s Big Players,"John C. Malone is weighing a deal for Time Warner Cable, using Charter Communications as the merger partner, people briefed on the matter said.",2013/06/30
782,https://www.nytimes.com/2013/07/01/deal-talk-in-cable-tv/,Deal Talk in Cable TV,"John C. Malone of Liberty Media is said to be weighing a deal for Time Warner Cable. | Criminal defense work, once shunned by top law firms, is looking increasingly lucrative. | Onyx Pharmaceuticals put itself up for sale after rejecting an unsolicited $10 billion takeover bid. | An updated analysis shows C.E.O.’s got a large raise last year.",2013/07/01
1183,https://www.nytimes.com/2013/07/07/nyregion/events-in-connecticut.html,Events in Connecticut,A guide to cultural and recreational events in Connecticut.,2013/07/07
616,https://www.nytimes.com/2013/07/08/business/media/a-different-deal-mania-grips-tv.html,A Different Deal Mania Grips TV,"As companies like Tribune and Gannett buy up local television stations, the goal is not transformation, but leverage, using size to cut better deals with distributors and suppliers.",2013/07/08
460,https://www.nytimes.com/2013/07/10/business/media/meredith-vieira-to-return-to-daytime-tv-as-talk-show-host.html,"Returning to Daytime TV, Vieira Will Host Talk Show","Meredith Vieira, former host on “The View” and “Today,” will begin her syndicated show in fall 2014 for NBCUniversal.",2013/07/10
382,https://www.nytimes.com/2013/07/10/business/media/legendary-entertainment-said-to-be-near-deal-to-move-to-universal.html,Legendary Entertainment Said to Be Near Deal to Move to Universal,"If the deal happens, the fast-growing movie financing and production company behind “Man of Steel” and “The Hangover” franchise would leave Warner Brothers.",2013/07/10
407,https://www.nytimes.com/2013/07/13/business/media/owners-of-hulu-call-off-sale-and-plan-to-invest-750-million.html,"Hulu Owners Call Off Sale, Instead Pledging to Invest to Take On Rivals","The streaming-video Web site had been seeking bids for months. The owners — 21st Century Fox, the Walt Disney Company and NBCUniversal — instead decided not to sell.",2013/07/13
345,https://www.nytimes.com/2013/07/17/business/media/google-is-said-to-mull-internet-cable-service.html,Google Said to Weigh Supplying TV Channels,"The company has begun talks with major media companies about licensing TV channels, according to people with knowledge of the meetings.",2013/07/17
361,https://bits.blogs.nytimes.com/2013/07/18/daily-report-apple-works-with-tv-industry-on-grand-vision/,Daily Report: Apple Works With TV Industry on ‘Grand Vision’,"Apple is working with distributors and producers of TV programming in its efforts to reimagine television as it did the cellphone, Brian Stelter reports in The New York Times.",2013/07/18
573,https://www.nytimes.com/2013/07/18/business/media/apples-move-into-tv-relies-on-cooperation-with-industry-leaders.html,Pushing the Right Buttons,"Apple’s steps to reimagine television, like teaming up with ESPN, stand in stark contrast to efforts by Google to compete with established companies.",2013/07/18
605,https://www.nytimes.com/2013/07/26/business/media/glenn-britt-to-retire-as-time-warner-cable-chief.html,Glenn Britt to Retire as Time Warner Cable Chief,"Mr. Britt, 64, will be succeeded by Robert Marcus, who at 48 represents generational change both for the company and the industry.",2013/07/26
627,https://www.nytimes.com/2013/07/29/business/media/two-ad-giants-in-merger-deal-chasing-google.html,Two Ad Giants Chasing Google in Merger Deal,The merger of Omnicom and Publicis signals that advertising is now firmly in the business of collecting and selling the personal information of millions of consumers.,2013/07/29
405,https://www.nytimes.com/2013/07/29/business/economic-reports-for-the-week-of-july-29.html,Economic Reports for the Week of July 29,"Data to be released will include pending home sales for June, the first estimate of second-quarter gross domestic product and ADP employment for July.",2013/07/29
534,https://www.nytimes.com/2013/07/31/business/media/abcs-evening-news-bests-nbc-in-coveted-age-group.html,ABC News Dethrones NBC in Crucial Ratings Race,"“World News With Diane Sawyer” beat “NBC News With Brian Williams” among viewers age 25 to 54 last week, ABC’s first victory in the category since 2008.",2013/07/31
62,https://www.nytimes.com/2013/08/01/business/media/2-media-companies-announce-big-gains-in-profit.html,"Comcast and CBS Post Strong Results, Aided by Web",Comcast surpassed analysts’ earnings projections while CBS Corporation reported its highest quarterly profits ever.,2013/08/01
64,https://www.nytimes.com/2013/08/01/business/media/comcast-profit-jumps-26-on-growth-of-broadband.html,Comcast Profit Jumps 28.6% on Growth of Broadband,"Comcast’s second-quarter earnings rose to $1.7 billion, exceeding analysts’ estimates, helped by the continued growth of the company’s broadband Internet and business products.",2013/08/01
454,https://www.nytimes.com/2013/08/02/business/media/fusion-announces-premiere-date-and-prime-time-schedule.html,Fusion Announces Premiere Date and Prime-Time Schedule,"The channel, a joint venture of ABC News and Univision, has broadened its target audience to include millennials as well as bilingual Latinos.",2013/08/02
1154,https://www.nytimes.com/2013/08/04/nyregion/events-in-connecticut.html,Events in Connecticut,A guide to cultural and recreational events in Connecticut.,2013/08/04
532,https://www.nytimes.com/2013/08/07/business/media/advance-ad-sales-for-new-tv-season-called-lukewarm.html,Advance Ad Sales for New TV Season Called Lukewarm,"The five broadcast networks sold an estimated $9 billion worth of commercial time before the season starts, about the same or a little less than last year’s sales.",2013/08/07
1120,https://www.nytimes.com/2013/08/11/nyregion/events-in-connecticut.html,Events in Connecticut,A guide to cultural and recreational events in Connecticut.,2013/08/11
669,https://www.nytimes.com/2013/08/12/morning-agenda-fresh-scrutiny-for-wall-street-analysts/,Fresh Scrutiny for Wall Street Analysts,"With I.P.O.’s making a comeback, some analysts say Wall Street is slipping back to its old ways. | Prosecutors are exploring ways to penalize JPMorgan Chase over a trading loss. | A look at the Wall Street experiences of Lawrence H. Summers. | The House Financial Services Committee is sometimes called “the cash committee.”",2013/08/12
319,https://bits.blogs.nytimes.com/2013/08/12/daily-report-nbc-to-buy-start-up-to-stream-video-from-phones/,Daily Report: NBC to Buy Start-Up to Stream Video From Phones,"On Monday, NBC News will announce its acquisition of Stringwire, an early stage Web service that enables streaming live video straight to its control rooms from mobile devices.",2013/08/12
484,https://www.nytimes.com/2013/08/12/business/media/nbc-buying-web-service-to-stream-phone-video.html,NBC Buying Web Service to Stream Phone Video,NBC News’s acquisition of Stringwire will allow it to stream live video from the cellphones of witnesses to events into its control rooms in New York.,2013/08/12
457,https://www.nytimes.com/2013/08/15/sports/hockey/76ers-owner-is-expected-to-buy-the-devils.html,76ers Owner Expected to Buy Devils,"Josh Harris, the principal owner of the Philadelphia 76ers, is expected to buy the Devils and assume their lease in Newark in a deal said to be worth more than $320 million.",2013/08/15
339,https://www.nytimes.com/2013/08/16/business/media/sony-and-viacom-reach-tentative-internet-tv-deal.html,Sony and Viacom Reach Tentative Deal to Stream Cable Channels,The agreement is believed to be the first of its kind between a major programmer and any of the technology giants that are trying to disrupt traditional modes of TV delivery.,2013/08/16
488,https://www.nytimes.com/2013/08/16/sports/hockey/a-change-in-devils-owners-but-not-in-the-boss-lamoriello.html,"A Change in the Devils’ Owners, but Not in the Boss","Joshua Harris and David Blitzer were introduced as the Devils’ new owners, with Lou Lamoriello, the club’s longtime president and general manager, still in charge of the on-ice operations.",2013/08/16
1033,https://www.nytimes.com/2013/08/18/nyregion/events-in-connecticut.html,Events in Connecticut,A guide to cultural and recreational events in Connecticut.,2013/08/18
449,https://www.nytimes.com/2013/08/19/technology/a-push-to-connect-millions-who-live-offline-to-the-internet.html,"Most of U.S. Is Wired, but Millions Aren’t Plugged In","The Obama administration is concerned that 60 million are shut out of jobs, government services, health care and education, and that the economic effects are looming larger.",2013/08/19
548,https://www.nytimes.com/2013/08/21/business/media/al-jazeera-makes-its-american-debut.html,Al Jazeera Makes Limited American Debut,"The news channel, which replaced Current TV on Tuesday, lost some viewers when it was dropped by AT&T U-verse and could not be streamed over the Internet.",2013/08/21
543,https://www.nytimes.com/2013/08/22/technology/personaltech/streaming-devices-lead-the-way-to-smart-tv.html,Devices Lead the Way to a Smarter TV,"While change is coming to the television set, for now the best way to get access to online video is through game consoles and other devices like Apple TV and Google’s Chromecast.",2013/08/22
371,https://artsbeat.blogs.nytimes.com/2013/08/30/dave-chappelle-cuts-short-a-stand-up-show/,Dave Chappelle Cuts Short a Stand-Up Show,The comedian cut off a performance in Hartford when he became frustrated by audience members interrupting his routine.,2013/08/30
455,https://www.nytimes.com/2013/09/02/big-banks-and-solo-deal-maker-to-share-in-huge-telecom-deal/,"Big Banks, and Solo Deal Maker, to Share in Huge Telecom Deal","A platoon of big banks and independent advisers, including a former star banker at Morgan Stanley, are set to reap hundreds of millions of dollars in fees from Verizon’s $130 billion deal with Vodafone.",2013/09/02
607,https://www.nytimes.com/2013/09/03/business/media/accounts-and-people-of-note-in-the-advertising-industry.html,Accounts and People of Note in the Advertising Industry,"American Express is teaming with Vanity Fair and Condé Nast Entertainment for “The Decades Series,” a collection of video clips that will mark the 100th anniversary of Vanity Fair.",2013/09/03
580,https://www.nytimes.com/2013/09/07/business/media/bold-play-by-cbs-fortifies-broadcasters.html,Bold Play by CBS Fortifies Broadcasters,"CBS and its chief, Les Moonves, have given the broadcast world a shot in the arm by pushing distributors to pay broadcasters just as they do cable networks.",2013/09/07
531,https://www.nytimes.com/2013/09/07/business/media/if-million-second-quiz-succeeds-nbc-gets-the-grand-prize.html,"If ‘Million Second Quiz’ Succeeds, NBC Gets the Grand Prize","NBC’s new quiz show, starting on Monday, is getting attention for its unspoken ambition: proving that broadcast TV still matters.",2013/09/07
281,https://www.nytimes.com/2013/09/09/business/verizon-and-fcc-net-neutrality-battle-set-in-district-court.html,Verizon-F.C.C. Court Fight Takes On Regulating Net,Verizon and other companies that spent billions of dollars to build their Internet pipelines are fighting the F.C.C.,2013/09/09
462,https://www.nytimes.com/2013/09/09/business/media/accounts-and-people-of-note-in-the-advertising-industry.html,Accounts and People of Note in the Advertising Industry,"Advertising spending in the United States rose 3.5 percent in the second quarter compared with the same period a year ago, according to a report by the Kantar Media unit of WPP.",2013/09/09
65,https://www.nytimes.com/2013/09/10/business/media/jeff-shell-television-executive-to-take-over-at-universal-studios.html,"Jeff Shell, TV Executive, to Take Over at Universal Studios","Comcast, NBCUniversal’s corporate owner, appears intent on funneling the Hollywood studio’s content to cable television.",2013/09/10
461,https://www.nytimes.com/2013/09/13/nyregion/verizon-abandons-plans-for-wireless-home-phones-in-parts-of-new-york.html,Verizon Backing Off Plans for Wireless Home Phones,"Amid complaints from residents of Fire Island, the company said it would start laying fiber optic cable to restore service in areas ravaged by Hurricane Sandy.",2013/09/13
526,https://www.nytimes.com/2013/09/13/business/media/nbc-announces-a-face-lift-and-one-new-face-for-today.html,"NBC Announces a Face-Lift, and One New Face, for ‘Today’","NBC outlined changes for its morning program, “Today,” which has lost about a quarter of its audience and is stuck in second place behind “Good Morning America.”",2013/09/13
240,https://www.nytimes.com/2013/09/16/business/media/a-befuddling-game-show-slides-despite-synergies.html,"A Befuddling Game Show Slides, Despite ‘Synergies’",A strategy known as “symphony” — in which NBC liberally salts its broadcasts with promotions — seems to have had little effect in drawing viewers to “The Million Second Quiz.”,2013/09/16
653,https://www.nytimes.com/2013/09/16/business/media/accounts-and-people-of-note-in-the-advertising-industry.html,Accounts and People of Note in the Advertising Industry,"Bentley Motors has chosen a Minneapolis agency, Solve, to lead its marketing in the Americas.",2013/09/16
386,https://www.nytimes.com/2013/09/19/business/media/live-commercials-coming-to-late-night.html,Live Commercials Coming to ‘Late Night’,The advertisements for Lexus will run during Jimmy Fallon’s taped talk show. A comedy troupe will come up with the commercials based on audience suggestions.,2013/09/19
637,https://www.nytimes.com/2013/09/21/sports/ensuring-team-items-are-just-a-click-away.html,Ensuring Team Items Are Just a Click Away,"Fanatics is the nation’s largest online seller of licensed sports merchandise. It includes more than one million items for professional and college teams, conferences and leagues.",2013/09/21
289,https://www.nytimes.com/2013/09/21/business/media/head-of-nbc-entertainment-extends-contract-to-2017.html,Head of NBC Entertainment Extends Contract to 2017,"Robert Greenblatt, who was put in charge by Comcast in 2011, has had some successes like “The Voice” as well as fallow periods.",2013/09/21
383,https://www.nytimes.com/2013/09/23/business/media/news-from-the-advertising-industry.html,News From the Advertising Industry,"Account assignments, executive appointments and miscellaneous news from advertising agencies.",2013/09/23
508,https://www.nytimes.com/2013/09/28/business/media/breaking-bad-race-to-the-end.html,Race to End for ‘Breaking Bad’ Fans Who Got Behind,"Viewers are trying to catch up on old episodes of “Breaking Bad” through Netflix, Amazon, iTunes and other Internet services as the hit series nears its end.",2013/09/28
60,https://www.nytimes.com/2013/09/28/business/media/comcast-ordered-to-place-bloomberg-with-tv-peers.html,Comcast Ordered to Place Bloomberg With TV Peers,A Federal Communications Commission ruling asserted that the cable company must place Bloomberg TV closer to other news channels in so-called news neighborhoods.,2013/09/28
473,https://www.nytimes.com/2013/09/30/business/media/accounts-and-people-of-note-in-the-advertising-industry.html,Accounts and People of Note in the Advertising Industry,"Sponsorship spending for cause marketing is expected to total $1.78 billion this year, up almost 5 percent over last year.",2013/09/30
