,link,headline,summary,date
271,https://www.nytimes.com/video/business/dealbook/100000003647202/why-comcast-walked-away.html,Why Comcast Walked Away,"“We gotta move on,” says Brian L. Roberts, Comcast’s chief executive, on abandoning the cable giant’s $45 billion bid for Time Warner Cable.",
153,https://www.nytimes.com/video/business/100000004190862/nyts-stewart-on-redstone-king-lear-in-the-boardroom.html,Talking of Comcast and Viacom,"James B. Stewart, appearing on CNBC, described the situation in Viacom as ""King Lear in the board room"" and also discussed strong earnings at Comcast.",
477,https://www.nytimes.com/video/business/dealbook/100000003647466/people-hate-the-cable-companies.html,‘People Hate the Cable Companies’,James B. Stewart of The New York Times discusses Comcast’s abandoned bid for Time Warner Cable and negative yields in Europe.,
462,https://www.nytimes.com/video/multimedia/100000003704842/charter-buying-larger-rival-time-warner-cable.html,Charter buying larger rival Time Warner Cable,"Charter Communications deal to buy Time Warner Cable will face scrutiny from regulators, but, if completed, will create a strong number two rival to Comcast. Bobbi Rebell reports.",
262,https://www.nytimes.com/video/multimedia/100000003645119/setback-for-comcasts-merger-deal.html,Setback for Comcast's merger deal,"Comcast's $45 billion merger deal with Time Warner Cable will reportedly be sent to an administrative judge, and that could put Time Warner Cable into play. Fred Katayama reports.",
160,https://www.nytimes.com/interactive/2018/business/dealbook/tax-savings-benefits.html,What Companies Are Doing With Their Savings From the Tax Law,"The tax overhaul has prompted hundreds of employers, including at least 40 members of the Standard & Poor’s 500-stock index, to pass on savings to workers.",
674,https://www.nytimes.com/2014/09/02/fanduel-an-online-fantasy-sports-site-raises-70-million/,"FanDuel, an Online Fantasy Sports Site, Raises $70 Million","FanDuel has obtained financing from investors led by Shamrock Capital Advisors, NBC Sports Ventures and Kohlberg Kravis Roberts.",2014/09/02
641,https://www.nytimes.com/2014/09/09/business/media/att-u-verse-to-carry-rural-media-groups-rfd-tv.html,AT&T U-verse to Carry Rural Media Group’s RFD-TV,The rural-focused television network landed coverage on AT&T’s service after a monthslong campaign against a pair of proposed media mergers.,2014/09/09
610,https://bits.blogs.nytimes.com/2014/09/10/netflix-and-other-big-websites-protest-proposed-net-neutrality-rules/,Netflix and Other Big Websites Protest Proposed Net Neutrality Rules,"The sites used a pinwheel icon, which means something is loading slowly, to show users what it would be like if Internet traffic was slowed.",2014/09/10
722,https://www.nytimes.com/2014/09/11/business/media/a-video-series-turns-a-spotlight-on-local-artists.html,A Video Series Turns a Spotlight on Local Artists,"Each episode opens with text that indicates that it is presented by Windstream, but contrary to what is often the case with branded content, the company is never mentioned or even obliquely evoked otherwise.",2014/09/11
729,https://www.nytimes.com/2014/09/12/morning-agenda-banks-bow-to-apple-pay/,Morning Agenda: Banks Bow to Apple Pay,Banks eager to work with Apple on new mobile payment system. | Signs rattle subprime lending industry. | Bankers fear Britain’s exit from E.U. | Hertz and Icahn make peace.,2014/09/12
715,https://www.nytimes.com/2014/09/15/business/media/q-and-a-with-stuart-elliott.html,Q. and A. With Stuart Elliott,Readers are unhappy with the back-to-back commercial practice.,2014/09/15
676,https://boss.blogs.nytimes.com/2014/09/16/today-in-small-business-the-case-against-tipping/,Today in Small Business: The Case Against Tipping,Tech upgrades for small businesses. How to use Instagram to promote products. Should we ban states and cities from offering tax breaks for jobs?,2014/09/16
726,https://www.nytimes.com/2014/09/25/morning-agenda-devices-fuel-subprime-auto-boom/,Morning Agenda: Devices Fuel Subprime Auto Boom,Subprime auto lenders are using technology to digitally repossess cars. | Trading opportunities beckon in China. | Harvard names endowment chief. | Wednesday was a big day for I.P.O.s,2014/09/25
349,https://www.nytimes.com/2014/09/25/business/media/comcast-accuses-rivals-of-extortion-in-opposing-its-bid-for-time-warner-cable.html,Comcast Lashes Out at Rivals Opposed to Merger Plan,"In a filing with regulators, the company said opponents of the deal with Time Warner Cable first sought “various self-interested requests,” which were denied.",2014/09/25
357,https://www.nytimes.com/2014/09/29/business/media/growling-by-comcast-may-bring-tighter-leash.html,Growling by Comcast May Bring Tighter Leash,"Regardless of the company’s motive, the issues it raised are hugely important and won’t be brushed aside by bombast or counterattack.",2014/09/29
712,https://wordplay.blogs.nytimes.com/2014/10/01/20th-century-figure/,20th-Century Figure,David Woolf challenges the laws of physics.,2014/10/01
623,https://www.nytimes.com/2014/10/02/us/retired-veteran-of-presidents-detail-will-temporarily-lead-secret-service.html,Interim Secret Service Chief Was in President’s Detail,"Joseph Clancy, 58, who retired from the Secret Service in 2011 as special agent in charge of the Presidential Protective Division, will replace Julia Pierson, who resigned.",2014/10/02
677,https://boss.blogs.nytimes.com/2014/10/08/today-in-small-business-the-bacon-boom/,Today in Small Business: The Bacon Boom,The “most bountiful” holiday season in three years? The most innovative cities in America. Did Comcast retaliate against an unhappy customer by getting him fired?,2014/10/08
640,https://www.nytimes.com/2014/10/09/us/latest-news-ebola-st-louis-new-york-comic-con.html,Your Thursday Briefing,Here’s what you need to know to start your day.,2014/10/09
717,https://www.nytimes.com/2014/10/10/blackstone-to-spin-off-its-advisory-business/,"Shunning Wall Street Norms, Blackstone to Spin Off Its Advisory Group","The business will merge with a fledgling firm founded by Paul J. Taubman, the former Morgan Stanley investment banker, who will run the combined firm as chief executive and chairman.",2014/10/10
653,https://www.nytimes.com/2014/10/10/blackstones-move-could-set-off-a-trend/,Blackstone’s Move Could Set Off a Trend,"The deal may give other merger practitioners ideas. The rise in global mergers may spawn a super-boutique or entice a big bank to buy an independent firm, Jeffrey Goldfarb of Reuters Breakingviews writes.",2014/10/10
689,https://www.nytimes.com/2014/10/11/business/media/21st-century-fox-combines-with-apollo-to-form-tv-production-group.html,21st Century Fox Forms TV Production Joint Venture With Apollo,"The deal, valued at more than $2 billion, unites the makers of “Big Brother,” “American Idol” and “MasterChef,” among other shows.",2014/10/11
647,https://www.nytimes.com/2014/10/11/business/obama-reiterates-his-support-for-net-neutrality.html,Obama Reiterates His Opposition to Internet ‘Fast Lanes’,The president gave a strong signal to his Democratic appointees to the Federal Communications Commission that he wants them to heed those opposing Internet fast lanes.,2014/10/11
582,https://www.nytimes.com/2014/10/14/business/jean-tirole-wins-nobel-prize-in-economics.html,Jean Tirole Wins Nobel in Economics for Work on Regulation,"Mr. Tirole, a French economist, has provided insight into how governments can best tame powerful firms, the Royal Swedish Academy of Sciences said.",2014/10/14
671,https://boss.blogs.nytimes.com/2014/10/14/today-in-small-business-business-travel-and-ebola/,Today in Small Business: Business Travel and Ebola,How to transfer money through Twitter. How to get the most out of Yelp. Is this the hottest real estate start-up in New York City?,2014/10/14
734,https://www.nytimes.com/2014/10/17/business/cbs-to-offer-web-subscription-service.html,Cord-Cutters Rejoice: CBS Joins Web Stream,"The moves by CBS and HBO signal a watershed moment for web-delivered television, where viewers have more options to pay only for the networks or programs they want to watch — and to decide how, when and where to watch them.",2014/10/17
353,https://bits.blogs.nytimes.com/2014/10/20/senator-calls-on-comcast-to-extend-net-neutrality-pledge/,Senator Calls on Comcast to Extend Net Neutrality Pledge,"Senator Patrick Leahy, the Vermont Democrat who chairs the Judiciary Committee, called on Comcast to commit to never allow so-called fast lanes, or paid prioritization, on its network, even beyond the expiration of a current promise to avoid the practice through 2018.",2014/10/20
629,https://www.nytimes.com/2014/10/20/business/media/the-stream-finally-cracks-the-dam-of-cable-tv-.html,The Stream Finally Cracks the Dam of Cable TV,"Netflix, which was supposed to lay waste to traditional media companies, may have saved them instead.",2014/10/20
639,https://www.nytimes.com/2014/10/22/sports/johnny-weir-and-tara-lipinski-named-nbcs-top-figure-skating-broadcast-team.html,NBC Is Ready to Name Weir and Lipinski as Its Top Figure Skating Broadcast Team,"Johnny Weir and Tara Lipinski, whose analysis drew praise during the Winter Olympics in Sochi, have earned an expected promotion to the lead team for the sport on the NBC Sports Group.",2014/10/22
728,https://www.nytimes.com/2014/10/22/upshot/political-tv-ads-can-be-wasteful-but-thats-changing.html,Political TV Ads Can Be Wasteful. But That’s Changing.,The tools to target the most valuable segments of the electorate are slowly being put to use.,2014/10/22
551,https://www.nytimes.com/2014/10/22/opinion/hbo-and-cbs-move-toward-selling-content-directly-to-consumers.html,Unraveling the Cable Bundle,"HBO and CBS are moving toward à la carte services, a more pragmatic approach to selling content that should benefit consumers.",2014/10/22
626,https://www.nytimes.com/2014/10/24/business/media/amc-networks-buys-a-stake-in-bbc-america.html,AMC Networks Acquires a Stake in BBC America,The transaction brings together two television groups that attract affluent audiences.,2014/10/24
557,https://www.nytimes.com/2014/10/26/sports/hockey/a-year-later-trying-to-comprehend-a-young-hockey-players-suicide.html,"A Year Later, Trying to Comprehend a Young Hockey Player’s Suicide",The family and friends of a 17-year-old hockey player are coming to terms with who he was and what led him to leap from the George Washington Bridge.,2014/10/26
638,https://www.nytimes.com/2014/10/27/business/media/accounts-and-people-of-note-in-the-advertising-industry.html,Accounts and People of Note in the Advertising Industry,"George Washington University hired Tribal Worldwide as its first digital media agency of record, and Anheuser-Busch chose LatinWorks for a Mexican beer campaign.",2014/10/27
401,https://www.nytimes.com/2014/10/29/nyregion/free-broadband-for-public-housing-in-new-york-sought-as-condition-in-comcast-deal.html,Free Broadband for Public Housing in New York Sought as Condition in Comcast Deal,A group of New York politicians is lobbying Comcast to provide the free broadband as a condition for its proposed $45 billion merger with Time Warner Cable.,2014/10/29
685,https://bits.blogs.nytimes.com/2014/10/29/unpacking-the-f-c-c-s-online-video-proposal/,Unpacking the F.C.C.’s Online Video Proposal,A blog post by the chairman of the Federal Communications Commission about online video seemed to raise as many questions as it answered.,2014/10/29
719,https://www.nytimes.com/2014/10/31/upshot/why-the-us-has-fallen-behind-in-internet-speed-and-affordability.html,Why the U.S. Has Fallen Behind in Internet Speed and Affordability,The lack of competition in the U.S. broadband industry could have long-term economic consequences for American competitiveness.,2014/10/31
709,https://www.nytimes.com/2014/11/05/nyregion/in-lopsided-money-race-cuomo-campaign-is-awash-in-cash.html,"Awash in Campaign Cash, Cuomo Benefited From Big Donors and Loopholes","Gov. Andrew M. Cuomo has raised more than $45 million over the past four years, according to a research group. His opponent, Rob Astorino, had raised $4.8 million as of last month.",2014/11/05
549,https://www.nytimes.com/2014/11/09/your-money/the-stock-market-is-on-edge-about-a-cable-merger.html,The Stock Market Is on Edge About a Cable Merger,"As regulatory issues swirl, investors are fretting over a Comcast deal with Time Warner Cable.",2014/11/09
741,https://www.nytimes.com/2014/11/09/opinion/sunday/a-promising-approach-to-internet-rules.html,A Promising Approach to Internet Rules,"To ensure a fair hybrid system for Web traffic, the F.C.C. must be willing to limit the power of broadband giants.",2014/11/09
708,https://www.nytimes.com/2014/11/10/business/media/news-from-the-advertising-industry-.html,News From the Advertising Industry,"Account assignments, miscellaneous news from advertising agencies and more.",2014/11/10
588,https://takingnote.blogs.nytimes.com/2014/11/10/obama-for-net-neutrality/,Obama for Net Neutrality,Ted Cruz tried to link his proposal to health care reform.,2014/11/10
688,https://www.nytimes.com/2014/11/11/business/media/nbc-executive-says-he-is-very-satisfied-with-pace-of-super-bowl-ad-sales.html,NBC Executive Says He Is ‘Very Satisfied’ With Pace of Super Bowl Ad Sales,"Sales of commercial time in Super Bowl XLIX by NBC, which will broadcast the game Feb. 1, is approaching 90 percent.",2014/11/11
707,https://www.nytimes.com/2014/11/11/upshot/a-super-simple-way-to-understand-the-net-neutrality-debate.html,A Super-Simple Way to Understand the Net Neutrality Debate,President Obama has thrown his support behind the idea that Internet access is more like access to electricity than to cable TV.,2014/11/11
594,https://www.nytimes.com/politics/first-draft/2014/11/11/big-business-strongly-opposed-to-net-neutrality-rules/,Big Business ‘Strongly Opposed’ to Net Neutrality Rules,The biggest business lobby group in the United States is not happy that President Obama is pressuring the Federal Communications Commission to impose stricter rules on broadband providers.,2014/11/11
658,https://www.nytimes.com/2014/11/12/business/net-neutrality-debate-access-and-costs-are-top-issues.html,Net Neutrality Debate: Internet Access and Costs Are Top Issues,"After President Obama urged the F.C.C. to set tougher net neutrality rules, questions loom about decreased competition and the cost of monitoring.",2014/11/12
366,https://www.nytimes.com/2014/11/13/net-neutrality-review-could-give-comcast-an-out-in-the-time-warner-cable-deal/,Net Neutrality Review Could Give Comcast an Out in the Time Warner Cable Deal,"Comcast is locked into its deal with Time Warner Cable unless it gets a timely assist from the Federal Communications Commission, Steven Davidoff Solomon writes in the Deal Professor column.",2014/11/13
616,https://www.nytimes.com/2014/11/13/technology/in-net-neutrality-debate-tech-giants-on-the-sidelines.html,"In Net Neutrality Push, Internet Giants on the Sidelines",Companies like Facebook and Google have stayed away from mobilizing their users to support an issue that primarily affects smaller Internet upstarts.,2014/11/13
540,https://www.nytimes.com/2014/11/13/upshot/internet-firms-are-far-behind-cable-companies-in-political-donations.html,Internet Firms Are Far Behind Cable Companies in Political Donations,The gap is slowly closing between the two sides in a coming debate over Internet regulation.,2014/11/13
361,https://www.nytimes.com/2014/11/14/morning-agenda-net-neutralitys-effect-on-comcast/,Morning Agenda: Net Neutrality’s Effect on Comcast,Net neutrality could give Comcast a way out of its Time Warner Cable acquisition. | Warren E. Buffett’s deal for Duracell satisfies a number of his deal-making preferences. | Virgin America to begin trading. | Goldman seeks to lure tech talent.,2014/11/14
561,https://www.nytimes.com/2014/11/15/opinion/joe-nocera-net-neutrality-rules.html,Net Neutrality Rules,Why is it so hard to achieve a deal when it’s something that everyone wants?,2014/11/15
723,https://www.nytimes.com/2014/11/15/opinion/why-the-fcc-should-heed-president-obama-on-internet-regulations.html,Why the F.C.C. Should Heed President Obama on Internet Regulation,Preventing the creation of fast and slow lanes on the Internet would correct an old mistake.,2014/11/15
693,https://www.nytimes.com/2014/11/16/actavis-said-near-deal-to-buy-allergan/,Allergan Nears a Deal With Actavis to Block a Takeover by Valeant,"At $62.5 billion, a deal between the drug makers Actavis and Allergan would be one of the biggest mergers of the year.",2014/11/16
533,https://www.nytimes.com/2014/11/16/your-money/a-plumbing-problem-for-the-internet-and-the-stock-market-.html,A Plumbing Problem for the Internet (and the Stock Market),How the net neutrality debate has jostled the stock price of one keeper of the pipes.,2014/11/16
721,https://www.nytimes.com/2014/11/17/allergan-agrees-to-be-sold-to-actavis/,"Allergan Escapes Valeant’s Pursuit, Agreeing to Be Bought by Actavis",The $66 billion acquisition by Actavis would be the largest deal this year and would thwart the takeover effort of Valeant and William A. Ackman.,2014/11/17
735,https://www.nytimes.com/2014/11/17/mega-mergers-popular-again-on-wall-street/,Mega-Mergers Popular Again on Wall Street,"A pair of deals announced on Monday, worth $100 billion, brought the year’s total for American companies to $1.5 trillion, the highest since 2000.",2014/11/17
656,https://www.nytimes.com/2014/11/17/actavis-and-halliburton-deals-make-for-biggest-merger-monday-of-2014/,Actavis and Halliburton Deals Make for Biggest ‘Merger Monday’ of 2014,Merger Monday turned into mega-merger Monday as more than $105 billion worth of deals were announced.,2014/11/17
642,https://www.nytimes.com/2014/11/21/taubman-hires-top-sports-banker/,Taubman Hires Top Sports Banker,"Paul J. Taubman is bringing Don Cornwell, a managing director who specializes in sports team deals, to his boutique investment bank.",2014/11/21
667,https://boss.blogs.nytimes.com/2014/11/21/today-in-small-business-big-cannabis-is-coming/,Today in Small Business: ‘Big Cannabis’ Is Coming,How the president’s immigration plan could help cities like Detroit. A lot of notable investors — and a former head of the Small Business Administration — are investing in a payroll start-up. A seasoned traveler says you can be more productive on a plane without Wi-Fi.,2014/11/21
743,https://www.nytimes.com/2014/11/22/us/rhode-island-investigating-ex-attorney-general-on-lobbying-rule.html,Rhode Island Investigating Former State Attorney General,A former Rhode Island attorney general is being investigated on suspicion of lobbying former colleagues without registering as a lobbyist.,2014/11/22
690,https://www.nytimes.com/2014/11/25/arts/television/jimmy-fallons-name-goes-on-30-rock-marquee.html,Jimmy Fallon’s Name Goes on 30 Rock Marquee,"The marquee, consistent with the building’s Art Deco architecture, announces that it is home to “The Tonight Show Starring Jimmy Fallon.”",2014/11/25
727,https://www.nytimes.com/2014/11/29/us/politics/ex-chief-of-obama-security-works-to-buck-up-scarred-secret-service.html,Ex-Chief of Obama Security Works to Boost Scarred Secret Service,"Joseph P. Clancy leads an agency marred by embarrassing incidents, particularly one in which an Army veteran with a knife penetrated the White House.",2014/11/29
706,https://www.nytimes.com/2014/12/04/morning-agenda-young-bankers-flock-to-private-equity/,Morning Agenda: Young Bankers Flock to Private Equity,Young Wall Street bankers are enamored with private equity. | An activist investor takes aim at TheStreet. | Brazilians are turning to pawnshops for cash.,2014/12/04
340,https://www.nytimes.com/2014/12/04/business/media/coalition-formed-to-oppose-comcast-time-warner-cable-merger.html,Coalition Opposes Comcast-Time Warner Cable Merger,"A collection of companies, public interest groups and labor unions said the deal with Comcast would harm both consumers and competition.",2014/12/04
652,https://www.nytimes.com/2014/12/07/after-a-dry-spell-a-boom-in-big-deals/,"After a Dry Spell, a Boom in Big Deals","Low interest rates, strong stock prices and healthy capital balances set the scene for a flurry of large acquisitions, most of them traditional and relatively safe bets.",2014/12/07
648,https://www.nytimes.com/2014/12/08/business/obamas-net-neutrality-bid-divides-civil-rights-groups.html,Obama’s Net Neutrality Bid Divides Civil Rights Groups,"The vision for regulation of the Internet has met with opposition from the N.A.A.C.P. and the Rainbow/PUSH Coalition, while other civil rights groups support treating Internet access as an essential service.",2014/12/08
637,https://www.nytimes.com/2014/12/09/boutique-investment-banks-gain-prestige/,Boutique Investment Banks Gain Prestige,"Though 2014 may have been a year of big deals, it was also a banner year for many of the smaller investment banks advising on them.",2014/12/09
692,https://www.nytimes.com/2014/12/20/business/motion-picture-association-criticizes-media-coverage-of-sony-attack.html,Sony Defends Itself Against Criticism That It Bowed to Hackers’ Threats,Sony says it has been searching for alternative ways to show “The Interview” after theater owners refused to book it in the face of threats.,2014/12/20
718,https://www.nytimes.com/2014/12/22/business/federal-trade-commission-raises-its-voice-under-its-soft-spoken-chairwoman.html,Edith Ramirez Is Raising the F.T.C.’s Voice,"Edith Ramirez’s tenure as leader of the commission has been marked by an effort to bring the regulator into the public eye, directing particular attention on digital privacy and transactions.",2014/12/22
716,https://www.nytimes.com/2014/12/27/us/bipartisan-effort-to-restrict-lobbyists-influence-of-attorneys-general.html,A Bipartisan Push to Limit Lobbyists’ Sway Over Attorneys General,An effort is emerging to try to prevent lawyers and lobbyists from shutting down investigations or enlisting attorneys general as partners in litigation.,2014/12/27
554,https://www.nytimes.com/2015/01/01/business/media/sonys-the-interview-is-set-for-on-demand-and-wider-online-viewing.html,Sony’s ‘The Interview’ Is Set for On-Demand and Wider Online Viewing,"Sony’s new partners will expand digital availability of the film, which will also have a wider theatrical release starting Friday.",2015/01/01
605,https://www.nytimes.com/2015/01/09/opinion/net-neutrality-and-the-fcc.html,Moving Toward Internet Fairness,The Federal Communications Commission is getting closer to issuing strong rules on broadband service.,2015/01/09
644,https://www.nytimes.com/2015/01/10/sports/ncaafootball/darren-carrington-not-with-ducks-for-college-football-playoff-championship.html,Receiver Out for Oregon in Title Game,"The Ducks seem likely to face Ohio State in the national championship game on Monday without wide receiver Darren Carrington, who is not with the team, a spokesman said.",2015/01/10
714,https://www.nytimes.com/2015/01/13/business/a-small-software-company-sees-a-future-in-containers-of-code.html,"Docker, a Software Start-Up, Sees a Future in Containers of Code",The start-up is in the forefront of a move to package applications much as shipping containers hold physical goods.,2015/01/13
607,https://takingnote.blogs.nytimes.com/2015/01/14/getting-government-into-the-broadband-business/,Getting Government Into the Broadband Internet Business,President Obama wants to make it easier for cities to compete with cable and telephone companies.,2015/01/14
618,https://www.nytimes.com/2015/01/18/your-money/decoding-the-paradox-of-rising-cable-stocks.html,Decoding the Paradox of Rising Cable Stocks,"Why, despite President Obama’s moves toward greater regulation of Internet providers, cable companies’ share prices have continued to go up.",2015/01/18
509,https://www.nytimes.com/2015/01/20/technology/shifting-politics-of-net-neutrality-debate-ahead-of-fcc-vote.html,Shifting Politics of Net Neutrality Debate Ahead of F.C.C. Vote,"A simple fight over big government versus small has put Republicans in the awkward position of defending cable giants, one of the nation’s most maligned industries.",2015/01/20
581,https://www.nytimes.com/2015/01/21/upshot/obama-calls-for-more-internet-service-options-for-consumers.html,Obama Calls for More Internet Options for Consumers,The goal is to increase competition among Internet providers and spur better prices and service.,2015/01/21
679,https://www.nytimes.com/2015/01/22/sports/facing-76ers-knicks-earn-a-win-someone-had-to.html,"Facing 76ers, Knicks Earn a Win. Someone Had To.","In a game between two teams jockeying for the top pick in the N.B.A. draft, the Knicks, whether they liked it or not, took home the victory.",2015/01/22
731,https://www.nytimes.com/politics/first-draft/2015/01/23/today-in-politics-81/,Today in Politics,The death of King Abdullah of Saudi Arabia will usher in a new era of relations between the United States and its most stalwart Arab ally.,2015/01/23
684,https://www.nytimes.com/2015/01/27/morning-agenda-subprime-auto-loans-spun-into-gold/,Morning Agenda: Subprime Auto Loans Spun Into Gold,Investors are fueling the boom in subprime auto lending. | Snow blankets the New York region. | A Dodd-Frank provision on disclosing pay ratios has stalled. | Helena Morrissey is the face of women’s advancement in business in Britain.,2015/01/27
604,https://www.nytimes.com/2015/01/29/opinion/republicans-try-to-pre-empt-the-fcc.html,Republicans Try to Pre-empt the F.C.C.,A bill would throw a wrench into the Federal Communications Commission’s plan to adopt strong Internet rules.,2015/01/29
