,link,headline,summary,date
458,https://www.nytimes.com/2016/04/30/business/dealbook/rovi-buys-tivo-in-1-1-billion-deal.html,Rovi Buys TiVo in $1.1 Billion Deal,"In acquiring TiVo, Rovi will get access to analytics about viewing habits and add 10 million households to its own 18 million.",2016/04/30
415,https://www.nytimes.com/2016/04/30/technology/tv-stations-agree-to-sell-enough-spectrum-to-meet-fccs-goal.html,TV Stations Agree to Sell Enough Spectrum to Meet F.C.C.’s Goal,The agency reached its maximum target for a giant airwave auction that will support the next generation of wireless Internet services.,2016/04/30
424,https://www.nytimes.com/2016/05/03/business/media/hulu-is-said-to-plan-full-cable-and-broadcast-channel-streaming.html,Hulu Is Said to Plan Full Cable and Broadcast Channel Streaming,Hulu is said to be working to change from a rerun-based service as TV companies rethink the way they approach streaming video.,2016/05/03
486,https://www.nytimes.com/2016/05/04/business/media/hulu-aims-to-deliver-what-you-want-to-watch-next.html,Hulu Aims to Deliver What You Want to Watch Next,"Mike Hopkins, the chief executive, talks about a streamlined bundle of broadcast and cable channels and other plans in the works.",2016/05/04
389,https://www.nytimes.com/2016/05/06/business/media/dreamworks-animation-manages-a-quarterly-profit.html,DreamWorks Animation Manages a Quarterly Profit,"The studio, now being sold to Comcast, earned $13.8 million, an improvement from a loss in last year’s quarter.",2016/05/06
449,https://www.nytimes.com/2016/05/11/business/dealbook/staples-office-depot-merger.html,Office Depot and Staples Call Off Merger After Judge Blocks It,A federal judge said the combination would “substantially impair” competition in the business of selling office supplies.,2016/05/11
394,https://www.nytimes.com/2016/05/12/business/international/three-o2-merger-blocked-eu.html,E.U. Regulators Block Merger of British Mobile Carriers on Competition Grounds,"The acquisition of O2 by Hutchison Whampoa, the owner of the operator Three, would have harmed consumer choice, the bloc’s antitrust chief said.",2016/05/12
497,https://www.nytimes.com/2016/05/17/business/media/looking-to-its-future-television-revisits-its-past.html,TV’s Big Bet on Nostalgia,"In the upcoming season, networks are offering new versions of shows like “MacGyver,” “Prison Break” and “MTV Unplugged.”",2016/05/17
573,https://news.blogs.nytimes.com/2016/05/18/morning-agenda-a-tale-of-two-silicon-valleys/,Morning Agenda: A Tale of Two Silicon Valleys,I.M.F. Takes Firmer Stand Favoring Relief for Greek Debt | Bank of America Called ‘Bro’s Club’ in Bias Suit,2016/05/18
545,https://www.nytimes.com/2016/05/29/business/top-ceo-pay-fell-yes-fell-in-2015.html,"Top C.E.O. Pay Fell — Yes, Fell — in 2015","While the top-paid chief executives at the nation’s largest companies received an average of $19 million last year, that figure was down from 2014.",2016/05/29
568,https://www.nytimes.com/2016/06/09/technology/the-challenges-of-closing-the-digital-divide.html,The Challenges of Closing the Digital Divide,"Mignon Clyburn, an F.C.C. commissioner, discusses the agency’s efforts to bring broadband to low-income individuals and rural areas.",2016/06/09
556,https://news.blogs.nytimes.com/2016/06/13/morning-agenda-hedge-fund-managers-try-to-stanch-loss-of-investors/,Morning Agenda: Hedge Fund Managers Try to Stanch Loss of Investors,Blue Coat to Be Sold to Symantec | Walgreens Cuts Ties to Theranos,2016/06/13
338,https://www.nytimes.com/2016/06/13/technology/cable-industry-mobilizes-lobbying-army-to-block-fcc-moves.html,Cable Industry Mobilizes Lobbying Army to Block F.C.C. Moves,"Giants like Comcast, AT&T and Verizon oppose plans to limit broadband providers’ ability to share users’ data and to open the market for set-top boxes.",2016/06/13
446,https://www.nytimes.com/2016/06/13/sports/baseball/tickets-on-phones-a-hang-up-for-some-yankees-fans.html,Tickets on Phones? It’s a Big Hang-Up for Some Yankee Fans,The myriad problems fans are experiencing as they adjust to a new team policy banning print-at-home tickets are producing a long line at the customer service window before each game.,2016/06/13
473,https://www.nytimes.com/2016/06/15/technology/net-neutrality-fcc-appeals-court-ruling.html,"Court Backs Rules Treating Internet as Utility, Not Luxury","An appeals court panel affirmed the Federal Communications Commission’s rules about net neutrality, clearing the way for stricter oversight of broadband providers.",2016/06/15
402,https://www.nytimes.com/2016/06/16/technology/court-decides-all-bits-are-equal.html,Court Decides All Bits Are Equal,A ruling on how you get internet content means the neighbor’s blog matters as much as Netflix. And Netflix can’t be charged extra for being a data hog.,2016/06/16
348,https://www.nytimes.com/2016/06/22/business/media/a-conversation-with-cablevisions-new-owner.html,A Conversation With Cablevision’s New Owner,"In an interview, Dexter Goei, chief executive of Altice U.S.A., talks about the company’s goals for its new operations.",2016/06/22
489,https://www.nytimes.com/2016/07/04/technology/why-tech-support-is-purposely-unbearable.html,Why Tech Support Is (Purposely) Unbearable,"Worse, just as you suspected, companies know the torture they are putting you through, with cable and mobile service providers the most egregious offenders.",2016/07/04
58,https://www.nytimes.com/2016/07/07/business/dealbook/detente-for-netflix-and-comcast.html,Détente for Netflix and Comcast,"The relationship between the two companies has often been rocky, but nothing brings out the olive branch like a business opportunity.",2016/07/07
547,https://news.blogs.nytimes.com/2016/07/07/morning-agenda-italys-plan-for-banks-is-dividing-europe/,Morning Agenda: Italy’s Plan for Banks Is Dividing Europe,More British Property Funds Halt Withdrawals | Wall Street Scion Pleads Guilty to Charges in $40 Million Fraud,2016/07/07
301,https://www.nytimes.com/2016/07/09/business/dealbook/lawsuit-aims-at-jeffrey-katzenberg-and-his-dual-class-shares.html,Lawsuit Aims at Jeffrey Katzenberg and His Dual-Class Shares,"He owns 11.5 percent of DreamWorks Animation but has 60 percent of the shareholder vote, which gives him control in a sale to NBCUniversal.",2016/07/09
382,https://www.nytimes.com/2016/07/14/business/dealbook/faiza-saeed-to-become-first-woman-to-lead-cravath-swaine-moore.html,"Faiza Saeed to Become First Woman to Lead Cravath, Swaine & Moore",Faiza J. Saeed’s 25 years at the law firm have included some of the most prominent corporate deals in recent history.,2016/07/14
527,https://news.blogs.nytimes.com/2016/07/14/morning-agenda-the-first-woman-to-lead-cravath-swaine-moore/,"Morning Agenda: The First Woman to Lead Cravath, Swaine & Moore",How Private Equity Found Power and Profit in State Capitols | Law Center Calls Seller-Financed Home Sales ‘Toxic Transactions’,2016/07/14
377,https://www.nytimes.com/2016/07/15/sports/baseball/new-york-mets-yankees-tv-ratings-yes-network-sny.html,Mets’ On-Field Success and Yankees’ Off-Field Squabble Propel a Switch in Viewership,The Mets are vying for a playoff spot after a World Series appearance while a dispute with Comcast is keeping the Yankees off nearly a million television screens.,2016/07/15
528,https://www.nytimes.com/2016/07/17/movies/matt-damon-paul-greengrass-jason-bourne.html,Why Matt Damon and Paul Greengrass Couldn’t Quit Jason Bourne,The actor and the director discuss what led them to an additional chapter in the high-velocity life of a once amnesiac governmental assassin.,2016/07/17
390,https://www.nytimes.com/2016/07/23/technology/personaltech/checking-the-home-broadband-meter.html,Checking the Home Broadband Meter,"Monthly plans from internet service providers that limit data have become common, but you can keep tabs on your use.",2016/07/23
403,https://www.nytimes.com/aponline/2016/07/27/us/ap-us-dem-2016-philadelphia.html,"Actors, Delegates Protest on Quiet Day 3 of Dem Convention",Actors and delegates took center stage in smaller and more subdued protests by Bernie Sanders supporters on a mostly quiet Day 3 of the Democratic National Convention.,2016/07/27
476,https://news.blogs.nytimes.com/2016/07/27/morning-agenda-sex-fear-and-video-surveillance-at-worlds-largest-hedge-fund/,"Morning Agenda: Sex, Fear and Video Surveillance at World’s Largest Hedge Fund",Deutsche Bank Profits Take a Hit | Analog Devices Buys Linear Technology,2016/07/27
538,https://www.nytimes.com/2016/07/31/business/media/yahoo-and-the-online-universe-according-to-verizon.html,Yahoo and the Online Universe According to Verizon,"In amassing Yahoo, AOL and other online services, Verizon is preparing for the day when its most important clients are advertisers, not users.",2016/07/31
465,https://www.nytimes.com/2016/08/01/arts/television/stephen-colbert-found-himself-again-at-the-conventions.html,Colbert Again in Character — as Himself — at the Conventions,The late-night host’s two-week live format revived his show. Here’s how he can keep his nightly gig thriving.,2016/08/01
523,https://www.nytimes.com/aponline/2016/08/03/sports/olympics/ap-us-oly-digital-life-olympics-without-tv.html,Olympic Video and VR: Guide to Watching Without a TV,No TV? No problem!,2016/08/03
417,https://www.nytimes.com/2016/08/04/business/time-warner-hulu-stake.html,Time Warner Acquires 10% Stake in Hulu,"The deal, which will go into effect early next year, is part of a push by the company to expand viewing options for its customers.",2016/08/04
492,https://www.nytimes.com/aponline/2016/08/04/business/ap-us-dish-taking-sports-out.html,Breaking Up the Bundle? Dish Relegates ESPN to an Add-On,"Dish Network is offering a new ""skinny"" bundle of about 50 cable channels that doesn't include ESPN and some other sports channels, giving people who don't care about sports a way to save money on TV without joining the ranks of ""cord cutters.""",2016/08/04
309,https://www.nytimes.com/reuters/2016/08/05/business/05reuters-olympics-rio-companies-warnings.html,Blame It on Rio: Some U.S. Companies See Sales Hit From Olympics,"The Olympics are already proving to be a boon for Comcast Corp&#8217;s NBC and a drag for its U.S. media competitors, as well as for restaurants that rely on customers venturing out in the evening for a bite to eat.",2016/08/05
70,https://www.nytimes.com/2016/08/05/sports/olympics/nbc-comcast-rio-games-future-of-television.html,"Betting Billions on Rio, Comcast Hopes to Win the Future of Television","The cable giant will provide 6,800 hours of programming on 11 channels and 41 live streams — and, for some viewers, a way to find it all.",2016/08/05
522,https://www.nytimes.com/aponline/2016/08/08/technology/ap-us-tec-live-video-pays-off.html,Boom in Live Video Helping Some Creators Make a Living,"Casey Cooper is one of the most famous drummers on the planet right now. He has a million followers on YouTube, and his flaming-sticks drumming cover of Ellie Goulding's ""Burn"" is insane.",2016/08/08
404,https://www.nytimes.com/reuters/2016/08/08/arts/08reuters-olympics-rio-lesliejones.html,Twitter Scores Leslie Jones a Rio Role After Overcoming Abuse,"""Ghostbusters"" actress Leslie Jones almost quit Twitter last month after receiving online abuse, but the comedian had the last laugh on Monday as her humorous Olympics tweets landed her an invite from NBC to cover the sporting event.",2016/08/08
550,https://www.nytimes.com/2016/08/09/us/politics/think-tank-scholars-corporate-consultants.html,Think Tank Scholar or Corporate Consultant? It Depends on the Day,"Acting as independent arbiters to shape government policy, many researchers also have corporate roles that are sometimes undisclosed.",2016/08/09
315,https://www.nytimes.com/2016/08/09/business/media/harry-potter-films-to-be-shown-on-syfy-and-usa-network.html,‘Harry Potter’ Films to Be Shown on Syfy and USA Network,"The deal, said to be more than $200 million, will begin in 2018 and will allow NBCUniversal to use even more Potter material at its theme parks.",2016/08/09
427,https://www.nytimes.com/2016/08/11/sports/olympics/tv-ratings-for-olympics-on-nbc-down-20-percent-from-london-games.html,"As Olympic Viewership Falls, NBC Thinks of the Bigger Picture","NBC has done better since the opening ceremony, when viewership fell 35 percent compared with four years ago.",2016/08/11
352,https://www.nytimes.com/aponline/2016/08/16/us/ap-us-campaign-2016-nbc-trump.html,NBC Chairman Blasts Trump in Private Facebook Post,"The chairman of NBC Entertainment slammed Donald Trump, the network's onetime ""Apprentice"" star, as ""toxic"" and ""demented"" in a private Facebook post that became public.",2016/08/16
407,https://www.nytimes.com/aponline/2016/08/16/business/ap-us-nielsens.html,NBC Audience Soars With First Full Week of Olympics Games,You don't need to be a numbers-cruncher to guess what won the ratings race last week &#8212; and why.,2016/08/16
494,https://www.nytimes.com/aponline/2016/08/17/sports/olympics/ap-oly-biz-olympics-for-the-blind.html,How Do the Blind Watch the Olympics? NBC Helps Them Hear It,Two people in a recording booth deep inside a Connecticut office park are helping millions of blind Americans feel part of the Olympics like never before.,2016/08/17
93,https://www.nytimes.com/reuters/2016/08/22/business/22reuters-comcast-stanford.html,Comcast's Golf Channel Beats Appeal Over Allen Stanford Fraud,A federal appeals court on Monday said Comcast Corp's Golf Channel need not repay $5.9 million it had received from convicted swindler Allen Stanford in exchange for services aimed at furthering his multibillion-dollar Ponzi scheme.,2016/08/22
441,https://www.nytimes.com/aponline/2016/08/27/sports/baseball/ap-bbo-leading-off.html,"LEADING OFF: Ellis Starts for Phils, Jones Maybe OK for O's",A look at what's happening all around the majors Sunday:,2016/08/27
431,https://www.nytimes.com/2016/09/05/business/media/look-up-in-the-digital-age-billboards-are-far-from-dead.html,"Look Up: In the Digital Age, Billboards Are Far From Dead","Billboards, long used by big brands to promote their products, and more recently by tech companies, are flourishing compared with other traditional media.",2016/09/05
406,https://www.nytimes.com/reuters/2016/09/15/arts/15reuters-fcc-television.html,FCC Chair Says His Set-Top Box Reform Proposal May Change,The head of the U.S. Federal Communications Commission said he might change his proposal to allow tens of millions of U.S. pay TV subscribers to ditch costly set-top boxes and access video programming online.,2016/09/15
378,https://www.nytimes.com/2016/09/15/opinion/free-tv-viewers-from-cable-box-fees.html,Free TV Viewers From Cable Box Fees,Ending cable’s control over set-top boxes would result in lower costs and more choice for TV consumers.,2016/09/15
405,https://www.nytimes.com/reuters/2016/09/19/arts/19reuters-awards-emmys-networks.html,"Cable Kings HBO, FX Upstage Online Competitors at TV's Emmys","It was a repeat for HBO at television's Emmy awards on Sunday as the premium cable network's ""Game of Thrones"" and ""Veep"" won the night's top trophies, thwarting competition from deep-pocketed streaming services for the industry's highest honors.",2016/09/19
57,https://www.nytimes.com/aponline/2016/09/20/business/ap-us-comcast-wireless.html,Comcast Plans to Launch Wireless Service Next Year,"Comcast plans to launch a cellphone service roughly in the middle of next year, although it would be limited to areas of the country where it's a cable provider.",2016/09/20
408,https://www.nytimes.com/aponline/2016/09/20/business/ap-us-nielsens.html,'America's Got Talent' Gives Season-Ending Win to NBC,"The 12-year-old singing sensation Grace VanderWaal's $1 million prize capped a successful season for summer's favorite television show, ""America's Got Talent,"" and helped NBC to victory last week in the television ratings.",2016/09/20
257,https://www.nytimes.com/aponline/2016/09/21/business/ap-us-charter-wireless.html,Another Big Cable Company Says It Wants to Do Cellphones Too,"A day after cable giant Comcast said it planned to start selling cellphone service , rival Charter says it wants to have a wireless business too.",2016/09/21
439,https://www.nytimes.com/reuters/2016/09/21/business/21reuters-viacom-dividend.html,Viacom to Look Internally and Externally for New CEO: Source,"Viacom Inc's board plans to look both internally and externally for a new chief executive to replace interim CEO Tom Dooley, a source familiar with the situation told Reuters on Wednesday.",2016/09/21
373,https://www.nytimes.com/2016/09/22/us/politics/hillary-clinton-money-obama.html,Liberals See Hillary Clinton’s Focus on Big Donors as Bafflingly Dated,The lack of an online donor network is forcing Mrs. Clinton to continue with an aggressive calendar of fund-raisers with rich donors — events that can limit her time in swing states.,2016/09/22
310,https://www.nytimes.com/aponline/2016/09/27/us/ap-us-democratic-national-convention-fundraising.html,Filings Show DNC Host Committee Raised Over $85M for Event,The host committee for the Democratic National Convention in Philadelphia says it raised over $85 million to put on July's event.,2016/09/27
520,https://www.nytimes.com/2016/09/27/business/dealbook/trumps-a-businessman-wheres-his-business-backing.html,Trump’s a Businessman. Where’s His Business Backing?,"Despite pushing proposals that sound like a corporate chieftain’s dream, the Republican nominee isn’t getting much love from his peers.",2016/09/27
351,https://www.nytimes.com/aponline/2016/10/11/business/ap-us-business-highlights.html,Business Highlights,,2016/10/11
275,https://www.nytimes.com/2016/10/12/technology/free-broadband-initiatives-for-poor-and-rural-areas-with-eye-on-future.html,Tech Companies Expect Free High-Speed Internet for Poorer Americans to Pay Off Later,"Tech companies like Sprint, Comcast and Facebook are increasingly working to make high-speed internet available to every American.",2016/10/12
493,https://www.nytimes.com/aponline/2016/10/16/us/ap-us-film-box-office.html,Affleck's 'The Accountant' Tops Charts With $24.7 Million,Ben Affleck is still a box office draw outside of the bat suit.,2016/10/16
398,https://www.nytimes.com/2016/10/18/us/politics/donald-trump-tv-jared-kushner.html,Jared Kushner Talks of a Trump TV Network With a Media Deal Maker,"Mr. Kushner, Donald J. Trump’s son-in-law, informally reached out to a veteran media investment banker, who is also a friend, about setting up the channel.",2016/10/18
440,https://www.nytimes.com/aponline/2016/10/20/sports/hockey/ap-hkn-ducks-flyers.html,Ducks Snap Winless Start With 3-2 Win Over Flyers,The Flyers wanted their Big 5-0 bash to end in celebration.,2016/10/20
308,https://www.nytimes.com/reuters/2016/10/20/business/20reuters-time-warner-m-a-at-t.html,AT&T Discussed Takeover in Meetings With Time Warner: Bloomberg,"Senior executives of telecommunications company AT&amp;T Inc and media conglomerate Time Warner Inc have discussed various business strategies including a possible merger in recent weeks, Bloomberg reported on Thursday, citing people it said were familiar with the matter.",2016/10/20
281,https://www.nytimes.com/2016/10/22/business/dealbook/att-is-said-to-be-in-advanced-merger-talks-with-time-warner.html,AT&T Aims for an Empire in Merger Talks With Time Warner,A deal would give the giant TV distributor and internet provider a collection of programming like HBO and movies like “Suicide Squad.”,2016/10/22
219,https://www.nytimes.com/2016/10/23/business/dealbook/regulatory-microscope-lies-ahead-for-att-and-time-warner.html,Regulatory Microscope Lies Ahead for AT&T and Time Warner,The deal will probably face a much sterner regulatory review than the Comcast-NBC Universal merger in 2009.,2016/10/23
318,https://www.nytimes.com/2016/10/23/business/dealbook/att-agrees-to-buy-time-warner-for-more-than-80-billion.html,AT&T Agrees to Buy Time Warner for $85.4 Billion,The potential union would probably face heavy scrutiny from government regulators.,2016/10/23
343,https://www.nytimes.com/2016/10/24/business/dealbook/att-time-warner-deal-confidence.html,The Corporate Confidence of the AT&T-Time Warner Deal,"Big deals are usually postponed during times of political and economic uncertainty, but many corporate titans apparently see smooth sailing ahead.",2016/10/24
279,https://www.nytimes.com/2016/10/24/business/dealbook/swift-opposition-to-resurrection-of-att-giant.html,Swift Opposition to Resurrection of AT&T Giant,Much of the concern about AT&T’s $85.4 billion purchase of Time Warner is rooted in how consumers have fared since Comcast bought NBCUniversal.,2016/10/24
410,https://www.nytimes.com/2016/10/24/business/making-sense-of-atts-bid-for-time-warner.html,Making Sense of AT&T’s Bid for Time Warner,"The proposed $85 billion merger faces tough regulatory scrutiny, but the potential to challenge cable companies may make a compelling case.",2016/10/24
416,https://www.nytimes.com/2016/10/25/briefing/us-briefing-hillary-clinton-donald-trump-world-series.html,"Hillary Clinton, Donald Trump, World Series: Your Tuesday Briefing",Here’s what you need to know to start your day.,2016/10/25
273,https://www.nytimes.com/2016/10/25/business/media/with-att-time-warner-deal-brewing-a-focus-on-preserving-cnns-integrity.html,"With AT&T-Time Warner Deal Brewing, a Focus on Preserving CNN’s Integrity",The difficulties of defending tough reporting and shielding journalists from powerful antagonists can be hard for any corporation to stomach. And AT&T has no journalistic lineage.,2016/10/25
246,https://www.nytimes.com/2016/10/25/business/media/a-chilly-reaction-to-att-time-warner-deal.html,A Chilly Reaction to AT&T-Time Warner Deal,A look at where the AT&T deal leaves other prominent media companies and what some think they might attempt to do in response.,2016/10/25
286,https://www.nytimes.com/2016/10/25/opinion/promises-promises-from-att.html,"Promises, Promises From AT&T",Antitrust regulators need to examine whether the AT&T-Time Warner deal would squelch competition or limit consumer choice.,2016/10/25
344,https://www.nytimes.com/2016/10/25/technology/att-time-warner-deal-is-a-strike-in-the-dark.html,AT&T-Time Warner Deal Is a Shot in the Dark,AT&T’s $85 billion deal for Time Warner is a ploy to do something — anything — in the face of a rapidly changing media landscape.,2016/10/25
380,https://www.nytimes.com/2016/10/25/business/dealbook/att-time-warner-teneo-clinton.html,"Morning Agenda: AT&T and Time Warner, Behind the Curtain at Teneo",The AT&T-Time Warner deal could reshape the entire media landscape in the United States and spur even more consolidation. Not everyone is on board with that.,2016/10/25
383,https://www.nytimes.com/2016/10/26/technology/att-set-to-lobby-for-merger-with-deep-pockets-and-a-big-network.html,AT&T Cheerleading Squad for Merger: Nearly 100 Lobbyists,"As a multimillion-dollar donor to lawmakers, with a huge roster of lobbyists, the communications giant is ready to pursue its $85 billion bid for Time Warner.",2016/10/26
249,https://www.nytimes.com/2016/10/26/business/economy/why-a-media-merger-that-should-go-through-might-not.html,Why a Media Merger That Should Go Through Might Not,"Under longstanding antitrust policy, the AT&T-Time Warner deal should be practically a shoo-in. But these are not usual times.",2016/10/26
515,https://www.nytimes.com/2016/10/26/technology/chief-who-sharpened-fccs-teeth-faces-final-hurdles.html,One Last Growl for F.C.C.’s Sharp-Toothed Watchdog,"Tom Wheeler, who increased regulation of the cable and wireless industries, now faces tough industry opposition and a review of a media megadeal.",2016/10/26
386,https://www.nytimes.com/2016/10/26/business/dealbook/att-time-warner-metlife-bonds.html,"Morning Agenda: A New Media Order, Crisis Echos, MetLife Disputes Its Status","AT&T and Time Warner have opened up about their deal — the primary point of concern between the two companies was price, and even regulatory issues were less of a problem.",2016/10/26
56,https://www.nytimes.com/2016/10/27/business/dealbook/att-could-find-a-lesson-in-comcasts-media-merger.html,AT&T Could Find a Lesson in Comcast’s Media Merger,Comcast’s acquisition of NBCUniversal was prudent by today’s standards.,2016/10/27
516,https://www.nytimes.com/2016/10/27/business/media/targeted-advertising-time-warner-merger.html,Individualized Ads on TV Could Be One Result of AT&T-Time Warner Merger,"In a call with investors, the chiefs of the companies noted that the combined trove of their consumer data would be useful to marketers and consumers.",2016/10/27
287,https://www.nytimes.com/2016/10/28/technology/fcc-tightens-privacy-rules-for-broadband-providers.html,Broadband Providers Will Need Permission to Collect Private Data,"The new rules require broadband providers to get permission to collect data on a subscriber’s web browsing, app use, location and financial information.",2016/10/28
272,https://www.nytimes.com/2016/10/29/business/media/telecoms-ambitions-on-targeted-ads-seen-curbed-by-fccs-new-privacy-rules.html,Telecoms’ Ambitions on Targeted Ads Seen Curbed by F.C.C.’s New Privacy Rules,AT&T’s and Verizon’s hopes of collecting and analyzing customer data to sell advertising may be dashed if they have to ask customers’ permission.,2016/10/29
335,https://www.nytimes.com/2016/10/29/business/dealbook/baker-hughes-could-be-a-good-fit-for-general-electric.html,Baker Hughes Could Be a Good Fit for General Electric,"G.E. has sold off $200 billion of financial assets since the financial crisis, but it is now prepared for an offensive.",2016/10/29
