,link,headline,summary,date
280,https://www.nytimes.com/2011/07/08/world/europe/08newscorp.html,Move to Close Newspaper Is Greeted With Suspicion,"An outpouring of suspicion and condemnation came from all directions on Thursday, following the News Corporation’s decision to shut down the British tabloid The News of the World.",2011/07/08
457,https://www.nytimes.com/2011/07/08/world/europe/08britain.html,Scandal Shifts Britain’s Media and Political Landscape,An arrest seems imminent for The News of the World’s once politically influential former editor after the Murdochs announced plans to shut down the tabloid.,2011/07/08
405,https://www.nytimes.com/interactive/2011/07/08/world/europe/20110708-key-players-in-the-phone-hacking-scandal.html,Key Figures in the Phone Hacking Case,"Some of the people who have drawn criticism, have resigned or have been arrested in the phone hacking scandal.",2011/07/08
100,https://www.nytimes.com/2011/07/08/business/news-corp-is-in-need-of-a-new-action-plan.html,News Corp. Is in Need of a New Action Plan,"In response to the turmoil at the News Corporation, an imagined letter from a concerned shareholder to the company’s independent board members.",2011/07/08
403,http://dealbook.nytimes.com/2011/07/08/the-fallout-for-the-bskyb-deal/,The Fallout for the BSkyB Deal,"As the British public and politicians line up to take shots at Rupert Murdoch’s media empire in the wake of a phone-hacking scandal, a proposed acquisition of the pay-TV company British Sky Broadcasting by News Corporation has been postponed by regulators. DealBook’s Adrienne Carter speaks to Mike Huckman, director of media strategy at the MSL Group, about whether shutting down The News of the World will be sufficient to save the BSkyB deal.",2011/07/08
531,http://wheels.blogs.nytimes.com/2011/07/08/wheelies-the-double-overtime-edition/,Wheelies: The Double-Overtime Edition,In which we bring you motoring news from around the Web:,2011/07/08
599,https://www.nytimes.com/2011/07/08/world/europe/08profile.html,A Tenacious Rise to the Top in the Brutal Men’s World of Tabloids,"Rebekah Brooks, the chief executive of News International, Rupert Murdoch’s British newspaper subsidiary, has used a winning combination of charm, effrontery, audacity and tenacity to thrive.",2011/07/08
589,http://dealbook.nytimes.com/2011/07/08/morning-take-out-281/,Morning Take-Out,"Carlyle Is Said to Be in Talks With Energy Buyout Shop  |  Carlyle's potential acquisition of Energy Capital, a buyout shop focused on investments in power plants and gas pipelines, underscores the relentless drive by the private equity giant to gather more assets and broaden its product line as it gears up for an initial public offering.",2011/07/08
345,http://thelede.blogs.nytimes.com/2011/07/08/statement-by-cameron-on-press-inquiries/,Statement by Cameron on Press Inquiries,"Following the arrest of a former tabloid editor who was until January his spokesman, Prime Minister David Cameron of Britain called on Friday for two separate investigations into the specific misconduct at The News of the World and the need for better regulation of newspapers, as my colleagues John Burns and Alan Cowell report.",2011/07/08
452,https://www.nytimes.com/2011/07/09/world/europe/09britain.html,Former Aide to Cameron Is Arrested in Tabloid Scandal,"Andy Coulson, a former editor of The News of the World and a former aide to Prime Minister David Cameron, was arrested on Friday.",2011/07/09
411,https://www.nytimes.com/2011/07/09/world/europe/09newscorp.html,"A Murdoch Loyalist Hangs On, Raising Questions About a Corporate Strategy","Amid a phone-hacking scandal, Rebekah Brooks told her employees she would not resign, suggesting that she retained the backing of her boss, Rupert Murdoch.",2011/07/09
451,https://www.nytimes.com/2011/07/09/world/europe/09murdoch.html,Phone Scandal Poses Defining Test for a Murdoch Son,"James Murdoch, the son of Rupert Murdoch, faces a new test as he jockeys to run his father’s company, the News Corporation, and salvage the biggest deal in the Murdochs’ history.",2011/07/09
200,https://www.nytimes.com/2011/07/09/sports/autoracing/09iht-SRQANDA09.html,"Is Formula One for Sale? No, but, Maybe","Q. and A. with Bernie Ecclestone, president and chief executive of Formula One Management and Formula One Administration.",2011/07/09
339,https://www.nytimes.com/2011/07/10/world/europe/10britain.html,"For Years, the Tabloids’ Sting Kept British Politicians in Line",Fear of media harassment and political necessity have long underpinned the uneasy collusion between British politicians and the nation’s tabloids.,2011/07/10
349,https://www.nytimes.com/2011/07/10/world/europe/10hacking.html,"At a Paper Set to Close, Defiance and Foreboding",The News of the World’s staff assembled on Saturday for the paper’s last working shift before it is shut down by the Murdoch empire.,2011/07/10
474,https://www.nytimes.com/2011/07/10/sunday-review/10gossip.html,Shocker! Tabs Won’t Change!,Celebrity gossip-gathering supports a vast economy in which everyone — from major media executives to nightclub doormen — has a stake.,2011/07/10
343,https://www.nytimes.com/2011/07/11/business/media/a-tabloid-shame-exposed-by-honest-rivals.html,"A Tabloid Shame, Exposed by Earnest Rivals","For Rupert Murdoch, newspapers have been useful in wielding influence and are the very thing that brought his company into the cross hairs.",2011/07/11
201,http://dealbook.nytimes.com/2011/07/11/british-official-refers-bskyb-deal-to-another-regulator/,British Official Refers BSkyB Deal to Another Regulator,"As a phone-hacking scandal threatens to derail News Corporation’s bid to buy BSkyB, a British official has referred the merger to the Competition Commission for approval, which could delay approval for months.",2011/07/11
408,https://www.nytimes.com/2011/07/11/world/europe/11britain.html,Cozy Ties Mark Newspaper’s Dealings With Scotland Yard,A detective’s account offers another window into an unusually close relationship between The News of the World and the British police.,2011/07/11
354,http://thelede.blogs.nytimes.com/2011/07/11/celebrity-targets-of-tabloid-cheer-its-demise/,Celebrity Targets of Tabloid Cheer Its Demise,"As my colleagues John F. Burns and Alan Cowell report, there was widespread revulsion in Britain last week when it was revealed that journalists at The News of the World, a British tabloid newspaper, had hacked into the voice mail of a 13-year-old girl following her abduction in 2002.",2011/07/11
175,http://dealbook.nytimes.com/2011/07/11/church-of-england-calls-for-accountability-in-news-corp-scandal/,Church of England Seeks Accountability From News Corp. in Hacking Scandal,The Church of England has entered the debate about the phone-hacking scandal at The News of the World — as an investor.,2011/07/11
587,http://dealbook.nytimes.com/2011/07/11/morning-take-out-282/,Morning Take-Out,"Nestle to Buy Control of China's Biggest Confectioner | Nestlé said on Monday that it had agreed to pay $1.7 billion for a 60 percent stake in a big Chinese confectioner, its second significant foray into the rapidly growing Chinese market in less than three months.",2011/07/11
493,http://thelede.blogs.nytimes.com/2011/07/11/three-murdoch-papers-reportedly-targeted-gordon-brown/,Three Murdoch Papers Reportedly Targeted Gordon Brown,"As my colleagues John F. Burns and Alan Cowell report, on Monday, just one day after the last edition of The News of the World was printed, new allegations of misconduct by journalists working at two other British newspapers owned by Rupert Murdoch surfaced.",2011/07/11
172,https://www.nytimes.com/2011/07/11/business/media/the-state-of-british-journalism.html,The State of British Journalism,"In the aftermath of the News of the World scandal, what Britain needs is a nasty, tabloid-style divorce to keep powerful press barons and politicians from sharing the same beds.",2011/07/11
116,http://dealbook.nytimes.com/2011/07/12/parliament-to-oppose-news-corp-s-bskyb-deal/,Parliament to Oppose News Corp.’s BSkyB Deal,"The British government plans to back a Labour Party motion in Parliament to block the News Corporation‘s $12 billion bid for British Sky Broadcasting, British news outlets reported on Tuesday.",2011/07/12
401,https://www.nytimes.com/2011/07/12/world/europe/12bskyb.html,News Corporation Moves to Delay BSkyB Deal to Avoid Its Collapse,"The media giant said it was prepared to submit its offer to a regulator, giving the deal some breathing room amid a political furor.",2011/07/12
126,https://www.nytimes.com/2011/07/12/business/media/perkins-is-best-hope-for-news-corp.html,Perkins Is Best Hope for News Corp.,"Tom Perkins, the renowned American venture capitalist, is a prime candidate to lead the charge for a badly needed overhaul of governance at the News Corporation.",2011/07/12
415,http://mediadecoder.blogs.nytimes.com/2011/07/12/news-corporation-looks-to-bolster-stock-with-buyback-plan/,News Corporation Looks to Bolster Stock With Buyback Plan,"The News Corporation on Tuesday moved to stanch the accelerating drop in its stock price, announcing a program to repurchase $5 billion in shares.",2011/07/12
353,http://thelede.blogs.nytimes.com/2011/07/12/latest-updates-on-british-phone-hacking-scandal/,Updates on British Phone-Hacking Scandal,"On Tuesday, The Lede is following developments in the phone-hacking scandal in Britain, as fresh revelations of misconduct by journalists continue to come to light.",2011/07/12
467,http://dealbook.nytimes.com/2011/07/12/morning-take-out-283/,Morning Take-Out,"An Addition to the List of Tax Loopholes | President Obama has talked about eliminating tax breaks for partners at hedge funds and private equity firms - along with those of corporate jet owners, oil companies and others taking advantage of quirks in the tax code.",2011/07/12
366,http://krugman.blogs.nytimes.com/2011/07/12/thugs-of-the-world/,Thugs of the World,"I obviously never had a very good opinion of Rupert Murdoch’s role in US and UK affairs. But I never expected to see the kinds of things now coming to light as the phone-hacking scandal metastasizes — hacking Gordon Brown and the Queen, bribing the police, hiring investigators to dig up dirt on the people investigating the hacking, and on and on.",2011/07/12
473,https://www.nytimes.com/2011/07/12/world/europe/12hacking.html,Murdoch Tabloids’ Targets Included Downing Street and the Crown,Reports surfaced that two of Rupert Murdoch’s newspapers may have bribed police officers to obtain information about Queen Elizabeth II and former Prime Minister Gordon Brown.,2011/07/12
171,http://dealbook.nytimes.com/2011/07/12/news-corp-opts-for-delay-on-bskyb/,News Corp. Seeks to Delay BSkyB Deal in Bid to Save It,"In a last-minute gambit to save its bid for the broadcaster BSkyB, the News Corporation said on Monday that it was withdrawing the concessions it had made to keep Sky News independent, a move designed to send its offer to the competition regulator and remove the takeover from the political arena, The New York Times reports. Read More »",2011/07/12
204,https://www.nytimes.com/2011/07/12/opinion/12iht-edcohen12.html,In Defense of Murdoch,"Warning: This column is a defense of Rupert Murdoch. He's been good for newspapers over the past several decades, keeping them alive and vigorous and noisy and relevant.",2011/07/12
260,https://www.nytimes.com/2011/07/13/business/advice-for-james-murdoch.html,Some Advice for a Murdoch,James Murdoch should stage his own tactical retreat and resign from the News Corporation. The heir apparent to his father’s media empire has lost authority.,2011/07/13
607,http://dealbook.nytimes.com/2011/07/13/morning-take-out-284/,Morning Take-Out,"S.E.C. and Pension Systems to Examine Fletcher Fund | The Securities and Exchange Commission has opened an inquiry into Fletcher Asset Management, a New York hedge fund run by Alphonse Fletcher Jr., a prominent Wall Street investor, according to a person with direct knowledge of the situation.",2011/07/13
414,https://www.nytimes.com/2011/07/13/world/europe/13cameron.html,Connections to Murdoch Start to Chafe British Leader,Prime Minister David Cameron has found himself a step behind in reacting to the phone-hacking revelations and his own associations with the press.,2011/07/13
72,https://www.nytimes.com/2011/07/13/world/europe/13newscorp.html,News Corp. Announces Stock Buyback as Shares Slip Again,"In a bid to reverse the drop in stock price, News Corporation announced that it would buy back $5 billion in shares. Since last week, the company’s stock has lost about 15 percent of its value.",2011/07/13
213,http://mediadecoder.blogs.nytimes.com/2011/07/13/congressmen-call-for-u-s-investigation-of-news-corporation/,Congressmen Call for U.S. Investigation of News Corporation,"Two members of Congress are calling for government inquiries in the United States into the conduct of Rupert Murdoch’s News Corporation, which is enmeshed in a deepening hacking scandal in Britain.",2011/07/13
495,https://www.nytimes.com/2011/07/13/world/europe/13hacking.html,Lawmakers to Call Murdoch to Testify in Hacking Case,"All three major parties in Parliament rebuked Rupert Murdoch’s media empire, and a parliamentary panel called him to testify about the phone-hacking scandal.",2011/07/13
396,http://mediadecoder.blogs.nytimes.com/2011/07/13/criticism-of-news-corp-spreads-in-the-u-s/,Calls for Congress to Investigate the Conduct of the News Corporation,"Public criticism of the News Corporation’s conduct in the British hacking scandal has crossed the ocean to the United States — and crossed the floor to the Republican side — as half a dozen members of Congress urged the government to investigate possible misconduct, including violations of a law that guards against foreign corruption.",2011/07/13
90,http://dealbook.nytimes.com/2011/07/13/after-bskyb-deals-collapse-whats-next-for-news-corp/,"After BSkyB Deal’s Collapse, What’s Next for News Corp.?","The News Corporation‘s investors appear to be breathing a sigh of relief now that the media conglomerate has withdrawn its troubled $12 billion bid for British Sky Broadcasting. Shares in the company were up more than 6 percent as of early Wednesday afternoon, to $16.31.",2011/07/13
336,http://dealbook.nytimes.com/2011/07/13/murdochs-political-triage/,Murdoch’s Political Triage,"By dropping efforts to acquire outstanding shares of the British Sky Broadcasting Group, Rupert Murdoch is trying to quell the political uproar that threatens his empire. DealBook’s Andrew Ross Sorkin and The New York Times’s media editor, Bruce Headlam, discuss News Corporation’s announcement that it is withdrawing its $12 billion bid for Britain’s main satellite television broadcaster.",2011/07/13
113,http://dealbook.nytimes.com/2011/07/13/news-corp-withdraws-bskyb-bid/,News Corp. Drops Bid for BSkyB,"The News Corporation has withdrawn its $12 billion bid for the majority of British Sky Broadcasting, the satellite broadcaster, as the firestorm continued in Britain over a phone-hacking scandal.",2011/07/13
475,http://thelede.blogs.nytimes.com/2011/07/13/latest-updates-on-british-phone-hacking-scandal-2/,Updates on British Phone-Hacking Scandal,"On Wednesday, The Lede is following developments in the phone-hacking scandal in Britain.",2011/07/13
455,https://www.nytimes.com/2011/07/14/world/europe/14hacking.html,Victim’s Family Appears Amid Rage at Tabloids,The significance many British see in the hacking scandal found expression in the sight of an ordinary family standing at the door of 10 Downing Street.,2011/07/14
146,https://www.nytimes.com/2011/07/14/world/europe/14react.html,News Corp. Newspapers May Face U.S. Inquiry,"A British newspaper’s claim that journalists working for News Corporation tried to obtain phone records of victims of the Sept. 11, 2001 terrorist attacks may prompt an F.B.I. inquiry.",2011/07/14
240,http://thelede.blogs.nytimes.com/2011/07/14/rupert-murdoch-defends-his-company-and-his-son/,Rupert Murdoch Defends His Company and His Son,"In an interview with The Wall Street Journal, a newspaper he owns, Rupert Murdoch defended the way his son James has handled the phone-hacking scandal and said that News Corporation had responded to the misconduct by its tabloid journalists “extremely well.”",2011/07/14
86,https://www.nytimes.com/2011/07/14/business/murdoch-discount-in-news-corp-stock.html,A Murdoch Discount in News Corp. Stock,"Because the company is run at Mr. Murdoch’s whim, its shares trade more cheaply than rivals’, and the phone-hacking scandal has widened that gap.",2011/07/14
252,https://www.nytimes.com/interactive/2011/07/14/business/media/rupert-murdochs-empire.html,Rupert Murdoch&rsquo;s Empire,"Chart of News Corporation&rsquo;s 2010 revenues, by sector.",2011/07/14
266,https://www.nytimes.com/2011/07/14/opinion/14iht-edlet14.html,Rupert Murdoch Under Fire,Let’s hear it for Rupert the innovator. But let’s not give him more power.,2011/07/14
261,http://thelede.blogs.nytimes.com/2011/07/14/confusion-over-parliaments-power-to-compel-murdochs-to-testify/,Confusion Over Parliament’s Power to Compel Murdochs to Testify,"To help clear up the confusion, it is worth consulting an official government report, revised last year, that explains in detail how Parliament’s power to order nonmembers of the Commons to appear has lapsed over the years. (Thanks to Mr. Waugh, the PoliticsHome editor, for pointing to it.)",2011/07/14
166,http://dealbook.nytimes.com/2011/07/14/news-corp-hires-top-criminal-defense-lawyer/,News Corp. Hires Top Criminal Defense Lawyer,"NYTMM.removeChildrenOf($(""NYTMM_Embed190"")); var _obj = new NYTMM.SlidingGallery($(""NYTMM_Embed190""),592,315,chameleonData); _obj.setFixedCaptionHeight(0); _obj.setPhotoData(chameleonData.photos,chameleonData.link); if($$('div.articleSpanImage').length > 0) { $$('div.articleSpanImage')[0].insertBefore(NYTMM.createElement('img',null,null,null,{display:'none'}),$$('div.articleSpanImage')[0].firstChild); }",2011/07/14
288,https://www.nytimes.com/2011/07/14/world/europe/14newscorp.html,Father and Son Split on Tactics in Murdoch Family Drama,A family drama played out during the decision by Rupert Murdoch’s News Corporation to withdraw a bid for British Sky Broadcasting.,2011/07/14
399,https://www.nytimes.com/2011/07/15/nyregion/fbi-opens-inquiry-into-hacking-of-911-victims.html,F.B.I. Opens Inquiry Into Hacking of 9/11 Victims’ Phones,The investigation will look into reports that journalists for The News of the World tried to gain access to phone records of people killed in the terrorist attacks.,2011/07/15
205,http://formulaone.blogs.nytimes.com/2011/07/15/after-ecclestone-the-future-of-formula-one-according-to-whitmarsh/,"After Ecclestone, the Future of Formula One According to Whitmarsh","Last weekend we published an interview with Bernie Ecclestone, the commercial boss of Formula One, on topics such as the digital future of Formula One and the future ownership of the series at a time when there are bids in the air.",2011/07/15
333,https://www.nytimes.com/2011/07/15/business/murdochs-woes-could-include-bancrofts.html,Murdoch’s Woes Could Include Bancrofts,Add to Rupert Murdoch’s list of potential headaches a blast from the past: the Bancroft family.,2011/07/15
337,http://economix.blogs.nytimes.com/2011/07/15/proclaiming-integrity/,Proclaiming Integrity,"“Every banker knows that if he has to prove that he is worthy of credit, however good may be his arguments, in fact his credit is gone.” — Walter Bagehot, “Lombard Street,” published in 1873.",2011/07/15
187,http://opinionator.blogs.nytimes.com/2011/07/15/day-of-reckoning/,Day of Reckoning,Never apologize. Never back down. Never lose.,2011/07/15
585,http://dealbook.nytimes.com/2011/07/15/morning-take-out-286/,Morning Take-Out,Highlights from the DealBook newsletter.,2011/07/15
453,http://thelede.blogs.nytimes.com/2011/07/15/complete-text-rupert-murdochs-apology/,Rupert Murdoch Apologizes to Victims of Phone Hacking,"Updated | 1:44 p.m. Since, remarkably, Rupert Murdoch’s personal letter of apology for the phone hacking scandal will run in its pages as a full-page ad on Saturday, The Guardian has obtained the complete text and posted it online.",2011/07/15
206,http://thelede.blogs.nytimes.com/2011/07/15/murdochs-reporters-report-on-murdoch/,Murdoch’s Reporters Report on Murdoch,"One of the more bizarre aspects of the scandal at the British newspaper division of the News Corporation is that it has forced journalists at news organizations owned by the company to report extensively in recent days on the man who is, ultimately, their boss, Rupert Murdoch.",2011/07/15
250,http://economix.blogs.nytimes.com/2011/07/15/podcast-sovereign-debt-phone-hacking-and-law-schools/,"Podcast: Sovereign Debt, Phone Hacking and Law Schools",There has been a flurry of headline-grabbing developments in the slow-moving financial and fiscal crises on both sides of the Atlantic.,2011/07/15
259,https://www.nytimes.com/2011/07/15/world/europe/rebekah-brooks-resignation-letter.html,Text of Rebekah Brooks’s Resignation Letter,"Rebekah Brooks, the chief executive of News International, announced her resignation on Friday. Following is the text of the letter, as transmitted by The Associated Press.",2011/07/15
450,https://www.nytimes.com/2011/07/15/world/europe/15hacking.html,Murdochs Now Say They Will Appear Before Parliament,"In an abrupt about-face, News Corporation said Thursday that Rupert Murdoch and his son James would testify before a parliamentary panel.",2011/07/15
449,https://www.nytimes.com/2011/07/15/world/europe/15hinton.html,Murdoch Loyalist in Hacking Scandal Spotlight,"Les Hinton, now of The Wall Street Journal, is coming under scrutiny for what he did and did not know when he ran Rupert Murdoch’s British newspapers.",2011/07/15
142,http://dealbook.nytimes.com/2011/07/15/law-surprise-news-corp-s-hiring-of-williams-connolly/,Law Surprise: News Corp.’s Hiring of Williams & Connolly,"7:19 p.m. | Updated Over the last four decades, two large law firms — Hogan Lovells and Skadden, Arps, Slate, Meagher & Flom — have served as primary outside counsel to the News Corporation, the media conglomerate run by Rupert Murdoch.",2011/07/15
232,http://mediadecoder.blogs.nytimes.com/2011/07/15/les-hinton-chief-of-dow-jones-resigns/,Les Hinton’s Resignation Letters,"The hacking scandal that has roiled Rupert Murdoch’s News Corporation reached his American media empire for the first time on Friday, claiming the publisher of The Wall Street Journal, who has resigned.",2011/07/15
160,https://www.nytimes.com/2011/07/16/world/europe/16hacking.html,2 Top Deputies Resign as Crisis Isolates Murdoch,"Les Hinton, who led Rupert Murdoch’s British newspaper subsidiary during the period in which phone hacking occurred, joined Rebekah Brooks in resigning.",2011/07/16
507,https://www.nytimes.com/2011/07/16/opinion/16iht-edrachman16.html,Tabloid Shock! Outrage!,"For an industry in decline, credibility might end up being the last asset that the quality press has to offer.",2011/07/16
395,https://www.nytimes.com/interactive/2011/07/16/world/europe/four-with-links-between-scotland-yard-and-news-international.html,Four With Links Between Scotland Yard and News International,Four With Links Between Scotland Yard and News International,2011/07/16
398,https://www.nytimes.com/2011/07/16/opinion/16nocera.html,The Journal Becomes Fox-ified,The Wall Street Journal interview with Rupert Murdoch might as well have been dictated by the News Corporation public relations department.,2011/07/16
447,https://www.nytimes.com/2011/07/17/world/europe/17police.html,Stain From Tabloids Rubs Off on a Cozy Scotland Yard,Testimony and new evidence indicate that Scotland Yard and News International became so intertwined that they wound up sharing the goal of containing the phone-hacking investigation.,2011/07/17
530,https://www.nytimes.com/2011/07/17/your-money/mutual-funds-and-etfs/in-mutual-fund-performance-vice-battles-virtue.html,The Wages of Virtue and Vice,"In second-quarter performance, a mutual fund that follows virtuous investing landed on top. But a vice fund nipped at its heels at No. 2.",2011/07/17
391,http://thelede.blogs.nytimes.com/2011/07/17/media-response-to-the-arrest-of-rebekah-brooks/,Media Response to the Arrest of Rebekah Brooks,"News of Sunday's arrest of Rebekah Brooks, the former chief of Rupert Murdoch's media operations in Britain, was greeted with a mix of righteous indignation that she had clung to power for so long, barely concealed glee by some of Mr. Murdoch's rivals and conspicuous understatement in at least one of the tabloid newspapers that Ms. Brooks once edited.",2011/07/17
331,https://www.nytimes.com/interactive/2011/07/17/world/europe/20110717police-correspondence.html,Correspondence Between The New York Times and Scotland Yard,"Documents show The New York Times’s request for information about the phone-hacking scandal at The News of the World that was sent last year to Scotland Yard, and its response.",2011/07/17
448,https://www.nytimes.com/2011/07/17/world/europe/17britain.html,"A Day of Apologies for the Murdochs, and of New Questions for Cameron","Penitence was the buzzword far beyond the London headquarters of Rupert Murdoch’s British-based newspaper subsidiary, News International.",2011/07/17
344,http://bits.blogs.nytimes.com/2011/07/18/lulz-security-says-it-hacked-news-corporation-sites/,Lulz Security Says It Hacked News Corporation Sites,7:18 p.m. | Updated Adding more details of the attacks.,2011/07/18
