,link,headline,summary,date
536,http://query.nytimes.com/gst/fullpage.html?res=9806E1D6143FF932A05754C0A9679D8B63,News Of The World,"Whether the scandal afflicting News Corp. represents the beginning of the fall of the House of Murdoch or just another thrilling episode in the career of the Teflon tycoon, I can't say. There is plenty enough spectacle without speculation. Nor is this the place to celebrate a rival's troubles. True, I did pull from my files and savor the indignant letters we received from News of the World's top editors last year as we prepared to publish an investigation of the paper's phone-hacking culture and Scotland Yard's timidity -- work that has been fully vindicated in recent weeks. But even if it is true, as online wags put it, that Murdoch's troubles threaten to deplete the world supply of schadenfreude, I don't plan to join the party.",
101,http://query.nytimes.com/gst/fullpage.html?res=9B04EFDF123DF93AA35751C0A9649D8B63,"News Corp. Profited in Quarter, Despite Hacking Scandal","Cable television dramas and movies helped raise News Corporation's revenues by 2 percent in the second quarter, offsetting the growing costs related to a phone hacking scandal at the company's British newspaper unit. The company on Wednesday beat Wall Street's expectations, reporting $1.06 billion in net income, or 42 cents a share, in the three months that ended Dec. 31, compared with $642 million, or 24 cents a share, in the same period a year ago. Revenue grew slightly, to $8.98 billion, up from $8.76 billion in 2010.",
380,http://query.nytimes.com/gst/fullpage.html?res=940DE2DE133EF931A15755C0A9679D8B63,Hulu Ponders Sale on Heels Of Buy Offer,"Hulu, the online video service, is weighing a possible sale of the company after it received a takeover offer from an unidentified suitor, people briefed on the matter said Tuesday. The unsolicited offer has prompted Hulu's board to consider its options, and the company is speaking to potential advisers, these people said. It may contact potential buyers, including other media companies and private equity firms that have wanted the chance to buy the service.",
981,http://query.nytimes.com/gst/fullpage.html?res=9902E6DA163DF934A15751C0A9639C8B63,L.I. @ WORK,"Cablevision and News Corp. Restructure a Partnership Regional Programming Partners, formed by the Cablevision Systems Corporation and the News Corporation, will be restructured, Cablevision said on Tuesday. Under the current structure, Cablevision owns 60 percent and the News Corporation owns 40 percent of the company, whose assets include Madison Square Garden, the Fox Sports Net, and six regional sports networks.",
373,http://query.nytimes.com/gst/fullpage.html?res=9500E1D61E3CF93AA15750C0A9649D8B63,Inside the Times,International MILITIAS IN THE CONGO,
361,http://query.nytimes.com/gst/fullpage.html?res=9B00E4D91739F934A15752C1A9679D8B63,The Murdochs Hug It Out,INT. PSYCHOLOGIST'S OFFICE -- DAY A framed degree tells us that DR. LEO HART holds a Ph.D. in psychology from Columbia University.,
107,https://www.nytimes.com/video/business/100000001518685/just-a-minute-chozick-on-opportunity-co.html,Just a Minute: Amy Chozick on News Corp,The scrutiny and scandal in Britain around News Corporation has affected its ability to expand and acquire. Amy Chozick discusses her article on the subject.,
341,http://query.nytimes.com/gst/fullpage.html?res=9A0DE6DD1E31F935A25753C1A9669D8B63,FUND-RAISING: Murdoch Defends Donations,"The News Corporation chairman Rupert Murdoch said this morning that his company's $1 million donations to the United States Chamber of Commerce and the Republican Governors Association ''were unusual'' but that ''they were in the interests of our shareholders and the country.'' The comments came during the News Corp.'s annual meeting of shareholders, in response to pointed questions from representatives of labor groups and a liberal foundation that have company shares.",
340,https://www.nytimes.com/video/business/100000000943628/murdochs-political-triage.html,Murdoch's Political Triage,Dealbook's Andrew Ross Sorkin and media editor Bruce Headlam discuss News Corporation's announcement it is withdrawing a $12 billion bid for Britain's main satellite television broadcaster.,
334,https://www.nytimes.com/video/business/media/100000000952629/media-decoder.html,Media Decoder: The Murdochs to Testify,"David Carr and Brian Stelter discuss the latest developments in the phone-hacking scandal and look ahead to Tuesday's testimony from Rupert Murdoch, James Murdoch and Rebekah Brooks.",
332,http://query.nytimes.com/gst/fullpage.html?res=9E07E0DE173CF93AA25754C0A9679D8B63,Amorality on Display in London Extends to the Stage as Well,"LONDON -- And so the sorry story continues, as people from the corridors of power confess their crimes and await their judgments. The glamorous favorite of the tyrant has fallen from her high perch, and it is rumored that further depths of corruption are waiting to be plumbed. Reputations everywhere are in tatters. Such was the view on Saturday night - no, not of the television screen from my couch - but from a seat at the Donmar Warehouse toward the end of its production of ''Luise Miller.'' I had been reluctant to tear myself away from the ever-evolving news of the phone-hacking scandal, which could be relied upon to produce a fresh resignation or arrest at regular intervals. But leave it to Friedrich Schiller, the 18th-century German chronicler of the evil that politicians do, to provide a soap opera that's nearly as juicy as that surrounding Rupert Murdoch's News International organization (and Parliament and Scotland Yard).",
329,http://query.nytimes.com/gst/fullpage.html?res=9806E7DC133CF933A15754C0A9679D8B63,"Murdoch, 'Surprised and Shocked,' Is Likely to Face More Questions","LONDON -- Rupert and James Murdoch said repeatedly during their extended testimony before a parliamentary committee in Britain that their involvement in managing the News Corporation's response to the phone hacking scandal was limited. Rupert Murdoch said he felt let down by ''the people that I trusted and then, maybe the people they trusted.'' Even so, the Murdochs' defense of their roles highlighted several issues that continuing investigations by parliamentary committees and the police are likely to examine in greater detail. Among them:",
328,https://www.nytimes.com/video/opinion/100000000957239/bloggingheads-is-murdochism-bad.html,Bloggingheads: Is Murdochism Bad?,"Felix Salmon, left, of Reuters and Alex Massie of the Spectator debate Rupert Murdoch's influence on American society.",
327,https://www.nytimes.com/video/multimedia/100000000955295/media-decoder.html,Media Decoder: Murdoch's Testimony,"Jeremy W. Peters and David Carr provide analysis of the testimony offered by Rupert Murdoch, James Murdoch and Rebekah Brooks before a British parliamentary committee.",
326,http://query.nytimes.com/gst/fullpage.html?res=9F03E4DD153CF93AA25754C0A9679D8B63,Murdoch's Board Stays On Sidelines,The board of the News Corporation might as well be named ''Friends of Rupert.'' The independent directors - who have a fiduciary responsibility to the company's shareholders - have remained silent amid the widening scandal at Rupert Murdoch's media empire.,
325,http://query.nytimes.com/gst/fullpage.html?res=9C0CE1D8163FF930A15754C0A9679D8B63,News Corporation Sells a Billboard Unit in Russia,"MOSCOW -- The News Corporation, Rupert Murdoch's media conglomerate embroiled in scandal, sold its billboard company in Russia to a consortium of investors led by a Kremlin-controlled bank, the bank announced on Friday. The sale of News Outdoor Russia had been under negotiation for at least months. The timing was apparently unrelated to the turmoil around the News Corporation in Britain, where Parliament is investigating a tabloid newspaper's practice of hacking into cell phones to obtain information.",
404,http://query.nytimes.com/gst/fullpage.html?res=9503E5DF153DF930A25756C0A9649D8B63,Capitalists And Other Psychopaths,"THERE is an ongoing debate in this country about the rich: who they are, what their social role may be, whether they are good or bad. Well, consider the following. A recent study found that 10 percent of people who work on Wall Street are ''clinical psychopaths,'' exhibiting a lack of interest in and empathy for others and an ''unparalleled capacity for lying, fabrication, and manipulation.'' (The proportion at large is 1 percent.) Another study concluded that the rich are more likely to lie, cheat and break the law. The only thing that puzzles me about these claims is that anyone would find them surprising. Wall Street is capitalism in its purest form, and capitalism is predicated on bad behavior. This should hardly be news. The English writer Bernard Mandeville asserted nearly as much three centuries ago in a satirical-poem-cum-philosophical-treatise called ''The Fable of the Bees.''",
323,https://www.nytimes.com/video/world/europe/100000000953922/disturbance-during-murdoch-testimony.html,Deng Defends Murdoch at Hearing,A man disrupted the parliamentary committee hearings during the testimony of Rupert and James Murdoch.,
434,http://query.nytimes.com/gst/fullpage.html?res=9E04E3D6173EF93BA15756C0A9649D8B63,Choice of New Italian Media Regulator a Test of Berlusconi's Strength,"PARIS -- When Italians said ''Basta!'' to Silvio Berlusconi, it turned out that they were ready for more than just a political change. Since Mr. Berlusconi stepped down from his post as prime minister last year, returning to life as a media mogul, the digital era finally seems to have dawned in Italy. Mr. Berlusconi's television company, Mediaset, an analog-era powerhouse that continued to dominate the Italian media scene well into his 17-year sojourn in or near the prime minister's villa, has suffered greatly since he left for the third and presumably final time. Advertising has fallen, earnings have plunged and more Italians are tuning in to alternatives like Sky Italia, the satellite television broadcaster owned by Rupert Murdoch's News Corp.",
459,http://query.nytimes.com/gst/fullpage.html?res=9401E5DF133CF93BA35756C0A96F9C8B63,Murdoch Says News Corp. Will Charge for Newspaper Content Online,"News Corp. plans to start charging readers to view stories on more of its newspaper Web sites within the next year, according to Rupert Murdoch, the company's chief executive. Mr. Murdoch, calling the newspaper business model ''malfunctioning,'' said the company planned to test payment options on some of the company's ''stronger'' newspapers.",
681,http://query.nytimes.com/gst/fullpage.html?res=9C01E6DC103FF932A15753C1A96E9C8B63,A 'Family' Flap,"A Sunday night episode of the Fox animated series ''Family Guy'' stirred up trouble by suggesting -- rather directly -- that Nazi officers would have supported the McCain-Palin ticket. And it was another arm of the News Corporation conglomerate, Fox News Channel, that first raised questions about the episode. Fox (the broadcast network) ran the episode in which Stewie, the obnoxious baby character at the center of the series, and Brian, a talking dog, traveled back in time to Poland during the 1939 German invasion. The characters ambush Nazi soldiers in an alley and steal their uniforms so they can travel without drawing attention. Putting on an overcoat, Stewie notices a McCain-Palin campaign button affixed to the lapel. ''Huh, that's weird,'' Stewie remarks.",
79,http://query.nytimes.com/gst/fullpage.html?res=9B0CE1DA1E3AF933A25756C0A9649D8B63,News Corp. Reports 47% Profit Gain and a Larger Stock Buyback,"In a signal to Wall Street that the continuing phone-hacking scandal in Britain has not had a significant impact on its bottom line, News Corporation on Wednesday reported a 47 percent increase in profit and said it would buy back an additional $5 billion worth of stock. News Corporation said its net income, driven largely by its strong cable television division, was $937 million in the third quarter, which ended March 31, or 38 cents a share, compared with $639 million, or 24 cents a share, in the period a year earlier.",
80,http://query.nytimes.com/gst/fullpage.html?res=9F03EEDC143DF933A25756C0A9649D8B63,News Corp. Reports 47% Profit Gain and a Larger Stock Buyback,"In a signal to Wall Street that the continuing phone-hacking scandal in Britain has not had a significant impact on its bottom line, News Corporation on Wednesday reported a 47 percent increase in profit and said it would buy back an additional $5 billion worth of stock. News Corporation said its net income, driven largely by its strong cable television division, was $937 million in the third quarter, which ended March 31, or 38 cents a share, compared with $639 million, or 24 cents a share, in the period a year earlier.",
616,http://query.nytimes.com/gst/fullpage.html?res=9A00E4D6133DF93BA2575BC0A9669D8B63,Inside the Times,International KARZAI ORDERS PHASEOUT,
580,http://query.nytimes.com/gst/fullpage.html?res=9C04E0DF1538F937A25751C1A96F9C8B63,Tilting Rightward At Journal,"Sunday was the second anniversary of the sale of The Wall Street Journal to Rupert Murdoch's News Corporation. At that time, a chorus of journalism church ladies (I was among them) warned that one of the crown jewels of American journalism now resided in the hands of a roughneck, and predicted that he would use it to his own ends. Yet here we are, two years later, and The Wall Street Journal still hits my doorstep every morning as one of the nation's premier newspapers.",
541,http://query.nytimes.com/gst/fullpage.html?res=9E07E3DB123BF930A15753C1A9669D8B63,F.C.C. Tries To Add Pressure In Fee Dispute,"The Federal Communications Commission tried Friday to step up the pressure on Cablevision and Fox's parent, the News Corporation, to reach a deal in their fee dispute. The agency demanded that the two sides ''provide evidence'' of good-faith negotiations, which are required by law in disputes over what is known as retransmission consent -- deals that allow cable systems to carry programming on broadcast channels. But the options for the F.C.C. remain limited, and the dispute shows no signs of resolution. For the first time since Saturday, when stations owned by the News Corporation -- including Fox's New York station, WNYW -- began being blacked out in homes serviced by Cablevision, the two sides held no negotiations Friday. Still, the F.C.C. request could be significant because if the commission determines that one side or the other is not acting in good faith, it may be able to impose a fine.",
174,https://www.nytimes.com/video/world/europe/100000000943484/timecast--phone-hacking-inquiry-opens.html,TimesCast | Phone Hacking Inquiry Opens,"July 13, 2011 - Speaking in Parliament amid growing criticism over his ties to News Corp., Britain's Prime Minister, David Cameron, detailed a wide-reaching public inquiry into the hacking scandal.",
532,http://query.nytimes.com/gst/fullpage.html?res=9901E0DE1131F93BA3575BC0A9679D8B63,Inside The Times,International SALEH LEAVES SAUDI HOSPITAL,
508,http://query.nytimes.com/gst/fullpage.html?res=9D02EFD81630F933A2575BC0A9679D8B63,Inside the Times,International UNUSUAL SUMMER CALM,
480,http://query.nytimes.com/gst/fullpage.html?res=9E05E5DD173BF931A35753C1A9669D8B63,Some Fox Channels Are Off Dish Network,"Dish Network subscribers are caught in the middle of a dispute between the company and the News Corporation over the fees paid to carry channels. On Friday, FX, the National Geographic Channel and Fox's regional sports networks had disappeared from Dish. In dueling statements, Fox Networks claimed that Dish ''decided to no longer carry Fox Networks cable programming,'' while Dish claimed that Fox Networks was ''blocking'' access to the channels. During the impasse Dish said that it would make the NFL Network, Big Ten Network and many other regional sports channels available.",
476,http://query.nytimes.com/gst/fullpage.html?res=9802E6D91630F932A35754C0A9679D8B63,DealBook Online,"HIRING SPREE Marc Andreessen, a founder of the venture capital firm Andreessen Horowitz, announced yet another addition on Thursday. Less than 24 hours after its appointment of Lawrence H. Summers to the role of special adviser, the firm is adding Jeff Jordan, left, the executive chairman of OpenTable, as general partner. With the arrival of Mr. Jordan, Andreessen Horowitz is now a team of five general partners, led by Mr. Andreessen and the firm's co-founder, Ben Horowitz. EVELYN M. RUSLI",
472,http://query.nytimes.com/gst/fullpage.html?res=9C04E2DB123DF937A25754C0A9679D8B63,DealBook Online,"DEBATING DODD-FRANK Bankers, regulators and journalists gathered in New York on Wednesday to discuss some of the Dodd-Frank Act's thorniest provisions -- derivatives, the new consumer protection agency and, of course, its efforts to end ''too big to fail.'' The Securities Industry and Financial Markets Association, one of Wall Street's largest lobbying groups and among the law's sharpest critics, hosted the conference, called Regulatory Reform Summit 2011. Headlining the event was Mary J. Miller, above, assistant Treasury secretary for financial markets. BEN PROTESS",
93,http://query.nytimes.com/gst/fullpage.html?res=9F02E6DF1139F930A25753C1A9679D8B63,Publisher of News Corp.'s Wall Street Journal Europe Resigns,"9:30 p.m. | Updated The News Corporation, already dealing with the fallout from a phone-hacking scandal in Britain, has suffered another blow to its European operations.",
471,http://query.nytimes.com/gst/fullpage.html?res=9A00E2DE103BF932A15753C1A9679D8B63,Inside The Times,"International AMID PROTESTS, GREECE",
470,https://www.nytimes.com/video/continuous/1248069366902/timescast-november-23-2010.html,"TimesCast | November 23, 2010",North and South Korea exchange artillery fire; American companies have their most profitable quarter ever; and News Corps invests in an iPad-only newspaper.,
441,http://query.nytimes.com/gst/fullpage.html?res=9906E1DB113CF93AA15750C0A9649D8B63,Bertelsmann Weighs Public Offering,"BERLIN -- Bertelsmann, the biggest media company in Europe, said Wednesday that it was considering a public offering of stock to raise money for expansion, a statement that marked a striking change of heart by the controlling Mohn family. Thomas Rabe, who took over as chief executive of Bertelsmann this year, said the company was looking for ways to accelerate its move into digital businesses and developing economies. While Bertelsmann's portfolio includes the publisher Random House and the developer of international television hits like ''Who Wants to Be a Millionaire,'' 80 percent of the company's revenue comes from slow-growing Europe.",
77,http://query.nytimes.com/gst/fullpage.html?res=9E05EFDF1E39F935A35750C0A9649D8B63,News Corp. Faces Inquiry Of Subsidiary For Bribery,"As News Corporation seeks to contain a widening investigation into illegal information gathering at its British publishing unit, the company may face fresh allegations at another problematic subsidiary. News Outdoor Russia, a Moscow-based billboard company that News Corporation sold to a Kremlin-controlled bank in July, is the subject of an F.B.I.inquiry into whether the company bribed local officials to approve favorable sign placements, The Wall Street Journal reported Monday.",
321,http://query.nytimes.com/gst/fullpage.html?res=9E00E4D7143FF937A15754C0A9679D8B63,THE STRIP,Brian McFadden The Strip comic mocks the activist who attempted to throw a pie at Rupert Murdoch during hearings before the British Parliament (M),
313,http://query.nytimes.com/gst/fullpage.html?res=940DE5D8173FF936A15754C0A9679D8B63,"More Than Kin, and Less Than Kind","AT the hearing into the News of the World phone hacking scandal in London this past Tuesday, the commissioner of Scotland Yard did something unusual for a policeman. He quoted Shakespeare. Explaining the swiftness of his resignation, he mangled a bit of Macbeth: ''If 'twere best it were done, 'twere well it were done quickly.'' The reference was perfectly fitting for a scandal whose defining adjective is coming to be ''Shakespearean.'' Many have noted superficial similarities between the scandal and Shakespearean tragedy: overheard messages, hired thugs. There's a hashtag sprawling through Twitter: #shakespeare4murdoch. (My favorite so far: ''remorse, remorse, my kingdom for remorse.'')",
248,https://www.nytimes.com/video/multimedia/100000000952267/timescast--july-18-2011.html,"TimesCast | July 18, 2011","The phone-hacking scandal in Britain takes down another top police official; and a British parliamentary committee anticipates the testimony of Rupert Murdoch, James Murdoch and Rebekah Brooks.",
246,https://www.nytimes.com/video/multimedia/100000000961340/timescast--july-21-2011.html,"TimesCast | July 21, 2011","July 21, 2011 - Explosions and a gun attack shake Norway; James Murdoch’s testimony before a Parliamentary committee is under scrutiny; and judges prepare for New York’s first gay weddings.",
236,https://www.nytimes.com/video/world/europe/100000001297405/timescast--news-corps-settlements.html,TimesCast | Phone Hacking Settlements,"January 19, 2012 — In the legal battle over phone hacking, lawyers identify some of the high-profile victims, including Jude Law, who have reached settlements with the News Corp.",
234,https://www.nytimes.com/video/multimedia/100000001296922/timescast--january-19-2012.html,"TimesCast | January 19, 2012",Rick Perry drops out of the race | News Corp. settles with some high-profile hacking victims | Kodak files for bankruptcy.,
152,http://query.nytimes.com/gst/fullpage.html?res=9A04E5DE1631F930A35750C0A9679D8B63,News Corp. Said to Offer To Sell Unit,"9:01 p.m. | Updated The News Corporation has proposed spinning off the Sky News unit, in an effort to finally win government approval of its takeover of British Sky Broadcasting, a person briefed on the matter said on Wednesday.",
219,https://www.nytimes.com/video/business/100000001406462/busines-day-live-march-5-2012.html,"Business Day Live | March 5, 2012",Foreign investment begins anew in Europe; The boycott against Rush Limbaugh’s advertisers; Staving off a scandal at News Corp.,
1004,http://query.nytimes.com/gst/fullpage.html?res=9904E1D61739F933A05751C1A9629C8B63,ROGERS COMMUNICATIONS BUYS REMAINDER OF SPORTSNET,"Rogers Communications, Canada's biggest cable television company, acquired the shares it did not already own of Rogers Sportsnet Inc. for 45 million Canadian dollars ($36.9 million) from the News Corporation. Rogers Sportsnet operates four all-sports channels and has annual revenue of more than 100 million Canadian dollars. Rogers, which is based in Toronto, developed Sportsnet in 1998 with the Fox Cable Networks of Fox Corporation and the CTV network of BCE Inc., and increased its ownership to 80 percent when it bought CTV's 40 percent stake in 2001. Sportsnet competes with the TSN all-sports cable network, which is 70 percent owned by BCE.",
1005,http://query.nytimes.com/gst/fullpage.html?res=9E02E0DA1F3CF931A15750C0A9639C8B63,NEWS CORPORATION GAINS FULL CONTROL OF FOX,"The News Corporation, controlled by Rupert Murdoch, said yesterday that it had persuaded Fox Entertainment Group minority holders to accept $6.6 billion for their stock, giving the company full control of assets including the Fox News Channel and the 20th Century Fox film studio. Fox's investors will get $36.72 a share in News Corporation nonvoting shares for their stock, based on Friday's closing prices. Minority investors held 178.4 million shares, or 18 percent in Fox, and will get 2.04 News Corporation shares for each share of Fox.",
203,http://query.nytimes.com/gst/fullpage.html?res=9E07EFD9133EF932A3575BC0A9679D8B63,Gauging Impact of a Scandal,"How worried is The Wall Street Journal that it could be tainted by the scandal roiling Rupert Murdoch's British newspapers? Worried enough that it is asking its readers point-blank: What impact, if any, do the illegal acts by News of the World journalists have on their impression of The Wall Street Journal?",
194,http://query.nytimes.com/gst/fullpage.html?res=980CE0DD1539F932A25753C1A9679D8B63,Advisory Firm Urges Ouster Of Murdoch and His Sons,"8:00 p.m. | Updated A major investor advisory firm recommended Monday that shareholders of the News Corporation vote against the re-election of a vast majority of the media conglomerate's board, including Rupert Murdoch and his sons, who control the company.",
193,http://query.nytimes.com/gst/fullpage.html?res=9C07EFD81630F933A2575BC0A9679D8B63,"For Murdoch, a Board Meeting With Friendly Faces","When Rupert Murdoch sat down with his board on Tuesday for the first time since a phone hacking scandal overseas plunged his company into turmoil, he was surrounded by a lot of familiar, friendly faces. The meeting, held on the studio lot of 20th Century Fox and timed to coincide with News Corporation's quarterly earnings announcement on Wednesday, included many people with deep and longstanding ties to Mr. Murdoch, his company and his family.",
161,http://query.nytimes.com/gst/fullpage.html?res=9F00E4D81438F936A25753C1A9679D8B63,Pension Funds Challenge News Corporation Board,"A week before the News Corporation's annual shareholder meeting, the company is facing a growing chorus of investors rallying against company leadership after a phone-hacking scandal in Britain and a controversy this week over an unorthodox circulation arrangement in Europe. On Friday, California's two huge public sector pension funds said they would withhold support from some or all of the News Corporation's board nominees, including the chairman and chief executive,Rupert Murdoch, and push for the election of an independent chairman.",
