,link,headline,summary,date
1013,https://www.nytimes.com/2004/07/15/business/nielsen-critics-seize-on-new-ratings-data.html,Nielsen Critics Seize on New Ratings Data,"As Congress prepares to open hearings into Nielsen Media Research's new method for measuring local television audiences, critics say the latest data suggests the system continues to undercount the number of black and Hispanic viewers despite the company's efforts to fine-tune the technology. Nielsen, a unit of VNU, has been the target of a coordinated and well-financed campaign by the News Corporation and black and Hispanic groups against its plans to measure ratings in big cities with electronic devices known as people meters. The people meters would replace less technically advanced set-top boxes and the paper diaries that Nielsen began providing in 1950.",2004/07/15
935,https://www.nytimes.com/2004/07/30/business/company-news-news-corp-extends-contract-of-president-for-5-years.html,NEWS CORP. EXTENDS CONTRACT OF PRESIDENT FOR 5 YEARS,"The News Corporation's president and chief operating officer, Peter Chernin, signed an agreement to remain with the company for an additional five years. Mr. Chernin's new employment contract is effective Aug. 1, News Corporation said. His pay and other details were not disclosed. The company, which is based in Sydney, Australia, and is controlled by Rupert Murdoch, owns media assets including the Fox television networks, 20th Century Fox film studio, and newspapers like The Times of London and The New York Post. Mr. Chernin, 53, joined News Corporation in 1989 as president of entertainment at the Fox broadcast TV network. He became president and chief operating officer in 1996.",2004/07/30
995,https://www.nytimes.com/2004/08/11/business/company-news-board-approves-news-corporation-s-move-to-us.html,BOARD APPROVES NEWS CORPORATION'S MOVE TO U.S.,"The News Corporation, the media company controlled by Rupert Murdoch, said its board unanimously endorsed the company's plan to shift headquarters to the United States from Australia. News Corporation's shareholders will get one share in the United States company for every two shares they now own, the company said in a statement to the Australian Stock Exchange. The News Corporation, which is currently based in Sydney, will have its primary listing in New York and secondary listings in Sydney and London. The plan will be presented to the Securities and Investments Commission of Australia and Australian courts for approval, before shareholders vote on the proposal later this year, the News Corporation said.",2004/08/11
928,https://www.nytimes.com/2004/08/12/business/the-media-business-earnings-increase-7.8-at-news-corp.html,Earnings Increase 7.8% at News Corp.,"The News Corporation, the media company controlled by Rupert Murdoch, said yesterday that fiscal fourth-quarter profit rose 7.8 percent because advertising sales increased at its Fox broadcast network and cable channels like FX. The company said net income rose to $399 million, or 29 cents per American depository receipt, from $370 million, or 24 cents, a year earlier. Sales increased to $5.52 billion.",2004/08/12
1021,https://www.nytimes.com/2004/08/30/business/mediatalk-left-asked-speak-right-but-gatekeeper-wouldn-t-hear-it.html,"MediaTalk; The Left Asked to Speak to the Right, But a Gatekeeper Wouldn't Hear of It","The Fox News Channel, the highest-rated cable news network in the country, arrives this week at the Republican National Convention with an opportunity to serve up ample red meat for its core constituency. A growing number of advertisers would like a piece of that audience, but The Nation, the left-leaning political magazine, will not be among them. Ten days ago, the ad agency for The Nation sent a 60-second commercial to the cable network promoting its brand of political news and commentary as free of White House influence and corporate agendas.",2004/08/30
1020,https://www.nytimes.com/2004/09/16/business/media/16rupert.html,Murdoch Receives $12.5 Million Bonus,"The chairman and chief executive of the News Corporation, Rupert Murdoch, was paid $17 million, a 42 percent increase, in fiscal 2004 as television shows like ''American Idol'' and increased numbers of viewers at the FX cable network raised profit. Mr. Murdoch, 73, received a bonus of $12.5 million, up from $7.5 million in the previous year. His salary was little changed at $4.5 million for the year, which ended June 30, News Corporation said in its annual report.",2004/09/16
986,https://www.nytimes.com/2004/10/25/business/media/25tabloid.html,MediaTalk; Have Papers Taken Sides on O'Reilly?,"When gossipy news about celebrities breaks, The New York Post and The Daily News tend to go at it and each other -- in much the way rivals like the Yankees and Red Sox turn each game into an epic battle. So it is hardly surprising that each has covered fully, though differently, the controversy involving Bill O'Reilly of Fox News and Andrea Mackris, a producer on his program. Mr. O'Reilly and Ms. Mackris have traded lawsuits over charges of whether he sexually harassed her and whether she tried to extort money from him and his bosses. ''I think any story involving a TV star and phone sex is going to have traction with an audience,'' said Col Allan, the editor in chief of The Post.",2004/10/25
977,https://www.nytimes.com/2004/11/04/business/media/04newscorp.html,News Corporation's Profit Rises on Strong Cable Ad Sales,"The News Corporation, the media company controlled by Rupert Murdoch, said yesterday that its fiscal first-quarter profit rose 27 percent, in part because advertising sales increased at its cable networks, like the Fox News Channel. Net income increased to $536 million, or 32 cents a share, from $422 million, or 29 cents, in the quarter a year earlier, the company said. Sales in the quarter ended Sept. 30 increased 12 percent, to $5.19 billion. The results matched the expectations of analysts.",2004/11/04
1024,https://www.nytimes.com/2004/11/09/business/media/09place.html,"In Tussle With Murdoch, Malone Seeks Leverage","On the surface it is a simple stock purchase, but on another level, the maneuvering is part of an angry chess game between two mega-entrepreneurs who are used to running the board. Rupert Murdoch likes to keep tight control over the News Corporation, the far-flung media empire he plans to turn over to his children. But last week, the chairman of Liberty Media, John C. Malone, said he might increase Liberty's voting interest in the News Corporation to 17 percent from 9 percent.",2004/11/09
1023,https://www.nytimes.com/2004/11/12/business/media/12liberty.html,Malone Said to Be Pondering Acquisition,"John C. Malone made news this week when his Liberty Media Corporation said it might increase its voting stake in the News Corporation through a complex stock swap. But shareholders in another Malone property, Liberty Media International, have been focusing on another possible transaction. Liberty Media International, a company that was spun off from Liberty Media, has two major assets: a Japanese cable business and a stake in UnitedGlobalCom, a European cable operator. Shares in UnitedGlobalCom have risen recently on speculation that Mr. Malone might try to buy the rest of the company.",2004/11/12
1022,https://www.nytimes.com/2004/11/17/business/17place.html,Murdoch Moves to Avoid a Friendly Fight for Control,"The chairman of the News Corporation, Rupert Murdoch, may be telling investors and the media that his relationship with his counterpart at Liberty Media, John C. Malone, is friendly, as he did yesterday at an annual meeting. But Mr. Murdoch is clearly not taking any chances that he might lose control of the News Corporation, which he plans to turn over to his sons: Lachlan, now deputy chief operating officer, and James, chief executive of British Sky Broadcasting, Mr. Murdoch's satellite TV company in Britain.",2004/11/17
1039,https://www.nytimes.com/2004/11/26/sports/othersports/26nascar.html,Yellow Flags for Nascar's Future on TV,"When NBC and Fox, with their cable television partners, signed deals promising Nascar $400 million annually, the points system to win the Winston Cup had been in place since 1975 and the stock-car racing circuit's Super Bowl, the Daytona 500, started the season. Much has changed since then. Winston was replaced this year by Nextel, and the points system was overhauled to create a playoff during the final 10 races of the season.",2004/11/26
1019,https://www.nytimes.com/2004/12/08/business/media/08broadcast.html,"BBC Says It Will Cut 2,900 Jobs Over 3 Years","Maneuvering to safeguard its future and reputation in the digital era, the BBC, Britain's public broadcaster, announced Tuesday some of the deepest job cuts in its 82-year history, saying 2,900 positions would be eliminated over three years to save around $610 million in annual costs. The staff reductions represent more than 10 percent of a work force of 27,000 and drew a threat from labor unions to strike if the layoffs were compulsory. The cuts were announced at a time when the broadcaster faces challenges to the authority of its journalism and is under pressure to show it is not wasting public money.",2004/12/08
1035,https://www.nytimes.com/2004/12/14/science/earth/14fear.html,"New Climate Thriller: Scary, but Is It Science?","On the surface, Michael Crichton's ''State of Fear,'' can be seen simply as a thriller in which environmentalists happen to be the villains. Mixed with the story, however, are lengthy, annotated attacks on the scientific consensus that the globe is warming, human activity is a cause, and accumulating emissions of greenhouse gases may dangerously disrupt the climate system. While Mr. Crichton includes a note emphasizing that most of the book is a ''product of the author's imagination,'' he adds that ''references to real people, institutions and organizations that are documented in footnotes are accurate. Footnotes are real.''",2004/12/14
925,https://www.nytimes.com/2004/12/21/business/media/21liberty.html,Liberty Media Accelerates Swap of News Corp. Shares,"The Liberty Media Corporation, which is controlled by John C. Malone, began yesterday to accelerate a planned swap of nonvoting shares in the News Corporation, which is controlled by Rupert Murdoch, for voting shares in the company. Mr. Malone announced plans for the swap in November, but at the time, it was expected to take place in April. By moving up the swap, analysts said Mr. Malone might be trying to pressure Mr. Murdoch into trading some News Corporation assets for the voting shares held by Liberty.",2004/12/21
1034,https://www.nytimes.com/2005/01/07/technology/07tele.html,DirecTV Machine Will Compete With TiVo,"TiVo, the company that created the market for digital video recorders, received a serious challenge to its business on Thursday when DirecTV, the satellite provider, announced that it would begin offering its own brand of digital video recorder later this year. The move ends an exclusive relationship between the companies that supplied TiVo with two million of its three million subscribers.",2005/01/07
987,https://www.nytimes.com/2005/01/10/business/media/10deal.html,Murdoch to Buy Rest of Fox for $7 Billion,"Rupert Murdoch, consolidating his global media empire in the United States, is expected to announce today that he will buy out the shareholders of his Fox properties for about $7 billion, executives involved in the deal said last night. The deal would solidify Mr. Murdoch's control over some of the nation's most valuable media assets like the Fox broadcast network and the DirecTV satellite service and help simplify the complicated structure of his far-flung company, the News Corporation, which includes newspapers, television, film and satellite assets around the globe.",2005/01/10
1025,https://www.nytimes.com/2005/01/11/business/media/11place.html,Buyout Shows Murdoch In No Hurry Over Liberty,"Rupert Murdoch's announcement yesterday that his News Corporation would take full control of the Fox Entertainment Group sent a signal that he does not feel pressured to resolve his dispute with John C. Malone's Liberty Media Corporation before pushing ahead with other deals. Many analysts and investors had expected that Mr. Murdoch would settle the conflict over Liberty's voting interest in the News Corporation before buying out Fox. But Mr. Murdoch went ahead yesterday and said that he would buy the 18 percent of Fox that his company did not own, in a deal worth about $6 billion.",2005/01/11
1001,https://www.nytimes.com/2005/01/25/business/25place.html,A Fight Brews Over Proceeds Of Metromedia,"With an estimated net worth of $11 billion, John W. Kluge can afford to take the time before his investments rebound. But at age 90, time itself is a luxury. Yet Mr. Kluge, who made his fortune selling television stations and wireless licenses in the 1980's, is still engaged in the investment business, say people who know him. Recently, for example, he has been taking stakes in medical technology companies.",2005/01/25
1010,https://www.nytimes.com/2005/01/28/business/media/28fox.html,Fox Deadline Extended,"The News Corporation said yesterday that it was extending by two weeks the deadline for its offer to buy the 18 percent of the Fox Entertainment Group that is held by the public. It said that the bid to pay 1.9 shares of the News Corporation for each share of Fox would close on Feb. 22, rather than on Feb. 7.",2005/01/28
897,https://www.nytimes.com/2005/02/03/business/media/03murdoch.html,Cable and Film Divisions Bolster News Corp. Profit,"Driven by a strong performance at its film and cable businesses, the News Corporation said yesterday that its second-quarter net income rose 80 percent, to $386 million, or 13 cents a share, from $215 million, or 7 cents a share, in the quarter a year ago. The company said sales in the quarter, which ended Dec. 31, rose 18 percent, to $6.56 billion.",2005/02/03
1000,https://www.nytimes.com/2005/02/06/business/yourmoney/06book.html,Michael Crichton? He's Just the Author,"IF you do not know why she is a publishing legend, Jane Friedman will be happy to tell you. ''I am actually credited with inventing the author tour,'' Ms. Friedman, the president and chief executive of HarperCollins Publishers, told a group of aspiring editors and publicists recently at New York University's Center for Publishing. That boast is not without merit. In 1970, as a young publicist at Alfred A. Knopf, Ms. Friedman was assigned to schedule Julia Child on morning television shows to promote the second volume of her seminal work, ''Mastering the Art of French Cooking.'' Ms. Friedman added a series of kitchen demonstrations by Mrs. Child at department stores across the country, and -- voilà! -- the author tour was born.",2005/02/06
1008,https://www.nytimes.com/2005/02/23/sports/basketball/23cablevision.html,Cablevision Locks Up Garden,"Cablevision, which has held a 60 percent stake in Madison Square Garden since 1997, acquired the remainder yesterday from News Corporation, which, in exchange, received what it did not own of Fox Sports Net and other assets. Gaining full control of the Garden -- the arena, the Knicks, the Rangers, the Liberty, MSG Network, Fox Sports New York, the Theater and Radio City Entertainment -- makes it easier for Cablevision to keep it if it sells its cable systems or other assets.",2005/02/23
1018,https://www.nytimes.com/2005/02/24/business/media/24cable.html,"Cablevision Loss Widens, Yet Stock Rises","Cablevision Systems said yesterday that its losses widened in the fourth quarter, but the number of subscribers increased, helping to send its stock price up 8 percent. The company, based in Bethpage, N.Y., said its revenue rose 11.2 percent, to $1.3 billion, in the quarter, helped by subscriber growth for cable and other services. But losses widened to $305.8 million, from $197.3 million a year earlier.",2005/02/24
1040,https://www.nytimes.com/2005/03/01/business/media/01adco.html,A marketing barrier poised to fall: CNN is set to be the first cable news network to run liquor ads.,"CNN is to become the first national cable television news network to accept commercials for distilled spirits, by running a spot for Grey Goose vodka. The spot was to have run last night during ''News Night With Aaron Brown,'' but did not appear.",2005/03/01
896,https://www.nytimes.com/2005/03/04/business/media/04fox.html,News Corp. Raises Offer for Fox Buyout,"The News Corporation, the media company controlled by Rupert Murdoch, raised its offer for full ownership of the Fox Entertainment Group yesterday by 7 percent, to $6 billion. A committee of Fox directors endorsed the higher offer, and shareholders that sued to block the purchase agreed to a settlement, the News Corporation said. Mr. Murdoch offered 2.04 Class A nonvoting shares in the News Corporation for each Fox Class A share, up from a Jan. 10 offer of 1.9 shares.",2005/03/04
1026,https://www.nytimes.com/2005/03/06/business/yourmoney/06cnbc.html,Fox vs. CNBC? Now That Would Be a Grudge Match,"THE cable business channel CNBC contributed more than $250 million in profit last year to the coffers of General Electric, its parent company. It did so while attracting a tiny audience that is at best just over 200,000 viewers. That quarter of a billion dollars, a product of one of the highest profit margins in cable, is an enviable bounty. The News Corporation has certainly noticed. Its chairman, Rupert Murdoch, and his combative lieutenant, Roger Ailes, who leads its Fox News division, are considering whether to add their own cable business channel. And, in typical fashion, their goal would be not only to compete with CNBC, but also to crush it.",2005/03/06
1037,https://www.nytimes.com/2005/03/16/business/media/16liberty.html,Liberty Media Is Planning Spinoff of Two Subsidiaries,"The chairman of the Liberty Media Corporation, John C. Malone, said yesterday that the company would spin off two of its subsidiaries into a separate public company. Mr. Malone said Liberty would spin off Ascent Media and Liberty's 50 percent stake in Discovery Communications, the parent company of the Discovery Channel and several other services.",2005/03/16
1014,https://www.nytimes.com/2005/06/18/business/media/18interview.html,THE SATURDAY INTERVIEW -- With Susan Whiting; She Watches Who's Watching What,"FOR 17 years, Nielsen Media Research has used ''people meters'' to measure and report overnight results of the network television viewing habits of individuals and entire households. Recently, the company began rolling out people meters to measure local viewing -- and suddenly its process came under fire.",2005/06/18
990,https://www.nytimes.com/2005/07/10/fashion/weddings/10moff.html,"Julia Moffett, Toby Constantine","Julia Francesca Moffett and Toby Russell Constantine were married yesterday in a civil ceremony in London. Andrew Kenyon, a registrar, officiated at the Kensington and Chelsea register office. Last evening the Rev. Richard Harriott, a Roman Catholic priest, performed a religious ceremony at the Orangery in Holland Park in London. Ms. Moffett, 36, is keeping her name. She is the director of strategy and development in London for the BBC World Service Trust, which seeks to use communications to promote international development. She was until 2002 the managing director of the Markle Foundation, a philanthropy in New York. She graduated from Wesleyan University.",2005/07/10
895,https://www.nytimes.com/2005/07/16/business/media/16news.html,News Corp. Puts Web Businesses Into New Unit,"In the latest effort by a big media company to get its arms around the Internet, the News Corporation yesterday announced the creation of a division to house its interactive businesses. The new unit, Fox Interactive Media, will be based in Los Angeles, where the company has its Fox studio and television production businesses.",2005/07/16
994,https://www.nytimes.com/2005/07/22/business/media/22liberty.html,Another Spinoff Completed In Remaking Liberty Media,"John C. Malone, the media industry financier, moved a step closer to carving up what remains of his United States holdings yesterday. He completed the spinoff of Liberty Media's 50 percent interest in the cable channel group Discovery Communications to shareholders. On their first trading day, the shares closed at $15.09, up 24 cents. Now, Mr. Malone's plans for the rest of Liberty Media's assets may soon call for even more reorganizations, according to people briefed on the situation. One strategy under discussion would have Mr. Malone increasing his 18 percent interest in the News Corporation but allowing his sometime ally Rupert Murdoch, the chief executive of News Corporation, to vote the shares.",2005/07/22
1041,https://www.nytimes.com/2005/07/24/fashion/sundaystyles/24COLLEGE.html,Sophomorically Incorrect,"JOSH ABRAMSON and Ricky Van Veen were typical college freshmen in 1999, when they got the idea to post silly pictures of themselves on the Internet. They posed doing ''stupid college stuff,'' Mr. Abramson said, like putting plungers on their heads at the local hardware store or sticking metal objects in a toaster. Certain the gags were hilarious, the two students, childhood friends from Baltimore, sent links to friends and advertised their Web site with fliers in dormitory bathrooms at their colleges -- Mr. Abramson was at the University of Richmond, Mr. Van Veen at Wake Forest. Pretty soon the site was getting a thousand visitors a week.",2005/07/24
898,https://www.nytimes.com/2005/07/30/business/media/30murdoch.html,"Murdoch Son Leaves News Corp., Tossing Succession Into Question","Rupert Murdoch's oldest son, Lachlan -- considered by many to be his heir apparent -- resigned yesterday from his job at the News Corporation amid apparent family discord, adding a new twist to one of the business world's most closely watched succession chronicles. The decision by Lachlan, 33, to step down leaves just one of Rupert Murdoch's four adult children, James, in an executive position at the company, making him the clear front-runner to one day succeed his father. James, 32, runs British Sky Broadcasting, the satellite television service that is 34 percent owned by the News Corporation. Rupert Murdoch, 74, the chairman and chief executive of the News Corporation, has made clear that he would like one of his children to succeed him.",2005/07/30
1011,https://www.nytimes.com/2005/08/01/business/media/01value.html,Growth or Value? Entertainment Stocks Are Caught in the Transition,"Is it time for media companies to finally grow up? Movie theater attendance is caught in a two-year downward spiral. Sales of DVD's, once the growth engine for the entertainment business, are slowing. And worse, more advertising is going to the Web, where companies can better quantify consumer reaction to commercials.",2005/08/01
973,https://www.nytimes.com/2005/08/01/business/media/01murdoch.html,"Behind Murdoch Rift, a Media Dynasty Unhappy in Its Own Way","The sudden exit of Rupert Murdoch's elder son, Lachlan, from his job at the News Corporation came amid family tensions over the future control of one of the world's largest media companies, people close to the Murdochs said. But the resignation of Lachlan, 33, from his job as deputy chief operating officer of the global media empire, to move to Australia and spend more time with his family, is only partly linked to the debate over the empire's future.",2005/08/01
975,https://www.nytimes.com/2005/08/02/business/media/02murdoch.html,An Empire Shaken; Hands That Rocked the Cradle Now Shape a Company's Fate,"Wendi Deng, the wife of the media mogul Rupert Murdoch, and Anna Murdoch Mann, his former wife, have a seemingly cordial relationship. They see each other at family gatherings, like the weddings of Anna and Rupert's three adult children, and the christening of grandchildren, people who are close to the family say. Rupert Murdoch's two young children with Ms. Deng, his third wife, play frequently with the grandchildren he shares with Anna Mann, his second wife, who has remarried.",2005/08/02
868,https://www.nytimes.com/2005/08/06/business/media/06liberty.html,Liberty Media Unlikely to Sell News Corp. Stake This Year,"The Liberty Media Corporation is unlikely to unwind its investment in the News Corporation this year, Liberty's chairman, John C. Malone, said yesterday after the company posted second-quarter results. Mr. Malone said that he considered the stake in the News Corporation a long-term investment, meaning that the relationship between him and Rupert Murdoch, the chairman of the News Corporation, was not likely to be dissolved any time soon.",2005/08/06
991,https://www.nytimes.com/2005/08/08/business/media/08nielsen.html,"Nielsen, Long a Gauge of Popularity, Fights to Preserve Its Own","As it does every Father's Day, Real Men Cook, a charity devoted to encouraging African-American men to stay involved with their families, held its annual street fair this June in about a dozen cities across the country. Amid the grills and stoves serving up delicacies, corporate sponsors like State Farm Insurance and Volvo were on hand, seeking to entice new customers. And in eight of the cities, handing out pens, balloons and T-shirts from its booth, was a company that does not sell anything to the public -- Nielsen Media Research, the television ratings arbiter.",2005/08/08
997,https://www.nytimes.com/2005/08/11/sports/football/11giants.html,Giants' New Linebacker Has Something to Prove,The Giants' Antonio Pierce does not have a chip on his shoulder. But he does have newspaper clippings and a good memory.,2005/08/11
